title	link	summary	green_innovation	business_innovation	green_product	green_process	company	official_company_name	product_or_process	likely_naics_codes	greenwashing	total_tokens
Here's How Jeremy Jones Takes Climate Action Every Single Day - Outside	https://news.google.com/rss/articles/CBMieWh0dHBzOi8vd3d3Lm91dHNpZGVvbmxpbmUuY29tL291dGRvb3ItYWR2ZW50dXJlL2Vudmlyb25tZW50L2hlcmVzLWhvdy1qZXJlbXktam9uZXMtdGFrZXMtY2xpbWF0ZS1hY3Rpb24tZXZlcnktc2luZ2xlLWRheS_SAQA?oc=5	Pro snowboarder Jeremy Jones discusses his commitment to climate action through his company, Jones Snowboards, which emphasizes performance, durability, and sustainability. He highlights initiatives such as transitioning to a bio-based resin for snowboards and developing a recycling process for old boards to reduce waste. Jones also advocates for a plant-based diet and personal actions like reducing carbon emissions and supporting eco-friendly businesses. He calls for inclusivity in the climate movement, emphasizing the importance of collective action for the planet.	TRUE: The article describes various initiatives by Jones Snowboards that focus on sustainability, such as using bio-based materials and recycling processes, thereby contributing to environmental sustainability.	TRUE: The article outlines how Jones Snowboards has introduced new processes and products that significantly differ from traditional snowboard manufacturing, focusing on sustainability and performance.	TRUE: The snowboard products made with bio-based resin and the recycling initiatives qualify as green products since they are designed to reduce environmental impact throughout their life cycle.	TRUE: The article mentions the recycling process developed by Jones Snowboards to repurpose old snowboards, significantly minimizing waste and promoting sustainability, thereby qualifying as a green process.	Jones Snowboards	Jones Snowboards	bio-based resin and recycling process	Likely NAICS Codes: 339920 - Sporting Goods, Hobby, and Musical Instrument Stores; 336120 - Heavy Duty Truck Manufacturing; 325510 - Paint and Coating Manufacturing; 441222 - Boat Dealers	FALSE: The article does not promote misleading environmental benefits; instead, it transparently discusses genuine sustainability efforts by Jeremy Jones and Jones Snowboards.	2558
New Whitepaper Reveals Trillion-Dollar Opportunity for Corporate Climate Action in Asia - BCG	https://news.google.com/rss/articles/CBMifWh0dHBzOi8vd3d3LmJjZy5jb20vcHJlc3MvMjFhcHJpbDIwMjMtbmV3LXdoaXRlcGFwZXItcmV2ZWFscy10cmlsbGlvbi1kb2xsYXItb3Bwb3J0dW5pdHktZm9yLWNvcnBvcmF0ZS1jbGltYXRlLWFjdGlvbi1pbi1hc2lh0gEA?oc=5	The World Economic Forum's report highlights the significant revenue and job opportunities for Asian businesses from corporate climate action, projecting a USD$4.3 trillion opportunity and the creation of 232 million jobs by 2030. It emphasizes the urgent need for businesses to tackle environmental issues to avoid severe economic impacts due to climate change, particularly in Asia, where GDP could drop by 26% by 2050 without action. The report calls for collaboration between businesses, governments, and communities to implement effective climate strategies and innovate sustainably.	TRUE: The article discusses targeted climate action and corporate investment in green technologies that could lead to reduced greenhouse gas emissions and promote sustainability in Asia's industries.	TRUE: The report outlines new business opportunities and processes that involve significant investments in renewable energy, energy efficiency, and circular economy practices, representing significant improvements in how businesses operate.	FALSE: The article does not specifically mention any particular good or service that qualifies as a green product.	FALSE: While the article discusses corporate climate action, it does not name any specific green processes that qualify as defined.	World Economic Forum, Boston Consulting Group, SAP	World Economic Forum	product or process not identified	Likely NAICS Codes: 541620 - Environmental Consulting Services, 221118 - Other Electric Power Generation, 541690 - Other Scientific and Technical Consulting Services, 333414 - Current-Carrying Wiring Device Manufacturing	FALSE: The article does not present misleading information regarding environmental benefits; it emphasizes genuine climate action and the business case for sustainability.	2416
Spin Master Issues 2022 Corporate Social Responsibility Report and Releases Climate Action Plan - PR Newswire	https://news.google.com/rss/articles/CBMilgFodHRwczovL3d3dy5wcm5ld3N3aXJlLmNvbS9uZXdzLXJlbGVhc2VzL3NwaW4tbWFzZXItaXNzdWVzLTIwMjItY29ycG9yYXRlLXNvY2lhbC1yZXNwb25zaWJpbGl0eS1yZXBvcnQtYW5kLXJlbGVhc2VzLWNsaW1hdGUtYWN0aW9uLXBsYW4tMzAxNzkxNTk4Lmh0bWzSAQA?oc=5	Spin Master Corp. issued its 2022 Corporate Social Responsibility report, highlighting its evolved CSR vision and new environmental targets including significant reductions in emissions and waste. The report outlines progress in four key areas: environment, products, people, and communities, and includes plans for future sustainability efforts. The company has established ambitious goals for carbon emissions reduction and waste management. Spin Master also increased philanthropic contributions to impact children globally.	TRUE - The article discusses Spin Master Corp.'s commitment to reducing its environmental footprint through specific targets for emissions and waste reduction, along with sustainable product development.	TRUE - The company's initiatives and new CSR strategies represent improved business processes and offerings that significantly differ from previous practices and aim for enhanced environmental performance.	TRUE - The launch of sustainably-minded products by Spin Master aligns with the definition of green products designed to reduce environmental impact throughout their lifecycle.	TRUE - Spin Master's establishment of a Climate Action Plan and targets for waste reduction reflect the adoption of manufacturing and operational processes that minimize environmental impacts.	Spin Master Corp.	Spin Master Corp.	Climate Action Plan	Likely NAICS Codes: 339932 - Toy and Game Manufacturing, 541612 - Environmental Consulting Services, 312130 - Bottled and Canned Soft Drinks Manufacturing, 711510 - Independent Artists, Writers, and Performers	FALSE - The article does not contain misleading statements about environmental benefits; instead, it outlines concrete targets and progress in sustainability efforts, indicating genuine commitment.	3120
Advancing Human and Planetary Health: Enabling Healthy Diets and Addressing Climate Change - Food and Agriculture Organization of the United Nations	https://news.google.com/rss/articles/CBMihQFodHRwczovL3d3dy5mYW8ub3JnL2dlbmV2YS9uZXdzL2RldGFpbHMvQWR2YW5jaW5nLUh1bWFuLWFuZC1QbGFuZXRhcnktSGVhbHRoLUVuYWJsaW5nLUhlYWx0aHktRGlldHMtYW5kLUFkZHJlc3NpbmctQ2xpbWF0ZS1DaGFuZ2UtL2Vu0gEA?oc=5	The FAO Nutrition Dialogue Series focused on the intersection of climate change and nutrition, highlighting the need for healthy diets to address agrifood systems' environmental footprints. The initiative, backed by the Government of Egypt and WHO, aims to foster collaboration between nutrition and climate action through the I-CAN initiative, showcasing case studies from Malawi, Pakistan, and Ethiopia. These examples illustrate practical steps to enhance agrifood systems and promote better nutrition while supporting climate change mitigation. The series emphasizes sharing experiences to bolster efforts towards sustainable development goals.	TRUE, this is green innovation because it discusses actions addressing climate change and transforming agrifood systems to enhance environmental sustainability and health outcomes.	FALSE, the article does not mention a specific new or improved product or business process introduced to the market; it instead focuses on initiatives and collective actions in agrifood systems.	FALSE, the article does not describe a specific good or service that meets the definition of a green product.	TRUE, the article describes processes related to agrifood systems transformation aimed at reducing environmental impacts and enhancing sustainability.	company not identified	official company name not identified	product or process not identified	Likely NAICS Codes: 111 - Crop Production, 112 - Animal Production and Aquaculture, 311 - Food Manufacturing, 541 - Professional, Scientific, and Technical Services	FALSE, the article does not provide misleading claims about environmental benefits but rather discusses constructive actions taken by various organizations to address climate and nutrition issues.	2268
LyondellBasell Details Accelerated Momentum in 2022 Sustainability Report - LyondellBasell	https://news.google.com/rss/articles/CBMikgFodHRwczovL3d3dy5seW9uZGVsbGJhc2VsbC5jb20vZW4vbmV3cy1ldmVudHMvY29ycG9yYXRlLS1maW5hbmNpYWwtbmV3cy9seW9uZGVsbGJhc2VsbC1kZXRhaWxzLWFjY2VsZXJhdGVkLW1vbWVudHVtLWluLTIwMjItc3VzdGFpbmFiaWxpdHktcmVwb3J0L9IBAA?oc=5	LyondellBasell published its annual sustainability report highlighting its progress in sustainability initiatives, including circular plastics recycling and greenhouse gas emissions reduction targets. The company plans to produce over 2 million metric tons of recycled and renewable-based polymers annually by 2030. Furthermore, it reported improving diversity, equity, and inclusion efforts alongside achieving record safety levels in operations. CEO Peter Vanacker emphasized the importance of addressing climate and circularity to capture potential value and foster a low carbon future.	TRUE - This innovation is considered green because it focuses on sustainability initiatives aimed at reducing plastic waste, enhancing recycling capabilities, and accelerating greenhouse gas emissions reductions, thus contributing to environmental sustainability goals.	TRUE - The article discusses LyondellBasell's development and marketing of sustainable products, such as recycled and renewable-based polymers, which represents a new business process and product innovation significantly different from previous offerings.	TRUE - The recycled and renewable-based polymers produced and marketed under the Circulen brand qualify as green products as they are designed to reduce environmental impact throughout their lifecycle.	TRUE - The initiatives described, including mechanical recycling and renewable energy procurement, illustrate green processes that aim to minimize waste and reduce environmental impacts during production.	LyondellBasell	LyondellBasell Industries N.V.	Circulen brand recycled and renewable-based polymers	{'Likely NAICS Codes': ['325211 - Plastics Material and Resin Manufacturing', '325211 - Specialty Polymer Manufacturing', '324110 - Petroleum Refineries', '332999 - All Other Miscellaneous Fabricated Metal Product Manufacturing']}	FALSE - The article does not seem to promote misleading environmental benefits; instead, it provides specific actions and measurable commitments related to sustainability, indicating a genuine effort towards environmental responsibility.	2680
Tillamook County Creamery Association Partners With New Seasons Market to Drive Climate Action; Jocelyn Bridson ... - Deli Market News	https://news.google.com/rss/articles/CBMizgFodHRwczovL3d3dy5kZWxpbWFya2V0bmV3cy5jb20vcXVpY2stYml0ZS90aWxsYW1vb2stY291bnR5LWNyZWFtZXJ5LWFzc29jaWF0aW9uLXBhcnRuZXJzLW5ldy1zZWFzb25zLW1hcmtldC1kcml2ZS1jbGltYXRlLWFjdGlvbi1qb2NlbHluLWJyaWRzb24tYW5kLWF0aGVuYS1wZXR0eS1zaGFyZS9jaGFuZGxlci1qYW1lcy9mcmktMDQwNzIwMjMtMDg0NS8xNTI4ONIBAA?oc=5	Tillamook County Creamery Association (TCCA) and New Seasons Market (NSM) have teamed up to establish a native riparian forest habitat on farmland in Tillamook County to improve environmental impacts and support farmers. They plan to plant approximately five acres of native vegetation to sequester carbon, protect water quality, and enhance wildlife habitat. The project aims to accelerate regenerative agriculture and help both companies meet their climate goals, and it will provide volunteer opportunities for staff. This partnership marks TCCA's first environmental project collaboration with a retail customer.	TRUE: This is green innovation because it involves creating a riparian forest habitat, which helps sequester carbon, protects water quality, and enhances wildlife habitat, contributing to environmental sustainability goals.	TRUE: This is a business innovation because TCCA and NSM are collaborating on a new environmental project that significantly differs from their previous practices, thereby introducing a new approach to sustainability in their operations.	FALSE: This is not a green product as the article describes processes and initiatives rather than a specific good or service that meets the definition of a green product.	TRUE: This is a green process because the partnership involves methods for regenerative agriculture that minimize environmental impacts by enhancing carbon sequestration and conserving resources.	Tillamook County Creamery Association, New Seasons Market	{'TCCA': 'Tillamook County Creamery Association', 'NSM': 'New Seasons Market'}	riparian forest habitat establishment	Likely NAICS Codes: 111000 - Crop Production, 112000 - Animal Production, 813110 - Religious Organizations, 921120 - Administration of Conservation Programs	FALSE: The article does not appear to be greenwashing, as it discusses a genuine collaborative effort between TCCA and NSM to implement sustainable agricultural practices and improve environmental impacts.	1857
Quick Tips to Repair Broken Items and Keep Them Out of the Landfill - Columbia University	https://news.google.com/rss/articles/CBMicWh0dHBzOi8vbmV3cy5jbGltYXRlLmNvbHVtYmlhLmVkdS8yMDIzLzA0LzIwL3F1aWNrLXRpcHMtdG8tcmVwYWlyLWJyb2tlbi1pdGVtcy1hbmQta2VlcC10aGVtLW91dC1vZi10aGUtbGFuZGZpbGwv0gEA?oc=5	The article discusses the concept of a circular economy, emphasizing the importance of repairing and reusing everyday items to reduce waste and environmental impacts. Sandra Goldmark advocates for creating a system where products are designed to be durable and repairable, helping to conserve resources and minimize emissions. It highlights the difficulties people face in accessing repair services and encourages a culture of repair and sustainable consumption.	TRUE: The article promotes the concept of a circular economy and highlights the importance of repairing products to reduce waste and environmental impact, aligning with the goals of environmental sustainability.	FALSE: The article does not describe a new or improved product or business process introduced to the market; rather, it discusses a concept and activism around sustainability and repair.	FALSE: The article does not identify a specific product that meets the definition of a green product; instead, it discusses the philosophy around making sustainable and repairable products.	TRUE: The article discusses the process of repairing and reusing items as a method to promote sustainability and reduce environmental impacts, which fits the definition of a green process.	company not identified	company not identified	repairing everyday items	Likely NAICS Codes: 811310 - Commercial and Industrial Machinery and Equipment (except Automotive and Electronic) Repair and Maintenance, 238220 - Plumbing, Heating, and Air-Conditioning Contractors, 423320 - Brick, Stone, and Related Construction Material Merchant Wholesalers, 541310 - Architectural Services	FALSE: The article does not engage in greenwashing as it promotes genuine efforts toward sustainability and repair rather than making misleading claims about environmental benefits.	3031
These 8 Countries are Embracing Plant-Based Food for the Planet - VegNews	https://news.google.com/rss/articles/CBMiQ2h0dHBzOi8vdmVnbmV3cy5jb20vY291bnRyaWVzLWVtYnJhY2luZy1wbGFudC1iYXNlZC1mb29kLWZvci1wbGFuZXTSAQA?oc=5	The article discusses global efforts to mitigate climate change through the promotion of plant-based diets and the involvement of various governments around the world in supporting plant-based food initiatives. It highlights examples from countries like Germany, the US, Canada, Denmark, Taiwan, India, the Netherlands, and Finland, which have implemented policies or strategies to reduce reliance on animal agriculture and promote sustainable food systems. These initiatives are aimed at reducing carbon footprints and achieving environmental sustainability goals.	TRUE	TRUE	TRUE	TRUE	company not identified	official_company_name not identified	product or process not identified	Likely NAICS Codes: 311111 - Wheat Farming, 311119 - Other Grain Farming, 311812 - Commercial Bakeries, 311910 - Snack Food Manufacturing	FALSE	3354
New York's Mannan Supermarket Partners with Charity Group to Improve Food Security - Progressive Grocer	https://news.google.com/rss/articles/CBMiZ2h0dHBzOi8vcHJvZ3Jlc3NpdmVncm9jZXIuY29tL25ldy15b3Jrcy1tYW5uYW4tc3VwZXJtYXJrZXQtcGFydG5lcnMtY2hhcml0eS1ncm91cC1pbXByb3ZlLWZvb2Qtc2VjdXJpdHnSAQA?oc=5	Mannan Supermarket has partnered with the Zara Charitable Foundation to provide fresh, culturally relevant food to 200 families in Queens facing food insecurity, particularly after reductions in government aid programs like SNAP and WIC. The collaboration aims to alleviate the challenges of rising food prices and limited resources for healthy eating. The initiative includes donations of various food items to local families through Richmond Hill High School.	FALSE: While the initiative addresses food insecurity and aims to provide healthy food, it does not directly relate to innovations in sustainability or reducing environmental impacts as defined by green innovation.	TRUE: The collaboration between Mannan Supermarket and the Zara Charitable Foundation is a new business partnership that significantly expands their service offerings to meet community needs.	TRUE: The fresh, culturally relevant food sourced from Mannan Supermarket, such as lentils, tortillas, and roti, meets the definition of a green product due to its focus on health and nutrition.	FALSE: The article does not describe a specific manufacturing or operational process that minimizes environmental impacts; the focus is on food donations.	Mannan Supermarket	Mannan Supermarket	product or process not identified	Likely NAICS Codes: 445110 - Supermarkets and Other Grocery (except Convenience) Stores, 624210 - Community Food Services, 813410 - Civic and Social Organizations, 813990 - Other Similar Organizations (except Business, Professional, Labor, and Political Organizations)	FALSE: There is no indication that this initiative is misleading or falsely marketed as environmentally responsible; it appears to genuinely address food insecurity.	1662
California approves rule phasing out big diesel trucks - CBS Sacramento	https://news.google.com/rss/articles/CBMiX2h0dHBzOi8vd3d3LmNic25ld3MuY29tL3NhY3JhbWVudG8vbmV3cy9jYWxpZm9ybmlhLWFwcHJvdmVzLXJ1bGUtcGhhc2luZy1vdXQtYmlnLWRpZXNlbC10cnVja3Mv0gFjaHR0cHM6Ly93d3cuY2JzbmV3cy5jb20vYW1wL3NhY3JhbWVudG8vbmV3cy9jYWxpZm9ybmlhLWFwcHJvdmVzLXJ1bGUtcGhhc2luZy1vdXQtYmlnLWRpZXNlbC10cnVja3Mv?oc=5	California regulators approved new rules that will prohibit the sale of new diesel big rigs and buses starting in 2036, aiming to reduce pollution and combat climate change. The rules will require companies to disclose their use of drayage trucks by 2024, coinciding with standards set by the Biden administration for similar vehicles. While the move is lauded as essential for public health and cleaner air, some trucking industry representatives argue it could lead to increased costs and express concern over charging infrastructure for zero-emission vehicles. The regulations are part of California's broader goal of achieving carbon neutrality by 2045.	TRUE; this initiative represents a significant step towards decarbonization and reducing harmful emissions from diesel vehicles, contributing to environmental sustainability goals.	TRUE; the new regulations represent a major change in business processes for the trucking industry and align with innovative approaches to reduce emissions and enhance sustainability.	FALSE; while the article discusses regulations related to the transition to zero-emission trucks, it does not specifically mention a good or service that qualifies as a green product.	TRUE; the regulations and initiative to phase out diesel vehicles represent a new process focused on minimizing environmental impacts and promoting sustainability in transportation.	company not identified	company not identified	product or process not identified	Likely NAICS Codes: 484121 - General Freight Trucking, Long-Distance, 336120 - Heavy Duty Truck Manufacturing, 488490 - Other Support Activities for Road Transportation, 541620 - Environmental Consulting Services	FALSE; the article discusses actual regulatory changes aimed at reducing emissions rather than misleading claims about environmental benefits.	2217
Ushering in the Next Generation of Climate Technology - BCG	https://news.google.com/rss/articles/CBMiVWh0dHBzOi8vd3d3LmJjZy5jb20vcHVibGljYXRpb25zLzIwMjMvbmV4dC1nZW5lcmF0aW9uLWNsaW1hdGUtbWl0aWdhdGlvbi10ZWNobm9sb2dpZXPSAQA?oc=5	The article emphasizes the necessity for global investments of $3.5 trillion per year in climate technologies to achieve net-zero emissions by 2050, highlighting the importance of market-shaping mechanisms to reduce investment risks and accelerate the deployment of these technologies. It argues that collaborative efforts among stakeholders can strategically address market failures in the climate technology sector, similar to successful public-private partnerships in global health. Failure to invest aggressively in climate technologies will prolong climate change impacts, with the article detailing historical funding gaps that have delayed progress in renewable energy sectors. The piece conveys a sense of urgency for immediate action towards climate innovation funding.	TRUE: The article discusses climate technologies that contribute to decarbonization, which aligns with green innovation's goals of reducing negative environmental externalities.	TRUE: The article describes emerging climate technologies and market mechanisms aimed at transforming proven concepts into viable products, which constitutes significant enhancements in business processes.	FALSE: The article does not specifically identify a good or service that fits the detailed definition of a green product, rather it discusses technologies and investment strategies.	TRUE: The article talks about market-shaping as a process that minimizes environmental impacts while promoting sustainability within climate technology deployment.	company not identified	company not identified	product or process not identified	Likely NAICS Codes: 541715 - Research and Development in the Physical, Engineering, and Life Sciences (except Nanotechnology and Biotechnology); 334519 - Other Measuring and Controlling Device Manufacturing; 335999 - All Other Miscellaneous Electrical Equipment and Component Manufacturing; 221118 - Other Electric Power Generation	FALSE: The article does not present misleading claims about environmental benefits but instead advocates for real investment in climate technologies, highlighting the urgency and importance of genuine action against climate change.	2492
California approves phase-out of large diesel-powered trucks - Vijesti.me	https://news.google.com/rss/articles/CBMiXmh0dHBzOi8vZW4udmlqZXN0aS5tZS93b3JsZC9nbG9idXMvNjU0NDM4L0NhbGlmb3JuaWEtYXBwcm92ZXMtcGhhc2Utb3V0LW9mLWxhcmdlLWRpZXNlbC10cnVja3PSAVVodHRwczovL2VuLnZpamVzdGkubWUvYW1wLzY1NDQzOC9DYWxpZm9ybmlhLWFwcHJvdmVzLXBoYXNlLW91dC1vZi1sYXJnZS1kaWVzZWwtdHJ1Y2tz?oc=5	California is enacting new regulations to phase out diesel-powered trucks and buses by 2036 to reduce greenhouse gas emissions and air pollution. The new rules require transparency in truck usage and support the transition to zero-emission vehicles, despite concerns from the transportation industry regarding potential cost increases. With California's ambitious emissions standards, the state aims to achieve carbon neutrality by 2045, including the adoption of electric vehicles and banning gas-powered equipment. This action is seen as significant for public health and environmental goals.	TRUE - The regulations targeting diesel trucks and the push towards zero-emission vehicles represent a clear effort to reduce greenhouse gas emissions and promote environmental sustainability.	TRUE - The transition to electric and zero-emission vehicles and regulations on trucking processes constitute a significant improvement in the business processes of transportation companies.	FALSE - The article does not mention a specific green product; it focuses on regulatory changes rather than particular goods.	TRUE - The regulatory shift towards zero-emission technology and the requirement for transparency in truck usage reflect the adoption of a green process aimed at reducing environmental impact.	company not identified	company not identified	process not identified	Likely NAICS Codes: 488510 - Freight Transportation Arrangement; 484121 - General Freight Trucking, Long-Distance, Truckload; 335999 - All Other Miscellaneous Electrical Equipment and Component Manufacturing; 541620 - Environmental Consulting Services	FALSE - The article describes legitimate regulatory measures aimed at reducing emissions rather than misleading claims about environmental benefits.	2137
