title	link	summary	green_innovation	business_innovation	green_product	green_process	company	official_company_name	product_or_process	likely_naics_codes	greenwashing	total_tokens
Top 10 Best Textile Companies In Europe 2023 - Inventiva	https://news.google.com/rss/articles/CBMiRGh0dHBzOi8vd3d3LmludmVudGl2YS5jby5pbi90cmVuZHMvdGV4dGlsZS1jb21wYW5pZXMtaW4tZXVyb3BlLTIwMjMv0gEA?oc=5	The textile industry plays a crucial role in the global economy, but it has significant environmental impacts due to high water usage and pollution. In response, many companies are prioritizing sustainability by implementing eco-friendly practices and innovative technologies. Notable examples, such as Lenzing AG and Worn Again Technologies, are leading the way in producing sustainable textiles and promoting circular economies. The industry's future success hinges on its commitment to sustainability and ethical labor practices.	TRUE, because the article discusses companies in the textile industry that are implementing sustainable practices to reduce environmental impacts, such as recycling, using eco-friendly materials, and developing closed-loop production processes.	TRUE, because the companies mentioned are introducing new or improved products and processes that significantly differ from traditional practices in the textile industry.	TRUE, because many of the products produced by the companies, such as Lenzing’s wood-based fibers and Worn Again Technologies’ recycled textiles, are designed to minimize environmental impact and use sustainable materials.	TRUE, because the practices described, such as recycling processes, energy conservation, and the use of sustainable resources, all minimize environmental impacts in manufacturing.	Lenzing AG	Lenzing AG	TENCEL™ fibers	[{'code': '313', 'category': 'Textile Mills'}, {'code': '314', 'category': 'Textile Product Mills'}, {'code': '32522', 'category': 'Artificial and Synthetic Fibers and Filaments Manufacturing'}, {'code': '332618', 'category': 'Other Fabricated Metal Product Manufacturing'}]	FALSE, as the article does not present misleading claims about environmental benefits; instead, it accurately discusses companies genuinely working toward sustainability and reducing their environmental impact.	4841
Top 10 Best Food & Beverages Companies In USA 2023 - Inventiva	https://news.google.com/rss/articles/CBMiSGh0dHBzOi8vd3d3LmludmVudGl2YS5jby5pbi90cmVuZHMvZm9vZC1iZXZlcmFnZXMtY29tcGFuaWVzLWluLXVzYS0yMDIzL9IBAA?oc=5	The article discusses the growth and importance of the food and beverage industry in the U.S. in 2023, highlighting major companies and their commitment to sustainability and innovation. It emphasizes the industry’s adaptation to consumer trends, creation of healthier products, and partnerships with government organizations for food safety. Moreover, it notes the industry's projected value and competitive landscape, asserting that corporate success relies on innovation, sustainability, and strategic partnerships.	TRUE: The article mentions several companies focusing on sustainability initiatives and the development of healthier, more nutritious products, aligning with green innovation principles.	TRUE: The companies discussed in the article introduce new or improved products and processes that significantly differ from their previous offerings, which qualifies as business innovation.	FALSE: The article does not specify a particular product designed to significantly reduce environmental impact; it discusses trends and company initiatives without identifying specific green products.	FALSE: The article mentions innovative practices but does not detail a specific process designed to minimize environmental impacts.	["McDonald's Corporation", 'Starbucks Corporation', 'Yum! Brands, Inc.', 'PepsiCo, Inc.', 'Nestlé SA', 'Coca-Cola Company', 'Mondelez International, Inc.', 'Kraft Heinz Company', 'Conagra Brands, Inc.', 'Hormel Foods Corporation']	["McDonald's Corporation", 'Starbucks Corporation', 'Yum! Brands, Inc.', 'PepsiCo, Inc.', 'Nestlé S.A.', 'The Coca-Cola Company', 'Mondelez International, Inc.', 'Kraft Heinz Company', 'Conagra Brands, Inc.', 'Hormel Foods Corporation']	product or process not identified	Likely NAICS Codes: 311 – Food Manufacturing, 312 – Beverage Manufacturing, 722 – Food Services and Drinking Places, 4244 – Grocery and Related Product Merchant Wholesalers	FALSE: The article does not present misleading claims about environmental benefits; instead, it describes companies' commitments to sustainability initiatives and innovation without exaggeration.	5138
Top 20 Best Leather Product Manufacturing Companies In India 2023 - Inventiva	https://news.google.com/rss/articles/CBMiSmh0dHBzOi8vd3d3LmludmVudGl2YS5jby5pbi90cmVuZHMvdG9wLWJlc3QtbGVhdGhlci1wcm9kdWN0LW1hbnVmYWN0dXJpbmcv0gEA?oc=5	The article highlights the top 20 leather product manufacturing companies in India for 2023, emphasizing their commitment to quality, innovation, and ethical manufacturing practices. It discusses each company's unique selling points, product ranges, and sustainability efforts, showcasing how technology is enhancing their manufacturing processes. The focus is on traditional craftsmanship combined with modern innovations, ensuring both style and durability in their leather goods. The article positions these companies as leaders in an evolving industry committed to sustainable practices.	TRUE; the article features companies that incorporate sustainable materials and eco-friendly production processes in their leather goods, thus contributing to environmental sustainability.	TRUE; the companies mentioned introduce new or improved leather products and processes that cater to market demands, differentiating themselves significantly from previous offerings.	TRUE; many of the leather products discussed are made from environmentally friendly materials and produced through sustainable practices, thereby significantly reducing their environmental impact.	TRUE; the article describes sustainable manufacturing practices employed by these companies, such as using renewable resources and minimizing waste, making their processes environmentally friendly.	Hidesign	Hidesign	leather products	Likely NAICS Codes: 31621 - Leather and Hide Tanning and Finishing, 316998 - All Other Leather Good Manufacturing, 448190 - Other Clothing Stores, 423910 - Sporting and Recreational Goods and Supplies Merchant Wholesalers	FALSE; the article does not present misleading information about environmental benefits and rather focuses on genuine sustainability efforts by the highlighted companies.	4271
Top 10 Best Fishing Companies In Europe 2023 - Inventiva	https://news.google.com/rss/articles/CBMiRGh0dHBzOi8vd3d3LmludmVudGl2YS5jby5pbi90cmVuZHMvZmlzaGluZy1jb21wYW5pZXMtaW4tZXVyb3BlLTIwMjMv0gEA?oc=5	The article discusses the significant role of fishing companies in sustainability and their efforts to adopt more environmentally friendly practices, highlighting the top fishing companies in Europe based on catch and revenue. Sustainability practices, such as selective fishing and innovative technologies, are emphasized across several companies. Each company is dedicated to reducing its environmental impact and promoting responsible aquaculture through various initiatives.	TRUE, because the article describes fishing companies that are adopting sustainable practices and technologies that minimize environmental impacts and promote sustainability.	TRUE, because the article discusses the introduction of new and improved practices and products by fishing companies, which represent significant advancements from their previous operations in the seafood industry.	TRUE, because the seafood products described are produced with environmentally benign methods, contributing to reduced environmental impact during their life cycle.	TRUE, because the companies mentioned implement sustainable practices and innovative technologies to minimize waste and environmental impacts in their operations.	Marine Harvest, Pescanova, Bakkafrost, Grieg Seafood, Marine Harvest Scotland, Royal Greenland, Lerøy Seafood Group, Austevoll Seafood, Sirena Group, Nueva Pescanova	Marine Harvest	sustainable seafood products	Likely NAICS Codes: 311712 - Fresh and Frozen Seafood Processing; 114112 - Shellfish Fishing; 114119 - Other Marine Fishing; 31199 - All Other Food Manufacturing	FALSE, as the article provides substantial evidence of the companies' genuine commitment to sustainable practices and does not present misleading information about their environmental benefits.	4340
Top 10 Best Food Processing Companies In Europe 2023 - Inventiva	https://news.google.com/rss/articles/CBMiSWh0dHBzOi8vd3d3LmludmVudGl2YS5jby5pbi90cmVuZHMvZm9vZC1wcm9jZXNzaW5nLWNvbXBhbmllcy1ldXJvcGUtMjAyMy_SAQA?oc=5	The article discusses the important role of food processing companies in Europe in providing diverse and affordable food options while emphasizing their commitment to sustainability and innovation. Key companies like Nestle, Unilever, and Danone are highlighted for their eco-friendly practices and efforts to address changing consumer preferences, such as plant-based diets. Despite facing challenges from regulatory pressures and competition, these companies are focused on reducing their environmental impact, waste, and using renewable resources.	TRUE, because the article describes several food processing companies implementing sustainable practices to reduce their environmental impact, such as using renewable energy, eco-friendly packaging, and sourcing ingredients responsibly.	TRUE, because the article discusses food processing companies creating new or improved products and processes that significantly differ from their previous offerings and cater to growing consumer demands for convenience and sustainability.	TRUE, because the article highlights the production of various food items that are developed using environmentally benign materials and sustainable practices, thus significantly reducing their environmental impact.	TRUE, because the article describes initiatives by companies to reduce waste, conserve resources, and limit harmful emissions, which aligns with the definition of green processes.	Nestle, Unilever, Danone, Ferrero, Mondelez International, Mars, Kellogg’s, Heineken, Diageo, Carlsberg	Nestlé S.A., Unilever PLC, Danone S.A., Ferrero Group, Mondelez International, Inc., Mars, Incorporated, Kellogg Company, Heineken N.V., Diageo plc, Carlsberg A/S	various food processing products and processes	Likely NAICS Codes: 311 - Food Manufacturing, 312 - Beverage Manufacturing, 3118 - Bakeries and Tortilla Manufacturing, 3119 - Other Food Manufacturing	FALSE, because the article provides substantial information regarding the companies’ genuine efforts to implement sustainable practices and responds to consumer demand for environmentally responsible products rather than making misleading claims.	4261
