title	link	summary	green_innovation	business_innovation	green_product	green_process	company	official_company_name	product_or_process	likely_naics_codes	greenwashing	total_tokens
How Are New Products and Services Developed in Businesses?	http://www.bing.com/news/apiclick.aspx?ref=FexRss&aid=&tid=667b5cf301c24fb4af6453a091795d74&url=https%3a%2f%2fsmallbusiness.chron.com%2fnew-products-services-developed-businesses-44843.html&c=9781705195694607728&mkt=en-us	The article discusses considerations for developing new products, whether for existing customers or new markets. It highlights that launching new products in new markets involves higher risk due to the need to establish company credentials and overcome market entry barriers. Building on existing customer relationships can ease the process of product launches. Greater marketing effort is necessary when entering new markets.	FALSE: The article does not mention any specific innovation aimed at reducing environmental impacts, therefore it does not qualify as green innovation.	TRUE: The article addresses the development of new products, which aligns with the definition of business innovation as it involves launching new offerings for different or existing markets.	FALSE: The article does not specify any goods or services designed to significantly reduce environmental impacts throughout their life cycle, thus it cannot be considered a green product.	FALSE: There is no mention of any specific processes that aim to minimize environmental impacts or promote sustainability in the article.	company not identified	company not identified	product or process not identified	Likely NAICS Codes: 541611 - Administrative Management and General Management Consulting Services, 541618 - Other Management Consulting Services, 541310 - Architectural Services, 541320 - Landscape Architectural Services	FALSE: The article does not make misleading claims about environmental benefits; it simply discusses market considerations without references to specific environmental impacts.	1375
Consumer Products	http://www.bing.com/news/apiclick.aspx?ref=FexRss&aid=&tid=667b5cf301c24fb4af6453a091795d74&url=https%3a%2f%2fwww.acs.org%2feducation%2fwhatischemistry%2flandmarks%2fnewproducts.html&c=14146689665567874098&mkt=en-us	The article discusses George Washington Carver's contributions as a scientist and educator at Tuskegee University, including his development of new uses for southern agricultural crops and methods for soil improvement for poor farmers.	TRUE - Carver's work in developing uses for crops and teaching soil improvement methods contributes to environmental sustainability by promoting better agricultural practices.	TRUE - Carver's development of new agricultural uses for crops can be considered a business innovation as it introduces improved methods and research into the agricultural sector.	FALSE - The article does not specifically mention a good or service that meets the definition of a green product.	TRUE - The methods Carver taught for soil improvement and resource conservation can be categorized as green processes that promote sustainability.	company not identified	company not identified	product or process not identified	Likely NAICS Codes: 111 - Crop Production, 115 - Support Activities for Agriculture and Forestry, 541 - Professional, Scientific, and Technical Services, 611 - Educational Services	FALSE - The article does not suggest that Carver or his methods are being misrepresented or exaggerated; rather, it highlights his genuine contributions to agricultural improvement.	1355
New Product Development and Introduction	http://www.bing.com/news/apiclick.aspx?ref=FexRss&aid=&tid=667b5cf301c24fb4af6453a091795d74&url=https%3a%2f%2fsmallbusiness.chron.com%2fnew-product-development-introduction-61192.html&c=1835354021749500249&mkt=en-us	The article suggests that testing a new product in the market prior to manufacturing can help minimize costly mistakes. It recommends creating a prototype for customer feedback or discussing the concept with customers to make adjustments. An internal review should be conducted to ensure the project meets business, technical, and financial objectives, and if shortcomings are found, changes should be made or the project stopped before further resources are committed.	FALSE - The article does not describe any specific green innovation or practices aimed at minimizing environmental impact.	TRUE - The article discusses the process of market testing a new product, which is an improvement in business processes related to product development.	FALSE - The article does not describe any good or service that significantly reduces environmental impact throughout its life cycle.	FALSE - The article discusses a testing process but does not detail a method specifically aimed at minimizing environmental impacts.	company not identified	company not identified	product or process not identified	Likely NAICS Codes: 541611 - Administrative Management and General Management Consulting Services, 541614 - Process, Physical Distribution, and Logistics Consulting Services, 541615 - Product Development Consulting Services, 541618 - Other Management Consulting Services	FALSE - The article provides straightforward advice on product testing and internal reviews without making misleading claims about environmental benefits, thus does not appear to be an example of greenwashing.	1376
The best new products this month from Sonos, Fujifilm and more	http://www.bing.com/news/apiclick.aspx?ref=FexRss&aid=&tid=667b5cf301c24fb4af6453a091795d74&url=https%3a%2f%2fwww.nbcnews.com%2fselect%2fshopping%2fnew-notable-sonos-jbl-fitbit-rcna156060&c=10620934023132122390&mkt=en-us	The article highlights various new product launches including Sonos Ace headphones, JBL Clip 5 speaker, Fujifilm X-T50 camera, and more. It provides details on features, improvements, and uses of these products aimed mainly at enhancing the user experience in tech and fitness. Each product is positioned as an innovation in its field, showcasing advancements over previous models while focusing on functionality and usability.	FALSE: The article does not discuss innovations that specifically contribute to environmental sustainability goals.	TRUE: The article describes new or improved products from different companies that differ significantly from previous versions and have been introduced to the market.	FALSE: While the products mentioned may offer enhanced features, they do not meet the definition of green products, as they do not significantly reduce environmental impact throughout their life cycle.	FALSE: The article does not describe any processes that minimize environmental impacts or promote sustainability.	company not identified	company not identified	product or process not identified	Likely NAICS Codes: 334310 - Audio and Video Equipment Manufacturing, 334410 - Semiconductor and Other Electronic Component Manufacturing, 334111 - Electronic Computer Manufacturing, 339999 - All Other Miscellaneous Manufacturing	FALSE: The article does not appear to be an example of greenwashing as it does not make misleading claims about environmental benefits of products, rather it focuses on product features and functionalities.	2612
The Pioneer Woman’s 3 new Walmart-exclusive kitchen appliances are under $60 and available to shop now	http://www.bing.com/news/apiclick.aspx?ref=FexRss&aid=&tid=667b5cf301c24fb4af6453a091795d74&url=https%3a%2f%2fwww.nj.com%2fshopping-deals%2f2024%2f06%2fthe-pioneer-womans-3-new-walmart-exclusive-kitchen-appliances-are-under-60-and-available-to-shop-now.html&c=7663046525513368539&mkt=en-us	Ree Drummond has launched a new small appliance collection in a Linen Speckle colorway for Walmart, including a Digital 2-Slice Toaster, a 6 Qt Slow Cooker, and a 6 Qt Pressure Cooker. The products feature various modern conveniences like programmable settings and are designed to fit into a modern kitchen aesthetic. Additionally, a new electric skillet and air fryer are set to join the collection later this summer. The prices for the new items start at $30, and they are exclusively available through Walmart.	FALSE: The article does not mention any specific attributes of the products that contribute to environmental sustainability, such as reduced energy consumption or materials that minimize environmental impact.	TRUE: The introduction of new small appliances with updated designs and features constitutes a new or improved product that has been brought to market, satisfying the definition of business innovation.	FALSE: The article does not specify that the new appliances are designed or manufactured in a way that significantly reduces their environmental impact throughout their lifecycle.	FALSE: There is no mention of any methods or techniques in manufacturing or operational activities that minimize environmental impacts related to the production of these appliances.	Walmart	Walmart Inc.	Digital 2-Slice Toaster, 6 Qt Slow Cooker, 6 Qt Pressure Cooker	Likely NAICS Codes: 3352 - Household Appliance Manufacturing, 4236 - Household Appliances, Electric Housewares, and Consumer Electronics Merchant Wholesalers, 4431 - Electronics and Appliance Stores, 5418 - Advertising, Public Relations, and Related Services	FALSE: There is no evidence in the article that suggests the products are being marketed with misleading claims regarding their environmental benefits.	1810
America's Most Innovative Companies	http://www.bing.com/news/apiclick.aspx?ref=FexRss&aid=&tid=667b5cf301c24fb4af6453a091795d74&url=https%3a%2f%2ffortune.com%2franking%2famericas-most-innovative-companies%2f&c=11123191776111620074&mkt=en-us	The article text outlines terms and conditions related to the use of the Fortune Media website, including acceptance of privacy policies and potential compensation for links to products and services. It emphasizes the registered trademarks and conditions for users of the site.	FALSE - The article does not discuss any products or practices that contribute to environmental sustainability or innovation.	FALSE - The article does not present a new or improved product or business process introduced in the market.	FALSE - There is no mention of any product designed to reduce environmental impact.	FALSE - The article does not describe any manufacturing or operational processes that minimize environmental impacts.	company not identified	company not identified	product or process not identified	Likely NAICS Codes: 9999 - Unclassified Industry, 5418 - Advertising, Public Relations, and Related Services, 5111 - Newspaper, Periodical, Book, and Directory Publishers, 5416 - Management, Scientific, and Technical Consulting Services	FALSE - The article does not suggest any misleading claims regarding environmental benefits as it is primarily legal and informational in nature.	1315
New iMac	http://www.bing.com/news/apiclick.aspx?ref=FexRss&aid=&tid=667b5cf301c24fb4af6453a091795d74&url=https%3a%2f%2fappleinsider.com%2finside%2fnew-imac&c=7898666714699059987&mkt=en-us	The article discusses the rumors and developments surrounding a new, larger iMac model, particularly its potential features, sizes, designs, and processors. It emphasizes the speculation about a 30-inch or larger iMac potentially launching in 2025, but confirms that Apple is not currently working on a 27-inch model. Early rumors suggested various upgrades and design changes, highlighting Apple's push towards efficiency and improved display technologies in future models.	FALSE, the article does not describe any innovations that significantly reduce environmental impact or promote sustainability.	TRUE, the article discusses the potential new iMac as a new or improved product that differs significantly from Apple's previous offerings, aligning with the definition of business innovation.	FALSE, while the iMac is a product, it is not designed specifically to reduce environmental impact throughout its life cycle as defined for green products.	FALSE, the article does not mention any methods or techniques that minimize environmental impacts in the manufacturing or operational activities of the iMac.	Apple	Apple Inc.	iMac	Likely NAICS Codes: 334111 - Electronic Computer Manufacturing, 423430 - Computer and Computer Peripheral Equipment and Software Merchant Wholesalers, 541511 - Custom Computer Programming Services, 334210 - Telephone Apparatus Manufacturing.	FALSE, there is no indication of misleading statements regarding environmental benefits; the article focuses on product specifications and future model rumors without any claims related to sustainability.	2948
