title	link	summary	green_innovation	business_innovation	green_product	green_process	company	official_company_name	product_or_process	likely_naics_codes	greenwashing	total_tokens
The future of materials - Deloitte	https://news.google.com/rss/articles/CBMiWmh0dHBzOi8vd3d3Mi5kZWxvaXR0ZS5jb20vdXMvZW4vaW5zaWdodHMvaW5kdXN0cnkvb2lsLWFuZC1nYXMvdGhlLWZ1dHVyZS1vZi1tYXRlcmlhbHMuaHRtbNIBAA?oc=5	Eastman, a global specialty materials company, is advancing its sustainability initiatives by launching chemical-recycling projects that repurpose waste plastics into valuable materials. The company utilizes Carbon Renewal Technology and Polyester Renewal Technology to enhance recycling processes while reducing greenhouse gas emissions significantly. Eastman aims to recycle vast amounts of plastic by 2030 and is adapting to market trends by designing products for better recyclability. Through partnerships and innovative practices, Eastman is addressing major environmental challenges.	TRUE - This is green innovation because Eastman is developing sustainable business practices that focus on recycling plastics to reduce waste and greenhouse gas emissions, thus addressing environmental challenges effectively.	TRUE - This is a business innovation as Eastman is introducing new chemical-recycling processes that significantly differ from their previous operations and meet market demand for sustainable materials.	FALSE - The article discusses processes and technologies rather than specific goods or services that fit the green product definition.	TRUE - This is a green process because Eastman's chemical-recycling methods are designed to minimize environmental impacts, reduce waste, and promote sustainability through innovative recycling technologies.	Eastman	Eastman Chemical Company	Carbon Renewal Technology (CRT) and Polyester Renewal Technology (PRT)	Likely NAICS Codes: 325199 - All Other Basic Organic Chemical Manufacturing; 326121 - Plastics Pipe and Pipe Fitting Manufacturing; 325211 - Plastics Material and Resin Manufacturing; 424130 - Industrial and Personal Service Paper Merchant Wholesalers	FALSE - The article does not suggest any misleading statements about Eastman's environmental benefits; rather, it outlines concrete efforts towards sustainability and recycling, indicating a genuine commitment rather than greenwashing.	2368
First Person Perspective: Carpet is the feedstock of the future - Resource Recycling	https://news.google.com/rss/articles/CBMic2h0dHBzOi8vcmVzb3VyY2UtcmVjeWNsaW5nLmNvbS9yZWN5Y2xpbmcvMjAyMy8wNi8xNC9maXJzdC1wZXJzb24tcGVyc3BlY3RpdmUtY2FycGV0LWlzLXRoZS1mZWVkc3RvY2stb2YtdGhlLWZ1dHVyZS_SAXNodHRwczovL3Jlc291cmNlLXJlY3ljbGluZy5jb20vcmVjeWNsaW5nLzIwMjMvMDYvMTQvZmlyc3QtcGVyc29uLXBlcnNwZWN0aXZlLWNhcnBldC1pcy10aGUtZmVlZHN0b2NrLW9mLXRoZS1mdXR1cmUv?oc=5	The article discusses advances in recycling technology for post-consumer carpet, highlighting the efforts of the Carpet America Recovery Effort (CARE) in California to recycle carpets into new products, achieving a recycling yield of 76.4% in 2021. The article emphasizes the role of mechanical and chemical recycling processes in transforming waste carpet into valuable materials for various applications, supported by major companies investing in sustainable feedstock solutions. This innovation contributes to a circular economy by repurposing waste into usable materials. The upcoming CARE Annual Conference will further explore these developments.	TRUE: This is green innovation because it involves the recycling of post-consumer carpet, reducing landfill waste and promoting sustainability by reintroducing materials into the economy.	TRUE: This represents business innovation as it significantly improves carpet recycling processes, creating new products and business opportunities that differ from the firm's previous processes.	TRUE: The recycled carpet and its new applications qualify as a green product, as they are designed and processed to minimize environmental impact and support a circular economy.	TRUE: The mechanical and chemical recycling methods described are green processes, as they aim to reduce waste and environmental impacts while utilizing renewable resources.	Eastman, Dow, PureCycle Technologies, ExxonMobil, Shell, Aquafil, Ascend Performance Materials, Circular Polymers	Ascend Performance Materials	product or process not identified	Likely NAICS Codes: 326199 - All Other Plastics Product Manufacturing, 326150 - Urethane and Other Foam Product Manufacturing, 321920 - Wood Container and Pallet Manufacturing, 562920 - Materials Recovery Facilities.	FALSE: The article does not appear to engage in greenwashing; it provides factual information about sustainable innovations and recycling efforts in the carpet industry without misleading claims.	2148
Mono-Material Lipstick Tubes - Trend Hunter	https://news.google.com/rss/articles/CBMiOmh0dHBzOi8vd3d3LnRyZW5kaHVudGVyLmNvbS90cmVuZHMvbW9uby1tYXRlcmlhbC1wYWNrYWdpbmfSAT5odHRwczovL3d3dy50cmVuZGh1bnRlci5jb20vYW1wL3RyZW5kcy9tb25vLW1hdGVyaWFsLXBhY2thZ2luZw?oc=5	Quadpack's Emerald is a new mono-material packaging solution designed for cosmetic products, available in recyclable PET and rPET materials, which aligns with circular economy principles. This innovation simplifies recycling for consumers and addresses challenges posed by multi-material cosmetic packaging. The trend toward sustainable beauty is driving demand for such environmentally friendly packaging solutions.	TRUE, because the innovation contributes to environmental sustainability by promoting mono-material packaging, which enhances recyclability and reduces waste in the cosmetic industry.	TRUE, because Quadpack's Emerald represents a new or significantly improved product in the business of packaging for cosmetics, introduced in the market.	TRUE, as Quadpack's Emerald is designed to significantly reduce environmental impact through its recyclable materials and minimalistic design throughout its life cycle.	FALSE, because the article does not specifically describe a production method or operational activity that minimizes environmental impacts; it focuses on the packaging product.	Quadpack	Quadpack Industries	Emerald	[{'code': '326150', 'category': 'Plastics Materials and Basic Forms and Shapes Manufacturing'}, {'code': '325991', 'category': 'Custom Compounding of Purchased Resins'}, {'code': '339999', 'category': 'All Other Miscellaneous Manufacturing'}, {'code': '423850', 'category': 'Service Establishment Equipment and Supplies Merchant Wholesalers'}]	FALSE, as the article does not present misleading information; instead, it highlights a legitimate effort to provide sustainable packaging solutions without exaggeration.	1753
With New Recycling Center Fully Operational, EGGER Now Manufactures Products With Post-Consumer Recycled Wood - PR Newswire	https://news.google.com/rss/articles/CBMipAFodHRwczovL3d3dy5wcm5ld3N3aXJlLmNvbS9uZXdzLXJlbGVhc2VzL3dpdGgtbmV3LXJlY3ljbGluZy1jZW50ZXItZnVsbHktb3BlcmF0aW9uYWwtZWdnZXItbm93LW1hbnVmYWN0dXJlcy1wcm9kdWN0cy13aXRoLXBvc3QtY29uc3VtZXItcmVjeWNsZWQtd29vZC0zMDE4NDQxNDEuaHRtbNIBAA?oc=5	EGGER Wood Products has launched a new recycling center to produce sustainable thermally fused laminate (TFL) and particleboard using up to 15% post-consumer recycled wood. The company emphasizes responsible wood usage and aims to extend the usable life of wood while minimizing waste. Most of the wood used comes from sawmill residues and pre-consumer recycled material, with only 7% sourced from sustainably managed forests. EGGER also commits to operating sustainably by sourcing wood locally and reducing transportation impacts.	TRUE, this is green innovation as it promotes environmental sustainability through the use of recycled materials, reducing waste, and minimizing the carbon footprint of production.	TRUE, this is a business innovation as it introduces a significantly improved product (sustainable TFL and particleboard) into the market that differentiates from previous offerings.	TRUE, the products (thermally fused laminate and particleboard) meet the definition of green products by being designed, manufactured, and used in ways that significantly reduce their environmental impact.	TRUE, the recycling center and the methods employed in sourcing wood minimize environmental impacts and promote sustainability, aligning with the definition of green processes.	EGGER Wood Products	EGGER Wood Products LLC	thermally fused laminate and particleboard	Likely NAICS Codes: 321211 - Wood Container and Pallet Manufacturing; 321219 - Other Millwork (including Flooring); 337121 - Upholstered Household Furniture Manufacturing; 337122 - Non-Upholstered Wood Household Furniture Manufacturing	FALSE, there is no evidence of greenwashing as the article provides clear and substantiated information about EGGER's sustainability practices and use of recycled materials.	2013
CPI Announces Keynote Speaker for 2023 Polyurethanes Technical Conference - American Chemistry Council	https://news.google.com/rss/articles/CBMinwFodHRwczovL3d3dy5hbWVyaWNhbmNoZW1pc3RyeS5jb20vY2hlbWlzdHJ5LWluLWFtZXJpY2EvbmV3cy10cmVuZHMvcHJlc3MtcmVsZWFzZS8yMDIzL2NwaS1hbm5vdW5jZXMta2V5bm90ZS1zcGVha2VyLWZvci0yMDIzLXBvbHl1cmV0aGFuZXMtdGVjaG5pY2FsLWNvbmZlcmVuY2XSAQA?oc=5	The Center for the Polyurethanes Industry (CPI) announced that Dr. Debbie Mielewski will deliver the keynote speech at the 65th Polyurethanes Technical Conference on Sept. 25, 2023. Dr. Mielewski, a sustainability expert with 36 years at Ford, is known for pioneering sustainable materials in the automotive industry, including a soy-based foam. She aims to inspire others to develop earth-friendly materials and will discuss sustainability challenges and progress in her keynote. The conference will cover regulatory issues, educational sessions, and the latest innovations in the polyurethanes sector.	TRUE: The article discusses advancements in sustainable materials and processes, particularly the development of soy-based foam, which contributes to reducing environmental impacts in the automotive sector.	TRUE: The introduction of sustainable materials in automotive manufacturing, particularly the soy-based foam, represents a significant improvement in product offering and business processes for the automotive industry.	TRUE: The soy-based foam developed for automotive seating is designed to minimize environmental impact, aligning with the definition of a green product through its sustainable materials and processes.	TRUE: The processes involved in developing and implementing sustainable automotive materials exemplify green processes aimed at reducing waste and resource consumption.	Ford Motor Company	Ford Motor Company	Soy-based foam	Likely NAICS Codes: 336111 - Automobile Manufacturing, 327320 - Ready-Mix Concrete Manufacturing, 325211 - Plastics Material and Resin Manufacturing, 541715 - Research and Development in the Physical, Engineering, and Life Sciences	FALSE: The article does not indicate any misleading information about environmental benefits; instead, it highlights genuine advancements in sustainable materials within the automotive industry.	1894
30 sustainable and ethical fashion brands to shop now - Marie Claire UK	https://news.google.com/rss/articles/CBMibWh0dHBzOi8vd3d3Lm1hcmllY2xhaXJlLmNvLnVrL25ld3MvZmFzaGlvbi1uZXdzL2Jlc3QtZXRoaWNhbC1mYXNoaW9uLWJyYW5kcy10by1rbm93LXN1c3RhaW5hYmxlLWZhc2hpb24tODQxNjnSAQA?oc=5	The article discusses the rise of sustainable clothing brands that aim to reduce environmental impacts and promote ethical practices. It highlights the importance of distinguishing genuine sustainable brands from those engaging in greenwashing, providing guidance on how to identify accountability and sustainable practices. Various brands are mentioned, each with distinct commitments to sustainability, such as using eco-friendly materials and responsible production methods.	TRUE, because the article discusses sustainable clothing brands that are designed and manufactured with the goal of reducing environmental impact throughout their life cycle.	TRUE, because the sustainable clothing brands introduced in the article represent new and improved business processes and products that differ significantly from traditional fast fashion practices.	TRUE, because the clothing produced by the brands mentioned is made from environmentally friendly materials and focuses on reducing negative environmental impacts.	TRUE, because the brands implement sustainable production processes that minimize waste, conserve resources, and limit harmful substance release.	Dai	Dai	Dai’Cycle	Likely NAICS Codes: 448120 - Women's Clothing Stores, 315190 - Other Clothing Manufacturing, 541613 - Marketing Consulting Services, 423990 - Other Miscellaneous Durable Goods Merchant Wholesalers	FALSE, because the article makes a strong distinction between genuine sustainable brands and those that engage in greenwashing, providing insights into accountability and transparent practices.	6268
Role of R&D in achieving sustainable goals - Indian Chemical News	https://news.google.com/rss/articles/CBMiWmh0dHBzOi8vd3d3LmluZGlhbmNoZW1pY2FsbmV3cy5jb20vb3Bpbmlvbi9yb2xlLW9mLXJkLWluLWFjaGlldmluZy1zdXN0YWluYWJsZS1nb2Fscy0xNzk1ONIBX2h0dHBzOi8vd3d3LmluZGlhbmNoZW1pY2FsbmV3cy5jb20vb3Bpbmlvbi9saXRlL3JvbGUtb2YtcmQtaW4tYWNoaWV2aW5nLXN1c3RhaW5hYmxlLWdvYWxzLTE3OTU4?oc=5	The article discusses the chemical industry's diverse range of products and the increasing demand for sustainable and environmentally friendly materials driven by changing consumer preferences. It emphasizes the importance of research and development in creating new green products and processes, alongside the principles of green chemistry aimed at minimizing environmental impacts. Collaborations among researchers, government, and industry are highlighted as essential for developing safer chemicals and sustainable practices across various sectors, including pharmaceuticals and agrochemicals. The article concludes that while green chemistry isn't a panacea for environmental challenges, it remains a foundational approach to achieving sustainability goals.	TRUE - The article describes innovations in the chemical industry that focus on reducing environmental impacts, promoting sustainability, and developing safer and more sustainable products and processes.	TRUE - The article discusses new or improved products and processes introduced in the chemical industry that address environmental concerns and change consumer preferences, showcasing significant differences from previous practices.	FALSE - While the article discusses the development of safer chemicals and sustainable materials, it does not name any specific green products.	TRUE - The article describes processes that minimize environmental impacts, such as sustainable manufacturing practices and the principles of green chemistry, aiming for efficiency and reduced waste.	company not identified	company not identified	product or process not identified	Likely NAICS Codes: 325 - Chemical Manufacturing, 3254 - Pharmaceutical and Medicine Manufacturing, 3253 - Pesticide, Fertilizer, and Other Agricultural Chemical Manufacturing, 3255 - Paint, Coating, and Adhesive Manufacturing	FALSE - The article does not engage in misleading claims about environmental benefits; rather, it emphasizes legitimate efforts towards sustainability and green innovations within the chemical industry.	3046
Samuel Ross joins Beats by Dre - HYPEBAE	https://news.google.com/rss/articles/CBMiaWh0dHBzOi8vaHlwZWJhZS5jb20vMjAyMy82L3NyLWEtZm91bmRlci1zYW11ZWwtcm9zcy1iZWF0cy1ieS1kcmUtcHJpbmNpcGFsLWRlc2lnbi1jb25zdWx0YW50LXJvbGUtZGV0YWlsc9IBAA?oc=5	British artist and designer Samuel Ross has joined Beats as its first-ever Principal Design Consultant, bringing fresh perspectives to the brand's industrial design strategy. His focus will be on designing new products and packaging with an emphasis on sustainable materials and premium finishes. Ross has previously collaborated with Beats on the successful Studio3 Wireless design, marking the beginning of a unique partnership. He aims to enhance Beats' design language by blending wearability, style, and functionality.	TRUE, because the focus on incorporating sustainable materials and enhancing environmental impact in product design aligns with the principles of green innovation.	TRUE, as Ross's role involves introducing improved product design and strategies distinct from Beats' previous approaches.	FALSE, because while the focus is on sustainable materials, specific products designed to reduce environmental impact throughout their life cycle are not mentioned.	FALSE, because the article does not describe a specific process that minimizes environmental impacts or promotes sustainability.	Beats	Beats Electronics, LLC	product or process not identified	[{'code': '339999', 'category': 'All Other Miscellaneous Manufacturing'}, {'code': '332999', 'category': 'All Other Miscellaneous Fabricated Metal Product Manufacturing'}, {'code': '423990', 'category': 'Other Miscellaneous Durable Goods Merchant Wholesalers'}, {'code': '541410', 'category': 'Interior Design Services'}]	FALSE, there is no evidence of misleading claims regarding environmental benefits, as the focus is genuinely on sustainable design practices.	1614
How Up-Fuse is turning plastic waste into trendy fashion - Gulf Business	https://news.google.com/rss/articles/CBMiSWh0dHBzOi8vZ3VsZmJ1c2luZXNzLmNvbS91cC1mdXNlLXR1cm5zLXBsYXN0aWMtd2FzdGUtaW50by10cmVuZHktZmFzaGlvbi_SAQA?oc=5	The article discusses Up-fuse, an eco-conscious brand co-founded by Lama El Khawanky that transforms plastic waste into durable fashion products while supporting local communities. The company promotes sustainability by recycling materials and aims to contribute to the circular economy through its slow fashion model. They actively engage with local NGOs and artisans to foster job creation and social impact. The article highlights their successful products and their participation in events like COP27 to raise environmental awareness.	TRUE, because Up-fuse creates products from recycled plastic waste and supports local artisans, contributing to environmental sustainability and reducing negative environmental impacts.	TRUE, because Up-fuse offers a unique product line that significantly differs from conventional fashion by transforming waste into stylish, eco-friendly items and engages in sustainable business practices.	TRUE, because the products made by Up-fuse from recycled materials significantly reduce environmental impact throughout their life cycle.	TRUE, because Up-fuse employs methods that minimize waste and resource consumption by upcycling materials and collaborating with NGOs to source plastic waste.	Up-fuse	Up-fuse	Lolita Multi Way Bag	[{'code': '315210', 'category': 'Cut and Sew Apparel Manufacturing'}, {'code': '423910', 'category': 'Sporting and Recreational Goods and Supplies Merchant Wholesalers'}, {'code': '541612', 'category': 'Human Resources Consulting Services'}, {'code': '311119', 'category': 'Other Animal Food Manufacturing'}]	FALSE, because the article presents a genuine commitment to environmental sustainability and social impact without making misleading claims about the environmental benefits of their products.	2615
Next generation gantry sees BAT UK help retailers keep up in fast-moving alternative nicotine products landscape - Grocery Trader	https://news.google.com/rss/articles/CBMijQFodHRwczovL2dyb2Nlcnl0cmFkZXIuY28udWsvbmV4dC1nZW5lcmF0aW9uLWdhbnRyeS1zZWVzLWJhdC11ay1oZWxwLXJldGFpbGVycy1rZWVwLXVwLWluLWZhc3QtbW92aW5nLWFsdGVybmF0aXZlLW5pY290aW5lLXByb2R1Y3RzLWxhbmRzY2FwZS_SAQA?oc=5	BAT UK is launching a new sustainable gantry solution designed for alternative nicotine products, which incorporates environmentally friendly materials and processes. The gantry, manufactured by Zedis, uses 100% recycled plastic and locally sourced materials, ensuring zero waste during production. The innovation aims to assist retailers in better merchandising these products in response to market changes. Retailers have praised the modern design and the collaboration with BAT UK to tailor the solution to their needs.	TRUE: This innovation is green because it utilizes 100% recycled plastic and sustainable materials sourced locally, minimizing environmental impacts during production and promoting sustainability in retail.	TRUE: This is a business innovation as it introduces a new and improved product (the sustainable gantry) that differs significantly from previous retail display solutions and is designed to support the changing market.	TRUE: The gantry qualifies as a green product because it is designed and manufactured to significantly reduce environmental impact through the use of recycled materials and sustainable practices.	TRUE: This scenario describes a green process as it involves zero waste manufacturing techniques and the use of locally sourced materials, promoting conservation of resources and reduction of environmental impacts.	BAT UK	British American Tobacco UK Limited	sustainable gantry solution	Likely NAICS Codes: 312230 - Tobacco Product Manufacturing, 337215 - Showcase, Partition, Shelving, and Locker Manufacturing, 541614 - Process, Physical Distribution, and Logistics Consulting Services, 321999 - All Other Miscellaneous Wood Product Manufacturing	FALSE: The article does not exhibit greenwashing, as it presents a genuine effort by BAT UK to implement sustainable practices and materials in their new product, backed by retailer feedback and local sourcing.	2281
