title	link	summary	green_innovation	business_innovation	green_product	green_process	company	official_company_name	product_or_process	likely_naics_codes	greenwashing	total_tokens
"The design industry needs to let go of its obsession with the new" - Dezeen	https://news.google.com/rss/articles/CBMiSGh0dHBzOi8vd3d3LmRlemVlbi5jb20vMjAyMy8xMC8wMi9kZXNpZ24tcmVwYWlyLWthdGllLXRyZWdnaWRlbi1vcGluaW9uL9IBAA?oc=5	The article discusses the need for the design industry to shift away from its obsession with new products and towards a focus on sustainability and circular economy principles, emphasizing repair, reuse, and the use of second-life materials. It highlights brands that incorporate these values, such as Toast and Raeburn, which are reestablishing the importance of mending and maintaining products. The article argues for celebrating older objects rather than constantly seeking new ones to combat throwaway culture.	TRUE - The article promotes green innovation by advocating for repair, reuse, and sustainable product design, which contributes to environmental sustainability and the circular economy.	TRUE - The article discusses brands like Toast and Raeburn that have introduced new business models focused on repair and sustainability, representing a significant change in traditional business practices.	TRUE - The products mentioned, such as repurposed clothing and vintage lights, are designed and used to minimize environmental impact, aligning with the definition of green products.	TRUE - The processes described, such as 'design for disassembly' and the use of waste materials, aim to minimize environmental impact, fulfilling the criteria for green processes.	Toast	Toast Ltd.	Spoke sofa	Likely NAICS Codes: 315240 - Women's Clothing Manufacturing, 448120 - Women's Clothing Stores, 337121 - Upholstered Furniture Manufacturing, 453220 - Gift, Novelty, and Souvenir Stores	FALSE - The article does not appear to promote misleading environmental claims but rather advocates for genuine sustainable practices and circular economy principles.	2341
Aldi pilots blister pack recycling as retailers are urged to join ‘game changing’ refill collaboration - edie.net	https://news.google.com/rss/articles/CBMiemh0dHBzOi8vd3d3LmVkaWUubmV0L2FsZGktcGlsb3RzLWJsaXN0ZXItcGFjay1yZWN5Y2xpbmctYXMtcmV0YWlsZXJzLWFyZS11cmdlZC10by1qb2luLWdhbWUtY2hhbmdpbmctcmVmaWxsLWNvbGxhYm9yYXRpb24v0gGDAWh0dHBzOi8vd3d3LmVkaWUubmV0L2FsZGktcGlsb3RzLWJsaXN0ZXItcGFjay1yZWN5Y2xpbmctYXMtcmV0YWlsZXJzLWFyZS11cmdlZC10by1qb2luLWdhbWUtY2hhbmdpbmctcmVmaWxsLWNvbGxhYm9yYXRpb24vP2FtcD10cnVl?oc=5	The article discusses initiatives by Marks & Spencer (M&S) and Aldi aimed at reducing single-use packaging and promoting sustainable practices through refillable packaging and recycling programs. Aldi is encouraging customers to return medical packaging for recycling with the help of TerraCycle, while the Reposit refill scheme, supported by M&S, aims to scale reusable packaging across various products. Both companies are taking steps to create a circular economy by partnering with other brands and utilizing consumer insights to improve their practices. Overall, these collaborations highlight a growing trend towards sustainability in retail.	TRUE: The article describes various initiatives that contribute to environmental sustainability, including the recycling of difficult-to-recycle plastics and a refillable packaging system, which aim to minimize waste and promote a circular economy.	TRUE: The initiatives mentioned involve new processes and collaborations that significantly differ from traditional packaging and recycling methods, demonstrating a new approach to business operations.	FALSE: While the article mentions initiatives surrounding green products, it does not specifically name a green product that fits the defined criteria.	TRUE: The article discusses methods of recycling and refillable packaging that minimize environmental impacts and promote sustainability, which qualifies as green processes.	Marks & Spencer	Marks and Spencer Group plc	Reposit packaging refill scheme	Likely NAICS Codes: 445299 - All Other Specialty Food Stores, 322211 - Corrugated and Solid Fiber Box Manufacturing, 453310 - Used Merchandise Stores, 424120 - Stationery and Office Supplies Merchant Wholesalers	FALSE: The article does not indicate that the companies are making unsubstantiated claims about their environmental practices; rather, it outlines genuine efforts to improve sustainability and reduce environmental impact.	2027
From gadget to garbage - newagebd.net	https://news.google.com/rss/articles/CBMiPmh0dHBzOi8vd3d3Lm5ld2FnZWJkLm5ldC9hcnRpY2xlLzIxNDg5OS9mcm9tLWdhZGdldC10by1nYXJiYWdl0gEA?oc=5	The article discusses the growing problem of electronic waste (e-waste) in Bangladesh, detailing its environmental and health impacts and emphasizing the need for effective management strategies. It highlights the lack of regulatory frameworks, inadequate recycling facilities, and the challenges posed by the informal sector that handles the majority of e-waste. The article advocates for a circular economy and innovative approaches to improve e-waste management practices that could benefit both the environment and the economy. Overall, it calls for a comprehensive and inclusive plan to address the e-waste crisis and its consequences.	TRUE: The article discusses the need for innovative solutions to manage e-waste, which contributes to environmental sustainability and addresses negative externalities associated with electronic waste.	TRUE: The article mentions the implementation of effective e-waste recycling and management practices, which signifies an improvement over previous practices within the e-waste sector in Bangladesh.	FALSE: The article does not describe a specific good or service that meets the definition of a green product.	TRUE: The call for establishing proper e-waste recycling facilities and the adoption of sustainable practices indicate efforts to develop green processes in waste management.	company not identified	company not identified	product or process not identified	Likely NAICS Codes: 562920 - Materials Recovery Facilities, 333249 - Other Industrial Machinery Manufacturing, 811211 - Consumer Electronics Repair and Maintenance, 541620 - Environmental Consulting Services	FALSE: The article does not appear to engage in greenwashing, as it genuinely addresses the issues surrounding e-waste and advocates for transparent and effective management solutions rather than making misleading claims.	5356
Being a green superpower will unlock the UK economy - The New Statesman	https://news.google.com/rss/articles/CBMia2h0dHBzOi8vd3d3Lm5ld3N0YXRlc21hbi5jb20vc3BvdGxpZ2h0L3N1c3RhaW5hYmlsaXR5L2VuZXJneS8yMDIzLzEwL2dyZWVuLXN1cGVycG93ZXItb3ZvLWVuZXJneS11ay1lY29ub2150gEA?oc=5	The article discusses the UK’s need to lead in net-zero initiatives and emphasizes the importance of decarbonizing homes and increasing renewable energy to reduce energy costs and emissions. It highlights the potential for job creation and economic growth through substantial investments in green innovation. The author calls for urgent policy changes and funding to support a transition to a sustainable and flexible energy system, showcasing the country's opportunity to innovate and set an example in green energy.	TRUE, because the article promotes initiatives aimed at decarbonization, energy efficiency, and the transition to renewable energy, which contribute to environmental sustainability goals.	TRUE, as it discusses innovative products and services introduced by OVO to create economic growth through green energy solutions and infrastructure updates.	FALSE, because while the article discusses initiatives and services related to energy efficiency and renewable energy, it does not specifically identify a singular product that meets the definition of a green product.	TRUE, as the article outlines processes such as retrofitting homes for energy efficiency and creating a flexible energy grid that minimizes environmental impacts and promotes sustainability.	OVO	OVO Energy Ltd	Power Move scheme	Likely NAICS Codes: 221118 - Other Electric Power Generation, 236118 - Residential Remodelers, 541620 - Environmental Consulting Services, 562910 - Environmental Remediation Services	FALSE, because the article does not appear to make misleading claims about the environmental benefits of the company's practices; rather, it advocates for genuine green initiatives and the need for policy improvements.	2438
Scientific study finds remanufactured laptops produce only 6.34% of CO2 emissions in comparison to new ... - TECHNOLOGY RESELLER	https://news.google.com/rss/articles/CBMihAFodHRwczovL3RlY2hub2xvZ3lyZXNlbGxlci51ay9zY2llbnRpZmljLXN0dWR5LWZpbmRzLXJlbWFudWZhY3R1cmVkLWxhcHRvcHMtcHJvZHVjZS1vbmx5LTYtMzQtb2YtY28yLWVtaXNzaW9ucy1pbi1jb21wYXJpc29uLXRvLW5ldy_SAQA?oc=5	A study by Cranfield University found that remanufactured laptops from Circular Computing produce only 6.34% of the CO2 emissions of new laptops, highlighting the environmental benefits of circular economy practices. The remanufacturing process reduces electronic waste and utilizes a significant percentage of existing technology, contributing to sustainability goals. Circular Computing seeks to create ethically and environmentally responsible IT solutions and aims to further enhance their processes for sustainability. This innovative approach provides a high-performance alternative to new laptops while ensuring carbon neutrality.	TRUE, because remanufactured laptops significantly reduce CO2 emissions and electronic waste, contributing to environmental sustainability.	TRUE, because the remanufacturing of laptops represents a new and improved business process that differs significantly from traditional manufacturing.	TRUE, because the remanufactured laptops are designed and produced in ways that greatly minimize their environmental impact throughout their life cycle.	TRUE, because Circular Computing’s Circular Remanufacturing Process reduces waste, conserves resources, and promotes sustainability by reusing most of the existing technology.	Circular Computing	Circular Computing	Circular Remanufacturing Process	Likely NAICS Codes: 334111 - Electronic Computer Manufacturing, 811212 - Computer and Office Machine Repair and Maintenance, 423430 - Computer and Computer Peripheral Equipment and Software Wholesalers, 541511 - Custom Computer Programming Services	FALSE, because the article provides evidence from a peer-reviewed study demonstrating the significant environmental benefits of the remanufacturing process, thereby not misleading consumers about the product's sustainability.	2546
The Coca‑Cola Company is First to Launch Multiple Sparkling Beverages in 100% Recycled Plastic Bottles* Across ... - Canada NewsWire	https://news.google.com/rss/articles/CBMiqAFodHRwczovL3d3dy5uZXdzd2lyZS5jYS9uZXdzLXJlbGVhc2VzL3RoZS1jb2NhLWNvbGEtY29tcGFueS1pcy1maXJzdC10by1sYXVuY2gtbXVsdGlwbGUtc3BhcmtsaW5nLWJldmVyYWdlcy1pbi0xMDAtcmVjeWNsZWQtcGxhc3RpYy1ib3R0bGVzLWFjcm9zcy1jYW5hZGEtODQ3Njk0MDk1Lmh0bWzSAQA?oc=5	The Coca-Cola Company announced that all its 500mL sparkling beverage bottles in Canada will be made with 100% recycled plastic by early 2024, aiming to save 7.6 million pounds of new plastic and reduce CO2 emissions. This initiative is part of their World Without Waste goals, which targets 50% recycled content in packaging by 2030. The bottles will feature messaging to encourage recycling, and the production will take place in various Canadian facilities. Coca-Cola is partnering with the community to promote the transition and sustainability efforts.	TRUE: This is green innovation because it significantly reduces the use of virgin plastic in beverage packaging, promotes recycling, and supports the development of a circular economy for plastic.	TRUE: This is a business innovation because it involves a significant update to Coca-Cola's product offering by transitioning to 100% recycled plastic bottles, which differs from their previous practices.	TRUE: It is a green product because the new 500mL bottles are designed to minimize environmental impact by utilizing 100% recycled materials, thus reducing the product's life cycle impact.	TRUE: It exemplifies a green process as it emphasizes sustainable manufacturing methods that use recycled materials, reduce waste, and lower energy consumption.	The Coca-Cola Company	The Coca-Cola Company	100% recycled plastic bottles	[{'code': '312111', 'category': 'Soft Drink Manufacturing'}, {'code': '325199', 'category': 'All Other Basic Organic Chemical Manufacturing'}, {'code': '326199', 'category': 'All Other Plastics Product Manufacturing'}, {'code': '339999', 'category': 'All Other Miscellaneous Manufacturing'}]	FALSE: The article does not indicate greenwashing because the claims about using 100% recycled plastic are substantiated by specific sustainability goals and actions outlined by the company.	2401
Lithuania lags far behind EU in recycling plastic waste - LRT	https://news.google.com/rss/articles/CBMiaGh0dHBzOi8vd3d3LmxydC5sdC9lbi9uZXdzLWluLWVuZ2xpc2gvMTkvMjEwNTEyMC9saXRodWFuaWEtbGFncy1mYXItYmVoaW5kLWV1LWluLXJlY3ljbGluZy1wbGFzdGljLXdhc3Rl0gEA?oc=5	Lithuania recycles significantly less plastic than the EU average, and the Economy and Innovation Ministry plans to provide financial incentives to improve the situation. Many companies struggle to recycle difficult plastic products, and concerns are raised about the environmental claims of biodegradable bags. The government has allocated funds to support small companies in enhancing recycling methods, but Lithuania's recycling rates are currently low, highlighting a need for a stronger circular economy strategy. EU officials indicate that reaching recycling targets seems unlikely based on current data.	TRUE, because the article discusses measures to improve recycling processes and reduce plastic waste, contributing to environmental sustainability goals.	TRUE, as the article mentions financial support aimed at helping medium and small companies innovate their recycling methods and incorporate waste back into production.	FALSE, because while biodegradable bags are mentioned, they are criticized for not being as environmentally friendly as claimed, thus not fitting the criteria for a true green product.	TRUE, as the article highlights the need for improved recycling methods and the encouragement of processes that can better integrate waste into new production.	Plasta	Plasta	recycling methods	['3261 - Plastics Product Manufacturing', '5621 - Waste Collection', '5622 - Waste Treatment and Disposal', '5417 - Scientific Research and Development Services']	FALSE, as the article critically evaluates environmental claims related to biodegradable bags and highlights the need for genuine improvements in recycling efforts rather than just unfounded marketing claims.	1671
Cenviro's Contribution To Circular Economy in Advancing Malaysia - The Edge Malaysia	https://news.google.com/rss/articles/CBMibWh0dHBzOi8vdGhlZWRnZW1hbGF5c2lhLmNvbS9jb250ZW50L2FkdmVydGlzZS9jZW52aXJvcy1jb250cmlidXRpb24tdG8tY2lyY3VsYXItZWNvbm9teS1pbi1hZHZhbmNpbmctbWFsYXlzaWHSAQA?oc=5	Cenviro SDN BHD, a leading integrated waste management company in Malaysia, is accelerating its shift towards a circular economy model by focusing on waste recycling and recovery, and operating the country's first scheduled waste-to-energy plant since 2018. The company aims to balance its operations between treatment and disposal and recycling, thereby reducing waste and promoting sustainability. Cenviro also plans significant investments to enhance its recycling capabilities and has partnered with SK Ecoplant to expand regionally. They have also issued a sustainability-linked sukuk to fund future projects aligned with reducing greenhouse gas emissions.	TRUE - This is green innovation because Cenviro's waste-to-energy plant and recycling initiatives effectively reduce environmental impacts by minimizing waste and promoting a circular economy.	TRUE - This represents business innovation as Cenviro is introducing improved waste management processes that differ significantly from their previous operations and are aimed at market implementation.	FALSE - The article discusses processes but does not identify a distinct good or service that meets the definition of a green product.	TRUE - Cenviro's waste-to-energy process and its methods for recycling and recovering materials from scheduled waste constitute green processes as they aim to minimize environmental impact.	Cenviro SDN BHD	Cenviro SDN BHD	Scheduled Waste to Energy (SWtE) plant	Likely NAICS Codes: 562112 - Hazardous Waste Collection, 562211 - Hazardous Waste Treatment and Disposal, 562920 - Material Recovery Facilities, 221118 - Other Electric Power Generation	FALSE - The article does not demonstrate greenwashing as Cenviro's practices are aligned with genuine efforts towards sustainability and circular economy principles.	2889
steps up support to help British businesses recycle 12 million unused mobile phones and tablets - Virgin Media O2 - Virgin Media O2	https://news.google.com/rss/articles/CBMikQFodHRwczovL25ld3MudmlyZ2lubWVkaWFvMi5jby51ay92aXJnaW4tbWVkaWEtbzItc3RlcHMtdXAtc3VwcG9ydC10by1oZWxwLWJyaXRpc2gtYnVzaW5lc3Nlcy1yZWN5Y2xlLTEyLW1pbGxpb24tdW51c2VkLW1vYmlsZS1waG9uZXMtYW5kLXRhYmxldHMv0gEA?oc=5	Virgin Media O2 enhances its 'O2 Recycle for Business' initiative to help companies recycle unused electronic devices, as a study shows that 70% of businesses struggle to manage electronic waste. The service allows organizations to trade in devices for cash, credit towards new ones, or charitable donations, while ensuring that all collected devices are recycled or refurbished, contributing to a circular economy. O2 Recycle has processed over 3.8 million devices since its launch and aims to help companies reduce their Scope 3 supply chain carbon emissions.	TRUE - The initiative promotes recycling and responsible disposal of electronic waste, contributing to environmental sustainability and the circular economy.	TRUE - The 'O2 Recycle for Business' service is a new or improved business process that allows companies to easily recycle and trade in their old devices, differing significantly from previous practices of electronic waste disposal.	FALSE - While the service itself facilitates recycling, it does not describe a specific physical good that meets the green product criteria.	TRUE - The recycling initiative constitutes a green process as it minimizes environmental impacts by ensuring electronic devices are recycled or refurbished instead of ending up in landfills.	Virgin Media O2	Virgin Media O2 Limited	O2 Recycle for Business	Likely NAICS Codes: 532230 - Short-Term Rental and Leasing, 423620 - Electronic Markets and Agents and Brokers, 811212 - Computer and Office Machine Repair and Maintenance, 541611 - Administrative Management and General Management Consulting Services.	FALSE - The article does not describe any misleading claims about environmental benefits; rather, it discusses a legitimate initiative aimed at promoting sustainability and responsible electronic waste management.	2178
TSA, Clark Rubber partnership to revolutionise tyre waste problem - Waste Management Review	https://news.google.com/rss/articles/CBMiZmh0dHBzOi8vd2FzdGVtYW5hZ2VtZW50cmV2aWV3LmNvbS5hdS90c2EtY2xhcmstcnViYmVyLXBhcnRuZXJzaGlwLXRvLXJldm9sdXRpb25pc2UtdHlyZS13YXN0ZS1wcm9ibGVtL9IBAA?oc=5	Tyre Stewardship Australia (TSA) has partnered with Clark Rubber to promote the use of recycled tyre-derived material in new product manufacturing in Australia. Through the TSA Market Development Fund, grants of up to $250,000 are available to support local manufacturers and innovators in developing sustainable products that contribute to a circular economy. A1 Rubber exemplifies successful repurposing of end-of-life tyres, producing various products from the recycled material. The initiative aims to not only reuse materials but also to foster innovation and sustainable solutions within the country.	TRUE, because the innovation promotes the recycling of used tyres, contributing to environmental sustainability by minimizing waste and supporting a circular economy.	TRUE, because the collaboration and funding support the development of new products and processes that significantly differ from previous offerings in the market.	TRUE, because the recycled products derived from used tyres are designed to minimize environmental impact and promote sustainability throughout their life cycle.	TRUE, because the methods discussed involve recycling and upcycling tyres, thus minimizing resource consumption and environmental harm.	Tyre Stewardship Australia	Tyre Stewardship Australia	recycled tyre-derived material	Likely NAICS Codes: 326299 - All Other Rubber Products Manufacturing, 493130 - Warehousing and Storage, 321911 - Manufactured Home (Mobile Home) Manufacturing, 339999 - All Other Miscellaneous Manufacturing	FALSE, because the article clearly discusses initiatives that promote genuine environmental benefits without misleading claims.	1797
O2 UK Relaunch Recycle for Business to Help Firms Trade in Old Tech - ISPreview UK	https://news.google.com/rss/articles/CBMidmh0dHBzOi8vd3d3LmlzcHJldmlldy5jby51ay9pbmRleC5waHAvMjAyMy8xMC9vMi11ay1yZWxhdW5jaC1yZWN5Y2xlLWZvci1idXNpbmVzcy10by1oZWxwLWZpcm1zLXRyYWRlLWluLW9sZC10ZWNoLmh0bWzSAQA?oc=5	O2 has relaunched their 'O2 Recycle for Business' service, allowing companies to trade in old devices for cash, credit, or donation to charity. The service claims to have recycled or refurbished 92% of devices processed since 2009, supporting the circular economy and reducing e-waste. Organizations can recycle multiple devices easily and donate cash back to a charity supporting digital inclusion. The initiative aims to help businesses manage unused devices and lower their carbon emissions.	TRUE: The initiative contributes to environmental sustainability by promoting the recycling and refurbishment of electronic devices, thus reducing e-waste and supporting the circular economy.	TRUE: 'O2 Recycle for Business' represents a business innovation by offering a new and improved service that allows companies to trade in old devices for value, thus changing the way they manage technology disposal.	FALSE: The service itself is not a green product, as it is focused on the process of recycling and refurbishment rather than a specific physical product designed to have low environmental impact.	TRUE: The recycling and refurbishment processes used in 'O2 Recycle for Business' minimize environmental impacts by ensuring that devices are reused or recycled rather than ending up in landfills.	O2	Virgin Media O2	'O2 Recycle for Business'	Likely NAICS Codes: 532210 - Consumer Electronics Rental, 561990 - All Other Support Services, 423690 - Other Electronic Parts and Equipment Merchant Wholesalers, 811212 - Computer and Office Machine Repair and Maintenance	FALSE: The article does not suggest greenwashing, as it describes a genuine service focused on sustainability and responsible disposal of electronic waste, with clear benefits for both businesses and the environment.	1835
