title	link	summary	green_innovation	business_innovation	green_product	green_process	company	official_company_name	product_or_process	likely_naics_codes	greenwashing	total_tokens
Harnessing The Future Of Digital And Smart Manufacturing Of Medical Devices - Med Device Online	https://news.google.com/rss/articles/CBMidGh0dHBzOi8vd3d3Lm1lZGRldmljZW9ubGluZS5jb20vZG9jL2hhcm5lc3NpbmctdGhlLWZ1dHVyZS1vZi1kaWdpdGFsLWFuZC1zbWFydC1tYW51ZmFjdHVyaW5nLW9mLW1lZGljYWwtZGV2aWNlcy0wMDAx0gEA?oc=5	The article discusses the rapid evolution of digital and smart manufacturing in the medical device sector, highlighting the importance of digital transformation for improving efficiency, productivity, and regulatory compliance. It emphasizes benefits such as increased traceability and communication between research and development with manufacturing, all aimed at meeting consumer demands and enhancing product portfolios. The implementation of advanced technologies, such as AI, machine learning, and the Internet of Things, supports this transformation towards smart manufacturing. It also addresses the challenges and steps required for successful digitalization.	TRUE - The innovation fosters environmental sustainability by promoting digital and smart manufacturing practices that increase efficiency, reduce errors, and minimize resource consumption.	TRUE - The article outlines the transition to digital processes and smart manufacturing in medical device production, representing new and improved business processes that enhance productivity and compliance.	FALSE - The article does not specifically mention any green products that are designed or manufactured to significantly reduce environmental impact.	TRUE - The digital and smart manufacturing processes described aim to minimize environmental impacts through waste reduction, enhanced resource efficiency, and improved safety measures.	company not identified	company not identified	product or process not identified	Likely NAICS Codes: 334510 - Electromedical and Electrotherapeutic Apparatus Manufacturing, 541715 - Research and Development in the Physical, Engineering, and Life Sciences (except Nanotechnology and Biotechnology), 334111 - Electromedical Apparatus Manufacturing, 541611 - Administrative Management and General Management Consulting Services	FALSE - The article does not exhibit characteristics of greenwashing as it focuses on legitimate advancements in manufacturing processes aimed at improving efficiency and sustainability.	2834
Medtech Innovation Needs a Digital Upgrade | BCG - BCG	https://news.google.com/rss/articles/CBMiVmh0dHBzOi8vd3d3LmJjZy5jb20vcHVibGljYXRpb25zLzIwMjMvY29tcGFuaWVzLW5lZWQtZGlnaXRhbC10cmFuc2Zvcm1hdGlvbi1pbi1tZWR0ZWNo0gEA?oc=5	The article discusses the need for medical technology companies to evolve by adopting an evergreen platform approach to innovation, which emphasizes continuous product improvement and modular design. It highlights the importance of user engagement and faster development processes to ensure products meet market needs effectively. Key strategies include designing modular components, enhancing collaboration with users, and evolving research and development funding models to optimize their product life cycles.	FALSE - The article does not explicitly focus on innovations that contribute directly to environmental sustainability goals as defined.	TRUE - The article describes a shift in medtech companies towards continuous product improvement and iterative development processes, aligning with the definition of business innovation.	FALSE - The article does not mention any specific goods or services that meet the criteria for green products.	TRUE - The article discusses innovative processes aimed at optimizing product development and modular design, which can minimize waste and resource consumption, aligning it with green process principles.	company not identified	company not identified	product or process not identified	Likely NAICS Codes: 325414 - Biological Product Manufacturing, 541715 - Research and Development in the Physical, Engineering, and Life Sciences, 339112 - Surgical and Medical Instrument Manufacturing, 541611 - Administrative Management and General Management Consulting Services	FALSE - The article does not promote misleading claims about environmental benefits; instead, it advocates for genuine improvements in product and process innovations within the medtech industry.	3580
How businesses can close China's AI talent gap - McKinsey	https://news.google.com/rss/articles/CBMibWh0dHBzOi8vd3d3Lm1ja2luc2V5LmNvbS9jYXBhYmlsaXRpZXMvcXVhbnR1bWJsYWNrL291ci1pbnNpZ2h0cy9ob3ctYnVzaW5lc3Nlcy1jYW4tY2xvc2UtY2hpbmFzLWFpLXRhbGVudC1nYXDSAQA?oc=5	The article discusses the challenges and strategies for attracting and retaining AI talent in China, highlighting the growing demand for skilled professionals in AI and digital transformations. It categorizes companies based on their digital maturity and outlines specific talent needs and sourcing strategies for each archetype. The research indicates a significant talent gap expected by 2030, with recommendations for upskilling current employees and diversifying talent sources to fill these gaps. Overall, it aims to guide companies in effectively managing their talent needs amidst increasing competition for AI capabilities.	FALSE - The article does not focus on environmental sustainability or innovations aimed at reducing negative environmental impacts.	TRUE - The article discusses the need for new strategies in hiring and developing AI talent, which reflects changes in business processes and capabilities that are significantly different from previous practices.	FALSE - There are no specific products defined in the article that significantly reduce environmental impact throughout their life cycle.	FALSE - The article focuses on hiring and training processes rather than specific methods that minimize environmental impact.	company not identified	company not identified	product or process not identified	Likely NAICS Codes: 541511 - Custom Computer Programming Services, 541512 - Computer Systems Design Services, 541618 - Other Management Consulting Services, 611430 - Professional and Management Development Training	FALSE - The article does not engage in misleading claims about environmental benefits, as it primarily addresses AI talent and business strategies.	5205
Viral Safety With ICH Q5A Revision 2 - BioProcess Insider	https://news.google.com/rss/articles/CBMisAFodHRwczovL3d3dy5iaW9wcm9jZXNzaW50bC5jb20vdmlyYWwtY2xlYXJhbmNlL3ZpcmFsLXNhZmV0eS1mb3ItYmlvdGVjaG5vbG9neS1wcm9kdWN0cy1pbmNsdWRpbmctdmlyYWwtdmVjdG9ycy1pY2gtcTVhLXJldmlzaW9uLTItYnJpbmdzLXVwZGF0ZWQtYW5kLW1vcmUtY29tcHJlaGVuc2l2ZS1ndWlkYW5jZdIBAA?oc=5	The article discusses the International Council for Harmonisation's (ICH) revised guideline ICH Q5A(R2), which focuses on viral safety evaluations for biotechnology products derived from human and animal cell lines. It outlines key updates related to viral vectors, continuous manufacturing, and new molecular test methods to enhance viral safety and efficiency in biomanufacturing. The revisions aim to reflect recent scientific advances and provide flexibility in the testing and validation processes for ensuring viral safety. Overall, it emphasizes a multipronged approach to virus safety in the biopharmaceutical industry.	FALSE; the article does not focus on reducing environmental externalities or promoting sustainability in a way that fits the definition of green innovation.	TRUE; the article discusses a revised guideline and new methods for biopharmaceuticals that enhance the safety evaluation process, representing a significant improvement in business processes.	FALSE; there is no specific product mentioned that would qualify as a green product based on reducing environmental impact.	TRUE; the revised guideline emphasizes viral safety processes and methodologies that minimize risks and promote safe and effective biopharmaceutical manufacturing.	company not identified	company not identified	ICH Q5A(R2)	Likely NAICS Codes: 541714 - Research and Development in Biotechnology (except Nanobiotechnology), 325414 - Biological Product (except Diagnostic) Manufacturing, 541715 - Research and Development in the Physical, Engineering, and Life Sciences (except Nanotechnology), 621511 - Medical Laboratories	FALSE; there are no misleading claims about environmental benefits in the article, as it primarily discusses viral safety in biopharmaceutical processes.	6744
IDM Approach Continues to Strengthen ST's Semiconductor Leadership - EE Times India	https://news.google.com/rss/articles/CBMiXWh0dHBzOi8vd3d3LmVldGluZGlhLmNvLmluL2lkbS1hcHByb2FjaC1jb250aW51ZXMtdG8tc3RyZW5ndGhlbi1zdHMtc2VtaWNvbmR1Y3Rvci1sZWFkZXJzaGlwL9IBAA?oc=5	STMicroelectronics is significantly expanding its Catania facility to enhance production capacities for SiC and GaN semiconductors, which are key to supporting global sustainability efforts in power-efficient technologies. This move aims to address the growing demand for these wide-bandgap semiconductor devices in automotive and industrial applications, particularly amid the shift towards electrification. The investment solidifies ST's vertical integration strategy for its SiC business and positions Catania as a leading center for power innovations in Europe.	TRUE: The article discusses STMicroelectronics' development of SiC and GaN semiconductors, which are integral to creating power-efficient and sustainable technologies, thereby contributing positively to environmental sustainability goals.	TRUE: The expansion of STMicroelectronics' Catania facility and the introduction of new SiC and GaN semiconductor products represent significantly improved business processes and product offerings that differ from their previous capabilities.	TRUE: SiC and GaN semiconductors are designed to enhance energy efficiency and reduce environmental impact, aligning with the definition of green products.	TRUE: The fabrication processes for SiC and GaN semiconductors involve processes that minimize waste and energy consumption, representing a commitment to sustainable manufacturing practices.	STMicroelectronics	STMicroelectronics N.V.	SmartSiC process	Likely NAICS Codes: 334413 - Semiconductor and Related Device Manufacturing, 334111 - Electronic Computer Manufacturing, 335999 - All Other Miscellaneous Electrical Equipment and Component Manufacturing, 541712 - Research and Development in the Physical, Engineering, and Life Sciences (except Biotechnology)	FALSE: The article does not exhibit characteristics of greenwashing; it accurately describes genuine efforts by STMicroelectronics to expand production of environmentally beneficial technologies rather than making misleading claims.	3462
