title	link	summary	green_innovation	business_innovation	green_product	green_process	company	official_company_name	product_or_process	likely_naics_codes	greenwashing	total_tokens
Google Maps Platform: 3 new APIs to monitor environmental conditions - The Keyword | Google Product and Technology News	https://news.google.com/rss/articles/CBMiTmh0dHBzOi8vYmxvZy5nb29nbGUvcHJvZHVjdHMvbWFwcy9nb29nbGUtbWFwcy1hcGlzLWVudmlyb25tZW50LXN1c3RhaW5hYmlsaXR5L9IBAA?oc=5	The article discusses Google's efforts to address climate change by leveraging tools and technologies like Google Earth and the Solar API, which provide insights into environmental factors such as solar potential, air quality, and carbon emissions. These tools aim to support individuals and organizations in mapping and mitigating their environmental impact. Project Sunroof, originally a consumer-focused initiative, is now being extended to businesses to promote solar energy usage. The use of AI and machine learning to enhance sustainability practices is highlighted as a key innovation.	TRUE - This is green innovation because it develops new tools and technologies that help reduce carbon emissions and environmental impact, specifically promoting solar energy and improving environmental insights.	TRUE - This is a business innovation because it introduces new services, such as the Solar API, that significantly differ from previous offerings, enabling businesses to access detailed solar potential data for better decision-making.	TRUE - This is a green product because the Solar API helps users identify solar energy potential, thus facilitating a shift to renewable energy sources that significantly reduce environmental impact.	TRUE - This is a green process because the use of AI and machine learning to analyze aerial imagery and environmental data promotes efficiency and sustainability in assessing solar energy potential.	Google	Google LLC	Solar API	[{'code': '541511', 'category': 'Custom Computer Programming Services'}, {'code': '541512', 'category': 'Computer Systems Design Services'}, {'code': '541519', 'category': 'Other Computer Related Services'}, {'code': '334111', 'category': 'Electronic Computer Manufacturing'}]	FALSE - The article does not appear to be an example of greenwashing as it presents genuine technological advancements aimed at promoting sustainability and reducing carbon emissions, with no misleading claims evident.	1756
Shanghai Electric Delivers the First Batch of VRFB Products to Europe - PR Newswire	https://news.google.com/rss/articles/CBMifWh0dHBzOi8vd3d3LnBybmV3c3dpcmUuY29tL25ld3MtcmVsZWFzZXMvc2hhbmdoYWktZWxlY3RyaWMtZGVsaXZlcnMtdGhlLWZpcnN0LWJhdGNoLW9mLXZyZmItcHJvZHVjdHMtdG8tZXVyb3BlLTMwMTg5NjgzNi5odG1s0gEA?oc=5	Shanghai Electric Energy Storage has completed factory acceptance tests for its vanadium redox flow battery (VRFB) equipment, marking its first major delivery of flow battery products to Europe for renewable projects. The company is advancing energy storage technology to facilitate low-carbon targets, showcasing innovations in VRFB that improve performance and reliability while being environmentally safe. Shanghai Electric aims to provide efficient and sustainable energy solutions, enhancing its R&D investments to contribute to a greener future.	TRUE, the innovation involves energy storage technology that supports renewable energy and reduces dependence on fossil fuels, contributing to decarbonization and sustainability.	TRUE, the development and delivery of bespoke VRFB products represent a significant new process and product offering that differs from previous offerings, aligning with business innovation.	TRUE, the vanadium redox flow battery (VRFB) is designed to operate safely using environmentally benign materials and is aimed at significantly reducing environmental impact through its usage and lifecycle.	TRUE, the manufacturing and operational processes of the VRFB, which emphasize minimal environmental impacts, energy efficiency, and the use of renewable resources, align with the definition of a green process.	Shanghai Electric Energy Storage Technology Co., Ltd.	Shanghai Electric Energy Storage Technology Co., Ltd.	vanadium redox flow battery (VRFB)	[{'code': '335999', 'category': 'All Other Miscellaneous Electrical Equipment and Component Manufacturing'}, {'code': '221118', 'category': 'Other Electric Power Generation'}, {'code': '541715', 'category': 'Research and Development in the Physical, Engineering, and Life Sciences (except Nanotechnology and Biotechnology)'}, {'code': '332719', 'category': 'Other Metal Container Manufacturing'}]	FALSE, the article provides substantive information about the company's commitment to innovation in energy storage technology and its environmental benefits, rather than misrepresenting or exaggerating their capabilities.	2338
Hitachi Energy supports a green hydrogen economy to accelerate the energy transition - Hitachi Energy	https://news.google.com/rss/articles/CBMiiAFodHRwczovL3d3dy5oaXRhY2hpZW5lcmd5LmNvbS9uZXdzL2ZlYXR1cmVzLzIwMjMvMDgvaGl0YWNoaS1lbmVyZ3ktc3VwcG9ydHMtYS1ncmVlbi1oeWRyb2dlbi1lY29ub215LXRvLWFjY2VsZXJhdGUtdGhlLWVuZXJneS10cmFuc2l0aW9u0gEA?oc=5	Hitachi Energy is developing innovative products and solutions to support the clean energy transition, focusing on green hydrogen production via water electrolysis powered by renewable energy. The company aims to optimize the integration of electrolysers into high-voltage grids and is working on hydrogen power generators as a zero-emission alternative to fossil fuel generators. These initiatives are geared towards reducing carbon footprints in hard-to-abate industries and providing clean energy solutions for various applications.	TRUE - This represents green innovation since it aims to produce green hydrogen and promote clean energy solutions, significantly reducing negative environmental externalities by utilizing renewable resources.	TRUE - The article discusses new products and business processes, including hydrogen power generators and advisory services that significantly differ from the company's previous offerings, thereby illustrating business innovation.	TRUE - The hydrogen power generator is a new product designed to produce energy with zero emissions, classifying it as a green product due to its significant reduction of environmental impact.	TRUE - The water electrolysis process described for producing green hydrogen is a green process as it minimizes environmental impacts by using renewable resources and avoiding harmful emissions.	Hitachi Energy	Hitachi Energy	Hydrogen power generator	[{'code': '334413', 'category': 'Semiconductor and Other Electronic Component Manufacturing'}, {'code': '221118', 'category': 'Other Electric Power Generation'}, {'code': '335999', 'category': 'All Other Miscellaneous Electrical Equipment and Component Manufacturing'}, {'code': '541330', 'category': 'Engineering Services'}]	FALSE - The article does not exhibit greenwashing; it provides detailed information about legitimate efforts and technologies being developed to contribute positively to the clean energy transition.	2120
SDGs & me: Responsible consumption and production - European Commission	https://news.google.com/rss/articles/CBMiSWh0dHBzOi8vZWMuZXVyb3BhLmV1L2V1cm9zdGF0L3dlYi9wcm9kdWN0cy1ldXJvc3RhdC1uZXdzL3cvZGRuLTIwMjMwODMwLTHSAQA?oc=5	The article discusses the Sustainable Development Goal for 'Responsible consumption and production' (SDG 12), emphasizing the need for sustainable practices among businesses, policymakers, and consumers. It highlights decreases in raw material consumption and waste generation in the EU while encouraging the use of secondary raw materials. Additionally, it mentions a recent package of measures adopted by the European Commission aimed at sustainably using key natural resources. The article also offers tools for visualizing the progress of different countries towards these goals.	TRUE, because it highlights sustainable practices and technologies that contribute to environmental sustainability and resource efficiency.	FALSE, as the article does not specifically mention a new or improved product or process introduced to the market by a firm.	FALSE, since the article does not refer to any specific good or service that meets the definition of a green product.	FALSE, because the article does not describe any specific process that minimizes environmental impacts.	company not identified	product or process not identified	not found	Likely NAICS Codes: 541620 - Environmental Consulting Services, 331999 - All Other Miscellaneous Nonmetallic Mineral Product Manufacturing, 311999 - All Other Miscellaneous Food Manufacturing, 562910 - Remediation Services.	FALSE, as the article does not make misleading claims about environmental benefits, but rather focuses on reporting actual data and promoting sustainability initiatives.	1702
Tanzania's Solar Journey Accelerates; d.light Secures $30 Million Investment - SolarQuarter	https://news.google.com/rss/articles/CBMibmh0dHBzOi8vc29sYXJxdWFydGVyLmNvbS8yMDIzLzA4LzIyL3Rhbnphbmlhcy1zb2xhci1qb3VybmV5LWFjY2VsZXJhdGVzLWQtbGlnaHQtc2VjdXJlcy0zMC1taWxsaW9uLWludmVzdG1lbnQv0gEA?oc=5	d.light has secured a $30 million securitization facility to expand solar access in Tanzania, supporting its Pay-Go personal finance service to aid low-income households in affording solar-powered products. The funding will contribute to d.light's total securitized financing of $490 million since 2020 and emphasizes the importance of green energy investments. CEO Nick Imudia highlighted the initiative's dual focus on customer well-being and environmental sustainability while TDB CEO Michael Awori recognized energy access as critical for sustainable development.	TRUE - This innovation contributes to environmental sustainability by providing affordable solar energy solutions, thereby reducing reliance on non-renewable energy sources and enhancing access to clean energy.	TRUE - This is a business innovation as it involves a new financing model (Pay-Go) introduced by d.light to enable customers to access solar products, significantly differing from their previous business processes.	TRUE - The solar-powered household products offered by d.light are designed to reduce environmental impact throughout their life cycle, from production to disposal, hence qualifying as green products.	TRUE - The Pay-Go financing model and the use of solar energy in operations minimize environmental impacts, promoting sustainability through renewable resources.	d.light	d.light Design, Inc.	Pay-Go personal finance service	Likely NAICS Codes: 335999 - All Other Miscellaneous Electrical Equipment and Component Manufacturing, 541611 - Administrative Management and General Management Consulting Services, 611710 - Educational Support Services, 221118 - Other Electric Power Generation	FALSE - The article does not suggest any misleading claims about environmental benefits; rather, it clearly outlines d.light's commitment to providing genuine solar energy solutions to underserved communities.	1827
Charting Economic Success: A Comparative Exploration of New Zealand and Puerto Rico - The Weekly Journal	https://news.google.com/rss/articles/CBMisQFodHRwczovL3d3dy50aGV3ZWVrbHlqb3VybmFsLmNvbS90b3Atc3Rvcmllcy9jaGFydGluZy1lY29ub21pYy1zdWNjZXNzLWEtY29tcGFyYXRpdmUtZXhwbG9yYXRpb24tb2YtbmV3LXplYWxhbmQtYW5kLXB1ZXJ0by1yaWNvL2FydGljbGVfZjE2YmM5ZjAtM2FiMy0xMWVlLTk2MGYtOGYxMGI4ODUyNzU4Lmh0bWzSAQA?oc=5	The article discusses the economic challenges faced by Puerto Rico and suggests lessons from New Zealand's economic growth strategies to enhance its competitiveness. It emphasizes the importance of economic diversification, education and workforce development, trade agreements, fiscal management, and infrastructure investment. The writers propose a comprehensive action plan that mirrors New Zealand's success to revitalize Puerto Rico's economy. The focus includes sustainable practices that could lead to a prosperous future for Puerto Rico's citizens.	TRUE - The article discusses sustainable practices such as renewable energy development and agricultural innovation which contribute to environmental sustainability.	TRUE - The article describes strategies and initiatives aimed at diversifying Puerto Rico's economy and fostering new sectors, such as renewable energy and technology, which significantly deviate from previous practices.	FALSE - The article does not specify any particular good or service that meets the definition of a green product.	TRUE - The article mentions renewable energy development and sustainable agriculture, which are indicative of processes that minimize environmental impact and promote sustainability.	company not identified	company not identified	product or process not identified	Likely NAICS Codes: 541715 - Research and Development in the Physical, Engineering, and Life Sciences, 541611 - Administrative Management and General Management Consulting Services, 922130 - Legal Counsel and Prosecution, 541430 - Graphic Design Services.	FALSE - The article is focused on outlining genuine strategies for economic improvement and sustainability in Puerto Rico, rather than making misleading claims about environmental benefits.	3550
Morrow Batteries aim to realise the first prismatic LNMO battery cell in the world early 2024 | Morrow Batteries - Mynewsdesk	https://news.google.com/rss/articles/CBMinwFodHRwczovL3d3dy5teW5ld3NkZXNrLmNvbS9tb3Jyb3ctYmF0dGVyaWVzL3ByZXNzcmVsZWFzZXMvbW9ycm93LWJhdHRlcmllcy1haW0tdG8tcmVhbGlzZS10aGUtZmlyc3QtcHJpc21hdGljLWxubW8tYmF0dGVyeS1jZWxsLWluLXRoZS13b3JsZC1lYXJseS0yMDI0LTMyNjc0OTPSAQA?oc=5	Morrow Batteries announces the production of next-generation LNMO-X batteries, which utilize Lithium Nickel Manganese Oxide (LNMO) technology, replacing cobalt with manganese for a more sustainable and cost-effective battery. The company has made significant progress in producing LNMO electrodes under industrial conditions and aims to supercharge heavy mobility and energy storage markets. The new cells have passed safety tests and show promising performance improvements in challenging conditions. Morrow is preparing for pilot production in Korea.	TRUE; this innovation leads to the development of more sustainable battery technology, reducing reliance on cobalt and improving environmental performance.	TRUE; it introduces a new product (LNMO-X batteries) that significantly differs from previous offerings and has been brought to market.	TRUE; LNMO-X batteries are designed and manufactured in a way that significantly reduces their environmental impact throughout their life cycle.	TRUE; the production process for LNMO electrodes minimizes environmental impacts by using abundant and sustainable materials and energy-efficient techniques.	Morrow Batteries	Morrow Batteries	LNMO-X batteries	Likely NAICS Codes: 335911 - Storage Battery Manufacturing, 335999 - All Other Miscellaneous Electrical Equipment and Component Manufacturing, 335999 - Other Electronic Component Manufacturing, 331491 - Nonferrous Metal (except Aluminum) Smelting and Refining.	FALSE; the article provides specific details about sustainable practices and product development, thus it does not appear to mislead regarding environmental benefits.	1698
LOHUM and Vecmocon partner to accelerate EV battery adoption and enable easy financing - Autocar Professional	https://news.google.com/rss/articles/CBMifGh0dHBzOi8vd3d3LmF1dG9jYXJwcm8uaW4vbmV3cy9sb2h1bS1hbmQtdmVjbW9jb24tcGFydG5lci10by1hY2NlbGVyYXRlLWV2LWJhdHRlcnktYWRvcHRpb24tYW5kLWVuYWJsZS1lYXN5LWZpbmFuY2luZy0xMTYzMDDSAYIBaHR0cHM6Ly93d3cuYXV0b2NhcnByby5pbi9uZXdzL2xvaHVtLWFuZC12ZWNtb2Nvbi1wYXJ0bmVyLXRvLWFjY2VsZXJhdGUtZXYtYmF0dGVyeS1hZG9wdGlvbi1hbmQtZW5hYmxlLWVhc3ktZmluYW5jaW5nLTExNjMwMD9hbXA9MQ?oc=5	Vecmocon and LOHUM are partnering to enhance the lifecycle management of electric vehicle batteries through an AI-powered battery management system and vehicle intelligence module, aiming to power over 100,000 batteries in two years. Their collaboration combines battery testing technology and real-time data monitoring to improve battery safety, reliability, and longevity. The partnership will contribute to a circular economy and sustainable ecosystem for electric vehicles in India.	TRUE: This innovation aims to support environmental sustainability by enhancing the lifecycle of EV batteries, thereby contributing to a closed-loop circular economy and reducing waste.	TRUE: The collaboration represents a new approach to battery management and lifecycle management that differs significantly from existing processes, introducing innovative technologies to the market.	FALSE: While the systems involved contribute to sustainability, they do not constitute a standalone green product; rather, they improve existing battery technologies.	TRUE: The integration of AI in battery management processes to optimize performance and longevity minimizes environmental impacts and promotes sustainability.	Vecmocon, LOHUM	Vecmocon Pvt. Ltd., LOHUM Lifestyles	AI-powered battery management system	Likely NAICS Codes: 334413 - Semiconductor and Related Device Manufacturing; 335999 - All Other Miscellaneous Electrical Equipment and Component Manufacturing; 541715 - Research and Development in the Physical, Engineering, and Life Sciences; 541511 - Custom Computer Programming Services.	FALSE: The article does not present misleading or false information; it accurately describes an innovative partnership focused on sustainability and improving battery management.	1679
Varinder Bhatia, Joint Vice President- Sales (Solar) at Havells India Ltd. - Energetica India	https://news.google.com/rss/articles/CBMiSWh0dHBzOi8vd3d3LmVuZXJnZXRpY2EtaW5kaWEubmV0L3Bvd2VyZnVsLXRob3VnaHRzL29ubGluZS92YXJpbmRlci1iaGF0aWHSAQA?oc=5	The article highlights the growth and potential of India's solar industry, driven by government initiatives and increasing consumer awareness. Havells India Ltd. is actively investing in solar solutions, including their flagship solar grid tie inverter, and emphasizes their commitment to quality and innovation. The company aims to expand its product portfolio and contribute to the sustainable energy landscape in India. The discussion also touches on the PLI scheme's role in enhancing Indian manufacturing capabilities in the solar sector.	TRUE: The innovation discussed contributes to environmental sustainability by promoting solar energy, which reduces reliance on fossil fuels and minimizes negative environmental impacts.	TRUE: The introduction of Havells' solar grid tie inverter and other solar solutions represents a significant departure from traditional energy offerings, showcasing a new or improved product that is being brought to market.	TRUE: The solar grid tie inverter is designed and manufactured to reduce environmental impact and support renewable energy, qualifying it as a green product.	TRUE: Havells' commitment to using state-of-the-art manufacturing facilities and rigorous quality control measures reflects a green process aimed at minimizing environmental impacts.	Havells India Ltd.	Havells India Ltd.	solar grid tie inverter	Likely NAICS Codes: 221118 - Other Electric Power Generation, 335999 - All Other Miscellaneous Electrical Equipment and Component Manufacturing, 423610 - Electrical Apparatus and Equipment, Wiring Supplies, and Related Equipment Merchant Wholesalers, 811310 - Commercial and Industrial Machinery and Equipment (except Automotive and Electronic) Repair and Maintenance	FALSE: The article does not exhibit elements of greenwashing; it presents genuine efforts by Havells to promote solar energy and outlines their commitment to sustainability and innovation without misleading claims.	3069
