title	link	summary	green_innovation	business_innovation	green_product	green_process	company	official_company_name	product_or_process	likely_naics_codes	greenwashing	total_tokens
A look at how we're building more sustainable hardware - The Keyword | Google Product and Technology News	https://news.google.com/rss/articles/CBMiZGh0dHBzOi8vYmxvZy5nb29nbGUvcHJvZHVjdHMvZGV2aWNlcy1zZXJ2aWNlcy9hLWxvb2stYXQtaG93LXdlcmUtYnVpbGRpbmctbW9yZS1zdXN0YWluYWJsZS1oYXJkd2FyZS_SAQA?oc=5	The article discusses a company's efforts to reduce waste by increasing the use of recycled materials, enhance repair options for phones, and improve packaging by eliminating plastic. In 2022, 30% of the materials in new products were recycled, and the packaging for Pixel 7 was 99% plastic-free. The company also partnered with iFixit to provide access to genuine spare parts to encourage phone repairs.	TRUE, because the company demonstrates commitment to sustainability by reducing waste, using recycled materials, and minimizing the carbon footprint in product manufacturing.	TRUE, because the company introduced new practices and products that significantly differ from previous methods, particularly in sourcing recycled materials and improving repairability.	TRUE, as the products utilize a significant proportion of recycled content, which reduces their overall environmental impact throughout their life cycle.	TRUE, the processes described, including the sourcing of recycled materials and efforts to reduce packaging waste, minimize environmental impacts and promote sustainability.	company not identified	company not identified	Pixel 7	Likely NAICS Codes: 334111 - Electronic Computer Manufacturing, 334310 - Audio and Video Equipment Manufacturing, 335999 - All Other Miscellaneous Electrical Equipment and Component Manufacturing, 339999 - All Other Miscellaneous Manufacturing	FALSE, as the article presents concrete actions and goals that show genuine efforts towards sustainability rather than misleading claims.	1634
Top 10: Brands Embracing the Circular Economy - Sustainability Magazine	https://news.google.com/rss/articles/CBMiWGh0dHBzOi8vc3VzdGFpbmFiaWxpdHltYWcuY29tL3RvcDEwL3RvcC0xMC1icmFuZHMtZW1icmFjaW5nLXRoZS1jaXJjdWxhci1lY29ub215LWluLTIwMjPSAQA?oc=5	The article highlights the growing adoption of a circular economy by brands, focusing on Patagonia as a leader in sustainability since 1986. Patagonia promotes environmental sustainability through initiatives like The Worn Wear programme, encouraging customers to repair, reuse, and recycle garments. The brand also utilizes recycled materials and organic cotton to reduce its environmental impact, thereby supporting a circular economy.	TRUE, because the article describes Patagonia's initiatives that significantly reduce environmental impacts by promoting repair, reuse, and recycling of clothing, aligning with the goals of green innovation.	TRUE, because Patagonia's Worn Wear programme and its use of sustainable materials represent new and improved business processes that differ significantly from previous practices.	TRUE, because the clothing line that incorporates recycled materials and uses organic fabrics is designed to minimize environmental impact throughout its life cycle.	TRUE, because the Worn Wear programme and the sustainable production practices employed by Patagonia minimize waste, conserve resources, and limit harmful substances.	Patagonia	Patagonia, Inc.	Worn Wear programme	Likely NAICS Codes: 424320 - Men's and Boy's Clothing and Furnishings Merchant Wholesalers; 448120 - Women's Clothing Stores; 316210 - Footwear Manufacturing; 541611 - Administrative Management and General Management Consulting Services.	FALSE, because the article does not present any misleading claims about Patagonia's environmental practices and instead accurately describes their commitment and actions towards sustainability.	1561
Capturing the green banking opportunity - McKinsey	https://news.google.com/rss/articles/CBMihgFodHRwczovL3d3dy5tY2tpbnNleS5jb20vY2FwYWJpbGl0aWVzL3N1c3RhaW5hYmlsaXR5L291ci1pbnNpZ2h0cy9ncmVlbi1ncm93dGgtdW5sb2NraW5nLXN1c3RhaW5hYmlsaXR5LW9wcG9ydHVuaXRpZXMtZm9yLXJldGFpbC1iYW5rc9IBAA?oc=5	A McKinsey survey reveals a significant and increasing interest among American consumers for climate-linked financial products, emphasizing the need for education and differentiation among providers. The findings suggest that demand for such products is broad, not confined to affluent urban dwellers, and that consumers are willing to pay more for impactful climate-linked options. Financial institutions have an opportunity to establish themselves as credible partners in the climate transition by providing specialized green offerings and supporting consumers with valuable advice. Overall, there is a push for more engaging and transparent climate brands to capture the green opportunity effectively.	TRUE, because the article discusses climate-linked financial products that aim to reduce environmental impact and promote sustainability by aligning financial services with consumers' climate-conscious preferences.	TRUE, as it describes new or improved financial products and processes introduced by firms that differ significantly from traditional offerings, targeting consumers' interests in climate-linked solutions.	TRUE, as climate-linked financial products represent goods and services designed to reduce environmental impact through sustainable financial practices.	TRUE, since the article highlights operational adjustments made by financial institutions to create and market climate-linked products, reflecting processes aimed at sustainability.	company not identified	company not identified	product or process not identified	Likely NAICS Codes: 522 - Credit Intermediation and Related Activities, 523 - Securities, Commodity Contracts, and Other Financial Investments and Related Activities, 524 - Insurance Carriers and Related Activities, 541 - Professional, Scientific, and Technical Services.	FALSE, as the article does not engage in misleading claims about the environmental benefits of products, but rather presents genuine insights into consumer demand for sustainable financial options.	3198
Consumer Companies Must Innovate to Drive Impact on Climate - BCG	https://news.google.com/rss/articles/CBMicWh0dHBzOi8vd3d3LmJjZy5jb20vcHVibGljYXRpb25zLzIwMjMvY29uc3VtZXItY29tcGFuaWVzLW5lZWQtaW5ub3ZhdGl2ZS1jbGltYXRlLWNoYW5nZS1zb2x1dGlvbnMtdG8tZHJpdmUtaW1wYWN00gEA?oc=5	The article discusses the Consumer Packaged Goods (CPG) sector's challenges in harnessing innovation to meet sustainability goals, emphasizing the increased consumer demand for sustainable products. Major companies like Nestlé and AB InBev are highlighted for their initiatives to innovate toward sustainability, including shifting to renewable energy and developing plant-based products. The article underscores the need for CPG companies to leverage advanced digital tools while also fostering consumer engagement to drive sustainable behaviors. It calls for immediate actions from businesses to create real sustainability advantages before opportunities diminish.	TRUE - The article describes various initiatives by companies that reduce environmental impacts, such as Nestlé's focus on plant-based products and renewable energy use, aligning with green innovation principles.	TRUE - The efforts by Nestlé and AB InBev to create new sustainable products and processes represent significant improvements in business practices which differ from their traditional methods.	TRUE - The article mentions products like Wunda, a pea-based milk alternative, which is designed to minimize environmental impact, thus meeting the definition of a green product.	TRUE - The article discusses processes such as the use of renewable energy and energy-efficient manufacturing methods, which aim to minimize waste and environmental impact.	Nestlé and AB InBev	Nestlé S.A. and Anheuser-Busch InBev	Wunda (pea-based milk alternative)	Likely NAICS Codes: 311 - Food Manufacturing, 312 - Beverage Manufacturing, 325 - Chemical Manufacturing, 323 - Printing and Related Support Activities	FALSE - The article does not suggest misleading claims about sustainability but rather highlights genuine efforts by companies to innovate and improve their environmental impact.	3819
LyondellBasell Details Accelerated Momentum in 2022 Sustainability Report - LyondellBasell	https://news.google.com/rss/articles/CBMikgFodHRwczovL3d3dy5seW9uZGVsbGJhc2VsbC5jb20vZW4vbmV3cy1ldmVudHMvY29ycG9yYXRlLS1maW5hbmNpYWwtbmV3cy9seW9uZGVsbGJhc2VsbC1kZXRhaWxzLWFjY2VsZXJhdGVkLW1vbWVudHVtLWluLTIwMjItc3VzdGFpbmFiaWxpdHktcmVwb3J0L9IBAA?oc=5	LyondellBasell published its annual sustainability report highlighting initiatives towards reducing plastic waste, enhancing circular and low carbon solutions, and setting ambitious greenhouse gas emissions reduction targets for 2030. The report details new recycling projects, significant production of recycled polymers, and progress in obtaining renewable electricity. The company emphasizes its commitment to transparency and its role in advancing sustainability goals. CEO Peter Vanacker remarked on the urgency of addressing climate and circularity issues.	TRUE, because the company is implementing green innovations such as increasing recycling capabilities and setting significant emissions reduction targets in line with environmental sustainability goals.	TRUE, as LyondellBasell is introducing improved processes and products, particularly in the field of recycling and production of renewable-based polymers, which significantly differ from their previous operations.	TRUE, the recycled and renewable-based polymers produced by the company significantly reduce environmental impact and align with the definition of green products.	TRUE, because the initiatives described involve methods that minimize waste and energy consumption through recycling and renewable electricity procurement.	LyondellBasell	LyondellBasell Industries N.V.	Circulen brand	[{'code': '325199', 'category': 'All Other Basic Organic Chemical Manufacturing'}, {'code': '326100', 'category': 'Plastics Product Manufacturing'}, {'code': '325211', 'category': 'Plastics Material and Resin Manufacturing'}, {'code': '562920', 'category': 'Materials Recovery Facilities'}]	FALSE, as the article provides substantial evidence of the company's genuine efforts towards sustainability, including specific targets and initiatives, rather than making misleading claims.	2668
Pushing the Boundaries of Sustainability and Materials Science - Window and Door	https://news.google.com/rss/articles/CBMiXWh0dHBzOi8vd3d3LndpbmRvd2FuZGRvb3IuY29tL2FydGljbGUvcHVzaGluZy1ib3VuZGFyaWVzLXN1c3RhaW5hYmlsaXR5LWFuZC1tYXRlcmlhbHMtc2NpZW5jZdIBAA?oc=5	The article discusses SunShield, a high-performance vinyl compound developed for window and door products that focuses on sustainability, energy efficiency, and recyclability. It emphasizes the need for new materials to meet modern climate challenges and highlights the innovative use of bio-based resins and natural materials in the production process. Industry leaders are striving for products that align with eco-conscious consumer demands while addressing the environmental impact of building materials. Overall, the article showcases a commitment to advancing sustainable practices in the manufacturing of window and door systems.	TRUE - The innovation contributes to environmental sustainability by developing materials that reduce waste, improve energy efficiency, and have recyclable end-of-life properties.	TRUE - The development of new materials and processes for window and door products represents an improvement over previous offerings, responding to market demands for sustainability.	TRUE - SunShield and Innergy are designed with environmentally benign materials and aim to reduce environmental impact throughout their life cycle.	TRUE - The manufacturing methods detailed emphasize the use of renewable resources, energy efficiency, and the recyclability of the product afterward, indicating a sustainable production process.	Deceuninck North America	Deceuninck North America	SunShield and Innergy	Likely NAICS Codes: 326199 - All Other Plastics Product Manufacturing; 238390 - Other Building Finishing Contractors; 327320 - Ready-Mix Concrete Manufacturing; 332999 - All Other Miscellaneous Fabricated Metal Product Manufacturing.	FALSE - The article does not contain misleading statements; instead, it provides accurate information on sustainable practices and innovations in window and door manufacturing.	2310
Coach Has a New Sustainable Fashion Brand. Will Shoppers Go For It? - The New York Times	https://news.google.com/rss/articles/CBMiVGh0dHBzOi8vd3d3Lm55dGltZXMuY29tLzIwMjMvMDQvMjAvZmFzaGlvbi9jb2FjaC1jb2FjaHRvcGlhLXN1c3RhaW5hYmxlLWZhc2hpb24uaHRtbNIBAA?oc=5	Stuart Vevers, the creative director of Coach, discussed the company's initiative to use waste leather from their production line to create a new product line called Coachtopia, which includes nearly 100 products made from recycled materials. This move comes in response to scrutiny over wasteful practices in the fashion industry, emphasizing circular business models that promote recycling and reuse.	TRUE: This initiative embodies green innovation as it promotes circular business models, minimizes waste, and repurposes production byproducts to create new products.	TRUE: The introduction of Coachtopia as a new product line reflects business innovation, significantly differing from Coach's previous offerings by utilizing waste materials and recycled components.	TRUE: The products in the Coachtopia line are designed to have a reduced environmental impact by using waste leather and recycled materials, fitting the definition of a green product.	TRUE: The process of utilizing waste leather and recycled materials to create new products constitutes a green process, as it minimizes environmental impacts and promotes sustainability.	Coach	Coach, Inc.	Coachtopia	Likely NAICS Codes: 448190 - Other Clothing Stores; 315210 - Cut and Sew Apparel Manufacturing; 541613 - Marketing Consulting Services; 323113 - Commercial Screen Printing.	FALSE: The article does not indicate greenwashing as Coach's initiative appears genuine in attempting to reduce waste and promote sustainability through the use of recycled materials.	1510
Slideshow: Eco-conscious innovation is trending - Food Business News	https://news.google.com/rss/articles/CBMiXmh0dHBzOi8vd3d3LmZvb2RidXNpbmVzc25ld3MubmV0L2FydGljbGVzLzIzNjQxLXNsaWRlc2hvdy1lY28tY29uc2Npb3VzLWlubm92YXRpb24taXMtdHJlbmRpbmfSAQA?oc=5	As Earth Day approaches, consumer interest in sustainable products has notably increased, with 93% of consumers maintaining or increasing sustainable purchase habits in the past year. Upcycled plant-based products have become a key trend, with companies like Minus Coffee and Kazoo Snacks introducing innovative offerings that reduce environmental impact by using upcycled ingredients and conserving resources. These products not only appeal to consumers but also present manufacturers with opportunities for effective storytelling around sustainability. Overall, the market for sustainable consumer packaged goods is experiencing significant growth despite supply chain challenges and inflation.	TRUE; the article discusses innovations in products that utilize upcycled ingredients and sustainable practices, contributing to environmental sustainability.	TRUE; the introduction of new products like bean-less coffee and tortilla chips made from corn germ represents significant advancements in the firms' product offerings.	TRUE; the products mentioned utilize environmentally friendly ingredients and processes that reduce overall environmental impact.	TRUE; the manufacturing processes described minimize environmental impact, conserve resources, and utilize upcycled materials.	['Minus Coffee', 'Kazoo Snacks', 'Brutal Foods']	['Compound Foods', 'Kazoo Snacks', 'Brutal Foods']	['bean-less coffee', 'tortilla chips', 'baked crunchy puffs']	[{'code': '311111', 'category': 'Dog and Cat Food Manufacturing'}, {'code': '311999', 'category': 'All Other Miscellaneous Food Manufacturing'}, {'code': '311830', 'category': 'Snack Food Manufacturing'}, {'code': '311942', 'category': 'Spice and Extract Manufacturing'}]	FALSE; the article does not present misleading information about the environmental benefits of the products mentioned, rather it highlights genuine innovations aimed at sustainability.	2296
Sustainability and ESG glossary: 52 terms to know - TechTarget	https://news.google.com/rss/articles/CBMiX2h0dHBzOi8vd3d3LnRlY2h0YXJnZXQuY29tL3N1c3RhaW5hYmlsaXR5L2ZlYXR1cmUvU3VzdGFpbmFiaWxpdHktYW5kLUVTRy1nbG9zc2FyeS1UZXJtcy10by1rbm930gEA?oc=5	The article emphasizes the importance of adopting sustainable practices to ensure the health of individuals, the planet, and businesses. It highlights the need for stakeholders in various sectors to understand key sustainability and environmental, social, and governance (ESG) concepts in order to effectively address climate disruption. Immediate action from business leaders, citizens, and governments is deemed imperative for tackling these issues.	TRUE: The article promotes sustainable practices and the significance of ESG initiatives, which align with the principles of green innovation aimed at reducing negative environmental impacts.	FALSE: The article does not discuss any specific new or improved product or business process; it focuses on the general importance of sustainability concepts.	FALSE: The article does not mention any specific good or service that significantly reduces environmental impact.	FALSE: The article does not describe any specific method or technique in manufacturing or production that minimizes environmental impacts.	company not identified	company not identified	product or process not identified	Likely NAICS Codes: 9241 - Administration of Environmental Quality Programs; 5416 - Management, Scientific, and Technical Consulting Services; 8112 - Electronic and Precision Equipment Repair and Maintenance; 9211 - Executive, Legislative, and Other General Government Support	FALSE: The article does not engage in misleading statements about environmental benefits; it advocates for awareness and action on sustainability without promoting any specific products or practices.	1439
We All Own Sustainability: A Q&A with Chief Sustainability Officer Ron Jarvis - The Home Depot	https://news.google.com/rss/articles/CBMieGh0dHBzOi8vY29ycG9yYXRlLmhvbWVkZXBvdC5jb20vbmV3cy9zdXN0YWluYWJpbGl0eS93ZS1hbGwtb3duLXN1c3RhaW5hYmlsaXR5LXFhLWNoaWVmLXN1c3RhaW5hYmlsaXR5LW9mZmljZXItcm9uLWphcnZpc9IBAA?oc=5	The Home Depot emphasizes its commitment to reducing environmental impact through initiatives led by its associates and business leaders. Their Eco Actions program promotes sustainable DIY projects and greener product choices, while efforts are made to reduce packaging waste and transition to energy-efficient practices. The company highlights improvements in resource consumption and aims to motivate industry-wide innovation towards sustainability. Overall, their sustainability strategies are embedded in core business operations to create competitive advantages.	TRUE: The article discusses multiple initiatives that significantly reduce environmental impact, such as promoting sustainable products, reducing energy consumption, and encouraging recycling, which all align with green innovation principles.	TRUE: The Home Depot introduces improved processes and products that differ significantly from its previous offerings, such as the Eco Actions program and innovations in packaging, which qualify as business innovation.	TRUE: The article mentions products like circularity-centered moving boxes made from recycled paper fiber and composite deck boards made from recycled plastic that significantly reduce environmental impact throughout their life cycle.	TRUE: The text outlines processes such as reducing electricity consumption by 50% since 2010 and employing sustainable materials in packaging, which minimize environmental impacts and promote sustainability.	The Home Depot	The Home Depot, Inc.	Eco Actions program	Likely NAICS Codes: 444130 - Hardware Stores, 444190 - Other Building Material Dealers, 444110 - Home Centers, 425120 - Wholesale Trade Agents and Brokers	FALSE: The article provides detailed insights into actual sustainability initiatives and their impacts, without misleading claims or exaggerated environmental benefits, suggesting authenticity rather than greenwashing.	2097
PepsiCo Debuts New Customer Sustainability Platform Designed To Deliver Critical Solutions Most Needed by ... - PR Newswire	https://news.google.com/rss/articles/CBMiqwFodHRwczovL3d3dy5wcm5ld3N3aXJlLmNvbS9uZXdzLXJlbGVhc2VzL3BlcHNpY28tZGVidXRzLW5ldy1jdXN0b21lci1zdXN0YWluYWJpbGl0eS1wbGF0Zm9ybS1kZXNpZ25lZC10by1kZWxpdmVyLWNyaXRpY2FsLXNvbHV0aW9ucy1tb3N0LW5lZWRlZC1ieS1jdXN0b21lcnMtMzAxNzk0OTcyLmh0bWzSAQA?oc=5	PepsiCo has launched 'pep+ Partners for Tomorrow', a platform designed to support customers in achieving sustainability goals through customizable solutions. The initiative focuses on various programs including on-demand collection of recyclable containers, reusable cup solutions, and investments in regenerative agriculture. This platform is part of PepsiCo's broader pep+ strategy to transform its business towards sustainability. The company aims to achieve net-zero emissions by 2040 and offers programs to assist its customers in similar efforts.	TRUE: This article details various sustainability initiatives under the 'pep+ Partners for Tomorrow' platform, which aim to reduce environmental impacts and promote sustainable practices, fulfilling the definition of green innovation.	TRUE: The launch of 'pep+ Partners for Tomorrow' represents a new platform that combines various sustainability offerings for customers, meeting the criteria for business innovation as it differs significantly from PepsiCo's previous offerings.	FALSE: While the article discusses several sustainability initiatives, it does not specifically define a good or service as a green product that meets the criteria set forth.	TRUE: The article describes various processes, such as the collection and recycling of containers and the piloting of reusable cup systems, which minimize environmental impact, fitting the definition of a green process.	PepsiCo	PepsiCo, Inc.	pep+ Partners for Tomorrow	Likely NAICS Codes: 311999 - All Other Food Manufacturing, 312111 - Soft Drink Manufacturing, 423820 - Beverage Container Manufacturing, 541611 - Administrative Management and General Management Consulting Services	FALSE: The article does not appear to exhibit characteristics of greenwashing; it outlines genuine sustainability initiatives and partnerships aimed at reducing environmental impacts, rather than making misleading claims.	4494
Sustainability: Avoiding the Greenwash - Store Brands Magazine	https://news.google.com/rss/articles/CBMiOWh0dHBzOi8vc3RvcmVicmFuZHMuY29tL3N1c3RhaW5hYmlsaXR5LWF2b2lkaW5nLWdyZWVud2FzaNIBAA?oc=5	The article discusses the ongoing challenges related to greenwashing and the lack of cohesive legislation across various states to combat misleading environmental claims. Experts suggest that retailers should take an active role in influencing government guidelines and work with third-party certifiers to substantiate claims. Companies like Sofidel have benefited from transparency through third-party certifications, enhancing their sustainability reputation. Overall, the article highlights the need for clear standards and accurate representation of environmental claims in retail.	FALSE - The article primarily discusses the challenges of greenwashing and emphasizes the need for accurate claims rather than presenting specific green innovations.	FALSE - While the article touches on marketing practices and the role of retailers, it does not provide examples of new or improved products or processes that signify business innovation.	FALSE - The article does not mention any specific goods or services that meet the definition of green products.	TRUE - The article discusses the efforts of companies to implement third-party certifications and minimize environmental impacts, which aligns with the definition of a green process.	Sofidel	Sofidel Group	third-party certifications	['322121 - Paper (except newsprint) Mills', '322122 - Newsprint Mills', '322130 - Paperboard Mills', '325320 - Pesticide and Other Agricultural Chemical Manufacturing']	FALSE - While the article refers to greenwashing and issues in the industry, it focuses on the importance of transparency and certification rather than promoting misleading claims.	1896
