title	link	summary	green_innovation	business_innovation	green_product	green_process	company	official_company_name	product_or_process	likely_naics_codes	greenwashing	total_tokens
Changing behavior could help Long Islanders better recycle and donate food - WSHU	https://news.google.com/rss/articles/CBMie2h0dHBzOi8vd3d3LndzaHUub3JnL2xvbmctaXNsYW5kLW5ld3MvMjAyMy0wNC0yMS9jaGFuZ2luZy1iZWhhdmlvci1jb3VsZC1oZWxwLWxvbmctaXNsYW5kZXJzLWJldHRlci1yZWN5Y2xlLWFuZC1kb25hdGUtZm9vZNIBAA?oc=5	The article discusses New York's Food Donation and Food Scraps Recycling law, emphasizing the need for larger organic waste management and encouraging food donation and recycling. It highlights the low percentage of food scraps currently being recycled compared to the total waste generated by large businesses and outlines new initiatives to promote better waste management practices. The article also stresses the importance of changing public perception of food waste as a resource rather than trash. Additionally, it discusses pilot programs aimed at reducing waste and promoting a circular economy on Long Island.	TRUE: The initiatives described promote environmental sustainability by encouraging food donation and recycling, thereby reducing waste and supporting a circular economy.	TRUE: The recycling law and associated programs represent new or improved processes that significantly differ from previous practices in waste management.	FALSE: The article does not identify a specific good or service that meets the definition of a green product.	TRUE: The recycling and food donation programs described represent methods that minimize environmental impacts and promote sustainability.	company not identified	company not identified	product or process not identified	Likely NAICS Codes: 562112 - Hazardous Waste Collection, 562119 - Other Waste Collection, 812220 - Cemeteries and Crematories, 311991 - Perishable Prepared Food Manufacturing	FALSE: The article does not indicate any misleading claims about the environmental benefits of the programs; rather, it promotes genuine efforts to manage food scraps sustainably.	2352
How can farmers deliver on EU Green Deal environmental commitments? | - Open Access Government	https://news.google.com/rss/articles/CBMiaGh0dHBzOi8vd3d3Lm9wZW5hY2Nlc3Nnb3Zlcm5tZW50Lm9yZy9ob3ctZmFybWVycy1kZWxpdmVyLWV1LWdyZWVuLWRlYWwtZW52aXJvbm1lbnRhbC1jb21taXRtZW50cy8xNTY5NDgv0gEA?oc=5	The article discusses the EU Green Deal, which emphasizes substantial changes in agricultural practices across the EU to enhance environmental sustainability, including reducing carbon footprints and adopting sustainable farming methods. It highlights the importance of new technologies, water conservation, and biodiversity protection to help farmers meet these commitments. Additionally, the article outlines various support mechanisms for farmers, including funding and financial incentives to promote sustainability. The article advocates for collective efforts among governments, businesses, and civil society to achieve these goals.	TRUE, because the article promotes farming practices that significantly reduce environmental impact and contribute to sustainability goals outlined in the EU Green Deal.	FALSE, as the article does not present a specific new or improved product or business process introduced on the market, but rather discusses broad agricultural practices and commitments.	FALSE, as there is no specific good or service mentioned that meets the criteria of a green product within the article.	TRUE, because the article describes various sustainable farming practices and techniques that minimize environmental impacts and promote sustainability.	company not identified	product or process not identified	not found	{'Likely NAICS Codes': ['111 - Crop Production', '112 - Animal Production and Aquaculture', '311 - Food Manufacturing', '325 - Chemical Manufacturing']}	FALSE, as the article focuses on legitimate commitments to sustainable agricultural practices and does not appear to provide misleading information about environmental benefits.	5964
The UK's investment in environmental science - Open Access Government	https://news.google.com/rss/articles/CBMiU2h0dHBzOi8vd3d3Lm9wZW5hY2Nlc3Nnb3Zlcm5tZW50Lm9yZy91ay1pbnZlc3RtZW50LWluLWVudmlyb25tZW50YWwtc2NpZW5jZS8xNTc2NzMv0gEA?oc=5	The article highlights the importance of environmental science in addressing climate change and its impacts on biodiversity and human health. It emphasizes the UK's investment in green technologies and the need for collaboration between businesses and government to support a low-carbon economy. It discusses the potential for green innovation to drive economic growth while promoting environmental sustainability. The article also outlines the role of environmental data in guiding decision-making and fostering resilience against environmental hazards.	TRUE, because the article discusses the UK's efforts to invest in environmental science and technologies that aim for decarbonization and sustainability, which aligns with the principles of green innovation.	TRUE, because the article refers to how companies are encouraged to adopt green business models and develop new products and services that are environmentally friendly.	FALSE, as no specific green product was identified that meets the definition provided.	TRUE, because it discusses investment in technologies and processes that minimize environmental impacts, enhance sustainability, and promote practices like carbon capture and storage.	company not identified	product or process not identified	not found	Likely NAICS Codes: 541620 - Environmental Consulting Services, 334513 - Instruments and Related Products Manufacturing for Measuring, Displaying, and Controlling Industrial Process Variables, 541715 - Research and Development in the Physical, Engineering, and Life Sciences (except Nanotechnology and Biotechnology), 221118 - Other Electric Power Generation.	FALSE, as the article does not make misleading claims about environmental benefits, but rather discusses genuine efforts and investments in environmental science and technology.	2493
D2C Brand Pilgrim Forays into the Hair Care Segment, Launches Its New Range - Indian Retailer	https://news.google.com/rss/articles/CBMiZWh0dHBzOi8vd3d3LmluZGlhbnJldGFpbGVyLmNvbS9uZXdzL2QyYy1icmFuZC1waWxncmltLWZvcmF5cy1oYWlyLWNhcmUtc2VnbWVudC1sYXVuY2hlcy1pdHMtbmV3LXJhbmdl0gEA?oc=5	Juicy Chemistry and Mommy Shots by Amrita launched the 'Scars are Beautiful' campaign to celebrate postpartum bodies and stretch marks, featuring stories from mothers to promote self-love and body positivity. The campaign encourages women to embrace their bodies, presenting scars as symbols of strength and resilience. The initiative aims to change societal perceptions of beauty and normalize the appearance of motherhood-related changes.	FALSE: The campaign focuses on body positivity and self-acceptance rather than reducing environmental impacts or promoting sustainability.	TRUE: The collaboration between Juicy Chemistry and Mommy Shots exemplifies business innovation by introducing a new marketing campaign that differs significantly from their previous offerings.	FALSE: The products discussed in the article are not defined as green products under the provided criteria focused on environmental impact.	FALSE: The article does not describe any specific manufacturing or operational processes that minimize environmental impacts.	Juicy Chemistry	Juicy Chemistry	Scars are Beautiful campaign	Likely NAICS Codes: 812199 - Other Personal Care Services, 446120 - Cosmetics, Beauty Supplies, and Perfume Stores, 541810 - Advertising Agencies, 541613 - Marketing Consulting Services	FALSE: The article does not appear to be greenwashing as it focuses on empowerment and self-acceptance rather than making misleading claims about environmental benefits.	2088
Top 20 Best Metal Ore Mining Companies In India 2023 - Inventiva	https://news.google.com/rss/articles/CBMiSmh0dHBzOi8vd3d3LmludmVudGl2YS5jby5pbi90cmVuZHMvdG9wLTIwLWJlc3QtbWV0YWwtb3JlLW1pbmluZy1jb21wYW5pZXMv0gEA?oc=5	The article discusses India's metal ore mining industry, highlighting its contribution to economic growth and the role of leading companies committed to sustainable mining practices and social responsibility. It mentions various companies that have adopted advanced technologies and initiatives to minimize environmental impacts and promote community development. The Indian government's support through policies and infrastructure investments is also noted, indicating the industry's growth potential.	TRUE: The article describes companies in the mining industry that implement sustainable practices and technologies to reduce environmental impacts, aligning with the definition of green innovation.	TRUE: The article discusses numerous companies in the metal ore mining sector that have introduced new or improved processes and products, showcasing significant advancements in technology and sustainability.	FALSE: The article does not specifically identify any individual green products but discusses the overarching sustainable practices of mining companies.	TRUE: Many companies mentioned in the article adopt sustainable mining practices intended to minimize environmental impact, which qualifies as green processes.	Vedanta Limited, Hindalco Industries Limited, Tata Steel Ltd, National Mineral Development Corporation (NMDC) Limited, Steel Authority of India Limited (SAIL), Hindustan Zinc Limited, Jindal Steel & Power Limited, Coal India Limited, JSW Steel Limited, Adani Group, Essel Mining & Industries Limited, Rashtriya Ispat Nigam Limited (RINL), Kudremukh Iron Ore Company Limited (KIOCL), Vedanta Resources Limited, Orissa Minerals Development Company Ltd (OMDC), Ferro Alloys Corporation Limited (FACL), Western Coalfields Limited (WCL), Uranium Corporation of India Limited (UCIL), MOIL Limited, Hindustan Copper Limited (HCL)	Official company names not single; specific companies include Vedanta Limited, Hindalco Industries Limited, Tata Steel Ltd, and others as listed.	product or process not identified	Likely NAICS Codes: 212230 - Copper, Nickel, Lead, and Zinc Mining, 212299 - All Other Metal Ore Mining, 331410 - Nonferrous Metal (except Aluminum) Smelting and Refining, 331110 - Iron and Steel Mills and Ferroalloy Manufacturing	FALSE: The article does not appear to exhibit greenwashing as it genuinely emphasizes the commitment of companies to sustainable practices and social responsibility rather than making misleading claims.	4698
