title	link	summary	green_innovation	business_innovation	green_product	green_process	company	official_company_name	product_or_process	likely_naics_codes	greenwashing	total_tokens
Post-Covid, Procurement Still Under-Resourced	http://www.bing.com/news/apiclick.aspx?ref=FexRss&aid=&tid=667b5cf6a5054e6592189d00e8fdc92f&url=https%3a%2f%2fepsnews.com%2f2024%2f06%2f20%2fpost-covid-procurement-still-under-resourced%2f&c=12423205572092565529&mkt=en-us	The article discusses the challenges faced by procurement departments, particularly in terms of under-resourcing and difficulties in implementing digital solutions for efficiency. It highlights the potential of technologies like AI to optimize operations while emphasizing the need for procurement leaders to advocate for investments and strategies to overcome these challenges. The article also stresses the importance of aligning short-term actions with long-term sustainability goals in supply chain management.	FALSE, as the article does not specifically promote or depict any green innovations aimed at improving environmental sustainability.	TRUE, because it discusses the implementation of new technologies and processes in procurement that differ significantly from previous practices and aim to enhance operational efficiency.	FALSE, as there are no specific green products mentioned that meet the definition of being designed to significantly reduce environmental impact.	TRUE, as it outlines efforts to automate and improve procurement processes, which can lead to reduced resource consumption and enhanced efficiency, aligning with sustainable practices.	Jaggaer	Jaggaer, Inc.	Digital Procurement Solutions	Likely NAICS Codes: 541611 - Administrative Management and General Management Consulting Services, 541512 - Computer Systems Design Services, 541519 - Other Computer Related Services, 541618 - Other Management Consulting Services.	FALSE, because the article does not present misleading information regarding environmental benefits or falsely claim sustainable practices.	2462
Alarms will be sounding at Qantas, but not in the cockpit	http://www.bing.com/news/apiclick.aspx?ref=FexRss&aid=&tid=667b5cf6a5054e6592189d00e8fdc92f&url=https%3a%2f%2fwww.smh.com.au%2fbusiness%2fcompanies%2falarms-will-be-sounding-at-qantas-not-in-the-cockpit-in-the-boardroom-20240625-p5joil.html&c=3111502803488902133&mkt=en-us	Qantas has seen a significant decline in its rankings in the World Airline Awards, plummeting from fifth in 2022 to 24th in 2023. The airline's recent controversies, including the illegal dismissal of ground crew and selling seats on non-existent flights, highlight a management more focused on profits than customer satisfaction. This has led to widespread criticism and a tarnished reputation for the national carrier.	FALSE, because the article does not discuss any innovations that contribute to environmental sustainability.	FALSE, because the article does not mention any new or improved products or business processes introduced by Qantas.	FALSE, because there are no goods or services in the article described as designed to significantly reduce environmental impact.	FALSE, because there is no mention of any methods or techniques that minimize environmental impacts and promote sustainability.	Qantas	Qantas Airways Limited	product or process not identified	Likely NAICS Codes: 481111 - Scheduled Passenger Air Transportation, 481112 - Scheduled Freight Air Transportation, 488119 - Other Airport Operations, 488190 - Other Support Activities for Air Transportation	FALSE, as the article does not indicate that Qantas is making false or misleading statements about its environmental benefits.	1497
Industrial Software Market worth $46.6 billion by 2029 - Exclusive Report by MarketsandMarkets™	http://www.bing.com/news/apiclick.aspx?ref=FexRss&aid=&tid=667b5cf6a5054e6592189d00e8fdc92f&url=https%3a%2f%2ffinance.yahoo.com%2fnews%2findustrial-software-market-worth-46-141500357.html&c=17676179398540094648&mkt=en-us	The global industrial software market is projected to grow from USD 21.5 billion in 2024 to USD 46.6 billion by 2029, driven by advances in smart manufacturing and Industry 4.0 technologies. Key benefits include enhanced operational efficiency, compliance with regulatory standards, and cost savings across sectors such as automotive and pharmaceuticals. The region of Asia Pacific is expected to experience significant growth due to strategic initiatives in smart manufacturing. Major players in the market include Siemens, Rockwell Automation, and ABB.	FALSE, the article focuses on market growth and technologies in industrial software without explicitly discussing innovations that directly contribute to environmental sustainability goals.	TRUE, the article discusses the industrial software market, which represents improved processes and products in manufacturing, thus qualifying as a business innovation.	FALSE, the article does not mention any specific product designed to significantly reduce environmental impact throughout its life cycle.	TRUE, the use of advanced industrial software solutions like MES and SCADA represents a green process by optimizing production and reducing resource consumption.	Siemens	Siemens AG	Manufacturing Execution Systems (MES), SCADA, and HMI systems	Likely NAICS Codes: 334611 - Software Publishers, 333249 - Other Industrial Machinery Manufacturing, 541511 - Custom Computer Programming Services, 541512 - Computer Systems Design Services	FALSE, the article does not promote misleading environmental claims or suggest that the software market is environmentally responsible when it may not be.	3283
Part-Time MBA concentration in Strategy & Leadership	http://www.bing.com/news/apiclick.aspx?ref=FexRss&aid=&tid=667b5cf6a5054e6592189d00e8fdc92f&url=https%3a%2f%2fwww.business.rutgers.edu%2fpart-time-mba%2fstrategy-leadership&c=7039444609558907483&mkt=en-us	Students in a concentration can choose between a Strategy track or a Leadership track, each consisting of 4 courses worth 12 credits. The tracks cannot be combined as a primary and secondary concentration, but can be pursued as a secondary concentration if 9 credits are completed in the chosen track. The foundation course, Strategic Management, is required for all students in this concentration.	FALSE: The article does not discuss any green innovations that contribute to environmental sustainability or reduce environmental impacts.	FALSE: The article does not reference any specific new or improved products or business processes that would qualify as business innovation.	FALSE: There are no goods or services mentioned in the article that meet the definition of a green product.	FALSE: The article does not describe any specific methods or techniques that minimize environmental impacts and promote sustainability.	company not identified	company not identified	product or process not identified	Likely NAICS Codes: 61 - Educational Services, 6113 - Colleges, Universities, and Professional Schools, 611110 - Colleges, Universities, and Professional Schools, 611699 - All Other Miscellaneous Schools and Instruction	FALSE: The article does not exhibit any characteristics of greenwashing as it does not make any misleading claims about environmental benefits.	1389
The Best Rain Barrels of 2024	http://www.bing.com/news/apiclick.aspx?ref=FexRss&aid=&tid=667b5cf6a5054e6592189d00e8fdc92f&url=https%3a%2f%2fwww.popularmechanics.com%2fscience%2fenvironment%2fg60981003%2fbest-rain-barrels%2f&c=14017911254908642421&mkt=en-us	The article discusses the benefits and features of rain barrels, which are designed to collect and store rainwater for irrigation and outdoor cleaning. It highlights different materials, capacities, and considerations for selecting rain barrels, emphasizing functionality, sustainability, and practicality. Recommendations include expert insights on rainwater harvesting regulations and incentives.	TRUE, because rain barrels contribute to environmental sustainability by conserving water and reducing runoff, which aligns with green innovation goals.	TRUE, as rain barrels represent a new or improved product that significantly differs from previous products and practices in their design and functionality.	TRUE, since rain barrels are designed and manufactured to significantly reduce their environmental impact by promoting water conservation and sustainable practices.	FALSE, because the article does not specifically describe a new green process related to the manufacturing or operational activities of rain barrels.	company not identified	company not identified	rain barrel	Likely NAICS Codes: 444220 - Nursery, Garden Center, and Farm Supply Stores; 326199 - All Other Plastics Product Manufacturing; 221310 - Water Supply and Irrigation Systems; 492110 - Couriers and Express Delivery Services	FALSE, as the article provides factual information about the product's benefits without making misleading claims about its environmental impacts.	2195
Full-Time MBA concentration in Strategy & Leadership	http://www.bing.com/news/apiclick.aspx?ref=FexRss&aid=&tid=667b5cf6a5054e6592189d00e8fdc92f&url=https%3a%2f%2fwww.business.rutgers.edu%2ffull-time-mba%2fstrategy-leadership&c=4556861948216077713&mkt=en-us	The article describes an MBA concentration that offers students the choice between a Strategy track or a Leadership track, with each track consisting of 4 courses (12 credits). Students must complete 9 credits in their chosen track to pursue it as a secondary concentration, and a Foundation Course in Strategic Management is required for both tracks. Tracks cannot be combined or designated as primary and secondary concentrations. Students should consult an advisor for degree completeness questions.	FALSE: The article does not discuss any innovations that contribute to environmental sustainability goals, which is the definition of green innovation.	FALSE: The article primarily focuses on an academic curriculum rather than any new or improved product or process introduced to the market.	FALSE: The article does not describe any good or service designed to reduce environmental impact, which is required for it to be considered a green product.	FALSE: The article does not outline any method or technique in manufacturing or operational activities that minimizes environmental impact.	company not identified	company not identified	product or process not identified	Likely NAICS Codes: 611310 - Colleges, Universities, and Professional Schools; 611430 - Business and Secretarial Schools; 611699 - All Other Miscellaneous Schools and Instruction; 611710 - Educational Support Services	FALSE: The article does not make any misleading claims about environmental benefits, so it is not indicative of greenwashing.	1414
Industrial Software Market worth $46.6 billion by 2029 - Exclusive Report by MarketsandMarkets	http://www.bing.com/news/apiclick.aspx?ref=FexRss&aid=&tid=667b5cf6a5054e6592189d00e8fdc92f&url=https%3a%2f%2fwww.finanznachrichten.de%2fnachrichten-2024-06%2f62576218-industrial-software-market-worth-dollar-46-6-billion-by-2029-exclusive-report-by-marketsandmarkets-008.htm&c=4675350215370242224&mkt=en-us	The global industrial software market is projected to grow from USD 21.5 billion in 2024 to USD 46.6 billion by 2029, driven by smart manufacturing and Industry 4.0 technologies like IoT and AI. Industrial software solutions enhance operational efficiency, reduce costs, and ensure compliance with quality standards, particularly in the automotive and pharmaceutical industries. The Asia Pacific region is expected to lead this growth with initiatives promoting smart factory implementations. Key players include Siemens, Rockwell Automation, and others.	FALSE - The article discusses industrial software and market projections without emphasizing environmental benefits or sustainability.	TRUE - The article identifies the industrial software market as introducing new and improved technologies, which represent significant advancements in business processes.	FALSE - The article does not specify any products that significantly reduce environmental impact or adhere to the green product definition.	FALSE - The article describes software solutions that improve operational efficiency but does not focus on processes specifically designed to minimize environmental impacts.	Siemens, Rockwell Automation, ABB, Emerson Electric Co., General Electric	Siemens AG	product or process not identified	Likely NAICS Codes: 511210 - Software Publishers, 334611 - Software Reproducing, 541511 - Custom Computer Programming Services, 541512 - Computer Systems Design Services	FALSE - The article does not contain misleading claims about environmental benefits; rather, it focuses on business growth and technological advancements.	3256
Alarms will be sounding at Qantas. Not in the cockpit, in the boardroom	http://www.bing.com/news/apiclick.aspx?ref=FexRss&aid=&tid=667b5cf6a5054e6592189d00e8fdc92f&url=https%3a%2f%2fwww.brisbanetimes.com.au%2fbusiness%2fcompanies%2falarms-will-be-sounding-at-qantas-not-in-the-cockpit-in-the-boardroom-20240625-p5joil.html&c=16529759153674330296&mkt=en-us	Qantas has seen a significant decline in its ranking in the Skytrax World Airline Awards, dropping from fifth in 2022 to 24th in 2023. The airline has faced various controversies, including the illegal sacking of ground crew and selling seats on 'ghost flights', leading to criticism of its management's focus on profits over customer and staff interests.	FALSE: The article does not discuss any green innovations that contribute to environmental sustainability goals.	FALSE: The article does not mention any new or improved products or business processes that differ significantly from previous ones.	FALSE: The article does not describe any products that are designed to significantly reduce environmental impact throughout their life cycle.	FALSE: The article does not specify any methods or techniques in manufacturing or operations that minimize environmental impacts.	Qantas	Qantas Airways Limited	product or process not identified	Likely NAICS Codes: 481111 - Scheduled Passenger Air Transportation, 481199 - Other Scheduled Air Transportation, 488190 - Other Support Activities for Air Transportation, 492110 - Couriers and Express Delivery Services	TRUE: The article suggests that Qantas's management has been more focused on profits rather than customer and staff interests, which may imply a disconnect between their stated commitments to sustainability and their actual practices, potentially indicating greenwashing.	1517
