title	link	summary	green_innovation	business_innovation	green_product	green_process	company	official_company_name	product_or_process	likely_naics_codes	greenwashing	total_tokens
Consumer Products Manufacturing: Made in the USA - Assembly Magazine	https://news.google.com/rss/articles/CBMiWmh0dHBzOi8vd3d3LmFzc2VtYmx5bWFnLmNvbS9hcnRpY2xlcy85Nzg4Ni1jb25zdW1lci1wcm9kdWN0cy1tYW51ZmFjdHVyaW5nLW1hZGUtaW4tdGhlLXVzYdIBAA?oc=5	The article discusses the increasing demand for consumer goods manufactured in the United States, specifically emphasizing the advantages of domestic production for speed, quality control, and supply chain management. Several companies, including Pacific Lock Co. and The Pen Company of America, highlight their commitment to manufacturing in the U.S. and their ability to innovate quickly, as well as the challenges faced in maintaining domestic manufacturing, particularly in sourcing skilled labor and raw materials. Overall, there is a focus on consumer preferences for American-made products amidst geopolitical tensions and the impacts of the COVID-19 pandemic.	FALSE: The article discusses domestic manufacturing and consumer preferences for Made in USA products, but it does not specifically address innovations that contribute to environmental sustainability goals.	TRUE: The article describes various companies that have introduced new or improved products and processes, emphasizing their unique production capabilities and strategies that differentiate them in the market.	FALSE: While the article talks about consumer goods, it does not specify any products that are designed to significantly reduce environmental impact according to the green product definition.	FALSE: Although the article discusses manufacturing processes, it does not detail any methods or techniques specifically aimed at minimizing environmental impacts or promoting sustainability.	Pacific Lock Co., The Pen Company of America, Gordon Brush Manufacturing Co.	Pacific Lock Co.	product or process not identified	Likely NAICS Codes: 339999 - All Other Miscellaneous Manufacturing, 332510 - Hardware Manufacturing, 326160 - Plastics Manufacturing , 339999 - Other Miscellaneous Manufacturing	FALSE: The article does not provide evidence of misleading claims regarding environmental benefits; instead, it focuses on the genuine efforts of companies to manufacture domestically and the associated advantages.	5737
China to hold first forum on sustainability in the cosmetics industry - Premium beauty	https://news.google.com/rss/articles/CBMiR2h0dHBzOi8vd3d3LnByZW1pdW1iZWF1dHluZXdzLmNvbS9lbi9jaGluYS10by1ob2xkLWZpcnN0LWZvcnVtLW9uLDIyMjkx0gEA?oc=5	China will host the first International Forum on Beauty Economy and Green Innovation on July 11th and 12th, 2023, to discuss environmental management in the cosmetics and household chemicals industries. The event, co-organized by various associations and government departments, will focus on topics such as green materials, eco-design, clean beauty, and biodiversity protection. It aims to create an international platform for exchange aiming to promote green transformation in the industry.	TRUE: The forum focuses on green innovation by addressing strategies and topics aimed at reducing environmental impact and promoting sustainability in the beauty economy.	TRUE: The forum represents a new approach to industry collaboration and improvement in product processes that significantly differ from previous practices.	FALSE: The article does not explicitly discuss any specific green products.	FALSE: The article does not detail any specific green processes.	company not identified	company not identified	product or process not identified	Likely NAICS Codes: 325620 - Toilet Preparation Manufacturing, 325611 - Soap and Other Detergent Manufacturing, 339114 - Toys and Games Manufacturing, 424210 - Drugs and Druggists' Sundries Merchant Wholesalers.	FALSE: The article does not appear to engage in greenwashing as it focuses on genuine discussions and collaborations aimed at environmental improvements in the industry.	1736
Manufacturing and the Circular Economy | ASSEMBLY - Assembly Magazine	https://news.google.com/rss/articles/CBMiUWh0dHBzOi8vd3d3LmFzc2VtYmx5bWFnLmNvbS9hcnRpY2xlcy85Nzg3NC1tYW51ZmFjdHVyaW5nLWFuZC10aGUtY2lyY3VsYXItZWNvbm9tedIBAA?oc=5	BMW Group is leading a project called Car2Car to explore the circular economy in automotive manufacturing by improving recycling processes for end-of-life vehicles. The project aims to enhance the quality and availability of recycled raw materials like aluminum, steel, and plastic, backed by $7 million in funding. Additionally, BMW is working on other initiatives to promote the sustainable use of secondary materials and reduce the carbon footprint of raw materials. The article highlights BMW's commitment to advancing recycling technologies and a circular economy in the automotive industry.	TRUE; BMW's initiatives focused on improving recycling processes and incorporating secondary materials into manufacturing contribute to environmental sustainability and reduce waste.	TRUE; The Car2Car project represents a new approach to automotive manufacturing processes that aims to significantly improve the recycling and reuse of materials compared to previous methods.	FALSE; While the article discusses initiatives aimed at sustainability, it does not mention a specific good or service that fits the definition of a green product.	TRUE; The Car2Car project demonstrates a green process by aiming to enhance recycling methods and reduce environmental impacts associated with the automotive manufacturing sector.	BMW Group	BMW AG	Car2Car project	{'Likely NAICS Codes': [{'code': '336111', 'category': 'Automobile Manufacturing'}, {'code': '331492', 'category': 'Secondary Smelting and Alloying of Aluminum'}, {'code': '331491', 'category': 'Nonferrous Metal (except Aluminum) Smelting and Refining'}, {'code': '562920', 'category': 'Material Recovery Facilities'}]}	FALSE; The article does not present any misleading information about BMW's practices; rather, it highlights genuine efforts towards sustainability and innovation in recycling.	2235
Bringing sustainable supply chain practices to Africa - Businessday	https://news.google.com/rss/articles/CBMiXWh0dHBzOi8vYnVzaW5lc3NkYXkubmcvb3Bpbmlvbi9hcnRpY2xlL2JyaW5naW5nLXN1c3RhaW5hYmxlLXN1cHBseS1jaGFpbi1wcmFjdGljZXMtdG8tYWZyaWNhL9IBAA?oc=5	The article emphasizes the importance of implementing sustainable practices in supply chains to mitigate environmental degradation and social issues. It outlines various strategies such as rethinking material components, using recycled materials, improving product packaging, and communicating sustainability initiatives to consumers. By adopting these practices, companies can reduce greenhouse gas emissions and enhance both ecological and social responsibility. The focus is on balancing profitability with sustainability throughout the supply chain process.	TRUE - The article discusses practices within supply chains that aim to reduce environmental impacts, such as recycling materials, optimizing packaging, and minimizing emissions, which fall under green innovation.	TRUE - The article outlines innovative practices in supply chain management that differ significantly from traditional methods, focusing on sustainability as a key aspect.	FALSE - The article does not specifically mention a good or service that meets the definition of a green product, as it discusses practices rather than identifiable products.	TRUE - The article describes processes like sustainable supply chain management and improvements in packaging and material use, which align with the definition of a green process.	Staples	Staples, Inc.	sustainable supply chain practices	['493110 - General Warehousing and Storage', '484121 - General Freight Trucking, Long-Distance, Truckload', '325992 - Photographic Film, Paper, Plate, and Chemical Manufacturing', '337124 - Metal Furniture Manufacturing']	FALSE - The article does not exhibit signs of greenwashing, as it provides substantial information about sustainable practices and their benefits without making misleading claims.	2468
Zouk Launches Flagship Store at Nexus Seawoods, Mumbai - Indian Retailer	https://news.google.com/rss/articles/CBMifGh0dHBzOi8vd3d3LmluZGlhbnJldGFpbGVyLmNvbS9hcnRpY2xlL2Zhc2hpb24tYmVhdXR5L2Zhc2hpb24tYWNjZXNzb3JpZXMvem91ay1sYXVuY2hlcy1mbGFnc2hpcC1zdG9yZS1uZXh1cy1zZWF3b29kcy1tdW1iYWnSAQA?oc=5	The article discusses the dynamic growth of beauty and personal care brands in India during 2022, highlighting their efforts in expanding retail presence, launching new products, and enhancing customer engagement. Major companies like SUGAR Cosmetics, The Body Shop, and Plum report significant revenue increases and plans for further expansion in 2023, while also focusing on sustainability and innovation. The essence of competition and evolving consumer behavior in the market is explored, with brands adapting their strategies to cater to new preferences.	FALSE - The article outlines business success stories and product expansions without specific emphasis on environmental sustainability or innovations that minimize environmental impacts.	TRUE - The companies mentioned in the article introduced new and improved products and processes, significantly different from their previous offerings, contributing to their market competitiveness.	FALSE - Although companies like The Body Shop are moving towards vegan products, the article does not specify any products that clearly meet the definition of a green product.	FALSE - The processes discussed in the article do not explicitly detail operational methods that minimize environmental impacts or prioritize sustainability.	SUGAR Cosmetics	SUGAR Cosmetics Pvt. Ltd.	product or process not identified	Likely NAICS Codes: 446120 - Cosmetics, Beauty Supplies, and Perfume Stores; 424210 - Drugs and Druggists' Sundries Merchant Wholesalers; 541614 - Process, Physical Distribution, and Logistics Consulting Services; 541490 - Other Specialized Design Services.	FALSE - The article does not contain instances of misleading claims about environmental benefits; instead, it focuses on the growth and strategies of the brands without unsubstantiated environmental claims.	4082
