title	link	summary	green_innovation	business_innovation	green_product	green_process	company	official_company_name	product_or_process	likely_naics_codes	greenwashing	total_tokens
Welcoming Caroline: Veolia Deploys Electric Telehandler at Integrated Waste Management Facility – FM Industry - FM Industry	https://news.google.com/rss/articles/CBMiiwFodHRwczovL2ZtaW5kdXN0cnkuY29tLzIwMjMvMDcvMTEvd2VsY29taW5nLWNhcm9saW5lLXZlb2xpYS1kZXBsb3lzLWVsZWN0cmljLXRlbGVoYW5kbGVyLWF0LXNvdXRod2Fyay1pbnRlZ3JhdGVkLXdhc3RlLW1hbmFnZW1lbnQtZmFjaWxpdHkv0gEA?oc=5	Veolia has introduced an electric MRF 360 telehandler at its Integrated Waste Management Facility in Southwark, transitioning from diesel to electric vehicles to reduce carbon emissions in line with Southwark Council’s Climate Action Plan. The telehandler is expected to cut CO2 emissions by 65% annually, equivalent to taking 39 cars off London’s roads, and has a longer expected lifespan than diesel models. This initiative marks a significant step in improving sustainability at Veolia and contributes to ecological transformation.	TRUE - This initiative contributes to environmental sustainability by significantly reducing carbon emissions and utilizing electric vehicles in waste management.	TRUE - The introduction of the electric telehandler represents a new and improved process that is markedly different from Veolia's previous diesel-powered methods.	FALSE - The telehandler itself is a piece of equipment that facilitates waste management, but it is not classified as a 'green product' since it does not conform to the comprehensive definition of a good or service designed to reduce environmental impact.	TRUE - The implementation of electric mobile plant vehicles in waste management represents a method that minimizes environmental impacts, reduces emissions, and promotes sustainability.	Veolia	Veolia Environnement S.A.	electric MRF 360 telehandler	Likely NAICS Codes: 562920 - Materials Recovery Facilities, 541620 - Environmental Consulting Services, 423810 - Construction and Mining (except Oil Well) Machinery and Equipment Merchant Wholesalers, 811310 - Commercial and Industrial Machinery and Equipment (except Automotive and Electronic) Repair and Maintenance.	FALSE - The article does not suggest that Veolia is making misleading claims about the environmental benefits of the telehandler; rather, it provides concrete information about the emissions reductions and sustainability goals related to this innovation.	1782
Explore the 10 Leading Circular Economy Examples in 2024 - StartUs Insights	https://news.google.com/rss/articles/CBMiTGh0dHBzOi8vd3d3LnN0YXJ0dXMtaW5zaWdodHMuY29tL2lubm92YXRvcnMtZ3VpZGUvY2lyY3VsYXItZWNvbm9teS1leGFtcGxlcy_SAQA?oc=5	The article discusses the circular economy as a sustainable alternative to the traditional linear economy, emphasizing its implementation across various industries to extend product life cycles and promote resource efficiency. It highlights real-world examples of startups and companies that are applying circular economy practices, such as closed-loop recycling, reduced food waste, and the use of biodegradable packaging. The article features innovative solutions in sectors including chemicals, food and beverage, packaging, manufacturing, and more, showcasing their commitment to environmental sustainability. Ultimately, it showcases how these innovations contribute to a more sustainable economy and reduce reliance on traditional finite resources.	TRUE, the article describes multiple innovations that contribute to environmental sustainability and reduce negative environmental externalities across various industries.	TRUE, the article talks about startups and companies that introduce new or improved products and processes which significantly differ from previous offerings in various sectors.	TRUE, the article identifies several products, such as compostable packages and upcycled flour, designed to minimize environmental impact throughout their life cycle.	TRUE, the article discusses multiple processes like closed-loop recycling and sustainable packaging solutions that aim to reduce waste and environmental impacts.	ReSolved Technologies, CIRCULAR FOOD, Treetop Biopak, Batch.Works, Circular Fashion LA, Circunomics, Varme Energy, SWING Biomethane, revitalyze.io, Circular Technologies.	ReSolved Technologies	Closed-Loop Plastic Recycling	Likely NAICS Codes: 325, Chemicals Manufacturing; 311, Food Manufacturing; 326, Plastics and Rubber Products Manufacturing; 339, Other Miscellaneous Manufacturing.	FALSE, the article does not exhibit greenwashing as it provides factual examples of environmental innovations and sustainable practices without misleading claims.	4784
Towards a Circular Plastics Economy: India's Actions to #BeatPlasticPollution - TERI	https://news.google.com/rss/articles/CBMiZGh0dHBzOi8vd3d3LnRlcmlpbi5vcmcvYXJ0aWNsZS90b3dhcmRzLWNpcmN1bGFyLXBsYXN0aWNzLWVjb25vbXktaW5kaWFzLWFjdGlvbnMtYmVhdHBsYXN0aWNwb2xsdXRpb27SAQA?oc=5	The article discusses the global crisis of plastic pollution and the initiatives taken by India to manage plastic waste, including banning single-use plastics, implementing Extended Producer Responsibility, and promoting a circular economy. It highlights the importance of collaboration among various stakeholders and outlines ongoing efforts and policies aimed at reducing plastic waste and its environmental impacts. It also emphasizes the role of the informal recycling sector in plastic waste management and the need for comprehensive solutions to achieve sustainability goals.	TRUE - The article addresses green innovations such as policies and initiatives aimed at reducing plastic waste and promoting circular economy practices, which contribute to environmental sustainability and the mitigation of plastic pollution.	FALSE - While the article discusses initiatives related to plastic management, it does not focus on a specific new or improved product or business process that has been introduced to the market.	FALSE - The article does not mention a specific good or service that fits the definition of a green product but instead discusses policies and practices related to plastic waste.	TRUE - The article describes processes related to plastic waste management, recycling, and initiatives aimed at reducing environmental impacts, which align with green process definitions.	company not identified	not found	product or process not identified	Likely NAICS Codes: 562920 - Materials Recovery Facilities; 326199 - All Other Plastics Product Manufacturing; 562211 - Hazardous Waste Treatment and Disposal; 3619 - Other Waste Management Services.	FALSE - The article does not provide misleading information about environmental benefits; rather, it outlines genuine efforts and policies aimed at addressing plastic pollution and promoting sustainability.	5931
Coastal Park Material Recovery Facility construction project on track - Democratic Alliance	https://news.google.com/rss/articles/CBMiY2h0dHBzOi8vd3d3LmRhLm9yZy56YS8yMDIzLzA3L2NvYXN0YWwtcGFyay1tYXRlcmlhbC1yZWNvdmVyeS1mYWNpbGl0eS1jb25zdHJ1Y3Rpb24tcHJvamVjdC1vbi10cmFja9IBAA?oc=5	The City of Cape Town is constructing a Coastal Park Material Recovery Facility (MRF) to enhance recyclable material diversion from landfills. The MRF will sort 65 tons of recyclables daily, create minimum 100 jobs, and provide a new drop-off facility for various waste types. The project aims to minimize landfill use and improve recycling efforts in the city. Alderman Twigg emphasizes the importance of the facility in addressing plastic pollution and encourages residents to utilize existing drop-off sites.	TRUE: This is green innovation because the MRF is designed to significantly reduce landfill waste and promote recycling, contributing to environmental sustainability goals.	TRUE: This is a business innovation as the construction and operation of the MRF represent new processes that differ significantly from prior waste management practices in Cape Town.	FALSE: The article does not mention a specific good or service that fits the definition of a green product.	TRUE: This is a green process as it involves the mechanical separation of recyclables which minimizes environmental impacts and promotes sustainability.	company not identified	company not identified	Coastal Park Material Recovery Facility	Likely NAICS Codes: 562920 - Materials Recovery Facilities, 921120 - Local Government Solid Waste Management, 238910 - Site Preparation Contractors, 811219 - Other Electronic and Precision Equipment Repair and Maintenance	FALSE: The article does not describe any misleading statements or practices; it provides transparent and factual information regarding the MRF's purpose and benefits.	2083
R186m recycling facility in Muizenberg set to operate in 2024 - CapeTown ETC	https://news.google.com/rss/articles/CBMiVWh0dHBzOi8vd3d3LmNhcGV0b3duZXRjLmNvbS9uZXdzL3IxODZtLXJlY3ljbGluZy1mYWNpbGl0eS1pbi1tdWl6ZW5iZXJnLW9wZXJhdGUtMjAyNC_SAQA?oc=5	A new recycling facility in Muizenberg is set to begin operations in November next year, with a capacity to sort 65 tonnes of recycled material daily. The R186 million facility will enhance Cape Town's recycling efforts and support the separation-at-source program, minimizing landfill needs and creating jobs. It will feature advanced mechanical separation equipment and a drop-off facility for various types of waste.	TRUE: The recycling facility represents green innovation as it aims to minimize environmental impact by improving recycling capabilities, reducing the need for landfills, and promoting a sustainable approach to waste management.	TRUE: The new recycling facility is a business innovation as it introduces a significantly improved process for handling recyclable materials, differing from previous waste management practices in the City of Cape Town.	FALSE: The article does not mention a specific good or service that would be classified as a green product; it focuses on the recycling facility itself.	TRUE: The facility's operations will involve a green process, as it utilizes methods and technologies that minimize environmental impact by efficiently sorting and processing recyclables.	company not identified	company not identified	product or process not identified	Likely NAICS Codes: 562920 - Materials Recovery Facilities; 488320 - Removal Services; 321999 - All Other Miscellaneous Wood Product Manufacturing; 722310 - Food Service Contractors	FALSE: The article does not appear to be an example of greenwashing, as it provides factual information about a legitimate recycling facility project aimed at enhancing environmental sustainability.	1720
Construction of new recycling facility in Cape Town on track for completion next year - Creamer Media's Engineering News	https://news.google.com/rss/articles/CBMiigFodHRwczovL3d3dy5lbmdpbmVlcmluZ25ld3MuY28uemEvYXJ0aWNsZS9jb25zdHJ1Y3Rpb24tb2YtbmV3LXJlY3ljbGluZy1mYWNpbGl0eS1pbi1jYXBlLXRvd24tb24tdHJhY2stZm9yLWNvbXBsZXRpb24tbmV4dC15ZWFyLTIwMjMtMDctMTnSAQA?oc=5	Cape Town is set to open a new material recovery facility designed to sort and process recyclables at the Coastal Park landfill, creating at least 100 jobs. The facility aims to enhance the city's recycling capacity, allowing for a significant expansion of its separation-at-source program. It will feature mechanical separation equipment and provide educational resources for waste management. The project supports the city’s strategy to manage waste responsibly and reduce reliance on landfills.	TRUE: The new material recovery facility promotes environmental sustainability by enhancing recycling capabilities, reducing waste, and minimizing the need for new landfills.	TRUE: The innovation involves a new facility and process for sorting recyclables which represents a significant improvement over existing waste management practices within the City of Cape Town.	FALSE: The article does not describe a specific product but rather a facility focused on processing recyclables.	TRUE: The operation of the new material recovery facility represents a green process aimed at minimizing environmental impacts through recycling and waste management.	company not identified	company not identified	material recovery facility	Likely NAICS Codes: 562920 - Materials Recovery Facilities; 81293 - Packaging and Labeling Services; 562119 - Other Waste Collection; 61171 - Educational Support Services	FALSE: The article does not appear to be an example of greenwashing as it provides detailed information about a legitimate initiative aimed at improving waste management and recycling efforts.	1608
Are our big waste players as green as they claim? - BusinessDesk	https://news.google.com/rss/articles/CBMiYmh0dHBzOi8vYnVzaW5lc3NkZXNrLmNvLm56L2FydGljbGUvaW5mcmFzdHJ1Y3R1cmUvYXJlLW91ci1iaWctd2FzdGUtcGxheWVycy1hcy1ncmVlbi1hcy10aGV5LWNsYWlt0gEA?oc=5	The article promotes a subscription service offering a 10-day free trial for news content, emphasizing its commitment to quality journalism and various subscriber benefits.	FALSE: The article does not discuss any innovation that contributes to environmental sustainability goals.	FALSE: The article does not present a new or improved product or business process introduced to the market.	FALSE: The article does not mention any good or service designed to significantly reduce environmental impact throughout its life cycle.	FALSE: The article does not describe any method that minimizes environmental impacts or promotes sustainability.	company not identified	company not identified	product or process not identified	Likely NAICS Codes: 511110 - Newspaper Publishers; 541910 - Marketing Research and Public Opinion Polling; 541820 - Public Relations Agencies; 511199 - All Other Publishers	FALSE: The article does not make false or misleading environmental claims; it simply promotes a subscription service.	1293
Trash talk to dispel Townsville’s common waste myths - Townsville Bulletin	https://news.google.com/rss/articles/CBMisQFodHRwczovL3d3dy50b3duc3ZpbGxlYnVsbGV0aW4uY29tLmF1L25ld3MvdG93bnN2aWxsZS90b3duc3ZpbGxlLWNpdHktY291bmNpbC1zaGluZXMtc3BvdGxpZ2h0LW9uLXJlY3ljbGluZy1pc3N1ZXMtdG8taGVscC10aGUtcGxhbmV0L25ld3Mtc3RvcnkvMDZiZDk0MzBlNGNlYzJjNDdiMzhkZGQzM2VkOGQ5OGHSAbUBaHR0cHM6Ly93d3cudG93bnN2aWxsZWJ1bGxldGluLmNvbS5hdS9uZXdzL3Rvd25zdmlsbGUvdG93bnN2aWxsZS1jaXR5LWNvdW5jaWwtc2hpbmVzLXNwb3RsaWdodC1vbi1yZWN5Y2xpbmctaXNzdWVzLXRvLWhlbHAtdGhlLXBsYW5ldC9uZXdzLXN0b3J5LzA2YmQ5NDMwZTRjZWMyYzQ3YjM4ZGRkMzNlZDhkOThhP2FtcA?oc=5	The Full Digital Access 12 Month Plan costs $208 for the first year, charged at $16 every 4 weeks. It automatically renews after the initial 12 months with the same charge unless cancelled, and there are no cancellations during this period. Payments made are non-refundable, and terms may vary after the first year.	FALSE, because the article does not describe any product or process that contributes to environmental sustainability or reduces negative environmental impacts.	FALSE, because the article does not present a new or significantly improved product or business process introduced to the market.	FALSE, because there is no indication that the product or service significantly reduces environmental impact throughout its life cycle.	FALSE, because the article does not mention any methods or techniques that minimize environmental impacts or promote sustainability.	company not identified	company not identified	product or process not identified	Likely NAICS Codes: 511199 - All Other Publishers, 519130 - Internet Publishing and Broadcasting and Web Search Portals, 541511 - Custom Computer Programming Services, 541512 - Computer Systems Design Services	FALSE, because there are no misleading claims about environmental benefits in the article; it focuses solely on subscription terms.	1377
