title	link	summary	green_innovation	business_innovation	green_product	green_process	company	official_company_name	product_or_process	likely_naics_codes	greenwashing	total_tokens
Auto Expo 2023: Suzuki Corp announces global unveil of first EV as eVX - ETAuto	https://news.google.com/rss/articles/CBMigAFodHRwczovL2F1dG8uZWNvbm9taWN0aW1lcy5pbmRpYXRpbWVzLmNvbS9uZXdzL3Bhc3Nlbmdlci12ZWhpY2xlL3N1enVraS1jb3JwLWFubm91bmNlcy1nbG9iYWwtdW52ZWlsLW9mLWZpcnN0LWV2LWFzLWV2eC85Njg5OTE2M9IBhAFodHRwczovL2F1dG8uZWNvbm9taWN0aW1lcy5pbmRpYXRpbWVzLmNvbS9hbXAvbmV3cy9wYXNzZW5nZXItdmVoaWNsZS9zdXp1a2ktY29ycC1hbm5vdW5jZXMtZ2xvYmFsLXVudmVpbC1vZi1maXJzdC1ldi1hcy1ldngvOTY4OTkxNjM?oc=5	Maruti Suzuki India Limited unveiled the Concept Electric SUV eVX at the Auto Expo 2023, reinforcing its commitment to sustainable motoring with plans for hybrid and electric vehicles. The eVX features a 60 kWh battery offering up to 550 km range and is part of a broader strategy to reduce greenhouse gas emissions and promote environmental sustainability. Maruti Suzuki aims to invest significantly in electric vehicle production in India and has declared a commitment to exploring various eco-friendly technologies to support the government's objectives. The company's approach combines advanced design elements with an emphasis on aerodynamics to deliver a progressive, environmentally friendly SUV.	TRUE - The innovation involves the development of an electric SUV that aims to minimize environmental impact and reduce greenhouse gas emissions, aligning with sustainability goals.	TRUE - The Concept eVX represents a new and improved product that significantly differs from the company's previous offerings, intended for market introduction.	TRUE - The Concept eVX is designed to significantly reduce environmental impact through its electric powertrain and sustainable design, qualifying it as a green product.	FALSE - While the article discusses the development of an EV, it does not specifically detail unique processes in manufacturing that emphasize minimized environmental impacts.	Maruti Suzuki India Limited	Maruti Suzuki India Limited	Concept Electric SUV eVX	Likely NAICS Codes: 336111 - Automobile Manufacturing, 336112 - Light Truck and Utility Vehicle Manufacturing, 335999 - All Other Miscellaneous Electrical Equipment and Component Manufacturing, 484110 - General Freight Trucking, Local	FALSE - The article does not indicate misleading claims about the environmental benefits; the company is actively pursuing sustainable technologies and investments in electric vehicles.	2108
How Recode's Shark Tank Rejection Boosted Its Growth ? - Indian Retailer	https://news.google.com/rss/articles/CBMifWh0dHBzOi8vd3d3LmluZGlhbnJldGFpbGVyLmNvbS9hcnRpY2xlL2QyYy1uZXctY29tbWVyY2UvcGVyc3BlY3RpdmVzL2hvdy1yZWNvZGVzLXJlamVjdGlvbi1zaGFyay10YW5rLXdvcmtlZC1mYXZvci1pdHMtZ3Jvd3Ro0gEA?oc=5	The article discusses how various Direct-to-Consumer (D2C) brands in India are gearing up for the festive season by ramping up product offerings, enhancing supply chains, and leveraging technology to meet consumer demands. Brands like Solethreads, Zouk, IGP, and The Tribe Concepts are focusing on stylish, sustainable products and efficient operations to drive sales and improve customer experience. The festive season is accompanied by increasing focus on online sales and a shift toward eco-friendly practices in product design and fulfillment strategies.	TRUE, because the brands mentioned in the article emphasize sustainability in their product offerings and processes, particularly the focus on recycled materials, sustainable production methods, and efforts to minimize environmental impacts.	TRUE, because the article describes new or improved products and business processes introduced by D2C brands that significantly differ from their previous offerings.	TRUE, because products such as sustainable footwear and eco-friendly bags are designed to minimize environmental impacts, aligning with the definition of a green product.	TRUE, because the article mentions innovations in operation and production processes that prioritize sustainability and resource efficiency.	Solethreads, Zouk, IGP, The Tribe Concepts	Solethreads, Zouk, IGP, The Tribe Concepts	reuse program, recycled footwear, sustainable product offerings	Likely NAICS Codes: 448120 - Shoe Stores, 314110 - Carpet and Rug Mills, 453220 - Gift, Novelty, and Souvenir Stores, 424130 - Industrial and Personal Service Paper Merchant Wholesalers	FALSE, because the article highlights genuine efforts by the companies to innovate sustainably and does not suggest any misleading claims regarding their environmental impact.	3208
JK Tyre launches three off-the-road tyres at Bauma Conexpo 2023 - ETAuto	https://news.google.com/rss/articles/CBMifWh0dHBzOi8vYXV0by5lY29ub21pY3RpbWVzLmluZGlhdGltZXMuY29tL25ld3MvdHlyZXMvamstdHlyZS1sYXVuY2hlcy10aHJlZS1vZmYtdGhlLXJvYWQtdHlyZXMtYXQtYmF1bWEtY29uZXhwby0yMDIzLzk3NDg3NjE00gGBAWh0dHBzOi8vYXV0by5lY29ub21pY3RpbWVzLmluZGlhdGltZXMuY29tL2FtcC9uZXdzL3R5cmVzL2prLXR5cmUtbGF1bmNoZXMtdGhyZWUtb2ZmLXRoZS1yb2FkLXR5cmVzLWF0LWJhdW1hLWNvbmV4cG8tMjAyMy85NzQ4NzYxNA?oc=5	JK Tyre launched three new off-the-road tyres at the Bauma Conexpo 2023, including the 26.5-25 Loader Champ and two variants for skid steer loaders. The company claims these products are technologically advanced and designed for challenging terrains, emphasizing performance and durability. The tyres are built with a silica-based tread compound for better wear resistance and feature a design that protects against damage.	FALSE, the article does not indicate that the tyres have significant environmental benefits or contribute to sustainability goals.	TRUE, the launch of new tyre products that are improved versions of previous offerings signifies business innovation.	FALSE, while the tyres may perform well, the article does not provide evidence that they significantly reduce their environmental impact throughout their life cycle.	FALSE, there is no mention of the production methods used for these tyres that would qualify as environmentally sustainable.	JK Tyre & Industries Ltd.	JK Tyre & Industries Ltd.	26.5-25 Loader Champ 28PR E4/L4 TL, 23X8.50-12 JET TRAX Ultima 6PR TL, 23X5.7-12 JET TRAX Super II 4PR TL	Likely NAICS Codes: 326211 - Tire Manufacturing (except Retreading), 326220 - Rubber and Plastics Hoses and Belting Manufacturing, 339999 - All Other Miscellaneous Manufacturing, 332999 - All Other Miscellaneous Fabricated Metal Product Manufacturing.	FALSE, the article does not suggest that JK Tyre is making misleading claims about the environmental benefits of their products.	1872
SS Beauty to Bank on Aggressive Omnichannel Model, to reach 25 Doors by Next Fiscal: Biju Kassim, President ... - Indian Retailer	https://news.google.com/rss/articles/CBMif2h0dHBzOi8vd3d3LmluZGlhbnJldGFpbGVyLmNvbS9hcnRpY2xlL2Zhc2hpb24tYmVhdXR5L3N1c3RhaW5hYmlsaXR5L3NzLWJlYXV0eS1iYW5rLWFnZ3Jlc3NpdmUtb21uaWNoYW5uZWwtbW9kZWwtcmVhY2gtMjUtZG9vcnPSAQA?oc=5	The article discusses the significant growth and expansion of various beauty and personal care brands in India throughout 2022, highlighting their strategies, product innovations, and revenue goals for 2023. Brands such as SUGAR Cosmetics, The Body Shop, Plum, and others are adapting to changing consumer behavior, focusing on both retail and digital experiences to enhance customer engagement. Several brands are also committing to sustainability by increasing their vegan product lines and improving their environmental impact.	FALSE: While some brands mentioned aim for sustainability, the overall article does not focus primarily on innovations that significantly contribute to environmental sustainability goals.	TRUE: The article details several brands that have introduced new or improved products and expanded their operations significantly, showcasing a business innovation.	TRUE: Several products mentioned, particularly from The Body Shop, aim to be 100 percent Vegan and recyclable, thus fitting the definition of green products.	FALSE: The article does not provide specific details or processes that minimize environmental impacts or promote sustainability in their manufacturing or operational methods.	SUGAR Cosmetics, The Body Shop, Plum, Colorbar, Kapiva, Earth Rhythm, ARATA, BlushBee, Crazy Owl - Your Skin Co, Pilgrim, iluvia Professional	SUGAR Cosmetics; The Body Shop; Plum; Colorbar Cosmetics; Kapiva; Earth Rhythm; ARATA; BlushBee; Crazy Owl - Your Skin Co; Pilgrim; Renaura Wellness Pvt. Ltd.	product or process not identified	Likely NAICS Codes: 446120 - Cosmetics, Beauty Supplies, and Perfume Stores; 325620 - Toilet Preparation Manufacturing; 454110 - Electronic Shopping; 424210 - Drugs and Druggists' Sundries Merchant Wholesalers	FALSE: The article does not promote misleading claims about environmental benefits; it presents brands genuinely attempting to improve their sustainability efforts.	4134
Rising production, EV transition, and global demand light up future of Indian tyre industry - ETAuto	https://news.google.com/rss/articles/CBMikQFodHRwczovL2F1dG8uZWNvbm9taWN0aW1lcy5pbmRpYXRpbWVzLmNvbS9ibG9nL3Jpc2luZy1wcm9kdWN0aW9uLWV2LXRyYW5zaXRpb24tYW5kLWdsb2JhbC1kZW1hbmQtbGlnaHQtdXAtZnV0dXJlLW9mLWluZGlhbi10eXJlLWluZHVzdHJ5Lzk3Mzc1Njgw0gGVAWh0dHBzOi8vYXV0by5lY29ub21pY3RpbWVzLmluZGlhdGltZXMuY29tL2FtcC9ibG9nL3Jpc2luZy1wcm9kdWN0aW9uLWV2LXRyYW5zaXRpb24tYW5kLWdsb2JhbC1kZW1hbmQtbGlnaHQtdXAtZnV0dXJlLW9mLWluZGlhbi10eXJlLWluZHVzdHJ5Lzk3Mzc1Njgw?oc=5	India's tyre industry is set for growth driven by factors such as increased vehicle production, government incentives, and rising demand for electric vehicle (EV) tyres. The article highlights innovations in tyre design, including smart tyres with sensors that promote fuel efficiency and sustainability. Compliance with new vehicle safety and efficiency norms is emphasized, alongside the government’s development initiatives benefiting the industry.	TRUE, because the innovations mentioned in the tyre industry, such as smart tyres that reduce fuel consumption and enhance sustainability, align with environmental sustainability goals.	TRUE, as the article discusses the introduction of new and improved products like EV tyres that differ significantly from previous products in the market.	TRUE, because the smart tyres developed for EVs are designed to minimize environmental impact and support sustainability throughout their lifecycle.	TRUE, as the article indicates innovations in tyre manufacturing processes aimed at reducing environmental impacts and adhering to safety and efficiency standards.	JK Tyre & Industries Ltd.	JK Tyre & Industries Ltd.	smart tyres	[{'code': '326211', 'category': 'Tire Manufacturing (except Retreading)', 'description': 'This comprises establishments primarily engaged in manufacturing tires and inner tubes.'}, {'code': '336120', 'category': 'Heavy Duty Truck Manufacturing', 'description': 'This includes establishments primarily engaged in manufacturing motor vehicle parts.'}, {'code': '336300', 'category': 'Motor Vehicle Parts Manufacturing', 'description': 'This sector includes firms that manufacture parts for motor vehicles, including tires.'}, {'code': '924110', 'category': 'Administration of Air and Water Resource and Solid Waste Management Programs', 'description': 'This code represents activities aimed at managing and improving resource resilience.'}]	FALSE, because the article does not suggest misleading claims about environmental benefits; instead, it discusses genuine innovations aimed at enhancing sustainability in tyre production.	2384
