title	link	summary	green_innovation	business_innovation	green_product	green_process	company	official_company_name	product_or_process	likely_naics_codes	greenwashing	total_tokens
Dover Reports Fourth Quarter and Full Year 2022 Results - PR Newswire	https://news.google.com/rss/articles/CBMib2h0dHBzOi8vd3d3LnBybmV3c3dpcmUuY29tL25ld3MtcmVsZWFzZXMvZG92ZXItcmVwb3J0cy1mb3VydGgtcXVhcnRlci1hbmQtZnVsbC15ZWFyLTIwMjItcmVzdWx0cy0zMDE3MzQxMzUuaHRtbNIBAA?oc=5	Dover Corporation reported strong financial results for the fourth quarter and full year of 2022, with an 8% year-over-year increase in revenue. Despite a decrease in net earnings, adjusted net earnings showed an 18% increase due to productivity improvements and pricing actions. The company remains optimistic about growth in 2023, citing healthy demand trends and an elevated order backlog. Dover has continued investments in acquisitions and capital expenditures to enhance its efficiency and market position.	FALSE - The article primarily discusses financial performance and business strategies, without indicating any direct innovations that contribute to environmental sustainability or reduce negative environmental impacts.	TRUE - The article describes the introduction of improved business processes and product delivery metrics that differ significantly from previous methods, showcasing Dover's operational improvements and capital initiatives.	FALSE - No specific product is identified in the article that noticeably meets the criteria of a green product designed to reduce environmental impact throughout its life cycle.	FALSE - The article does not mention any specific processes that minimize environmental impacts and promote sustainability, focusing instead on business performance and financial metrics.	Dover	Dover Corporation	product or process not identified	Likely NAICS Codes: 333999 - All Other Miscellaneous General Purpose Machinery Manufacturing, 332410 - Power Boiler and Heat Exchanger Manufacturing, 334514 - Totalizing Fluid Meter and Counting Device Manufacturing, 334513 - Instruments and Related Products Manufacturing for Measuring, Displaying, and Controlling Industrial Process Variables	FALSE - The article does not provide misleading statements about environmental benefits; instead, it primarily discusses financial outcomes and business strategies without any claims of eco-friendliness.	14480
Kohler Previews New 26kW Home Standby Generator and New Exclusive Colors at CES 2023 USA - English - USA ... - PR Web	https://news.google.com/rss/articles/CBMihQFodHRwczovL3d3dy5wcndlYi5jb20vcmVsZWFzZXMvS29obGVyX1ByZXZpZXdzX05ld18yNmtXX0hvbWVfU3RhbmRieV9HZW5lcmF0b3JfYW5kX05ld19FeGNsdXNpdmVfQ29sb3JzX2F0X0NFU18yMDIzL3Byd2ViMTkxMDEwNjYuaHRt0gEA?oc=5	Kohler Co. showcased its new 26kW air-cooled home standby generator and 10 exclusive colors at the Consumer Electronics Show in January 2023. The new designs aim to enhance customization for consumers while emphasizing rigorous environmental testing to ensure color longevity. Kohler also collaborated with Mossy Oak to offer camouflage patterns on its generators, promoting aesthetics that blend with the environment. The 26RCA generator is highlighted for its performance, durability, and automatic operation during power outages.	TRUE, because the innovations aim to minimize environmental impacts through rigorous testing and aesthetic options that allow homeowners to blend their generators into the environment, promoting sustainability.	TRUE, because the introduction of the new generator model and exclusive customization options represent a significant improvement in Kohler's product offerings.	TRUE, as the new generator is designed with emphasis on sustainability and minimizes environmental impacts throughout its life cycle.	FALSE, because while there are elements of innovation, the article does not specifically describe a unique method or technique aimed at minimizing environmental impacts in the production or operational processes.	Kohler Co.	Kohler Co.	26kW air-cooled home standby generator	Likely NAICS Codes: 335312 - Motor and Generator Manufacturing, 335999 - All Other Miscellaneous Electrical Equipment and Component Manufacturing, 335311 - Power, Distribution, and Specialty Transformer Manufacturing, 332999 - All Other Miscellaneous Fabricated Metal Product Manufacturing.	FALSE, as there is no indication in the article that Kohler is making misleading claims about the environmental benefits of its products; the emphasis on rigorous testing supports its claims.	2381
Kohler Co. Celebrates 150 Years of Bold Moves, Creativity, and Impact While Shaping the Next 150 Years of Its Iconic ... - PR Newswire	https://news.google.com/rss/articles/CBMiuQFodHRwczovL3d3dy5wcm5ld3N3aXJlLmNvbS9pbi9uZXdzLXJlbGVhc2VzL2tvaGxlci1jby1jZWxlYnJhdGVzLTE1MC15ZWFycy1vZi1ib2xkLW1vdmVzLWNyZWF0aXZpdHktYW5kLWltcGFjdC13aGlsZS1zaGFwaW5nLXRoZS1uZXh0LTE1MC15ZWFycy1vZi1pdHMtaWNvbmljLWtvaGxlci1icmFuZC0zMDE3MzAxNTcuaHRtbNIBAA?oc=5	Kohler Co. is celebrating its 150th anniversary by promoting its brand pillars of design, innovation, wellness, and sustainability through various initiatives, including product launches and partnerships with artists. The company emphasizes its commitment to continuous improvement and the creation of impactful products while engaging associates and customers in the celebration. The year-long campaign, themed 'Come All Creators', showcases Kohler's heritage and innovative spirit. Events and product activations are planned globally, highlighting Kohler's sustained leadership in design and sustainability.	TRUE, because Kohler's initiatives reflect a strong commitment to sustainability, focusing on the development of innovative products that minimize environmental impact.	TRUE, as the article discusses the introduction of new and improved products and processes, such as the Heritage Colors product launch and partnerships that contribute to Kohler's market offerings.	TRUE, since Kohler is introducing products designed to reduce environmental impact and incorporate sustainable materials and production methods.	TRUE, as the article implies that Kohler is adopting innovative manufacturing processes that minimize waste and promote sustainability in its product offerings.	Kohler Co.	Kohler Co.	Heritage Colors product launch	Likely NAICS Codes: 321992 – Prefabricated Wood Building Manufacturing; 327920 – Clay Product and Refractory Manufacturing; 332913 – Plumbing Fixture Manufacturing; 423720 – Hardware Merchant Wholesalers.	FALSE, as there is no evidence in the article that suggests misleading or false claims about the environmental benefits of Kohler's products or practices; the company appears genuine in its sustainability efforts.	3108
Kohler Co. Appoints Laura Kohler as Company's First Chief Sustainability and DEI Officer - PR Newswire	https://news.google.com/rss/articles/CBMijgFodHRwczovL3d3dy5wcm5ld3N3aXJlLmNvbS9uZXdzLXJlbGVhc2VzL2tvaGxlci1jby1hcHBvaW50cy1sYXVyYS1rb2hsZXItYXMtY29tcGFueXMtZmlyc3QtY2hpZWYtc3VzdGFpbmFiaWxpdHktYW5kLWRlaS1vZmZpY2VyLTMwMTcyNjEwMC5odG1s0gEA?oc=5	Kohler Co. has appointed Laura Kohler as its first Chief Sustainability and Diversity, Equity and Inclusion Officer to enhance sustainability and social impact across its business operations. The company has a long-standing commitment to environmental sustainability, with initiatives aimed at addressing climate change, water scarcity, and promoting diversity and inclusion. Kohler's strategy, 'Believing in Better', focuses on creating a better planet, communities, and lives through innovative products and programs. The company continues to invest in sustainable practices and has outlined ambitious 2035 Net Zero goals.	TRUE, because the article discusses Kohler's commitment to sustainability initiatives and social impact programs that aim to reduce environmental impact and promote social responsibility.	FALSE, because while Kohler is enhancing its operations and creating leadership roles, the article does not introduce a new or significantly improved product or business process.	FALSE, because the article does not explicitly mention a specific good or service that meets the definition of a green product.	TRUE, because Kohler's initiatives and the focus on sustainable practices suggest the implementation of green processes aimed at reducing environmental impacts.	Kohler Co.	Kohler Co.	product or process not identified	Likely NAICS Codes: 3324 - Bathroom Fixtures, 3371 - Household Furniture Manufacturing, 4232 - Furniture and Home Furnishing Merchant Wholesalers, 8113 - Commercial and Industrial Machinery and Equipment (except Automotive and Electronic) Repair and Maintenance	FALSE, because the article presents clear commitments and ongoing initiatives towards sustainability, rather than making misleading claims about environmental benefits.	2507
Kohler Showcases Kitchen and Bath Category Leadership at CES 2023 with New Smart Innovations and Designs to ... - PR Newswire	https://news.google.com/rss/articles/CBMivAFodHRwczovL3d3dy5wcm5ld3N3aXJlLmNvbS9uZXdzLXJlbGVhc2VzL2tvaGxlci1zaG93Y2FzZXMta2l0Y2hlbi1hbmQtYmF0aC1jYXRlZ29yeS1sZWFkZXJzaGlwLWF0LWNlcy0yMDIzLXdpdGgtbmV3LXNtYXJ0LWlubm92YXRpb25zLWFuZC1kZXNpZ25zLXRvLWVuaGFuY2Utd2VsbG5lc3MtYXQtaG9tZS0zMDE3MTIzMjAuaHRtbNIBAA?oc=5	Kohler Co. is showcasing a lineup of innovative smart products at CES 2023 aimed at enhancing well-being and improving water management efficiency. Featured products include the Anthem Smart Showering System, the Statement VES Showerhead that uses less water, and the H2Wise Smart Water Monitoring System that detects leaks. These products are designed to provide a luxurious experience while promoting sustainability by reducing water consumption. Kohler's efforts align with their sustainability strategy, 'Believing in Better,' which focuses on creating a positive impact for the planet and communities.	TRUE - The innovations focus on enhancing water efficiency and managing consumption, thus contributing to environmental sustainability and reducing negative environmental impacts.	TRUE - The article discusses new and improved products introduced by Kohler Co. that significantly differ from their previous offerings, indicating a notable business innovation.	TRUE - The products mentioned, such as the Statement VES Showerhead and the H2Wise Smart Water Monitoring Systems, are designed to reduce water usage and environmental impact throughout their life cycle.	FALSE - While the article mentions product innovations aimed at efficiency, it does not specifically describe any manufacturing or operational processes minimized for environmental impact.	Kohler Co.	Kohler Co.	Anthem Smart Showering System	['NAICS 326199 - All Other Plastics Product Manufacturing', 'NAICS 332911 - Industrial Valve Manufacturing', 'NAICS 326185 - Urethane and Other Foam Product (except Polystyrene) Manufacturing', 'NAICS 238220 - Plumbing, Heating, and Air-Conditioning Contractors']	FALSE - The article does not appear to contain misleading claims about the environmental benefits of Kohler's products; rather, it highlights genuine innovations aimed at reducing water usage and promoting sustainability.	2877
Kohler Introduces New Wellness Brand, Sprig - PR Newswire	https://news.google.com/rss/articles/CBMiYmh0dHBzOi8vd3d3LnBybmV3c3dpcmUuY29tL25ld3MtcmVsZWFzZXMva29obGVyLWludHJvZHVjZXMtbmV3LXdlbGxuZXNzLWJyYW5kLXNwcmlnLTMwMTcxMjkyNy5odG1s0gEA?oc=5	Kohler Co. has introduced Sprig, a new wellness brand that offers innovative shower infusion systems and self-care products designed to enhance daily routines and create at-home spa experiences. The products, which include shower infusion pods, bath bombs, and mists, are formulated with clean, natural ingredients and are designed to be environmentally friendly through the use of recycled materials. Sprig aims to transform standard routines into premium self-care rituals using botanical blends. Products are available for pre-sale and include a focus on elevating consumers' personal care experiences.	TRUE: The products use clean, natural ingredients and are designed with sustainability in mind, including packaging made from 94% post-consumer recycled material.	TRUE: Sprig represents a new brand and product line that enhances existing routines with innovative products, significantly differing from Kohler's previous offerings in the wellness market.	TRUE: Sprig's products, such as shower infusion pods and bath bombs, are created to minimize environmental impact and made with premium, non-toxic ingredients.	FALSE: The article does not detail a specific process related to the manufacturing or production of the products that aims to minimize environmental impacts.	Kohler Co.	Kohler Co.	Sprig	[{'code': '327991', 'category': 'Manufacturing - Ballasts, Light Fixtures, and Lighting Equipment Manufacturing'}, {'code': '325620', 'category': 'Manufacturing - Toilet Preparation Manufacturing'}, {'code': '454111', 'category': 'Retail Trade - Electronic Shopping and Mail-Order Houses'}, {'code': '423730', 'category': 'Wholesale Trade - Wood Kitchen Cabinet and Countertop Manufacturing'}]	FALSE: The article does not present misleading information about the environmental benefits of the products but rather emphasizes their clean, natural formulation and environmental considerations in their design.	2510
KOHLER PRESENTS HERITAGE COLORS - PR Newswire	https://news.google.com/rss/articles/CBMiV2h0dHBzOi8vd3d3LnBybmV3c3dpcmUuY29tL25ld3MtcmVsZWFzZXMva29obGVyLXByZXNlbnRzLWhlcml0YWdlLWNvbG9ycy0zMDE3MjM3ODguaHRtbNIBAA?oc=5	Kohler Co. has launched the Heritage Colors campaign, celebrating its historical use of vibrant colors in design and allowing consumers to vote on which colors will be included in a new product collection. The campaign features six vintage colorways and accompanying events in New York City with promotional offerings. The winning colors will be announced at the Kitchen & Bath Industry Show 2023, where limited editions of popular products will be offered in these shades. Kohler emphasizes its legacy in design while engaging consumers in a celebratory voting process.	FALSE, the article does not focus on innovations that significantly reduce environmental impact or promote sustainability.	TRUE, this is a business innovation as it introduces a new product collection through the Heritage Colors campaign, significantly different from Kohler's previous offerings.	FALSE, while the products may be colorful, the article does not indicate that they are designed to significantly reduce environmental impact throughout their life cycle.	FALSE, the article does not describe any methods or techniques that minimize environmental impacts or promote sustainability.	Kohler Co.	Kohler Co.	Heritage Colors campaign	{'Likely NAICS Codes': ['337110 - Wood Kitchen Cabinet and Countertop Manufacturing', '337211 - Wood Office Furniture Manufacturing', '332510 - Hardware Manufacturing', '423220 - Home Furnishing Merchant Wholesalers']}	FALSE, the article does not use misleading statements about environmental benefits; rather, it emphasizes a celebration of design and color without making unsubstantiated environmental claims.	2300
