title	link	summary	green_innovation	business_innovation	green_product	green_process	company	official_company_name	product_or_process	likely_naics_codes	greenwashing	total_tokens
International body verifies Vedanta Aluminium products as environmentally sustainable - PR Newswire	https://news.google.com/rss/articles/CBMikgFodHRwczovL3d3dy5wcm5ld3N3aXJlLmNvbS9hcGFjL25ld3MtcmVsZWFzZXMvaW50ZXJuYXRpb25hbC1ib2R5LXZlcmlmaWVzLXZlZGFudGEtYWx1bWluaXVtLXByb2R1Y3RzLWFzLWVudmlyb25tZW50YWxseS1zdXN0YWluYWJsZS0zMDE4OTQ1MzcuaHRtbNIBAA?oc=5	Vedanta Aluminium has received Environmental Product Declaration (EPD) International verification for its aluminium products, affirming its commitment to sustainable manufacturing through advanced green innovations. The EPD showcases the company's strong performance in energy consumption, greenhouse gas emissions, water usage, and waste generation based on rigorous Life Cycle Assessment (LCA). With this certification, Vedanta Aluminium aims to provide environmentally sustainable products critical for various sectors, reflecting its position as a leader in sustainability practices within the aluminium industry.	TRUE - This is a green innovation as it highlights Vedanta Aluminium's commitment to sustainability through the Environmental Product Declaration (EPD), which assesses and verifies the environmental performance of their products.	TRUE - This is a business innovation because Vedanta Aluminium has introduced improved products with a significant focus on sustainability that differ from their previous offerings and have been brought to market.	TRUE - The primary aluminium products verified by EPD qualify as green products since they are designed and manufactured to significantly reduce environmental impact throughout their life cycle.	TRUE - The advanced manufacturing practices mentioned in the article indicate green processes aimed at minimizing environmental impacts and promoting sustainability.	Vedanta Aluminium	Vedanta Aluminium Limited	Environmental Product Declaration (EPD) for primary aluminium products	['331318 - Other Aluminum Rolling, Drawing, and Extruding', '331316 - Aluminum Extruded Product Manufacturing', '331310 - Aluminum Sheet, Plate, and Foil Manufacturing', '331100 - Iron and Steel Mills and Ferroalloy Manufacturing']	FALSE - The article does not represent greenwashing as it provides transparent, verifiable information about Vedanta Aluminium's environmental performance through an internationally recognized Environmental Product Declaration following a thorough Life Cycle Assessment.	1909
Microalgae-based decarbonization project to deliver sustainable products to the value chain - Aquafeed.com	https://news.google.com/rss/articles/CBMijQFodHRwczovL3d3dy5hcXVhZmVlZC5jb20vcHJvZHVjdHMvc3VwcGxpZXJzLW5ld3MvbWljcm9hbGdhZS1iYXNlZC1kZWNhcmJvbml6YXRpb24tcHJvamVjdC10by1kZWxpdmVyLXN1c3RhaW5hYmxlLXByb2R1Y3RzLXRvLXRoZS12YWx1ZS1jaGFpbi_SAQA?oc=5	Danish startup Algiecel received approval and funding for a project that aims to convert CO2 and microalgae into valuable bio-based products for industries like aquafeeds. The project, in partnership with companies like Novozymes and DTU Chemical Engineering, will utilize CO2 from industrial sites in a photobioreactor to produce biomass while reusing water and nutrients. The initiative focuses on enabling small and mid-sized industries to efficiently valorize their CO2 emissions while contributing to decarbonization efforts. Algiecel's technology seeks to enhance sustainability by providing low-carbon products to the market.	TRUE, because the project demonstrates how CO2 can be captured and utilized to create biomass and bio-based products, contributing to decarbonization and reducing environmental impacts.	TRUE, because the project introduces a new method for utilizing CO2 emissions effectively to create innovative bio-based products, differing significantly from conventional manufacturing processes.	TRUE, because the biomass generated from the microalgae process can be considered a green product as it is produced through sustainable methods that reduce environmental impact.	TRUE, because the photobioreactor technology used by Algiecel minimizes environmental impacts by utilizing CO2, conserving resources, and recycling water and nutrients in the production process.	Algiecel	Algiecel A/S	CO2 utilization through microalgae photobioreactor	['32532 - Pesticide and Other Agricultural Chemical Manufacturing', '311114 - Soybean Processing', '541715 - Research and Development in the Physical, Engineering, and Life Sciences (except Biotechnology)', '424590 - Other Chemical and Allied Products Merchant Wholesalers']	FALSE, because the article provides a clear and substantiated overview of Algiecel's process and partnerships aimed at genuine sustainability efforts, with no indication of misleading environmental claims.	2092
Top 5 Perks Of Embracing Green Computing In Your Company - Spiceworks News and Insights	https://news.google.com/rss/articles/CBMiZWh0dHBzOi8vd3d3LnNwaWNld29ya3MuY29tL3RlY2gvZWRnZS1jb21wdXRpbmcvZ3Vlc3QtYXJ0aWNsZS9hZHZhbnRhZ2VzLW9mLWdyZWVuLWNvbXB1dGluZy1wcmFjdGljZXMv0gFlaHR0cHM6Ly93d3cuc3BpY2V3b3Jrcy5jb20vdGVjaC9lZGdlLWNvbXB1dGluZy9ndWVzdC1hcnRpY2xlL2FkdmFudGFnZXMtb2YtZ3JlZW4tY29tcHV0aW5nLXByYWN0aWNlcy8?oc=5	The article discusses the benefits of green computing for businesses, emphasizing its potential to lower energy costs, gain a competitive edge, and attract top talent while contributing to sustainability. It defines green computing as practices aimed at reducing greenhouse gas emissions and how these practices can enhance a company's environmental stewardship and long-term growth. The ICT sector's contribution to global greenhouse emissions is highlighted, along with the significant advantages of implementing energy-efficient technologies. Ultimately, the article advocates for the adoption of sustainable IT practices as a means of driving innovation and reducing the environmental impact of technology.	TRUE: The article describes green computing, which includes practices that reduce greenhouse gas emissions and promote sustainability, thus aligning with the definition of green innovation.	TRUE: The article highlights green computing as a new or improved business process that significantly differs from traditional IT practices, focusing on energy efficiency and sustainability.	FALSE: The article does not identify a specific good or service that meets the definition of a green product; it focuses on practices within the IT industry rather than specific products.	TRUE: The article mentions green computing practices as methods aimed at minimizing environmental impacts and promoting sustainability in the ICT sector.	Cordoniq	Cordoniq Inc.	green computing processes	Likely NAICS Codes: 511210 - Software Publishers, 518210 - Data Processing, Hosting, and Related Services, 541511 - Custom Computer Programming Services, 541512 - Computer Systems Design Services	FALSE: The article does not engage in greenwashing; it accurately describes the benefits and practices of green computing without making misleading claims about environmental benefits.	2643
The Toyota Production System: A Fresh Look - Assembly Magazine	https://news.google.com/rss/articles/CBMiVGh0dHBzOi8vd3d3LmFzc2VtYmx5bWFnLmNvbS9hcnRpY2xlcy85Nzk4MS10aGUtdG95b3RhLXByb2R1Y3Rpb24tc3lzdGVtLWEtZnJlc2gtbG9va9IBAA?oc=5	The article discusses the Toyota Production System (TPS), emphasizing its innovative approach to manufacturing that harmonizes mass production with flexibility to enhance efficiency, reduce waste, and meet customer demands. It highlights Toyota's commitment to environmental stewardship through its focus on eliminating pollution and resource depletion while maintaining profitability. The article argues that TPS is a viable model for integrating business and social responsibilities, suggesting it has broader implications for economic stability. Ultimately, it calls for a shift towards more sustainable manufacturing practices that serve both business and environmental goals.	TRUE - The article describes the Toyota Production System (TPS), which focuses on eliminating waste and promoting environmental stewardship, aligning with the principles of green innovation by reducing negative externalities and fostering sustainability.	TRUE - The article discusses the TPS as a new model of manufacturing that integrates various innovative processes, thus qualifying it as a significant improvement in business innovation.	TRUE - The article refers to the production of hybrid, electric, and hydrogen engines by Toyota, which fits the definition of green products designed to reduce environmental impact throughout their life cycle.	TRUE - It describes the TPS as a process that minimizes environmental impact by reducing waste, conserving resources, and optimizing production to align with actual customer demand, consistent with the definition of a green process.	Toyota Motor Corporation	Toyota Motor Corporation	Toyota Production System	Likely NAICS Codes: 336111 - Automobile Manufacturing, 336112 - Light Truck and Utility Vehicle Manufacturing, 541330 - Engineering Services, 339999 - All Other Miscellaneous Manufacturing	FALSE - The article does not indicate any deceptive practices regarding the environmental benefits attributed to Toyota's manufacturing processes; instead, it presents a genuine commitment to sustainability.	4645
Ready-To-Eat Food Market Assessment, By Category, By Packaging Type, By Distribution Channel, By End-user, By ... - GlobeNewswire	https://news.google.com/rss/articles/CBMi3QFodHRwczovL3d3dy5nbG9iZW5ld3N3aXJlLmNvbS9uZXdzLXJlbGVhc2UvMjAyMy8wOC8yMi8yNzI5Mjg1LzAvZW4vUmVhZHktVG8tRWF0LUZvb2QtTWFya2V0LUFzc2Vzc21lbnQtQnktQ2F0ZWdvcnktQnktUGFja2FnaW5nLVR5cGUtQnktRGlzdHJpYnV0aW9uLUNoYW5uZWwtQnktRW5kLXVzZXItQnktUmVnaW9uLU9wcG9ydHVuaXRpZXMtYW5kLUZvcmVjYXN0LTIwMTYtMjAzMEYuaHRtbNIBAA?oc=5	The ready-to-eat food market is projected to grow from USD 251.2 billion in 2022 to USD 379.13 billion by 2030 due to rising demand for innovative and convenient food options. Companies are focusing on sustainable packaging and healthier product offerings in response to consumer preferences for environmentally friendly and nutritious meals. The increasing number of women in the workforce and the impact of the COVID-19 pandemic have also driven the demand for ready-to-eat foods. Various key players in the industry are pursuing product innovation and strategic acquisitions to maintain their competitiveness.	TRUE - The article discusses the trend towards sustainable packaging and plant-based options within the ready-to-eat food sector, which contributes to environmental sustainability by reducing plastic waste and promoting healthier eating.	TRUE - The introduction of healthier, sustainable ready-to-eat food options represents a significant improvement in product offerings, aligning with consumer demand for quality and convenience.	TRUE - The mention of plant-based meals and sustainable packaging indicates that these ready-to-eat food products are designed to reduce environmental impact throughout their lifecycle.	FALSE - The article does not specifically describe processes in manufacturing or production that minimize environmental impacts.	Nomad Foods Ltd	Nomad Foods Limited	Green Cuisine Range	Likely NAICS Codes: 311991 - Perishable Prepared Food Manufacturing; 311992 - Food Product Machinery Manufacturing; 424490 - Other Grocery and Related Products Merchant Wholesalers; 722310 - Food Service Contractors	FALSE - The article does not suggest that the companies are making false or misleading claims about the environmental benefits of their products; rather, it discusses genuine trends towards sustainability.	3155
How Recycling Technology is Helping the Brands in the Footwear Industry - Indian Retailer	https://news.google.com/rss/articles/CBMifmh0dHBzOi8vd3d3LmluZGlhbnJldGFpbGVyLmNvbS9hcnRpY2xlL3JldGFpbC1idXNpbmVzcy9yZXRhaWwtdHJlbmRzL2hvdy1yZWN5Y2xpbmctdGVjaG5vbG9neS1oZWxwaW5nLWJyYW5kcy1mb290d2Vhci1pbmR1c3RyedIBAA?oc=5	The article discusses the top luxury watch brands in India, highlighting their heritage, craftsmanship, and unique features. Brands like Rolex, Omega, and TAG Heuer are emphasized for their innovations and status in the luxury watch market. It also offers guidance on choosing the right watch brand based on personal style, functionality, and budget.	FALSE: The article does not discuss any innovations that specifically contribute to environmental sustainability goals, such as decarbonization or reduction of harmful substances.	TRUE: The article discusses luxury watch brands representing new or improved products that are significantly different from previous offerings, showcasing business innovation in design and technology.	FALSE: The luxury watches mentioned do not qualify as green products, as they are not designed with a focus on reducing environmental impact throughout their lifecycle.	FALSE: The article does not mention any specific processes aimed at minimizing environmental impacts in the manufacturing or operation of the watches.	company not identified	company not identified	product or process not identified	Likely NAICS Codes: 448210 - Jewelry Stores, 331492 - Other Nonferrous Metal Refining and Alloying, 339911 - Jewelry (except Costume) Manufacturing, 339999 - All Other Miscellaneous Manufacturing	FALSE: The article does not exhibit characteristics of greenwashing, as it does not make misleading claims about environmental benefits related to the luxury watches.	5538
