title	link	summary	green_innovation	business_innovation	green_product	green_process	company	official_company_name	product_or_process	likely_naics_codes	greenwashing	total_tokens
The Nature Conservancy Presents "Nature's Canvas: Photo Contest Exhibition" Unleashing creativity to help protect the ... - PR Newswire	https://news.google.com/rss/articles/CBMivwFodHRwczovL3d3dy5wcm5ld3N3aXJlLmNvbS9hcGFjL25ld3MtcmVsZWFzZXMvdGhlLW5hdHVyZS1jb25zZXJ2YW5jeS1wcmVzZW50cy1uYXR1cmVzLWNhbnZhcy1waG90by1jb250ZXN0LWV4aGliaXRpb24tdW5sZWFzaGluZy1jcmVhdGl2aXR5LXRvLWhlbHAtcHJvdGVjdC10aGUtYmVhdXR5LW9mLW5hdHVyZS0zMDE4NzczMjQuaHRtbNIBAA?oc=5	The Nature Conservancy's 'Nature's Canvas: Photo Contest Exhibition' showcases award-winning photographs from its annual Global Photo Contest to highlight the beauty of nature and raise awareness of environmental protection and conservation. The exhibition features a new Climate category to address the effects of climate change, appealing to broader themes of nature conservation and community engagement. Visitors can participate creatively through an AR challenge and send postcards to promote the love for nature. The event aims to reignite public passion for conservation and increase awareness of environmental issues.	TRUE, because the event promotes environmental protection and nature conservation through art, raising awareness about ecological issues and the interconnectedness of life on Earth.	FALSE, because while it engages with the public and encourages participation in conservation activities, it does not specifically introduce a new or improved product or business process that meets the criteria of business innovation.	FALSE, because the event does not involve a specific good or service that significantly reduces environmental impact throughout its life cycle.	FALSE, because there is no specific method or technique described that minimizes environmental impacts or promotes sustainability in a production or operational context.	The Nature Conservancy	The Nature Conservancy	product or process not identified	Likely NAICS Codes: 813312 - Environmental Conservation Organizations, 712110 - Museums, 541410 - Interior Design Services, 541620 - Environmental Consulting Services.	FALSE, because the article reflects genuine efforts by The Nature Conservancy to promote environmental awareness and conservation through an artistic medium, with no indication of misleading claims or false representations.	2783
The Dawn of a New Man-Machine World Order Run By AI - BBN Times	https://news.google.com/rss/articles/CBMiWGh0dHBzOi8vd3d3LmJibnRpbWVzLmNvbS9lbnZpcm9ubWVudC90aGUtZGF3bi1vZi1hLW5ldy1tYW4tbWFjaGluZS13b3JsZC1vcmRlci1ydW4tYnktYWnSAQA?oc=5	The article discusses the transformative impact of artificial intelligence (AI) on various industries, highlighting its role in revolutionizing operations and enhancing efficiencies across sectors including finance, healthcare, manufacturing, and transportation. It emphasizes AI's contribution to environmental conservation through applications like precision agriculture, wildlife conservation, carbon footprint reduction, recycling, and climate modeling. Furthermore, the piece addresses the ethical, social, and political implications of AI's rise, suggesting the need for responsible governance as the technology evolves.	TRUE, because the article outlines multiple applications of AI that contribute to environmental sustainability, such as precision agriculture, wildlife conservation, and recycling, all of which minimize environmental impacts.	TRUE, as AI represents a new and improved technology that businesses are integrating to enhance efficiency, decision-making, and customer experiences, thus markedly changing traditional processes and models.	FALSE, because while the article discusses AI technologies and their applications for sustainability, it does not identify a specific product that meets the definition of a green product.	TRUE, as the article mentions several AI applications that improve operational processes in various industries, making them more sustainable and efficient, such as optimizations in supply chains and resource use.	company not identified	company not identified	product or process not identified	Likely NAICS Codes: 541511 - Custom Computer Programming Services, 541512 - Computer Systems Design Services, 334118 - Computer Terminal and Other Computer Peripheral Equipment Manufacturing, 541690 - Other Scientific and Technical Consulting Services.	FALSE, as the article does not appear to misrepresent the environmental benefits of AI; instead, it highlights genuine innovations that contribute to sustainability.	2266
Blue Economy for Revitalization of Oceans - Modern Diplomacy	https://news.google.com/rss/articles/CBMiUGh0dHBzOi8vbW9kZXJuZGlwbG9tYWN5LmV1LzIwMjMvMDcvMjYvYmx1ZS1lY29ub215LWZvci1yZXZpdGFsaXphdGlvbi1vZi1vY2VhbnMv0gEA?oc=5	The article discusses the importance of oceans for human civilization and introduces the concept of the Blue Economy as a sustainable framework for utilizing ocean resources. It emphasizes sustainable practices in fisheries, aquaculture, renewable energy production, and marine biotechnology while ensuring the health of marine ecosystems. The Blue Economy aligns with several UN Sustainable Development Goals and promotes the balanced use of ocean resources for economic growth. Collaborative efforts among communities, industries, and governments are essential for effective governance and revitalization of oceans.	TRUE, because the Blue Economy promotes sustainable practices that reduce environmental impacts while enabling economic growth related to ocean resources.	TRUE, as the article discusses new business practices in sustainable fisheries, aquaculture, and renewable energy that systematically differ from traditional approaches.	FALSE, the article does not specifically identify any single green product but discusses concepts and practices instead.	TRUE, as it outlines various sustainable practices in fisheries, aquaculture, and renewable energy production that aim to minimize environmental impact.	company not identified	product or process not identified	not found	Likely NAICS Codes: 115112 - Soil Preparation, Planting, and Cultivating, 482111 - Line-Haul Railroads, 541715 - Research and Development in the Physical, Engineering, and Life Sciences (except Nanotechnology and Biotechnology), 713990 - All Other Amusement and Recreation Industries	FALSE, as the article presents credible information on sustainable practices without misleading claims about environmental benefits.	2548
Retail India News: Amazon Business Achieves Remarkable 56 pc Sales Growth during Prime Day - Indian Retailer	https://news.google.com/rss/articles/CBMifWh0dHBzOi8vd3d3LmluZGlhbnJldGFpbGVyLmNvbS9uZXdzL3JldGFpbC1pbmRpYS1uZXdzLWFtYXpvbi1idXNpbmVzcy1hY2hpZXZlcy1yZW1hcmthYmxlLTU2LXBjLXNhbGVzLWdyb3d0aC1kdXJpbmctcHJpbWUtZGF50gEA?oc=5	Juicy Chemistry and Mommy Shots by Amrita have launched the 'Scars are Beautiful' campaign to celebrate postpartum bodies and stretch marks, aiming to inspire women to embrace their unique journeys of motherhood. Featuring 11 mothers sharing their stories, the campaign promotes self-love and body positivity, challenging societal perceptions of beauty. The founders express their hope to redefine beauty narratives and normalize the acceptance of physical and emotional scars among women.	FALSE, this is not a green innovation as it does not contribute specifically to environmental sustainability goals or address negative environmental externalities.	TRUE, this is a business innovation as it involves a new marketing campaign aimed at redefining beauty standards and promoting self-acceptance, differing significantly from previous marketing practices.	FALSE, there is no specific good or service identified in the article that significantly reduces environmental impact throughout its life cycle.	FALSE, the article does not describe any operational activities or processes that minimize environmental impacts or promote sustainability.	Juicy Chemistry and Mommy Shots by Amrita	Juicy Chemistry	Scars are Beautiful campaign	Likely NAICS Codes: 541810 - Advertising Agencies, 812199 - Other Personal Care Services, 541922 - Commercial Photography, 713940 - Fitness and Recreational Sports Centers	FALSE, the article does not appear to promote misleading statements about environmental benefits; instead, it emphasizes body positivity and self-acceptance, which is not an act of greenwashing.	2115
Gulu in bid to end plastic menace - Monitor	https://news.google.com/rss/articles/CBMiWGh0dHBzOi8vd3d3Lm1vbml0b3IuY28udWcvdWdhbmRhL25ld3MvbmF0aW9uYWwvZ3VsdS1pbi1iaWQtdG8tZW5kLXBsYXN0aWMtbWVuYWNlLTQzMDAyODDSAQA?oc=5	The article discusses efforts in Gulu City, Uganda, to combat plastic pollution through the Gulu Go Green campaign, which includes setting up plastic waste banks and involving local communities and schools in recycling initiatives. The partnership with various organizations aims to promote sustainable waste management and environmental conservation, along with utilizing technology to improve waste collection efficiency. Initiatives such as training young people for proper waste management and the integration of recycling into the community are highlighted as ways to promote ecological awareness and clean city objectives.	TRUE, because the initiatives described aim to reduce plastic waste and its environmental impact through sustainable practices, recycling, and community engagement.	TRUE, as the initiatives represent new or improved processes and partnerships aimed at managing waste, generating economic growth through recycling, and creating job opportunities.	TRUE, regarding recycled plastic products created by local firms, such as chairs and tables, which meet the criteria for having a reduced environmental impact.	TRUE, as the article describes processes for collecting, recycling, and managing waste that minimize environmental impacts and promote sustainability.	Hariss International Ltd	Hariss International Limited	plastic waste banks	Likely NAICS Codes: 562920 - Materials Recovery Facilities, 339999 - All Other Miscellaneous Manufacturing, 711219 - Other Spectator Sports, 611710 - Educational Support Services	FALSE, because the initiatives are substantiated by actionable steps towards waste management and recycling, rather than misleading marketing claims.	2741
Hindustan Unilever: Empowering Consumers For 90 Years - Inventiva	https://news.google.com/rss/articles/CBMiWmh0dHBzOi8vd3d3LmludmVudGl2YS5jby5pbi9idXNpbmVzcy9oaW5kdXN0YW4tdW5pbGV2ZXItZW1wb3dlcmluZy1jb25zdW1lcnMtZm9yLTkwLXllYXJzL9IBAA?oc=5	Hindustan Unilever Limited (HUL) is a leading Indian consumer goods company known for its diverse range of products, commitment to sustainability, and community development initiatives. Founded in 1933, HUL has evolved through innovation and expansion into international markets, maintaining a strong presence in the fast-moving consumer goods sector. The company emphasizes eco-friendly practices in its operations and product offerings while maintaining a focus on customer satisfaction and social responsibility. HUL continues to thrive under its strategic leadership, supporting its mission to make sustainable living commonplace.	TRUE - HUL actively engages in sustainable and responsible business practices, focusing on environmental conservation and community development, which reflects green innovation.	TRUE - HUL's introduction of new and improved products that significantly differ from its previous offerings qualifies as business innovation.	TRUE - HUL's products are designed and manufactured to reduce environmental impact throughout their lifecycle, aligning with the definition of green products.	TRUE - The company employs methods that minimize environmental impacts and promote sustainability in its manufacturing processes, characterized as green processes.	Hindustan Unilever Limited	Hindustan Unilever Limited	product or process not identified	{'Likely NAICS Codes': {'1': {'code': '325611', 'category': 'Soap and Other Detergent Manufacturing'}, '2': {'code': '446120', 'category': 'Cosmetics, Beauty Supplies, and Perfume Stores'}, '3': {'code': '311999', 'category': 'All Other Miscellaneous Food Manufacturing'}, '4': {'code': '311811', 'category': 'Retail Bakeries'}}}	FALSE - The article presents HUL's sustainable initiatives and practices as genuine contributions to environmental goals without misleading claims.	4837
