title	link	summary	green_innovation	business_innovation	green_product	green_process	company	official_company_name	product_or_process	likely_naics_codes	greenwashing	total_tokens
Virgin Media O2 helps businesses recycle unused phones and tablets | Virgin - Virgin	https://news.google.com/rss/articles/CBMifWh0dHBzOi8vd3d3LnZpcmdpbi5jb20vYWJvdXQtdmlyZ2luL3B1cnBvc2UvbGF0ZXN0LXB1cnBvc2UvdmlyZ2luLW1lZGlhLW8yLWhlbHBzLWJ1c2luZXNzZXMtcmVjeWNsZS11bnVzZWQtcGhvbmVzLWFuZC10YWJsZXRz0gEA?oc=5	Virgin Media O2 has relaunched its O2 Recycle initiative to help businesses sustainably dispose of unwanted devices. The program allows companies to trade in their old tech for cash back, credit towards new devices, or donations to charities while ensuring that none of the devices end up in landfills. Enhancements to the recycling platform have also made it easier for businesses to recycle devices remotely. With a focus on reducing e-waste and supporting digital inclusion, the initiative helps companies lower their carbon emissions.	TRUE, because the O2 Recycle initiative promotes the responsible disposal of electronic waste, supports the circular economy, and ensures that devices are recycled or refurbished instead of ending up in landfills.	TRUE, because O2 Recycle for Business represents a new method for companies to manage and trade in obsolete technology, significantly differing from previous processes and providing financial incentives.	FALSE, because the initiative itself is a service for recycling devices rather than a tangible product designed to reduce environmental impact.	TRUE, because the O2 Recycle process minimizes environmental impact by promoting recycling and refurbishment of electronic devices, reducing waste and resource consumption.	Virgin Media O2	Virgin Media O2	O2 Recycle for Business	Likely NAICS Codes: 532110 (Consumer Electronics Rental), 811212 (Computer and Office Machine Repair and Maintenance), 541614 (Process, Physical Distribution, and Logistics Consulting Services), 423690 (Other Electronic Parts and Equipment Merchant Wholesalers).	FALSE, because the article clearly outlines the environmental benefits and processes of the O2 Recycle initiative without making misleading claims about its effectiveness.	1812
Waste Reduction Week - City of St. John's |	https://news.google.com/rss/articles/CBMiOGh0dHBzOi8vd3d3LnN0am9obnMuY2EvZW4vbmV3cy93YXN0ZS1yZWR1Y3Rpb24td2Vlay5hc3B40gEA?oc=5	The article outlines the theme-based activities of Waste Reduction Week in Canada, emphasizing the importance of circular economy practices such as sharing, repairing, reusing, and recycling. It highlights how individuals can contribute to waste reduction through mindful consumption of textiles, e-waste management, plastic reduction, and food waste management. Additionally, it encourages community engagement in repair and reuse through local organizations. Overall, the article promotes sustainable practices across various sectors to benefit the environment.	TRUE, because the article describes various practices that reduce environmental impact and promote sustainability, which aligns with the principles of green innovation.	FALSE, because while the article discusses practices contributing to sustainability, it does not define or introduce a new or improved product or business process.	FALSE, because the article does not specifically name a product that meets the definition of a green product but discusses sustainable practices.	TRUE, because the article describes methods like recycling and repairing that minimize environmental impacts and promote sustainability.	company not identified	company not identified	product or process not identified	Likely NAICS Codes: 5622 - Waste Treatment and Disposal, 8123 - Drycleaning and Laundry Services, 4533 - Used Merchandise Stores, 5416 - Management, Scientific, and Technical Consulting Services.	FALSE, because the article does not make false or misleading claims about environmental benefits; instead, it provides genuine advice for reducing environmental impacts.	2491
Polartec introduces performance fabrics made with Biolon: Nylon just got better - Sporting Goods Intelligence Europe	https://news.google.com/rss/articles/CBMiiAFodHRwczovL3d3dy5zZ2lldXJvcGUuY29tL2NpcmN1bGFyLWVjb25vbXkvcG9sYXJ0ZWMtaW50cm9kdWNlcy1wZXJmb3JtYW5jZS1mYWJyaWNzLW1hZGUtd2l0aC1iaW9sb24tbnlsb24tanVzdC1nb3QtYmV0dGVyLzEwNTE3Mi5hcnRpY2xl0gEA?oc=5	Polartec has upgraded its Power Shield and Power Stretch Pro fabrics using Biolon™, a plant-based nylon fiber that reduces carbon footprint by 50 percent compared to traditional nylon. These updated fabrics are recyclable and incorporate renewable materials to enhance sustainability in functional textiles. Polartec aims to lead in creating high-performance textiles that prioritize environmental responsibility. The launch represents a significant step in Polartec's sustainability journey by increasing the proportion of recycled and bio-derived materials.	TRUE: This is green innovation because it introduces sustainable materials (Biolon™) that reduce environmental impact through lower carbon emissions and recyclability.	TRUE: This is a business innovation because it represents a significant improvement and new offering in Polartec's product line with the introduction of Biolon™ based fabrics.	TRUE: This is a green product because the fabrics are designed to minimize environmental impact through the use of plant-based materials and recyclability.	FALSE: This is not a green process as the article does not detail specific manufacturing or production techniques that minimize environmental impact.	Polartec	Polartec, LLC	Polartec® Power Shield™ and Power Stretch™ Pro fabrics with Biolon™	Likely NAICS Codes: 313210 - Broadwoven Fabric Mills, 313220 - Nonwoven Fabric Mills, 316210 - Footwear Manufacturing, 424320 - Men's and Boys' Clothing and Furnishings Merchant Wholesalers	FALSE: The article does not suggest greenwashing as it provides substantial examples of the environmental benefits of the product and how it aligns with sustainability goals.	2102
Coca-Cola India Launches 100% Recycled PET Bottles in the Carbonated Beverage Category - PR Newswire	https://news.google.com/rss/articles/CBMikAFodHRwczovL3d3dy5wcm5ld3N3aXJlLmNvbS9pbi9uZXdzLXJlbGVhc2VzL2NvY2EtY29sYS1pbmRpYS1sYXVuY2hlcy0xMDAtcmVjeWNsZWQtcGV0LWJvdHRsZXMtaW4tdGhlLWNhcmJvbmF0ZWQtYmV2ZXJhZ2UtY2F0ZWdvcnktMzAxOTQ3MjA3Lmh0bWzSAQA?oc=5	Coca-Cola India has launched new 250 ml and 750 ml carbonated beverage bottles made from 100% recycled PET (rPET) as part of its initiative to support a circular economy. This launch follows the introduction of a one-litre rPET bottle for its water brand Kinley, and aims to drive consumer awareness about recycling. The rPET bottles are designed to be recyclable and are part of Coca-Cola's broader efforts to reduce plastic waste and enhance sustainability in India. The expansion aligns with Coca-Cola's World Without Waste goal of increasing the recycled content in its packaging.	TRUE, because the launch of 100% recycled PET bottles minimizes environmental impacts, supports a circular economy, and reduces the need for virgin plastic, thereby contributing to sustainability goals.	TRUE, as the introduction of new pack sizes of Coca-Cola® in rPET represents a significant improvement in the company's product offering compared to previous products.	TRUE, because the rPET bottles are designed and manufactured to significantly reduce environmental impact, utilizing recycled materials and promoting recycling.	TRUE, since the manufacturing of these bottles involves recycling PET materials, which minimizes waste and resource consumption while also complying with food safety regulations.	Coca-Cola India	The Coca-Cola Company	100% recycled PET bottles	[{'code': '312111', 'category': 'Soft Drink Manufacturing'}, {'code': '326199', 'category': 'All Other Plastics Product Manufacturing'}, {'code': '325120', 'category': 'Industrial Gas Manufacturing'}, {'code': '424490', 'category': 'Other Grocery and Related Products Merchant Wholesalers'}]	FALSE, because the article presents substantive actions taken by Coca-Cola India to enhance sustainability and does not appear to involve misleading or unsubstantiated claims regarding environmental benefits.	2684
7 R&D insights to future-proof beauty businesses: from Cosmetic 360 - CosmeticsDesign-Europe.com	https://news.google.com/rss/articles/CBMifGh0dHBzOi8vd3d3LmNvc21ldGljc2Rlc2lnbi1ldXJvcGUuY29tL0FydGljbGUvMjAyMy8xMC8yMC83LVItRC1pbnNpZ2h0cy10by1mdXR1cmUtcHJvb2YtYmVhdXR5LWJ1c2luZXNzZXMtZnJvbS1Db3NtZXRpYy0zNjDSAQA?oc=5	The article discusses advancements in sustainable practices within the cosmetics and fragrance industry, focusing on refillable packaging, sustainable ingredient sourcing, and collaborative packaging innovations among major companies. Key points highlight the need for better sustainable packaging, the influence of consumer demand for eco-friendly products, and the importance of addressing water usage and marine impacts. Several companies, including L'Oréal, outline ambitious sustainability targets for 2030. Overall, the industry is showing a commitment to innovation aimed at reducing environmental impacts.	TRUE: The article details various green innovations in the cosmetics industry, such as refillable packaging solutions, sustainable ingredients, and collaborations to reduce plastic use, all of which contribute to environmental sustainability.	TRUE: The article discusses new product developments and collaborative processes within the cosmetics industry, which signify significant improvements from traditional practices and represent novel market offerings.	TRUE: Refillable packaging solutions described in the article meet the definition of a green product by aiming to minimize environmental impact throughout their life cycle and promote recycling.	TRUE: The article mentions green processes such as the research conducted on microbiological risk in refillable packaging, as well as sustainable sourcing and reduced water consumption in manufacturing cosmetics.	Aptar Beauty EMEA, L'Oréal, LVMH, Chanel, J&J, Shiseido, Fondation de la Mer	AptarGroup, Inc.	GAIA refill solution	Likely NAICS Codes: 325620 - Toilet Preparation Manufacturing, 326150 - Urethane and Other Foam Product Manufacturing, 325199 - All Other Basic Organic Chemical Manufacturing, 337127 - Institutional Furniture Manufacturing	FALSE: The article does not appear to be an instance of greenwashing, as it discusses genuine innovations and proactive measures being taken by companies to enhance sustainability in their products and processes, without misleading claims.	2693
Terrapure opens new plastic casing recycling facility in Quebec - Recycling Product News	https://news.google.com/rss/articles/CBMijAFodHRwczovL3d3dy5yZWN5Y2xpbmdwcm9kdWN0bmV3cy5jb20vYXJ0aWNsZS80MDk1Mi90ZXJyYXB1cmVzLW5ldy1wbGFzdGljcy1yZWN5Y2xpbmctZmFjaWxpdHktaGVscHMtY2xvc2UtdGhlLWxvb3AtZm9yLWJhdHRlcnktbWFudWZhY3R1cmVyc9IBAA?oc=5	Terrapure Environmental has opened a new plastics recycling facility at its battery recycling plant in Ville de Sainte-Catherine, which is the largest of its kind in Canada. This facility recycles plastic battery casings for reuse in new products, supporting a circular economy and reducing greenhouse gas emissions. The company has invested close to $30 million in this facility and can produce approximately 10,000 tonnes of recycled polypropylene pellets annually, significantly contributing to environmental sustainability. Terrapure employs over 40 skilled employees across its facilities, showcasing its commitment to both operational growth and environmental protection.	TRUE: This is green innovation because the facility contributes to the circular economy by recycling plastic waste, reduces greenhouse gas emissions, and conserves natural resources.	TRUE: This is a business innovation as it introduces a new and improved process for recycling plastics that differs significantly from the firm's previous operations and is brought into use.	TRUE: The recycled polypropylene pellets produced from plastic battery casings meet the definition of a green product as they significantly reduce environmental impact throughout their life cycle.	TRUE: The recycling process outlined, which minimizes waste and reduces energy consumption while recovering valuable materials, qualifies as a green process.	Terrapure Environmental	Terrapure Environmental	recycling process	Likely NAICS Codes: 336320 - Battery Manufacturing, 562920 - Materials Recovery Facilities, 325211 - Plastics Material and Resin Manufacturing, 811219 - Other Electronic and Precision Equipment Repair and Maintenance	FALSE: The article does not appear to be an example of greenwashing as it provides specific details regarding the environmental benefits and operational practices of Terrapure Environmental without misleading claims.	1882
Manhattan views, s'mores and campfires: how to go glamping in NYC - National Geographic	https://news.google.com/rss/articles/CBMiUGh0dHBzOi8vd3d3Lm5hdGlvbmFsZ2VvZ3JhcGhpYy5jb20vdHJhdmVsL2FydGljbGUvaG93LXRvLWdvLWdsYW1waW5nLWluLW5ldy15b3Jr0gEA?oc=5	Collective Retreats provides a unique escape on Governors Island, offering glamping accommodations and a tranquil environment just minutes from Manhattan. The site, transformed from a former car park, also emphasizes sustainability through projects like the Billion Oyster Project and Circular Economy Manufacturing. Guests enjoy various activities, local food options, and stunning views, making it a favored getaway for New Yorkers seeking a break from city life. With its focus on natural surroundings and rustic charm, Collective Retreats allows guests to connect with nature while experiencing a touch of luxury.	TRUE, because Collective Retreats promotes sustainability by utilizing a previously developed space, engaging in eco-friendly projects, and providing a low-impact retreat experience that minimizes environmental harm.	TRUE, as Collective Retreats presents a unique business model focused on temporary glamping accommodations that represent a significant development in hospitality and leisure services compared to traditional hotel offerings.	TRUE, the glamping accommodations provided by Collective Retreats are designed with sustainability in mind, offering environmentally conscious lodging that minimizes impact compared to conventional hotels.	TRUE, Collective Retreats employs processes that emphasize resource conservation and minimal environmental impact, particularly through the use of previously developed land and supporting local sustainable projects.	Collective Retreats	Collective Retreats, Inc.	glamping accommodations	Likely NAICS Codes: 721199 - All Other Traveler Accommodation, 713990 - All Other Amusement and Recreation Industries, 711190 - Other Performing Arts Companies, 541620 - Environmental Consulting Services	FALSE, because the article does not suggest that Collective Retreats is misrepresenting its sustainability practices; rather, it highlights genuine efforts towards environmental consciousness and responsible tourism.	2431
Growing e-waste an opportunity for manufacturers: Tech product makers - The Economic Times	https://news.google.com/rss/articles/CBMiigFodHRwczovL20uZWNvbm9taWN0aW1lcy5jb20vdGVjaC90ZWNobm9sb2d5L2dyb3dpbmctZS13YXN0ZS1hbi1vcHBvcnR1bml0eS1mb3ItbWFudWZhY3R1cmVycy10ZWNoLXByb2R1Y3QtbWFrZXJzL2FydGljbGVzaG93LzEwNDQyNzE3OC5jbXPSAY4BaHR0cHM6Ly9tLmVjb25vbWljdGltZXMuY29tL3RlY2gvdGVjaG5vbG9neS9ncm93aW5nLWUtd2FzdGUtYW4tb3Bwb3J0dW5pdHktZm9yLW1hbnVmYWN0dXJlcnMtdGVjaC1wcm9kdWN0LW1ha2Vycy9hbXBfYXJ0aWNsZXNob3cvMTA0NDI3MTc4LmNtcw?oc=5	The article discusses the challenges and opportunities associated with the growing issue of e-waste and how technology companies like Dell and Lenovo are addressing this issue by incorporating recycling and sustainability strategies into their operations. Dell employs closed-loop strategies to create new products from recycled materials, while Lenovo focuses on asset recovery services and the use of recycled materials in product design. Both companies emphasize the importance of consumer participation in recycling efforts and set ambitious goals to reduce their carbon footprint and promote a circular economy.	TRUE. The article discusses sustainable practices by technology companies that aim to reduce e-waste and environmental impacts through recycling, sustainable design, and promoting a circular economy.	TRUE. The article describes how Dell and Lenovo have introduced new practices around product design, recycling, and asset recovery services that differ significantly from their previous operations, aligning with the definition of business innovation.	TRUE. The products described, such as those incorporating recycled materials and designed for energy efficiency, fit the comprehensive definition of a green product due to their reduced environmental impact throughout their life cycle.	TRUE. The processes mentioned, including the closed-loop recycling strategies and the asset recovery services, aim to minimize environmental impacts and promote sustainability, thereby fitting the definition of a green process.	Dell Technologies, Lenovo	Dell Technologies Inc.	Closed-Loop Recycling Strategies, Asset Recovery Services	Likely NAICS Codes: 334111 - Electronic Computer Manufacturing, 335999 - All Other Miscellaneous Electrical Equipment and Component Manufacturing, 811211 - Consumer Electronics Repair and Maintenance, 561790 - Other Services to Buildings and Dwellings	FALSE. The article does not describe misleading or exaggerated claims about environmental benefits; instead, it provides concrete examples of companies actively engaging in sustainable practices and addressing e-waste responsibly.	1890
Electricity-Free Microfiber Filters - Trend Hunter	https://news.google.com/rss/articles/CBMiMGh0dHBzOi8vd3d3LnRyZW5kaHVudGVyLmNvbS90cmVuZHMvcGxhbmV0Y2FyZS0yMNIBNGh0dHBzOi8vd3d3LnRyZW5kaHVudGVyLmNvbS9hbXAvdHJlbmRzL3BsYW5ldGNhcmUtMjA?oc=5	The PlanetCare 2.0 microfiber filter is an aftermarket solution designed to prevent clothing fibers from polluting waterways by trapping up to 98% of microfibers in drainage. This electricity-free filter promotes a circular economy by allowing consumers to send back used filters for recycling into new products. It empowers consumers to contribute to reducing water contamination effectively. The product presents disruptive innovation opportunities in home appliances, sustainable fashion, and waste management industries.	TRUE: The PlanetCare 2.0 microfiber filter contributes to environmental sustainability by preventing microfiber pollution in waterways and promoting recycling, thereby reducing negative environmental externalities.	TRUE: The PlanetCare 2.0 microfiber filter is a new product that differs significantly from previous offerings in the market and it has been introduced to address microfiber contamination, qualifying it as a business innovation.	TRUE: The PlanetCare 2.0 filter is designed to significantly reduce environmental impact by minimizing microfiber pollution and promoting recycling, making it a green product.	TRUE: The process involved in the recycling of used microfiber filters into new products demonstrates a method that minimizes environmental impacts and promotes sustainability.	PlanetCare	PlanetCare	PlanetCare 2.0 microfiber filter	Likely NAICS Codes: 335220 - Home Appliances, 339999 - All Other Miscellaneous Manufacturing, 562920 - Materials Recovery Facilities, 812320 - Drycleaning and Laundry Services	FALSE: The article does not suggest any misleading information or exaggeration regarding the environmental benefits of the PlanetCare 2.0 microfiber filter, therefore it is not an example of greenwashing.	1686
Recommerce now worth £7bn to UK economy - just-style.com	https://news.google.com/rss/articles/CBMiaGh0dHBzOi8vd3d3Lmp1c3Qtc3R5bGUuY29tL25ld3Mvc2lnbmFsLXR3by10aGlyZHMtb2YtZ2VuLXotY29uc3VtZXJzLXByZWZlci1zZWNvbmQtaGFuZC10by1uZXctcHJvZHVjdHMv0gEA?oc=5	Recent data shows that UK consumers are increasingly embracing the 'recommerce economy', spending approximately £5.92 billion on second-hand products and £1.07 billion on rentals over the past year. The trend is driven primarily by Gen Z consumers, with significant growth in the resale apparel market and increased mentions of 'circular economy' in apparel company filings. Factors such as cost of living and sustainability concerns are influencing this shift towards purchasing second-hand items. Industry experts highlight that the boom in recommerce presents opportunities for retailers to adapt and cater to changing consumer preferences for sustainable shopping.	TRUE - The article describes a shift towards purchasing second-hand items and renting products, which significantly reduces resource consumption, promotes sustainability, and supports the circular economy by extending product life cycles and minimizing waste.	TRUE - The rise of the recommerce economy represents a new business model that significantly differs from traditional retail processes, as it involves the sale and rental of previously owned goods, thus introducing an improved business process.	TRUE - Second-hand items are considered green products as they are reused in a way that reduces environmental impact, conserves resources, and minimizes waste.	TRUE - The processes involved in the recommerce economy, including the renting and reselling of used products, minimize environmental impacts and promote sustainability by conserving resources and reducing waste.	company not identified	company not identified	product or process not identified	Likely NAICS Codes: 453310 - Used Merchandise Stores, 532290 - Other Commercial and Industrial Machinery and Equipment Rental and Leasing, 423990 - Other Miscellaneous Durable Goods Merchant Wholesalers, 448190 - Other Clothing Stores.	FALSE - The article does not appear to contain deceptive marketing tactics; instead, it provides genuine data supporting the shift towards sustainable practices among consumers without exaggerating or misleading about environmental benefits.	3034
‘Circular design’ gives e-waste a second life - Gadget	https://news.google.com/rss/articles/CBMiJGh0dHBzOi8vZ2FkZ2V0LmNvLnphL2V3YXN0ZW1hdGVyaWFsL9IBKmh0dHBzOi8vZ2FkZ2V0LmNvLnphL2V3YXN0ZW1hdGVyaWFsLz9hbXA9MQ?oc=5	The article emphasizes the importance of designing technology for a circular economy and reducing electronic waste (e-waste). Dell Technologies aims to incorporate sustainable materials, extend product life, and enhance recyclability to mitigate environmental impacts. Their commitment includes recovering used electronics and employing closed-loop strategies to recycle materials for new products. The article underscores collective efforts to drive a circular economy and promote responsible e-waste management.	TRUE, because it outlines Dell Technologies' practices that significantly reduce environmental impacts through sustainable material usage, recycling, and promoting circular economy principles.	TRUE, because the article discusses new processes and goals in product design and manufacturing that improve sustainability, which constitutes a significant improvement over previous practices.	TRUE, as Dell's products are designed using environmentally benign materials and processes that reduce their lifecycle environmental impact, fitting the definition of a green product.	TRUE, since Dell employs methods in their manufacturing that focus on minimizing waste, conserving natural resources, and using renewable materials in production.	Dell Technologies	Dell Technologies Inc.	closed-loop plastics, closed-loop rare earth magnets, and hydropower aluminium	Likely NAICS Codes: 334111 - Electronic Computer Manufacturing, 334118 - Computer Terminal and Other Computer Peripheral Equipment Manufacturing, 423430 - Computer and Computer Peripheral Equipment and Software Merchant Wholesalers, 811212 - Computer and Office Machine Repair and Maintenance.	FALSE, as the article provides verifiable commitments and actions by Dell Technologies towards sustainability and circular economy principles, without deceptive claims.	2078
