title	link	summary	green_innovation	business_innovation	green_product	green_process	company	official_company_name	product_or_process	likely_naics_codes	greenwashing	total_tokens
Waste to Energy: Waste-to-Energy in a Circular Economy: Friend or Foe? | WMW - Waste Management World	https://news.google.com/rss/articles/CBMiZ2h0dHBzOi8vd2FzdGUtbWFuYWdlbWVudC13b3JsZC5jb20vd2FzdGUtdG8tZW5lcmd5L3dhc3RlLXRvLWVuZXJneS1pbi1hLWNpcmN1bGFyLWVjb25vbXktZnJpZW5kLW9yLWZvZS_SAQA?oc=5	The article discusses the European Union's goals for reducing landfill waste and emphasizes the importance of recycling and waste-to-energy plants as alternatives to landfills. It highlights the need for better waste sorting and legislation to ensure that recyclable materials are not incinerated. The article argues for enhanced recycling rates and innovations, particularly for plastics, to minimize waste and dependence on fossil fuels. It also mentions the potential for waste-to-energy processes to contribute to energy independence.	TRUE: The discussions in the article reflect efforts towards sustainability through recycling improvements and waste-to-energy solutions, which align with green innovation goals.	FALSE: The article does not mention a specific new or improved product or business process that is being marketed as an innovation.	FALSE: The article does not identify a specific good or service that meets the criteria for a green product.	TRUE: The article describes the process of waste-to-energy and improved recycling methods, which aim to minimize environmental impacts and promote sustainability.	company not identified	company not identified	waste-to-energy process	['562213 - Solid Waste Combustors and Energy Recovery Systems', '562112 - Hazardous Waste Collection', '562920 - Materials Recovery Facilities', '562211 - Hazardous Waste Treatment and Disposal']	FALSE: The article does not present misleading claims about environmental benefits; rather, it discusses legitimate efforts and practices aimed at reducing environmental impact.	1902
8 Circular Economy Examples - Causeartist	https://news.google.com/rss/articles/CBMiOGh0dHBzOi8vd3d3LmNhdXNlYXJ0aXN0LmNvbS84LWNpcmN1bGFyLWVjb25vbXktZXhhbXBsZXMv0gEA?oc=5	The article discusses the circular economy as a sustainable approach that emphasizes minimizing waste and maximizing resource use through practices like upcycling, closed-loop recycling, and sharing economies. It highlights various examples such as upcycled fashion, electronic waste recycling, reusable packaging, and food waste reduction, all of which aim to reduce environmental impacts. The focus is on designing products for longevity and promoting a minimal waste philosophy.	TRUE - The article presents multiple examples of innovations that contribute to environmental sustainability by promoting recycling, reuse, and waste reduction.	TRUE - The article describes various new or improved processes and products that differ significantly from previous market offerings, such as Eileen Fisher's Take Back program and reusable packaging initiatives.	TRUE - The examples mentioned, such as refillable cleaning product bottles and upcycled fashion items, are designed to significantly reduce environmental impact throughout their life cycles.	TRUE - The article illustrates processes that minimize environmental impacts, such as closed-loop recycling, reusable packaging systems, and innovations in waste reduction.	Patagonia, Eileen Fisher, Apple, Fairphone, Method, Plaine Products, TerraCycle, Loop, RePack, Too Good To Go, FriendWithA, Zipcar, Turo, Kitchen United.	company not identified	upcycled fashion, closed-loop textile recycling, reusable packaging, food waste reduction, biomaterials in 3D printing.	Likely NAICS Codes: 448120 - Women's Clothing Stores, 334118 - Computer Terminal and Other Computer Peripheral Equipment Manufacturing, 325611 - Soap and Other Detergent Manufacturing, 562920 - Materials Recovery Facilities	FALSE - The article does not suggest misleading claims about environmental benefits; instead, it provides genuine examples of sustainable practices in various industries.	2205
What’s inside this sleeping bag’s ‘Endless Promise’? - GreenBiz	https://news.google.com/rss/articles/CBMiS2h0dHBzOi8vd3d3LmdyZWVuYml6LmNvbS9hcnRpY2xlL3doYXRzLWluc2lkZS1zbGVlcGluZy1iYWdzLWVuZGxlc3MtcHJvbWlzZdIBAA?oc=5	Nemo Equipment has introduced the Forte Endless Promise sleeping bag, designed for full recyclability and made predominantly from recycled polyester. The company emphasizes circular economy practices by partnering with recycling firms and ensuring sustainable product design. As part of its sustainability initiative, Nemo encourages users to recycle and trade in their products while providing educational resources. This approach positions Nemo as a leader in outdoor gear sustainability, focusing on minimizing environmental impact throughout the product's lifecycle.	TRUE, because the innovation significantly reduces environmental impact by ensuring the sleeping bag is fully recyclable and made from predominantly recycled materials, supporting a circular economy.	TRUE, as Nemo Equipment introduces an improved product that is distinct from previous offerings, specifically designed with circular economy principles in mind and successfully marketed to consumers.	TRUE, because the Forte sleeping bag is designed to have a reduced environmental impact through sustainable production processes and is fully recyclable, aligning with the definition of a green product.	TRUE, as Nemo's approach to product design and recycling partnerships demonstrates methods aimed at minimizing environmental impacts and promoting sustainability.	Nemo Equipment	Nemo Equipment, LLC	Forte Endless Promise sleeping bag	Likely NAICS Codes: 339920 - Sporting and Athletic Goods Manufacturing; 315210 - Cut and Sew Apparel Manufacturing; 325211 - Plastics Material and Resin Manufacturing; 811420 - Reupholstery and Furniture Repair	FALSE, because the article provides substantive details about Nemo's genuine efforts and commitments to sustainability, including product design for recyclability and partnerships to enable proper material recovery, which contrasts with deceptive greenwashing practices.	3423
Enhancing waste resource efficiency: circular economy for sustainability and energy conversion - Frontiers	https://news.google.com/rss/articles/CBMiP2h0dHBzOi8vd3d3LmZyb250aWVyc2luLm9yZy9hcnRpY2xlcy8xMC4zMzg5L2ZlbnZzLjIwMjMuMTMwMzc5MtIBAA?oc=5	This study examines optimizing waste resource efficiency through the Circular Economy (CE) framework, emphasizing waste treatment practices in Poland and potential energy conversion methods. It highlights the importance of developing waste incineration plants and improving biogas production, encouraging strategies for better waste management. The article contends that waste should not merely be seen as disposable but as a valuable resource that can contribute to energy self-sufficiency. The case study of the Orli Staw facility exemplifies innovative approaches to transforming waste into energy while promoting local sustainability.	TRUE, because the article discusses waste management and treatment practices that enhance resource efficiency, promote sustainability, and consider waste as a valuable resource within the Circular Economy framework.	TRUE, as the article examines new processes and practices related to waste management and energy production in Poland, which represent significant improvements to existing business processes.	FALSE, as the article does not specifically describe a tangible good that fits the definition of a green product; rather, it focuses on processes and treatment methods.	TRUE, since the article discusses methods for waste treatment and energy conversion that minimize environmental impacts and promote sustainability through the use of biogas and incineration.	company not identified	company not identified	Orli Staw installation for biogas production	Likely NAICS Codes: 5622 - Waste Treatment and Disposal; 5621 - Waste Collection; 22111 - Hydroelectric Power Generation; 22131 - Electric Power Generation, Transmission and Distribution.	FALSE, as the article does not employ misleading claims about the environmental benefits of products or practices; instead, it rigorously analyzes actual processes related to sustainability and energy recovery.	10152
Meet Heinz Schandl: designing for zero waste - CSIRO	https://news.google.com/rss/articles/CBMiUmh0dHBzOi8vd3d3LmNzaXJvLmF1L2VuL25ld3MvQWxsL0FydGljbGVzLzIwMjMvT2N0b2Jlci96ZXJvLXdhc3RlLWNpcmN1bGFyLWVjb25vbXnSAQA?oc=5	The article discusses Australia's efforts to transition to a circular economy as part of its Circular Economy for Missions initiative, which aims to significantly reduce waste going to landfills by 2030. This approach emphasizes rethinking waste management by promoting recycling and reuse of materials, envisioning a future where used materials are treated as assets rather than waste. The initiative also highlights the economic benefits and environmental impact of adopting circular economy principles across various sectors. Collaborative efforts with government and industry aim to embed these principles into scientific research and policy development.	TRUE. The article presents initiatives focused on reducing waste, promoting recycling, and advocating for a circular economy, all of which contribute to environmental sustainability goals.	TRUE. The article describes new processes and strategies related to waste management and circular economy initiatives that differ from traditional methods, representing a significant improvement in how businesses operate.	FALSE. The article does not explicitly identify a specific good or service that meets the definition of a green product.	TRUE. The article discusses methodologies aimed at minimizing waste and promoting a circular economy, which aligns well with the definition of green processes.	company not identified	company not identified	Circular Economy for Missions	[{'code': '541620', 'category': 'Environmental Consulting Services'}, {'code': '562920', 'category': 'Materials Recovery Facilities'}, {'code': '325311', 'category': 'Nitrogenous Fertilizer Manufacturing'}, {'code': '339999', 'category': 'All Other Miscellaneous Manufacturing'}]	FALSE. The article does not seem to engage in greenwashing; it focuses on genuine initiatives aimed at promoting sustainability and reducing waste within a circular economy framework.	2171
Circular economy: sustainable industry initiatives in Europe – in pictures - The Guardian	https://news.google.com/rss/articles/CBMigwFodHRwczovL3d3dy50aGVndWFyZGlhbi5jb20vZW52aXJvbm1lbnQvZ2FsbGVyeS8yMDIzL29jdC8wNS9jaXJjdWxhci1lY29ub215LXN1c3RhaW5hYmxlLWluZHVzdHJ5LWluaXRpYXRpdmVzLWluLWV1cm9wZS1pbi1waWN0dXJlc9IBAA?oc=5	Luca Locatelli, an Italian photographer, is documenting the circular economy through his work, showcasing practices and initiatives in Europe that promote waste elimination and nature regeneration. His exhibition, The Circle, is displayed at Gallerie d’Italia in Turin until February 18, 2024.	TRUE - This innovation focuses on the circular economy, which aims to reduce waste and regenerate nature, thus contributing to environmental sustainability.	FALSE - The article does not discuss a specific new or improved product or business process that meets the definition of business innovation.	FALSE - The article does not mention a specific good or service that can be classified as a green product.	FALSE - While the concept of the circular economy implies sustainable processes, the article does not specify a particular process that can be classified as a green process.	company not identified	product or process not identified	not found	Likely NAICS Codes: 541920 - Photographic Services, 541410 - Interior Design Services, 711510 - Independent Artists, Writers, and Performers, 999999 - Unclassified Industry	FALSE - The article does not provide misleading information about environmental benefits; it instead documents legitimate practices in the circular economy.	1335
Think that your plastic is being recycled? Think again. - MIT Technology Review	https://news.google.com/rss/articles/CBMiY2h0dHBzOi8vd3d3LnRlY2hub2xvZ3lyZXZpZXcuY29tLzIwMjMvMTAvMTIvMTA4MTEyOS9wbGFzdGljLXJlY3ljbGluZy1jbGltYXRlLWNoYW5nZS1taWNyb3BsYXN0aWNzL9IBZ2h0dHBzOi8vd3d3LnRlY2hub2xvZ3lyZXZpZXcuY29tLzIwMjMvMTAvMTIvMTA4MTEyOS9wbGFzdGljLXJlY3ljbGluZy1jbGltYXRlLWNoYW5nZS1taWNyb3BsYXN0aWNzL2FtcC8?oc=5	The article discusses the challenges and potential solutions to plastic pollution, highlighting the profitability of plastics and the need for policy changes to reduce demand. It mentions various innovative recycling techniques and the role of companies in developing environmentally friendly processes. Examples include processing mixed polymers into useful materials and using engineered microbes to recycle plastics, aiming for a more sustainable approach to plastic waste. Overall, the article emphasizes the importance of innovation and behavioral changes to tackle plastic pollution effectively.	TRUE: The article discusses innovations aimed at reducing plastic pollution and enhancing recycling processes, which contribute to sustainability goals.	FALSE: While it discusses various innovations, it does not identify a specific new or improved product or business process as required by the definition.	FALSE: The article does not explicitly mention a specific product that meets the definition of a green product.	TRUE: The article describes various innovative recycling processes that minimize environmental impacts and promote sustainability.	Carbios	Carbios	recycling process	Likely NAICS Codes: 325199 - All Other Basic Organic Chemical Manufacturing, 326112 - Plastics Packaging Film and Sheet (including Laminated) Manufacturing, 562213 - Solid Waste Combustors and Incinerators, 541714 - Research and Development in Biotechnology (except Nanobiotechnology)	FALSE: The article does not present misleading information about environmental benefits; rather, it addresses real challenges and discusses genuine innovations aimed at solving plastic pollution.	2152
Circular Fashion Revolution: Recycling Medical Scrubs for a Greener Future - EP Magazine	https://news.google.com/rss/articles/CBMid2h0dHBzOi8vZXBvbmxpbmUuY29tL2FydGljbGVzLzIwMjMvMTAvMTAvY2lyY3VsYXItZmFzaGlvbi1yZXZvbHV0aW9uLXJlY3ljbGluZy1tZWRpY2FsLXNjcnVicy1mb3ItYS1ncmVlbmVyLWZ1dHVyZS5hc3B40gEA?oc=5	The article discusses how the healthcare industry is adopting circular fashion practices by recycling medical scrubs to reduce waste and environmental impact. It highlights the challenges of sustainability in scrub production, including resource intensity and pollution from dyes. The article advocates for closing the loop in healthcare through innovative recycling techniques and biodegradable fabrics, thereby promoting a greener future for medical workwear. Overall, it portrays a shift towards sustainable practices that benefit both the environment and patient care.	TRUE - This is green innovation as it emphasizes reducing waste and environmental impact through recycling and using sustainable practices in the production and disposal of medical scrubs.	TRUE - It is a business innovation because it introduces new practices in the healthcare industry for manufacturing and using medical scrubs that significantly differ from traditional disposable practices.	TRUE - The article describes medical scrubs designed with sustainability in mind, focusing on recyclability and using environmentally benign materials.	TRUE - It includes processes such as recycling, using biodegradable fabrics, and on-demand production, which minimize environmental impacts during scrub manufacturing and usage.	company not identified	product or process not identified	not found	Likely NAICS Codes: 621610 - Home Healthcare Services, 812320 - Drycleaning and Laundry Services, 541620 - Environmental Consulting Services, 325110 - Petrochemical Manufacturing	FALSE - The article does not appear to engage in greenwashing as it provides an honest evaluation of the challenges in the production and waste management of medical scrubs while promoting genuine sustainable practices.	2465
Recycling used wood can make a big contribution to net zero, but needs much better coordination - Phys.org	https://news.google.com/rss/articles/CBMiRmh0dHBzOi8vcGh5cy5vcmcvbmV3cy8yMDIzLTEwLXJlY3ljbGluZy13b29kLWJpZy1jb250cmlidXRpb24tbmV0Lmh0bWzSAUVodHRwczovL3BoeXMub3JnL25ld3MvMjAyMy0xMC1yZWN5Y2xpbmctd29vZC1iaWctY29udHJpYnV0aW9uLW5ldC5hbXA?oc=5	A recent study emphasizes the importance of optimizing waste wood usage in the U.K. to meet net zero targets due to an anticipated 170% increase in global wood demand by 2050. The research highlights that currently, too much waste wood is incinerated instead of being recycled into new products, leading to unnecessary carbon emissions. It calls for improved collaboration among industry stakeholders and government policies to enhance circular economy practices and significantly reduce emissions. If implemented, recommendations could lead to a reduction of 78% in carbon emissions by 2050.	TRUE - The article discusses optimizing waste wood usage and enhancing circular economy practices, both of which contribute to environmental sustainability and decarbonization.	TRUE - The article presents new approaches to using waste wood more effectively, which represents an improved business process for the wood product industry.	FALSE - The article does not specifically mention a particular product, focusing instead on processes and practices for using waste wood.	TRUE - The study advocates for improved methods of reusing and recycling wood products, thus minimizing environmental impacts and promoting sustainability.	company not identified	product or process not identified	not found	Likely NAICS Codes: 321113 - Sawmills, 321219 - Reconstituted Wood Product Manufacturing, 337122 - Nonupholstered Wood Household Furniture Manufacturing, 541611 - Administrative Management and General Management Consulting Services	FALSE - The article provides a credible analysis and evidence-based recommendations for improving wood use and does not make misleading claims about environmental benefits.	2310
The plastipelago - New Mandala	https://news.google.com/rss/articles/CBMiLGh0dHBzOi8vd3d3Lm5ld21hbmRhbGEub3JnL3RoZS1wbGFzdGlwZWxhZ28v0gEA?oc=5	The article discusses Indonesia's waste management crisis and the government's adoption of the circular economy as a solution through initiatives like the 'Indonesia Clean from Waste' policy and the establishment of waste banks. It highlights the challenges of integrating informal waste sectors, the risks associated with open incineration of plastics, and the importance of public awareness and access to waste collection services. Additionally, it critiques the perception of waste as a resource without addressing the underlying waste issues, emphasizing the need for a balanced approach. The article advocates for effective waste management systems and social equity in waste management.	TRUE: The article discusses Indonesia's initiative to adopt a circular economy approach to waste management, which aims to reduce waste generation and promote recycling, ultimately contributing to environmental sustainability.	TRUE: The establishment of waste banks under the Indonesia Clean from Waste policy represents a new business model that transforms waste management by allowing citizens to exchange recyclables for money or services.	FALSE: While the article mentions products made from recycling, it does not specifically identify any product that meets the comprehensive definition of a green product.	TRUE: The circular economy strategy implemented by the Indonesian government aims to establish processes that minimize environmental impact through waste reduction and recycling, aligning with the definition of a green process.	company not identified	product or process not identified	not found	Likely NAICS Codes: 562111 - Solid Waste Collection; 562112 - Hazardous Waste Collection; 562119 - Other Waste Collection; 811219 - Other Electronic and Precision Equipment Repair and Maintenance.	FALSE: The article does not appear to be an example of greenwashing as it critically addresses the challenges of waste management practices and the need for genuine systemic change rather than misleading environmental claims.	5324
Catholic Ethical Purchasing Alliance Hosts Immersion at Ethical Textile Production Cooperative - Ignatian Solidarity Network	https://news.google.com/rss/articles/CBMijgFodHRwczovL2lnbmF0aWFuc29saWRhcml0eS5uZXQvYmxvZy8yMDIzLzEwLzAyL2NhdGhvbGljLWV0aGljYWwtcHVyY2hhc2luZy1hbGxpYW5jZS1ob3N0cy1pbW1lcnNpb24tYXQtZXRoaWNhbC10ZXh0aWxlLXByb2R1Y3Rpb24tY29vcGVyYXRpdmUv0gEA?oc=5	The Catholic Ethical Purchasing Alliance (CEPA) hosted an immersion event for leaders from Catholic institutions and workers' rights organizations to explore sustainable purchasing practices. Participants toured facilities that emphasize ethical clothing manufacturing, including organizations that focus on worker rights, sustainability, and circular economy principles. They learned about transparent production processes and the impact of these practices on their institutions and the environment. The event highlighted opportunities for ethical purchasing aligned with protecting workers' rights and the planet.	TRUE - The article discusses initiatives focused on sustainable production practices, worker rights, and circular economy principles, which contribute to environmental sustainability.	TRUE - The article describes innovative business practices in ethical clothing manufacturing that differ significantly from traditional methods, such as worker-owned cooperatives and transparent sourcing.	TRUE - The t-shirts produced by TS Designs are designed and manufactured in a way that significantly reduces environmental impact, supporting ethical and sustainable production processes.	TRUE - The methods used by Material Return and TS Designs involve recycling, waste reduction, and the use of locally sourced materials, which minimize environmental impacts.	TS Designs	TS Designs, Inc.	t-shirt	[{'code': '313210', 'category': 'Textile and Fabric Finishing Mills'}, {'code': '315210', 'category': 'Cut and Sew Apparel Manufacturing'}, {'code': '423320', 'category': 'Brick and Mortar Apparel Merchant Wholesalers'}, {'code': '541613', 'category': 'Marketing Consulting Services'}]	FALSE - The article does not present misleading claims about the environmental benefits; instead, it promotes genuine efforts towards sustainability and ethical labor practices.	2163
Navigating the new beauty and personal care packaging rules - CosmeticsDesign-Europe.com	https://news.google.com/rss/articles/CBMidWh0dHBzOi8vd3d3LmNvc21ldGljc2Rlc2lnbi1ldXJvcGUuY29tL0FydGljbGUvMjAyMy8xMC8yNS9OYXZpZ2F0aW5nLXRoZS1uZXctYmVhdXR5LWFuZC1wZXJzb25hbC1jYXJlLXBhY2thZ2luZy1ydWxlc9IBAA?oc=5	The article discusses upcoming EU and UK regulations aimed at enhancing packaging sustainability in the cosmetics industry, emphasizing the need for brands to adopt eco-friendly practices and improve recycling rates. It highlights the challenges luxury beauty brands face in balancing consumer demand for innovation with environmental sustainability. Notable companies such as Albéa and Quadpack are working on responsible packaging solutions and incorporating recycled materials while addressing compliance with new regulations. The article underscores the importance of accurate data and consumer education to combat misleading environmental claims.	TRUE, because the article discusses various innovations related to sustainable packaging and recycling processes which align with environmental sustainability goals.	TRUE, as the article covers new and improved packaging solutions and operational processes being implemented by cosmetics companies, representing business innovations in response to regulations.	TRUE, since the focus on developing recyclable and refillable packaging solutions characterizes efforts towards creating green products that reduce environmental impact.	TRUE, as the article describes methods being employed for sustainable packaging that minimize waste and energy consumption while promoting recycling.	['Albéa Cosmetics & Fragrance', 'Quadpack']	['Albéa', 'Quadpack']	recyclable and refillable packaging solutions	['325620 - Toilet Preparation Manufacturing', '339999 - All Other Miscellaneous Manufacturing', '322220 - Paper Bag and Coated and Treated Paper Manufacturing', '324121 - Asphalt Paving Mixture and Block Manufacturing']	FALSE, the article provides concrete examples of companies actively working towards sustainability and complying with regulations rather than misleading consumers about their environmental efforts.	2742
