title	link	summary	green_innovation	business_innovation	green_product	green_process	company	official_company_name	product_or_process	likely_naics_codes	greenwashing	total_tokens
CSRWire - STMicroelectronics Publishes 2023 Sustainability Report - CSRwire.com	https://news.google.com/rss/articles/CBMiXmh0dHBzOi8vd3d3LmNzcndpcmUuY29tL3JlcG9ydHMvNzcxODkxL3N0bWljcm9lbGVjdHJvbmljcy1wdWJsaXNoZXMtMjAyMy1zdXN0YWluYWJpbGl0eS1yZXBvcnTSAQA?oc=5	STMicroelectronics' 26th Sustainability Report highlights the company's sustainability performance in 2022, including its goal to become carbon neutral by 2027 and a significant increase in the use of renewable electricity. It reports that 77% of new products were identified as responsible and outlines achievements in reducing greenhouse gas emissions and waste management. The company emphasizes its commitment to sustainability through innovations that support decarbonization and sustainable manufacturing processes. The report is verified by a third party and aligns with various global sustainability standards.	TRUE, because the company is implementing sustainable technologies and processes aimed at reducing environmental impacts and is committed to decarbonization.	TRUE, because STMicroelectronics is introducing improved products and processes that differ significantly from previous offerings and contribute to sustainable practices.	TRUE, because the report identifies new products that are categorized as responsible, aimed at reducing environmental impact throughout their lifecycle.	TRUE, because the company is implementing processes that minimize waste and energy consumption while promoting sustainability in manufacturing.	STMicroelectronics	STMicroelectronics	Not specifically named; refers broadly to 'new products' that are responsible.	Likely NAICS Codes: 334413 - Semiconductor and Related Device Manufacturing, 334419 - Other Electronic Component Manufacturing, 334111 - Electronic Computer Manufacturing, 331491 - Nonferrous Metal (except Aluminum) Rolling, Drawing, and Extruding.	FALSE, because the company appears to provide substantiated information about its sustainability initiatives and performance, aligning with recognized standards.	2696
Coach rolls out Coachtopia, a new line made from material waste - Vogue Business	https://news.google.com/rss/articles/CBMia2h0dHBzOi8vd3d3LnZvZ3VlYnVzaW5lc3MuY29tL3N1c3RhaW5hYmlsaXR5L2NvYWNoLXJvbGxzLW91dC1jb2FjaHRvcGlhLWEtbmV3LWxpbmUtbWFkZS1mcm9tLW1hdGVyaWFsLXdhc3Rl0gEA?oc=5	The article discusses Coach's Coachtopia initiative, which focuses on transforming leather waste into new products through innovative design techniques, like 'designing backwards' to use scraps from production and tanneries. It highlights the creative approach of upcycling waste materials, yet raises questions about Coach's overall commitment to sustainability and circularity in its business model. Creative Director Stuart Vevers notes that the project involves a fresh perspective on design, enhancing the brand's environmental efforts.	TRUE - This is green innovation as it involves minimizing waste and repurposing leather scraps to create new products, thereby supporting sustainability and reducing environmental impact.	TRUE - This is a business innovation as it involves a new approach to product design that significantly differs from Coach's previous practices by using waste materials creatively.	TRUE - The products created from repurposed leather scraps are designed to reduce environmental impact throughout their life cycle, aligning with the definition of a green product.	TRUE - The upcycling method used to create new products from leather waste represents a green process aimed at minimizing environmental impacts in production.	Coach	Coach, Inc.	Coachtopia	Likely NAICS Codes: 316998 - All Other Leather Good and Luggage Manufacturing, 448110 - Men's Clothing Stores, 448120 - Women's Clothing Stores, 423220 - Home Furnishing Merchant Wholesalers.	FALSE - The article does not indicate greenwashing as it discusses genuine efforts to repurpose waste materials and enhance sustainability; however, it does question Coach's overall commitment to meaningful circularity.	1849
Siemens and IBM Collaborate to Accelerate Sustainable Product Development and Operations - IBM Newsroom	https://news.google.com/rss/articles/CBMifGh0dHBzOi8vbmV3c3Jvb20uaWJtLmNvbS8yMDIzLTA0LTE4LVNpZW1lbnMtYW5kLUlCTS1Db2xsYWJvcmF0ZS10by1BY2NlbGVyYXRlLVN1c3RhaW5hYmxlLVByb2R1Y3QtRGV2ZWxvcG1lbnQtYW5kLU9wZXJhdGlvbnPSAQA?oc=5	Siemens Digital Industries and IBM are collaborating to develop a combined software solution aimed at enhancing traceability and supporting sustainable product development by integrating various engineering domains. This collaborative effort seeks to optimize product lifecycles and improve decision-making earlier in the design process, with a focus on sustainability. The software will connect their existing tools for systems engineering and asset management, facilitating a more holistic approach to product development and reducing environmental impacts. The partnership intends to create a digital thread that ensures sustainability practices are incorporated throughout the lifecycle of a product.	TRUE: This represents green innovation as it focuses on sustainable product development, traceability, and optimization of product lifecycles while aiming to reduce environmental impacts.	TRUE: This is considered business innovation as it involves the development of a new, integrated software solution that significantly differs from previous offerings of the participating firms.	FALSE: The article discusses a software solution rather than a specific good or service that meets the definition of a green product.	TRUE: The integrated software solution establishes a green process by optimizing product lifecycle management and reducing resource consumption through improved traceability and sustainable practices.	Siemens Digital Industries and IBM	Siemens AG and IBM Corporation	combined software solution	Likely NAICS Codes: 541511 - Custom Computer Programming Services, 511210 - Software Publishers, 541512 - Computer Systems Design Services, 541618 - Other Management Consulting Services.	FALSE: The article does not indicate greenwashing as it presents a legitimate collaborative effort between companies aimed at improving sustainability and reducing environmental impacts through technology.	2847
Caterpillar | Understanding Our Scope 3 Emissions - Caterpillar Inc	https://news.google.com/rss/articles/CBMiggFodHRwczovL3d3dy5jYXRlcnBpbGxhci5jb20vZW4vY29tcGFueS9zdXN0YWluYWJpbGl0eS9zdXN0YWluYWJpbGl0eS1yZXBvcnQvZm9jdXMtYXJlYXMvbG93ZXItY2FyYm9uLWZ1dHVyZS9zY29wZS0zLWVtaXNzaW9ucy5odG1s0gEA?oc=5	Caterpillar is focused on creating a reduced-carbon future by investing in sustainable products and technologies, committing to make all new products sustainable by 2030. The company emphasizes its remanufacturing options that reduce waste and minimize resource use. Caterpillar calculates its GHG emissions, noting that over 95% are from the use of sold products. The article illustrates the company's commitment to sustainability through its product life extension strategies.	TRUE, because Caterpillar is investing in sustainable products and technologies that aim to meet climate-related objectives and reduce environmental impacts.	TRUE, because Caterpillar is introducing a new generation of products that are significantly more sustainable than their predecessors, which denotes significant improvement in their business processes.	FALSE, because while the commitment to sustainability is evident, specific products that meet the definition of 'green products' are not explicitly named in the text.	TRUE, because Caterpillar's remanufacturing options and practices that enhance product life while minimizing waste illustrate green processes.	Caterpillar	Caterpillar Inc.	Remanufacturing options	Likely NAICS Codes: 333120 - Construction Machinery Manufacturing, 333613 - Mechanical Power Transmission Equipment Manufacturing, 333611 - Turbine and Turbine Generator Set Units Manufacturing, 334511 - Search, Detection, Navigation, Guidance, Aeronautical, and Nautical System and Instrument Manufacturing	FALSE, as there is no evidence in the article to suggest that Caterpillar is making misleading claims about the sustainability of its products or practices; the content reflects genuine efforts towards environmental sustainability.	1725
69 Sustainable Fashion Brands That Are Anything But Boring - ELLE UK	https://news.google.com/rss/articles/CBMiYmh0dHBzOi8vd3d3LmVsbGUuY29tL3VrL2Zhc2hpb24vd2hhdC10by13ZWFyL2cyMjc4ODMxOS9zdXN0YWluYWJsZS1mYXNoaW9uLWJyYW5kcy10by1idXktZnJvbS1ub3cv0gEA?oc=5	The article discusses the evolution of sustainable clothing, highlighting brands and vintage shops that are making planet-friendly fashion choices. It emphasizes tips for online shopping that are more environmentally conscious, such as organizing clothing swaps and investing in timeless pieces. The article also points out brands that reduce their carbon footprint through ethical practices, including using recyclable or biodegradable materials and producing items in limited quantities. Overall, it encourages mindful purchasing and reselling of clothing.	TRUE - The article describes sustainable clothing practices that contribute to reducing the environmental impact of the fashion industry, such as using recycled materials and ethical production methods.	TRUE - The article mentions brands that offer new sustainable clothing options, showcasing improvements in fashion practices that differ from traditional, less sustainable methods.	TRUE - The clothing items mentioned in the article are categorized as green products because they are designed and manufactured in ways that minimize environmental impacts, using biodegradable or recycled materials.	TRUE - The article discusses sustainable production methods like making clothing to order or in small batches, which are processes that aim to reduce waste and environmental impact.	company not identified	company not identified	product or process not identified	Likely NAICS Codes: 315210 - Cut and Sew Apparel Manufacturing, 448120 - Women's Clothing Stores, 448190 - Other Clothing Stores, 541614 - Process, Physical Distribution, and Logistics Consulting Services	FALSE - The article does not appear to engage in greenwashing as it honestly promotes brands that actively seek to minimize their environmental impact through ethical and sustainable practices rather than making misleading claims.	1555
How are Sustainable Creative & Tech Companies Reducing Waste? - Adorama	https://news.google.com/rss/articles/CBMiNGh0dHBzOi8vd3d3LmFkb3JhbWEuY29tL2FsYy9zdXN0YWluYWJsZS10ZWNoLWJyYW5kcy_SAThodHRwczovL3d3dy5hZG9yYW1hLmNvbS9hbGMvc3VzdGFpbmFibGUtdGVjaC1icmFuZHMvYW1wLw?oc=5	The article discusses various tech and creative companies that are implementing environmentally friendly practices and producing sustainable products, highlighting their commitments to reducing carbon footprints and using recycled materials. It showcases examples such as HP's use of ocean-bound plastic, Logitech's recycled components in products, and Samsung's renewable energy initiatives. Other brands are recognized for innovative measures such as tree planting and conservation efforts. Overall, these companies are contributing to a shift towards more sustainable technology.	TRUE: The article highlights various companies and their initiatives that significantly reduce environmental impacts and promote sustainability through innovative practices and eco-friendly products.	TRUE: The article outlines new or improved products and processes that differ significantly from the firms' previous offerings, showing their introduction into the market.	TRUE: The products discussed in the article are designed and manufactured to minimize environmental impact, incorporate recycled materials, and help conserve natural resources.	TRUE: The companies mentioned are employing processes that minimize waste and environmental impact, such as using renewable energy and recycling materials in production.	HP, Logitech, Samsung, Acer, Sony, Canon, Microsoft, Nikon, Fujifilm, Lowepro, Peak Design, Pacsafe, Core SWX	Various Companies	Various eco-friendly products and sustainable practices	Likely NAICS Codes: 334111 - Electronic Computer Manufacturing, 334210 - Telephone Apparatus Manufacturing, 334220 - Radio and Television Broadcasting and Wireless Communications Equipment Manufacturing, 326199 - All Other Plastics Product Manufacturing	FALSE: The article provides substantial information on genuine environmental efforts and innovations by the companies discussed, without making misleading claims about their sustainability efforts.	3455
Winbond Sets Global Sustainability Standard with Sustainability Initiatives and Products - PR Newswire	https://news.google.com/rss/articles/CBMikAFodHRwczovL3d3dy5wcm5ld3N3aXJlLmNvbS9uZXdzLXJlbGVhc2VzL3dpbmJvbmQtc2V0cy1nbG9iYWwtc3VzdGFpbmFiaWxpdHktc3RhbmRhcmQtd2l0aC1zdXN0YWluYWJpbGl0eS1pbml0aWF0aXZlcy1hbmQtcHJvZHVjdHMtMzAxODA3ODA4Lmh0bWzSAQA?oc=5	Winbond Electronics Corporation has reported significant sustainability achievements and outlined aggressive goals for 2023 related to their semiconductor products. Their efforts include using low temperature soldering processes, space-saving techniques in product design, and advancements in ultra-low power consumption to reduce greenhouse gas emissions and conserve resources. The company aims for 90% electricity usage from green energy by 2030 and net zero carbon emissions by 2050. Winbond's sustainability initiatives have garnered numerous awards and recognition in the industry.	TRUE, because Winbond's initiatives and products aim to reduce environmental impact through carbon emission reduction, resource conservation, and the promotion of sustainable practices in their manufacturing and product development processes.	TRUE, because the new and improved semiconductor memory products and processes introduced by Winbond reflect a significant departure from previous offerings, meeting the definition of business innovation.	TRUE, because the flash memory products designed with low temperature soldering and ultra-low power consumption are made with environmentally friendly principles that reduce their overall environmental impact.	TRUE, because Winbond's use of low temperature soldering and energy conservation techniques in production minimizes waste, conserves resources, and reduces harmful emissions.	Winbond Electronics Corporation	Winbond Electronics Corporation	Low Temperature Soldering Process	{'code_1': {'naics_code': '334413', 'category': 'Semiconductor and Related Device Manufacturing'}, 'code_2': {'naics_code': '334412', 'category': 'Bare Printed Circuit Board Manufacturing'}, 'code_3': {'naics_code': '334418', 'category': 'Other Electronic Component Manufacturing'}, 'code_4': {'naics_code': '335999', 'category': 'All Other Miscellaneous Electrical Equipment and Component Manufacturing'}}	FALSE, as Winbond's claims and practices align with their reported sustainability achievements and product innovations, indicating genuine efforts towards reducing environmental impact rather than misleading marketing.	3085
The State of Natural Beauty: Consumers seek innovation, sustainability, quick routines - New Hope Network	https://news.google.com/rss/articles/CBMieWh0dHBzOi8vd3d3Lm5ld2hvcGUuY29tL3BlcnNvbmFsLWNhcmUvdGhlLXN0YXRlLW9mLW5hdHVyYWwtYmVhdXR5LWNvbnN1bWVycy1zZWVrLWlubm92YXRpb24tc3VzdGFpbmFiaWxpdHktcXVpY2stcm91dGluZXPSAQA?oc=5	The beauty and personal care industry is experiencing significant growth driven by the demand for natural products, with consumers increasingly advocating for cleaner, more sustainable options. Brands are innovating to offer inclusive and simplified beauty routines while using environmentally friendly ingredients and packaging. Additionally, consumers are becoming more educated about product ingredients and seeking transparency from brands, highlighting the importance of trust and efficacy in their purchasing decisions. Innovations such as waterless formulations and refillable packaging reflect a shift towards sustainability in personal care.	TRUE - The article discusses various beauty products and processes that prioritize sustainability, such as the use of environmentally friendly ingredients, compostable packaging, and waterless formulations, which contribute to reducing environmental impacts.	TRUE - The article outlines new and improved beauty products and processes that differ significantly from previous offerings, indicating clear business innovation within the beauty industry.	TRUE - The products mentioned are designed and manufactured to reduce environmental impact, utilizing biodegradable materials and promoting sustainable practices.	TRUE - The article describes processes such as waterless formulations and the development of sustainable packaging, which minimize waste and environmental harm.	ACURE	ACURE Organics, Inc.	Brightening Eye Serum Stick	Likely NAICS Codes: 325620 - Toilet Preparation Manufacturing; 446120 - Cosmetics, Beauty Supplies, and Perfume Stores; 339114 - Surgical and Medical Instrument Manufacturing; 424210 - Drugs and Druggists' Sundries Merchant Wholesalers	FALSE - The article does not indicate any misleading claims regarding the environmental benefits of the products; rather, it emphasizes transparency and the genuine push towards sustainability and clean beauty.	3360
Golden Goose Takes A Step Forward In Sustainability Agenda In Honor of Earth Day - vmagazine.com	https://news.google.com/rss/articles/CBMib2h0dHBzOi8vdm1hZ2F6aW5lLmNvbS9hcnRpY2xlL2dvbGRlbi1nb29zZS10YWtlcy1hLXN0ZXAtZm9yd2FyZC1pbi1zdXN0YWluYWJpbGl0eS1hZ2VuZGEtaW4taG9ub3Itb2YtZWFydGgtZGF5L9IBAA?oc=5	Italian brand Golden Goose is advancing its sustainability agenda by opening the Yatay Lab, launching online Repair services, and releasing its annual Sustainability Report. The partnership with Coronet Group focuses on developing circular materials to reduce fashion waste. The company is also expanding its bio-based product line, including the YATAY Model 1B sneaker, and aims for transparency in its sustainability efforts.	TRUE; the initiatives described, including the development of circular materials and the launch of a repair service, contribute to reducing environmental impact and promoting sustainability in fashion.	TRUE; the introduction of new sustainable products and processes, such as the bio-based YATAY Model 1B and online Repair services, represents significant improvements compared to the company's previous offerings.	TRUE; the YATAY Model 1B sneaker is designed with bio-based materials and aims to reduce environmental impact throughout its lifecycle.	TRUE; the opening of the Yatay Lab and the Repair service reflect methods aimed at minimizing environmental impacts and promoting sustainability in production and consumption.	Golden Goose	Golden Goose S.p.A.	YATAY Model 1B	[{'code': '316210', 'category': 'Footwear Manufacturing'}, {'code': '541715', 'category': 'Research and Development in the Physical, Engineering, and Life Sciences (except Nanotechnology and Biotechnology)'}, {'code': '448310', 'category': 'Jewelry, Luggage, and Leather Goods Stores'}, {'code': '423320', 'category': 'Brick, Stone, and Related Construction Material Merchant Wholesalers'}]	FALSE; the article outlines genuine efforts towards sustainability, such as collaborating with a material innovation company and enhancing transparency, rather than misleading claims about environmental benefits.	1964
Sustainable Cosmetics Summit Returns to New York on May 4 & 5 - Happi	https://news.google.com/rss/articles/CBMiYGh0dHBzOi8vd3d3LmhhcHBpLmNvbS9icmVha2luZy1uZXdzL3N1c3RhaW5hYmxlLWNvc21ldGljcy1zdW1taXQtcmV0dXJucy10by1uZXcteW9yay1vbi1tYXktNC01L9IBAA?oc=5	The Sustainable Cosmetics Summit is returning to North America in May 2023, focusing on sustainability innovations in the beauty industry. Topics include the use of green materials, new technologies, and efforts to decarbonize supply chains, with participation from industry experts and various companies. The summit will also feature case studies on sustainable product innovations, highlighting companies like Myro and L’Occitane Group. Overall, the event emphasizes how the cosmetic industry is moving towards sustainability and circularity.	TRUE: The article discusses an event focused on sustainability innovations in the cosmetics industry, which aligns with green innovation by promoting eco-friendly materials and practices.	TRUE: The article outlines various innovations and discussions at the summit that involve new products and business processes in the beauty industry.	TRUE: Various products discussed, such as sustainable refillable deodorants by Myro, meet the criteria for green products by significantly reducing environmental impact.	TRUE: The article mentions processes such as upcycling waste and using frictionless technology for zero waste systems, which are considered green processes.	L’Occitane Group	L'Occitane en Provence	sustainable refillable products	Likely NAICS Codes: 324121 - Asphalt Paving Mixture and Block Manufacturing; 325620 - Soap and Other Detergent Manufacturing; 423850 - Service Establishment Equipment and Supplies Merchant Wholesalers; 541613 - Marketing Consulting Services	FALSE: The article does not present misleading information about environmental benefits, but rather focuses on genuine sustainability efforts within the cosmetics industry.	1923
The Role of a Chief Sustainability Officer Is Bigger than ESG Reporting - IndustryWeek	https://news.google.com/rss/articles/CBMinQFodHRwczovL3d3dy5pbmR1c3RyeXdlZWsuY29tL2xlYWRlcnNoaXAvc3RyYXRlZ2ljLXBsYW5uaW5nLWV4ZWN1dGlvbi9hcnRpY2xlLzIxMjY0Nzc3L3RoZS1yb2xlLW9mLWEtY2hpZWYtc3VzdGFpbmFiaWxpdHktb2ZmaWNlci1pcy1iaWdnZXItdGhhbi1lc2ctcmVwb3J0aW5n0gEA?oc=5	The article emphasizes the importance of integrating sustainability into business strategies, highlighting collaboration among key roles to leverage technology and create competitive advantages. It stresses the need for companies to quantify and monetize sustainability efforts, ensuring they contribute to customer success and overall business growth. Examples of companies like Unilever are mentioned, showcasing successful sustainable brand growth.	TRUE: The article discusses sustainable business practices that significantly enhance environmental impact through collaboration and monetization, aligning with green innovation principles.	TRUE: The text highlights new strategic initiatives and collaborative efforts that enhance business processes and models, demonstrating significant innovation in how companies approach sustainability.	FALSE: The article does not discuss a specific green product or service; instead, it focuses on overall sustainability strategies and business models.	FALSE: While the article mentions sustainable practices, it does not detail a specific green process that relates to production or operational methods.	Unilever	Unilever	product or process not identified	Likely NAICS Codes: 541611 - Administrative Management and General Management Consulting Services, 312199 - All Other Food Manufacturing, 333999 - All Other Miscellaneous General Purpose Machinery Manufacturing, 541618 - Other Management Consulting Services	FALSE: The article does not appear to be an example of greenwashing as it focuses on genuine sustainability initiatives and the strategic importance of integrating those efforts into core business models.	1881
Should fashion opt out of Earth Day? - Vogue Business	https://news.google.com/rss/articles/CBMiUGh0dHBzOi8vd3d3LnZvZ3VlYnVzaW5lc3MuY29tL3N1c3RhaW5hYmlsaXR5L3Nob3VsZC1mYXNoaW9uLW9wdC1vdXQtb2YtZWFydGgtZGF50gEA?oc=5	The article discusses the evolution of Earth Day from being an important environmental platform to feeling more like a consumerist event. Alex McIntosh, a creative director at Create Sustain, expresses concern about the commercialization of Earth Day and the dilution of its original intent.	FALSE - The article discusses perceptions of Earth Day rather than presenting any specific green innovation.	FALSE - The article does not mention any specific new or improved products or business processes.	FALSE - There is no mention of a specific good or service that qualifies as a green product.	FALSE - The article does not describe any specific method or technique that qualifies as a green process.	company not identified	company not identified	product or process not identified	Likely NAICS Codes: 541618 - Other Management Consulting Services, 541613 - Marketing Consulting Services, 541612 - Human Resources Consulting Services, 813312 - Environment, Conservation and Wildlife Organizations	TRUE - The article implies that Earth Day is being used for consumerism, which reflects greenwashing by promoting environmental themes without actual commitment to sustainability.	1322
