title	link	summary	green_innovation	business_innovation	green_product	green_process	company	official_company_name	product_or_process	likely_naics_codes	greenwashing	total_tokens
KBIS exhibitors don’t water down their zeal for sustainability - www.designerstoday.com	https://news.google.com/rss/articles/CBMiamh0dHBzOi8vd3d3LmRlc2lnbmVyc3RvZGF5LmNvbS9raXRjaGVuLWJhdGgva2Jpcy1leGhpYml0b3JzLWRvbnQtd2F0ZXItZG93bi10aGVpci16ZWFsLWZvci1zdXN0YWluYWJpbGl0eS_SAQA?oc=5	At the recent KBIS show in Las Vegas, exhibitors showcased a range of sustainable innovations, focusing on water conservation and waste reduction in kitchen and bathroom products. Among the highlights were Beko's Harvest Fresh refrigerator and Moen's Smart Shower features, which promote efficiency and sustainability. Customization was another significant trend, with companies like LG Studio offering refrigerators with changeable color panels and Häcker Kitchens vastly expanding cabinet color options. Companies are increasingly blending design and eco-consciousness in their product offerings.	TRUE, because the innovations discussed, such as water-saving features and energy-efficient appliances, contribute to environmental sustainability and minimize negative environmental impacts.	TRUE, because the article mentions new and improved products and processes introduced in the market, demonstrating significant advancements in design, functionality, and sustainability.	TRUE, because many products introduced, such as the Harvest Fresh refrigerator and water-conserving faucets, are designed to reduce environmental impacts and promote sustainability.	TRUE, because the innovations described, like Moen's water-saving technologies and energy-efficient designs, involve processes that minimize environmental impact.	Beko Home Appliances USA, Moen, RainStick, Niagara, Kohler, LG Studio, Häcker Kitchens, Duravit, GE Café.	Beko Home Appliances USA	Harvest Fresh refrigerator, Smart Shower, Apphia smart faucet.	Likely NAICS Codes: 335220 - Major Household Appliance Manufacturing, 337110 - Wood Kitchen Cabinet and Countertop Manufacturing, 332211 - Cutlery and Handtool Manufacturing, 327390 - Other Concrete Product Manufacturing.	FALSE, as the article does not indicate any misleading claims about environmental benefits; rather, it discusses tangible innovations aimed at sustainability.	2675
Pure Harvest enters strategic partnership with Saudi's NADEC - Gulf Business	https://news.google.com/rss/articles/CBMiQWh0dHBzOi8vZ3VsZmJ1c2luZXNzLmNvbS9wdXJlLWhhcnZlc3QtcGFydG5lcnMtd2l0aC1zYXVkaXMtbmFkZWMv0gEA?oc=5	Pure Harvest Smart Farms has partnered with Saudi's National Agricultural Development Company (Nadec) on a food security project that will utilize climate-controlled systems to produce sustainably-grown, pesticide-free fruits and vegetables. The project aims to expand production capacity in Saudi Arabia while reducing water consumption and improving yields through sustainable solutions for local farmers. This initiative seeks to enhance food security and promote sustainability within the GCC region.	TRUE: The partnership promotes environmental sustainability by utilizing climate-controlled systems to grow crops sustainably and minimize water usage, contributing to food security and responsible resource management.	TRUE: The collaboration introduces new agricultural practices and controlled-environment farming, significantly differing from previous food production methods and providing an innovative approach to supplying fresh produce.	TRUE: The sustainably-grown, pesticide-free fruits and vegetables produced by Pure Harvest meet the criteria for green products as they are designed to minimize environmental impacts throughout their life cycle.	TRUE: The climate-controlled hybrid food production systems and sustainable practices employed by Pure Harvest represent a green process as they minimize water consumption and enhance sustainability in agriculture.	Pure Harvest Smart Farms	Pure Harvest Smart Farms	climate-controlled hybrid food production systems	[{'code': '111998', 'category': 'All Other Miscellaneous Crop Farming'}, {'code': '333241', 'category': 'Food Product Machinery Manufacturing'}, {'code': '541715', 'category': 'Research and Development in the Physical, Engineering, and Life Sciences (except Nanotechnology and Biotechnology)'}, {'code': '311991', 'category': 'Perishable Prepared Food Manufacturing'}]	FALSE: The article does not suggest any misleading claims about environmental benefits; rather, it describes genuine efforts aimed at sustainability and food security.	1925
Blinkit to Expand Dark Store by 40 pc over Next 1 yr - Indian Retailer	https://news.google.com/rss/articles/CBMiUmh0dHBzOi8vd3d3LmluZGlhbnJldGFpbGVyLmNvbS9uZXdzL2JsaW5raXQtZXhwYW5kLWRhcmstc3RvcmUtNDAtcGMtb3Zlci1uZXh0LTEteXLSAQA?oc=5	Quick commerce player Blinkit plans to expand its micro-fulfillment centers, targeting a 30-40% increase in store count over the next year. The CEO mentioned the importance of data in identifying high-potential neighborhoods for new stores and noted the growth in revenue despite no expansion in dark store footprint. Advertising revenue is expected to significantly drive revenue per order, with a new self-serve advertising platform launched for brands. Blinkit is becoming a preferred platform for over 500 brands to enhance awareness and sales through performance advertising.	FALSE; the article does not describe any significant innovative practices aimed at reducing environmental impact.	TRUE; the expansion of Blinkit's micro-fulfillment centers constitutes a new business process that significantly differs from its previous operations.	FALSE; the article does not discuss any specific product designed to reduce environmental impact.	FALSE; while the company is expanding processes, the article does not detail any methods that minimize environmental impact.	Blinkit	Blinkit Pvt Ltd	product or process not identified	Likely NAICS Codes: 4441 - Grocery Stores, 5191 - Other Information Services, 8129 - Other Personal Services, 5415 - Computer Systems Design and Related Services	FALSE; the article does not present misleading information about environmental benefits but rather focuses on business growth and strategy.	1869
Nadec & Pure Harvest Smart Farms announce strategic partnership to deliver high-quality, locally grown fresh produce - Saudi Gazette	https://news.google.com/rss/articles/CBMiLmh0dHBzOi8vd3d3LnNhdWRpZ2F6ZXR0ZS5jb20uc2EvYXJ0aWNsZS82Mjk0NDnSAQA?oc=5	Nadec has partnered with Pure Harvest Smart Farms to launch a national food security project in Saudi Arabia, focusing on year-round production of high-quality, locally grown, pesticide-free produce using high-tech, climate-controlled systems. This collaboration aims to improve food security and water conservation while aligning with Saudi Vision 2030. The innovative farming methods utilize renewable energy and minimize water usage, contributing to sustainability in the region. The project underscores a commitment to provide fresh produce and support local farmers with sustainable solutions.	TRUE - This is green innovation as it significantly reduces environmental impact by using climate-controlled systems that minimize water usage, eliminate pesticides, and integrate renewable energy, thus contributing to greater sustainability in agriculture.	TRUE - This constitutes a business innovation since it introduces a new method of food production via advanced farming techniques that differ significantly from traditional agricultural practices.	TRUE - The produce cultivated via this method is a green product as it is designed to have reduced environmental impacts, being locally grown, pesticide-free, and produced sustainably.	TRUE - The farming system implemented by Pure Harvest qualifies as a green process, as it utilizes sustainable agricultural practices, energy-efficient technology, and reduces resource consumption.	National Agricultural Development Company (Nadec)	National Agricultural Development Company (Nadec)	high-tech, climate-controlled hybrid food production systems	Likely NAICS Codes: 111340 - Greenhouses, 311111 - Vegetable and Melon Farming, 541711 - Research and Development in Biotechnology, 921120 - Public Administration, Food Safety and Inspection Programs	FALSE - The article does not exhibit characteristics of greenwashing, as it presents a genuine effort towards sustainable agricultural practices, without falsely claiming environmental benefits.	2493
Top 20 Best Consumer Goods Companies In India 2023 - Inventiva	https://news.google.com/rss/articles/CBMiSWh0dHBzOi8vd3d3LmludmVudGl2YS5jby5pbi90cmVuZHMvdG9wLWNvbnN1bWVyLWdvb2RzLWNvbXBhbmllcy1pbi1pbmRpYS_SAQA?oc=5	The article discusses the top 20 consumer goods companies in India for 2023, highlighting their market positions, product innovations, and commitments to sustainability. It emphasizes their resilience and adaptability in a competitive environment and the expected growth of the consumer goods sector driven by changing consumer preferences. Each company mentioned is noted for its strong brand presence and various sustainability initiatives. Overall, the landscape reflects an evolving market influenced by innovation and corporate social responsibility.	TRUE, because the companies mentioned have undertaken various initiatives to reduce their environmental footprint and promote sustainability through waste reduction, water conservation, and carbon footprint reduction.	TRUE, as the article highlights new product introductions and innovations by these companies that significantly differ from their previous offerings.	TRUE, because the products discussed are designed, manufactured, and used in ways that significantly reduce their environmental impact throughout their life cycle.	TRUE, as the companies implement processes that minimize environmental impacts, promote sustainability, reduce waste, and conserve natural resources.	Hindustan Unilever Ltd.	Hindustan Unilever Limited	Nestle A+ Milk Veggie Nutri Mix	Likely NAICS Codes: 311 - Food Manufacturing, 325 - Chemical Manufacturing, 424 - Merchant Wholesalers, Durable Goods, 446 - Health and Personal Care Stores	FALSE, as the article provides substantial evidence of the companies' genuine efforts toward sustainability and innovation, rather than misleading claims.	7308
Top 20 Nanotechnology Companies In India 2023 - Inventiva	https://news.google.com/rss/articles/CBMiSGh0dHBzOi8vd3d3LmludmVudGl2YS5jby5pbi90cmVuZHMvdG9wLTIwLW5hbm90ZWNobm9sb2d5LWNvbXBhbmllcy0yMDIzL9IBAA?oc=5	The article discusses various Indian companies engaged in the nanotechnology industry and highlights their focus on innovation, sustainability, and the development of new products, particularly in the pharmaceutical and materials sectors. It underscores their commitment to reducing carbon footprints and enhancing product performance through nanotechnology applications. Several companies received accolades for their sustainability initiatives, indicating a concerted effort towards environmentally friendly practices.	TRUE. The companies mentioned in the article are actively developing products and processes that focus on enhancing sustainability and reducing environmental impact through nanotechnology, which aligns with green innovation goals.	TRUE. The companies are introducing new or improved products and processes using nanotechnology, which signifies significant advancements in their respective industries, thus qualifying as business innovation.	TRUE. Many of the products mentioned, such as nanoscale drug delivery systems and eco-friendly materials, are designed to reduce environmental impact and improve health outcomes, meeting the definition of a green product.	TRUE. The companies employ research and development practices that minimize waste and energy consumption, promoting the use of renewable resources, which characterizes their methods as green processes.	Tata Chemicals Ltd., Reliance Industries Ltd., Biocon Ltd., Mahindra & Mahindra Ltd., Hindustan Unilever Ltd., Wipro Ltd., HCL Technologies Ltd., Cipla Ltd., Lupin Ltd., Cadila Healthcare Ltd., Sun Pharmaceutical Industries Ltd., Dr. Reddy's Laboratories Ltd., Piramal Enterprises Ltd., Glenmark Pharmaceuticals Ltd., Aurobindo Pharma Ltd., Jubilant Life Sciences Ltd., Granules India Ltd., Aequs Aerospace, SmartNano, Xsys Engineering.	Tata Chemicals Limited, Reliance Industries Limited, Biocon Limited, Mahindra & Mahindra Limited, Hindustan Unilever Limited, Wipro Limited, HCL Technologies Limited, Cipla Limited, Lupin Limited, Cadila Healthcare Limited, Sun Pharmaceutical Industries Limited, Dr. Reddy's Laboratories Limited, Piramal Enterprises Limited, Glenmark Pharmaceuticals Limited, Aurobindo Pharma Limited, Jubilant Life Sciences Limited, Granules India Limited, Aequs Aerospace, SmartNano, Xsys Engineering.	Nanoscale drug delivery systems, nanoscale materials and coatings.	Likely NAICS Codes: 325412 - Pharmaceutical Preparation Manufacturing; 334510 - Electro medical and Electrotherapeutic Apparatus Manufacturing; 541715 - Research and Development in the Physical, Engineering, and Life Sciences (except Nanotechnology); 332813 - Electroplating, Plating, Polishing, Anodizing, and Coloring.	FALSE. The article appears to present genuine efforts from the companies to innovate sustainably and improve their products' environmental performance, without evidence of misleading claims or exaggerations typical of greenwashing.	6630
Top 20 Best Dairy Products Manufacturing Companies In India 2023 - Inventiva	https://news.google.com/rss/articles/CBMiSmh0dHBzOi8vd3d3LmludmVudGl2YS5jby5pbi90cmVuZHMvZGFpcnktcHJvZHVjdHMtbWFudWZhY3R1cmluZy1jb21wYW5pZXMv0gEA?oc=5	The article discusses the top 20 dairy product manufacturing companies in India as of 2023, highlighting their contributions to quality, innovation, and sustainability in the dairy industry. It emphasizes their roles in providing employment, supporting rural livelihoods, and adapting to changing consumer preferences. The companies mentioned, including Amul, Mother Dairy, and Nestle India, are recognized for their commitment to high-quality products and social responsibility. Overall, the dairy sector is growing due to rising demand for various dairy products in both domestic and international markets.	TRUE - The companies highlighted in the article focus on sustainability initiatives such as renewable energy usage, promoting sustainable farming practices, and working to reduce their environmental impact, aligning with green innovation criteria.	TRUE - The article discusses various dairy companies that have introduced new products and processes, significantly distinct from their previous offerings, exemplifying business innovation within the food industry.	TRUE - The dairy products produced by these companies are designed and manufactured with environmental impact considerations, often using sustainable practices and materials, making them green products.	TRUE - Many companies mentioned implement processes that minimize environmental impact, such as using renewable sources and reducing waste during production, indicating the presence of green processes.	Amul	Gujarat Cooperative Milk Marketing Federation Ltd.	dairy products	Likely NAICS Codes: 311511 (Fluid Milk Manufacturing), 311512 (Creamery Butter Manufacturing), 311513 (Cheese Manufacturing), 311520 (Ice Cream and Frozen Dessert Manufacturing)	FALSE - The article does not indicate any deceptive marketing practices; instead, it emphasizes the genuine commitments of the companies to sustainability and social responsibility.	7062
