title	link	summary	green_innovation	business_innovation	green_product	green_process	company	official_company_name	product_or_process	likely_naics_codes	greenwashing	total_tokens
What's Now And Next In Sustainable Textiles? - Textile World Magazine	https://news.google.com/rss/articles/CBMiZ2h0dHBzOi8vd3d3LnRleHRpbGV3b3JsZC5jb20vdGV4dGlsZS13b3JsZC9mZWF0dXJlcy8yMDIzLzA3L3doYXRzLW5vdy1hbmQtbmV4dC1pbi1zdXN0YWluYWJsZS10ZXh0aWxlcy_SAQA?oc=5	The textile industry is undergoing a significant transformation towards sustainability, focusing on innovations such as the use of recycled fibers, organic materials, and energy-efficient processes to minimize environmental impacts. Manufacturers are implementing circular economy principles, digitalization, and improved transparency in supply chains to address ecological concerns and promote ethical practices. Advanced technologies, like molecular recycling and smart textiles, are being explored to enhance sustainability further. The article emphasizes the collaborative efforts needed to redefine industry practices for a more sustainable future.	TRUE, because the article discusses multiple innovations and practices within the textile industry that contribute to environmental sustainability, such as using recycled fibers, energy-efficient machinery, and promoting a circular economy.	TRUE, as the article highlights new practices and processes that significantly differ from traditional textile manufacturing, demonstrating innovation in product and process development within the industry.	TRUE, because the article mentions products made from recycled and organic materials that reduce environmental impact throughout their life cycle.	TRUE, as the article describes processes that minimize waste, reduce energy consumption, and involve the use of environmentally friendly technologies.	Moss	Moss	Endeavor™ waterless smart dyeing technology	Likely NAICS Codes: 313310 - Textile and Fabric Finishing Mills, 313210 - Broadwoven Fabric Mills, 424320 - Men’s and Boys’ Clothing and Furnishings Merchant Wholesalers, 315210 - Cut and Sew Apparel Contractors	FALSE, as the article provides credible information about genuine innovations and practices aimed at reducing environmental impact rather than making misleading claims.	3342
UCLA Study Highlights Smart Cups' Revolutionary Technology Reducing Environmental Impact of Liquid Consumer ... - PR Newswire	https://news.google.com/rss/articles/CBMiqwFodHRwczovL3d3dy5wcm5ld3N3aXJlLmNvbS9uZXdzLXJlbGVhc2VzL3VjbGEtc3R1ZHktaGlnaGxpZ2h0cy1zbWFydC1jdXBzLXJldm9sdXRpb25hcnktdGVjaG5vbG9neS1yZWR1Y2luZy1lbnZpcm9ubWVudGFsLWltcGFjdC1vZi1saXF1aWQtY29uc3VtZXItcHJvZHVjdHMtMzAxODgzMjc4Lmh0bWzSAQA?oc=5	Smart Cups has introduced a revolutionary printing technology that significantly reduces the environmental impact of beverage packaging by minimizing materials and transportation needs. A recent study highlights Smart Cups' potential to accommodate far greater beverage volumes than traditional packaging methods, leading to decreased energy consumption and carbon emissions. This innovative approach aims to transform the consumer-packaged goods industry and promote sustainability while enhancing logistical efficiency. Smart Cups is positioned as a leader in eco-friendly practices within its sector.	TRUE, because Smart Cups' technology reduces environmental burdens by minimizing packaging materials, energy consumption, and carbon emissions, thus contributing to sustainability goals.	TRUE, as Smart Cups presents a new method of delivering beverages that differs significantly from traditional processes, introducing a novel approach that is now market-ready.	FALSE, because while Smart Cups Technology offers an innovative packaging solution that significantly reduces environmental impact, it does not meet the comprehensive definition of a green product as a specific good.	TRUE, since Smart Cups technology focuses on a method that minimizes environmental impact in beverage delivery, using less packaging and energy in the process.	Smart Cups	Smart Cups, Inc.	Smart Cups Technology	Likely NAICS Codes: 311999 - All Other Miscellaneous Food Manufacturing, 322211 - Corrugated and Solid Fiber Box Manufacturing, 326199 - All Other Plastics Product Manufacturing, 541715 - Research and Development in the Physical, Engineering, and Life Sciences (except Nanotechnology and Biotechnology)	FALSE, because the article provides substantial research support for the environmental benefits claimed by Smart Cups, focusing on actual reductions in packaging and transportation needs rather than misleading marketing.	2491
'You don't have to be an activist': Here's how your simple actions can help protect the Earth - The Economic Times	https://news.google.com/rss/articles/CBMimgFodHRwczovL20uZWNvbm9taWN0aW1lcy5jb20vbmV3cy9ob3ctdG8veW91LWRvbnQtaGF2ZS10by1iZS1hbi1hY3RpdmlzdC1oZXJlcy1ob3cteW91ci1zaW1wbGUtYWN0aW9ucy1jYW4taGVscC1wcm90ZWN0LXRoZS1lYXJ0aC9hcnRpY2xlc2hvdy8xMDIxNDIyNDIuY21z0gGeAWh0dHBzOi8vbS5lY29ub21pY3RpbWVzLmNvbS9uZXdzL2hvdy10by95b3UtZG9udC1oYXZlLXRvLWJlLWFuLWFjdGl2aXN0LWhlcmVzLWhvdy15b3VyLXNpbXBsZS1hY3Rpb25zLWNhbi1oZWxwLXByb3RlY3QtdGhlLWVhcnRoL2FtcF9hcnRpY2xlc2hvdy8xMDIxNDIyNDIuY21z?oc=5	The article emphasizes the importance of individual actions in addressing environmental issues such as climate change, pollution, and resource depletion. It highlights practical steps individuals can take to protect the Earth, such as reducing waste, conserving water, and opting for renewable energy sources. The call for collective responsibility and community efforts to combat environmental challenges is stressed throughout. The overall message is that small, eco-friendly habits can lead to significant positive change for the planet.	TRUE, because the article promotes actions and practices that contribute to environmental sustainability, such as reducing waste, conserving resources, and supporting renewable energy.	FALSE, because the article does not discuss a specific new or improved product or business process introduced on the market.	FALSE, because the article does not specify any particular good or service that meets the criteria for a green product.	TRUE, because the article discusses various processes and practices aimed at minimizing environmental impact, such as waste reduction and energy-saving methods.	company not identified	company not identified	product or process not identified	Likely NAICS Codes: 541620 - Environmental Consulting Services, 237120 - Oil and Gas Pipeline and Related Structures Construction, 321114 - Wood Preservation, 221118 - Other Electric Power Generation	FALSE, because the article does not make misleading claims about environmental benefits; instead, it provides practical solutions for individuals to adopt sustainable practices.	2265
Unveiling The Mind-Blowing Retail Trends Of 2050: An Investigative Adventure Into The Future Of… - DataDrivenInvestor	https://news.google.com/rss/articles/CBMikQFodHRwczovL21lZGl1bS5kYXRhZHJpdmVuaW52ZXN0b3IuY29tL3VudmVpbGluZy10aGUtbWluZC1ibG93aW5nLXJldGFpbC10cmVuZHMtb2YtMjA1MC1hbi1pbnZlc3RpZ2F0aXZlLWFkdmVudHVyZS1pbnRvLXRoZS1mdXR1cmUtb2YtOTk2MGFlMTJlMzI50gEA?oc=5	The article explores predictions for the retail and shopping landscape in 2050 using insights generated from artificial intelligence. It suggests transformative changes in consumer behaviors and retail operations.	FALSE, the article does not provide information on innovations that contribute to environmental sustainability goals.	FALSE, the article does not discuss any specific new or improved products or business processes that differ significantly from existing ones.	FALSE, the article does not mention any specific goods or services designed to significantly reduce environmental impact throughout their life cycle.	FALSE, the article does not describe processes in manufacturing or operations that minimize environmental impacts and promote sustainability.	company not identified	company not identified	product or process not identified	Likely NAICS Codes: 448 - Clothing and Clothing Accessories Stores, 451 - Sporting Goods, Hobby, Book, and Music Stores, 454 - Nonstore Retailers, 423 - Merchant Wholesalers, Durable Goods	FALSE, there is no evidence in the article to suggest that it employs deceptive marketing tactics regarding environmental benefits.	1328
Tesla's 1st Cybertruck electric pickup has rolled off the assembly line, the company says - ETAuto	https://news.google.com/rss/articles/CBMiqAFodHRwczovL2F1dG8uZWNvbm9taWN0aW1lcy5pbmRpYXRpbWVzLmNvbS9uZXdzL2NvbW1lcmNpYWwtdmVoaWNsZS9taGN2L3Rlc2xhcy0xc3QtY3liZXJ0cnVjay1lbGVjdHJpYy1waWNrdXAtaGFzLXJvbGxlZC1vZmYtdGhlLWFzc2VtYmx5LWxpbmUtdGhlLWNvbXBhbnktc2F5cy8xMDE3OTc0MjnSAawBaHR0cHM6Ly9hdXRvLmVjb25vbWljdGltZXMuaW5kaWF0aW1lcy5jb20vYW1wL25ld3MvY29tbWVyY2lhbC12ZWhpY2xlL21oY3YvdGVzbGFzLTFzdC1jeWJlcnRydWNrLWVsZWN0cmljLXBpY2t1cC1oYXMtcm9sbGVkLW9mZi10aGUtYXNzZW1ibHktbGluZS10aGUtY29tcGFueS1zYXlzLzEwMTc5NzQyOQ?oc=5	Tesla has announced that its first production Cybertruck electric pickup has begun rolling off the assembly line, two years behind schedule. The truck features a unique design and is expected to start delivery slowly over the coming months. The model, staying true to Tesla's innovative approach, has already faced skepticism from analysts regarding its broad market appeal. As Tesla prepares to release its financial results, competitors are launching their own electric trucks.	FALSE, as the article does not provide sufficient information on the environmental benefits of the Cybertruck, such as its energy efficiency or lifecycle sustainability.	TRUE, because the Cybertruck represents a new product that differs significantly from Tesla's previous offerings and has been introduced to the market.	FALSE, as the article does not specifically detail that the Cybertruck is designed to significantly reduce its environmental impact throughout its life cycle.	FALSE, as there is no mention of specific methods or techniques used in the manufacturing of the Cybertruck that would minimize environmental impacts.	Tesla	Tesla, Inc.	Cybertruck	Likely NAICS Codes: 336111 - Automobile Manufacturing, 336112 - Light Truck and Utility Vehicle Manufacturing, 335999 - All Other Miscellaneous Electrical Equipment and Component Manufacturing, 423120 - Motor Vehicle Supplies and New Parts Merchant Wholesalers.	FALSE, as the article does not provide misleading claims about the environmental benefits of the Cybertruck but rather focuses on its production timeline and market position.	1716
Emerging Fabric Trends: Unveiling the Latest Innovations and Designs in the Fabric Industry - Indian Retailer	https://news.google.com/rss/articles/CBMifWh0dHBzOi8vd3d3LmluZGlhbnJldGFpbGVyLmNvbS9hcnRpY2xlL3JldGFpbC1idXNpbmVzcy90cmVuZHMvZW1lcmdpbmctZmFicmljLXRyZW5kcy11bnZlaWxpbmctbGF0ZXN0LWlubm92YXRpb25zLWFuZC1kZXNpZ25z0gEA?oc=5	The article discusses the top luxury watch brands in India, highlighting their heritage, craftsmanship, and unique features that make them desirable. It emphasizes the blend of tradition and modernity in these luxury timepieces, which serve as symbols of status and artistry. The article also provides tips for choosing the right luxury watch brand based on personal style, functionality, and brand heritage.	FALSE - The article does not discuss innovations that contribute to environmental sustainability goals or reduce negative environmental externalities.	TRUE - The article describes luxury watch brands as innovations in product design and marketing, showcasing new or improved products that differ significantly from previous offerings.	FALSE - The luxury watches mentioned in the article do not significantly reduce environmental impact throughout their life cycle as defined for green products.	FALSE - There is no mention of manufacturing or operational processes aimed at minimizing environmental impacts or promoting sustainability.	company not identified	company not identified	product or process not identified	Likely NAICS Codes: 334511 - Watches, Clocks, and Parts Manufacturing; 448130 - Jewelry Stores; 811211 - Consumer Electronics Repair and Maintenance; 453998 - All Other Miscellaneous Store Retailers (including luxury goods stores).	FALSE - The article does not make false or misleading claims about the environmental benefits of the luxury watch brands; it focuses on their quality and heritage.	5535
India stands to gain from global socio-political and economic changes, says Ralf Speth, TVS Motor Chairman - ETAuto	https://news.google.com/rss/articles/CBMiowFodHRwczovL2F1dG8uZWNvbm9taWN0aW1lcy5pbmRpYXRpbWVzLmNvbS9uZXdzL3R3by13aGVlbGVycy9pbmRpYS1zdGFuZHMtdG8tZ2Fpbi1mcm9tLWdsb2JhbC1zb2Npby1wb2xpdGljYWwtYW5kLWVjb25vbWljLWNoYW5nZXMtcmFsZi1zcGV0aC10dnMtY2hhaXJtYW4vMTAyMTU3ODgx0gGnAWh0dHBzOi8vYXV0by5lY29ub21pY3RpbWVzLmluZGlhdGltZXMuY29tL2FtcC9uZXdzL3R3by13aGVlbGVycy9pbmRpYS1zdGFuZHMtdG8tZ2Fpbi1mcm9tLWdsb2JhbC1zb2Npby1wb2xpdGljYWwtYW5kLWVjb25vbWljLWNoYW5nZXMtcmFsZi1zcGV0aC10dnMtY2hhaXJtYW4vMTAyMTU3ODgx?oc=5	TVS Motor Company maintains a positive outlook for its operations in India amidst challenges due to rural demand and geopolitical issues. The company is focusing on the electric two-wheeler segment, reporting substantial growth in sales of their iQube electric scooter and plans for new products utilizing advanced technologies. TVS is also investing in acquisitions to enhance its product range and has a dedicated team for electrification. Though facing export challenges, the company anticipates gradual recovery in its overseas markets.	TRUE, as TVS Motor Company is focused on producing electric vehicles (EVs) which contribute to decarbonization and reducing harmful emissions.	TRUE, because the introduction of new electric products and services marks a significant improvement in TVS's offerings compared to previous products.	TRUE, as the iQube electric scooter is designed to significantly reduce environmental impact by utilizing electric power instead of fossil fuels.	FALSE, there is no specific mention of a defined green process within the text for manufacturing or operational activities.	TVS Motor Company	TVS Motor Company Limited	iQube electric scooter	{'Likely NAICS Codes': [{'code': '336120', 'category': 'Motor Vehicle Manufacturing'}, {'code': '441228', 'category': 'Motorcycle, ATV, and All Other Motor Vehicle Dealers'}, {'code': '486110', 'category': 'Crude Petroleum and Natural Gas Extraction'}, {'code': '336399', 'category': 'All Other Motor Vehicle Parts Manufacturing'}]}	FALSE, the article does not contain misleading claims about environmental benefits; instead, it highlights genuine efforts by TVS Motor Company to promote sustainability through its electric vehicle initiatives.	2180
Retail India News: e-Sprinto Partners with AutoEVmart to Accelerate Electric Two-Wheeler Sales - Indian Retailer	https://news.google.com/rss/articles/CBMieWh0dHBzOi8vd3d3LmluZGlhbnJldGFpbGVyLmNvbS9uZXdzL3JldGFpbC1pbmRpYS1uZXdzLWUtc3ByaW50by1wYXJ0bmVycy1hdXRvZXZtYXJ0LWFjY2VsZXJhdGUtZWxlY3RyaWMtdHdvLXdoZWVsZXItc2FsZXPSAQA?oc=5	HanesBrands has agreed to sell its Champion business to Authentic Brands Group for up to $1.5 billion, with plans to focus on enhancing its innerwear category. This sale is part of HanesBrands' strategy to reduce debt and streamline operations after a thorough review of their business options. The transaction is anticipated to be completed in the second half of 2024 and will include transition services for the Champion brand.	FALSE, the article does not discuss any innovation that contributes to environmental sustainability or reduces negative environmental impacts.	TRUE, this is a business innovation as HanesBrands is selling its Champion business, which represents a new strategic direction and operational focus for the company.	FALSE, the article does not mention any goods or services that meet the definition of a green product.	FALSE, the article does not detail any methods or techniques that minimize environmental impacts or promote sustainability.	HanesBrands	HanesBrands Inc.	Champion business	Likely NAICS Codes: 448190 - Other Clothing Stores, 315210 - Cut and Sew Apparel Manufacturing, 315220 - Men's and Boys' Cut and Sew Apparel Manufacturing, 448110 - Men's Clothing Stores	FALSE, the article does not contain misleading information about environmental benefits but rather discusses a business transaction without any claims related to environmental sustainability.	2051
Retail India News: Alia Bhatt Joins Hands with SuperBottoms, as Investor and Brand Ambassador - Indian Retailer	https://news.google.com/rss/articles/CBMid2h0dHBzOi8vd3d3LmluZGlhbnJldGFpbGVyLmNvbS9uZXdzL3JldGFpbC1pbmRpYS1uZXdzLWFsaWEtYmhhdHQtam9pbnMtaGFuZHMtc3VwZXJib3R0b21zLWludmVzdG9yLWFuZC1icmFuZC1hbWJhc3NhZG9y0gEA?oc=5	Juicy Chemistry and Mommy Shots by Amrita launched the 'Scars are Beautiful' campaign to promote body positivity and self-love among mothers, featuring 11 mothers sharing their experiences and embracing their postpartum bodies and stretch marks. The campaign, aimed at shifting societal perceptions around beauty, highlights the strength and resilience of motherhood through personal stories of these women. The initiative encourages women to celebrate their bodies and challenges the obsession with physical perfection.	FALSE: The article does not present any green innovations that contribute to environmental sustainability goals.	TRUE: The campaign represents a business innovation by Juicy Chemistry and Mommy Shots as it introduces a new initiative that combines a marketing strategy with a product offering aimed at promoting self-image and empowerment.	FALSE: The products offered by Juicy Chemistry are not explicitly described as green products that significantly reduce environmental impact throughout their life cycle.	FALSE: The methods or techniques used in the campaign are not described as green processes that minimize environmental impacts or promote sustainability.	Juicy Chemistry	Juicy Chemistry	Scars are Beautiful campaign	[{'code': '812199', 'category': 'Other Personal Care Services'}, {'code': '446120', 'category': 'Cosmetics, Beauty Supplies, and Perfume Stores'}, {'code': '541850', 'category': 'Display Advertising'}, {'code': '541921', 'category': 'Photography Studios, Portrait'}]	FALSE: The campaign appears genuine in promoting self-love and body positivity without misleading statements about environmental benefits.	2152
