title	link	summary	green_innovation	business_innovation	green_product	green_process	company	official_company_name	product_or_process	likely_naics_codes	greenwashing	total_tokens
A New Generation and the Future of Sustainable Computing - InformationWeek	https://news.google.com/rss/articles/CBMiZ2h0dHBzOi8vd3d3LmluZm9ybWF0aW9ud2Vlay5jb20vc3VzdGFpbmFiaWxpdHkvYS1uZXctZ2VuZXJhdGlvbi1hbmQtdGhlLWZ1dHVyZS1vZi1zdXN0YWluYWJsZS1jb21wdXRpbmfSAQA?oc=5	The article discusses the environmental impact of computing technology and the growing awareness among Generation Z regarding sustainability in the tech industry. It highlights the detrimental effects of data centers, e-waste, and the demand for rare earth metals while emphasizing the need for more sustainable practices and collaboration among consumers, companies, and policymakers. Generation Z's focus on sustainability is influencing their career choices and consumer behavior, driving demand for environmentally friendly products and practices.	TRUE, because the article highlights efforts to promote sustainability and reduce environmental impacts associated with computing technologies, aligning with green innovation goals.	FALSE, because the article does not describe a specific new or improved product or process introduced by a firm; it discusses broader trends and societal impacts instead.	FALSE, because the article does not mention a specific good or service that significantly reduces environmental impact throughout its life cycle.	FALSE, because the article does not detail a specific method or technique in manufacturing or production that minimizes environmental impacts.	company not identified	company not identified	product or process not identified	Likely NAICS Codes: 334111 - Electronic Computer Manufacturing, 511210 - Software Publishers, 541511 - Custom Computer Programming Services, 518210 - Data Processing, Hosting, and Related Services	FALSE, because the article does not present misleading information; instead, it accurately discusses the environmental challenges and the need for sustainable practices in computing.	4074
Which areas of design need investment to reach 2030 sustainability goals? - Design Week	https://news.google.com/rss/articles/CBMiYWh0dHBzOi8vd3d3LmRlc2lnbndlZWsuY28udWsvaXNzdWVzLzE3LWFwcmlsLTIxLWFwcmlsLTIwMjMvZGVzaWduLWludmVzdG1lbnQtc3VzdGFpbmFiaWxpdHktMjAzMC_SAQA?oc=5	The article discusses the importance of rethinking traditional production and sales models in the design industry to successfully achieve sustainability goals by 2030. Various industry leaders emphasize the need for collaboration, investment in material science, and circular economy principles to minimize waste and improve product longevity. Additionally, there is a push for sustainable packaging and design practices that prioritize energy efficiency and reduce environmental impact. The focus is on creating meaningful innovations that positively impact the planet rather than simply producing more products.	TRUE, because the article discusses various strategies and innovations aimed at reducing environmental impact, such as sustainable materials, circular economy practices, and design for repair.	TRUE, because the article addresses new approaches in the design and production processes that significantly diverge from traditional methods and aim to improve market offerings in a sustainable manner.	FALSE, as the article does not specify a particular good or service that meets the defined criteria of a green product.	TRUE, as the article describes methods and practices in design and manufacturing that focus on sustainability, waste reduction, and energy efficiency.	Pearson Lloyd, Born Ugly, TAKT, SketchUp, Morrama, COLLINS	{'Pearson Lloyd': 'Pearson Lloyd', 'Born Ugly': 'Born Ugly', 'TAKT': 'TAKT', 'SketchUp': 'SketchUp', 'Morrama': 'Morrama', 'COLLINS': 'COLLINS'}	bFRIENDS, Perpetual Sustainable Design	Likely NAICS Codes: 541410 - Interior Design Services, 337121 - Upholstered Household Furniture Manufacturing, 325211 - Plastics Material and Resin Manufacturing, 541490 - Other Specialized Design Services	FALSE, as the article focuses on genuine efforts and strategies to achieve sustainability goals without misleading claims or exaggerations typically associated with greenwashing.	2792
2 new products from Helena Agri-Enterprises - Farm Progress	https://news.google.com/rss/articles/CBMiUWh0dHBzOi8vd3d3LmZhcm1wcm9ncmVzcy5jb20vc295YmVhbi8yLW5ldy1wcm9kdWN0cy1mcm9tLWhlbGVuYS1hZ3JpLWVudGVycHJpc2VzLdIBAA?oc=5	Helena Agri-Enterprises introduced two new products, Enertia and Resgenix, aimed at enhancing soil quality and water use efficiency for sustainable agriculture. Enertia is an enzyme-based seed treatment that improves root structure and nutrient absorption, while Resgenix is a water management tool that promotes uniform water absorption and reduces runoff. Both products have shown significant improvements in yield and resource efficiency based on field tests.	TRUE, because both Enertia and Resgenix contribute to environmental sustainability by improving soil health and water efficiency, minimizing resource consumption, and enhancing agricultural productivity.	TRUE, because the introduction of Enertia and Resgenix represents significant improvements over previous products and processes within Helena Agri-Enterprises and has been brought to market.	TRUE, because Enertia and Resgenix are designed, manufactured, and used in ways that significantly reduce their environmental impact throughout their life cycle, promoting sustainability in agriculture.	TRUE, because the methods used to produce and apply Enertia and Resgenix minimize waste, conserve resources, and promote efficiency in agriculture, aligning with sustainable practices.	Helena Agri-Enterprises	Helena Agri-Enterprises, LLC	Enertia, Resgenix	Likely NAICS Codes: 311119 - Other Animal Food Manufacturing, 213112 - Support Activities for Oil and Gas Extraction, 541715 - Research and Development in the Physical, Engineering, and Life Sciences (except Nanotechnology and Biotechnology), 325320 - Pesticide and Other Agricultural Chemical Manufacturing	FALSE, because there is no evidence of misleading statements or exaggerations regarding the environmental benefits of Enertia and Resgenix; the article presents factual improvements and test results supporting their sustainability claims.	2804
L'Oréal And Alibaba To Tackle Beauty's Environmental Problem In China - Jing Daily	https://news.google.com/rss/articles/CBMiRmh0dHBzOi8vamluZ2RhaWx5LmNvbS9wb3N0cy9sb3JlYWwtYWxpYmFiYS1iZWF1dHktc3VzdGFpbmFiaWxpdHktY2hpbmHSAQA?oc=5	L’Oréal and Alibaba have partnered to enhance sustainability in China's beauty industry through low-carbon standards, product development, and supply chain improvements. The two companies aim to tackle significant waste issues arising from packaging while promoting consumer education on sustainable living. Despite commendable initiatives, challenges remain in addressing packaging waste, which comprises a large portion of the industry's environmental impact. The growing consumer demand for eco-friendly products presents both an ethical and business opportunity for sustainable practices.	TRUE: The partnership between L’Oréal and Alibaba aims to establish low-carbon standards and improve sustainability, which aligns with green innovation goals.	TRUE: The collaboration involves the introduction of new sustainability practices and product developments that differ significantly from the firm's previous business processes.	FALSE: The article discusses initiatives rather than specific products that meet the definition of a green product.	TRUE: The efforts to improve supply chain sustainability and reduce waste highlight the implementation of green processes.	L’Oréal	L'Oréal SA	Not specified: The article discusses initiatives without naming a specific product or process.	Likely NAICS Codes: 325620 - Toilet Preparation Manufacturing, 424210 - Drugs and Druggists' Sundries Merchant Wholesalers, 454110 - Electronic Shopping and Mail-Order Houses, 541613 - Marketing Consulting Services.	FALSE: There is no indication in the article that L’Oréal or Alibaba is misleading consumers about their environmental benefits; rather, they are taking concrete steps towards sustainability.	1894
JPMorgan Facilitates Nearly $200 Billion Sustainable Finance in 2022 - ESG Today	https://news.google.com/rss/articles/CBMiXWh0dHBzOi8vd3d3LmVzZ3RvZGF5LmNvbS9qcG1vcmdhbi1mYWNpbGl0YXRlcy1uZWFybHktMjAwLWJpbGxpb24tc3VzdGFpbmFibGUtZmluYW5jZS1pbi0yMDIyL9IBAA?oc=5	JPMorgan Chase's sustainable finance activity fell by approximately 30% in 2022, facilitating $197 billion for climate and sustainable development initiatives, down from a record $285 billion in 2021. The bank is slightly behind its 10-year sustainable development target of $2.5 trillion, which includes $1 trillion for green initiatives. The report highlights that $70 billion of the 2022 mobilization went towards green projects, with the corporate and investment bank accounting for the majority of transactions. JPMorgan plans to enhance its focus on clients in the green economy and develop new products to support ESG objectives.	TRUE: The article describes JPMorgan Chase's financing of sustainable projects and initiatives that support climate and community development, which contributes to environmental sustainability goals.	TRUE: The sustainable finance activities of JPMorgan Chase represent a new or improved business process that significantly differs from its previous activities and has been introduced on the market.	FALSE: The article does not describe any specific good or service that meets the detailed definition of a green product.	FALSE: While the article discusses financing towards sustainable initiatives, it does not specifically detail any method or technique in manufacturing or production that minimizes environmental impacts.	JPMorgan Chase	JPMorgan Chase & Co.	product or process not identified	Likely NAICS Codes: 522110 - Commercial Banking; 523920 - Portfolio Management; 533110 - Lessors of Nonfinancial Intangible Assets (except Copyrighted Works); 524210 - Insurance Agencies and Brokerages	FALSE: The article provides factual information regarding the bank's sustainable finance activities and goals without making misleading claims about environmental benefits, thus it does not represent greenwashing.	1643
Why is recycling so important? The dirty truth behind our trash - ZME Science	https://news.google.com/rss/articles/CBMieGh0dHBzOi8vd3d3LnptZXNjaWVuY2UuY29tL2ZlYXR1cmUtcG9zdC90ZWNobm9sb2d5LWFydGljbGVzL3N1c3RhaW5hYmlsaXR5L2dyZWVuLWxpdmluZy0xL3doeS1pcy1yZWN5Y2xpbmctc28taW1wb3J0YW50L9IBAA?oc=5	The article discusses recycling as a vital process for reducing waste and promoting environmental sustainability. It highlights the myriad benefits of recycling, including energy conservation, reduced landfill waste, and economic advantages such as job creation. The text emphasizes the importance of viewing recycling as an opportunity to mitigate environmental harm while also suggesting methods for reducing and reusing materials. Overall, it advocates for a societal shift toward more sustainable practices.	TRUE; the article discusses recycling, which significantly reduces environmental impact and supports sustainability goals by conserving resources and decreasing pollution.	FALSE; while the article addresses the process of recycling, it does not focus on a specific new or improved product or business process introduced to the market.	FALSE; the article does not specifically mention a good or service designed with reduced environmental impact throughout its life cycle.	TRUE; recycling is described as a process that minimizes waste, conserves resources, and decreases energy consumption, aligning with the definition of a green process.	company not identified	company not identified	recycling	Likely NAICS Codes: 562920 - Materials Recovery Facilities, 423930 - Recyclable Material Merchant Wholesalers, 611430 - Professional and Management Development Training, 713990 - All Other Amusement and Recreation Industries	FALSE; the article does not engage in greenwashing, as it provides accurate information on the benefits and importance of recycling without making false or misleading environmental claims.	3321
Secondhand fashion has a looming sustainability problem: PFAS - Digital Commerce 360	https://news.google.com/rss/articles/CBMiTWh0dHBzOi8vd3d3LmRpZ2l0YWxjb21tZXJjZTM2MC5jb20vMjAyMy8wNC8yMC9zZWNvbmRoYW5kLXN1c3RhaW5hYmlsaXR5LXBmYXMv0gFRaHR0cHM6Ly93d3cuZGlnaXRhbGNvbW1lcmNlMzYwLmNvbS8yMDIzLzA0LzIwL3NlY29uZGhhbmQtc3VzdGFpbmFiaWxpdHktcGZhcy9hbXAv?oc=5	The article discusses the growing bans on PFAS chemicals in clothing across various U.S. states, prompting clothing companies to seek safer alternatives while addressing the challenges of existing products containing these harmful substances. The used apparel market is thriving alongside increasing demand for sustainable options, but concerns arise about reselling items that may contain PFAS. Industry leaders have been largely silent on how to navigate the intersection of PFAS elimination and secondhand clothing, highlighting the complexities of moving towards sustainability. Observers note that the transition towards sustainable fashion will not be straightforward.	TRUE: The initiatives to eliminate PFAS from new clothing products and the promotion of secondhand shopping as a more sustainable option exemplify green innovation efforts aimed at reducing harmful environmental impacts.	TRUE: The clothing companies' shifts towards safer alternatives and embracing resale and circular business models represent new strategies that differ significantly from their previous business processes.	FALSE: While the article discusses the push for safer clothing alternatives, it does not identify any specific green products currently in the market that would meet the definition of a green product at this time.	TRUE: The efforts by companies to find less toxic alternatives to PFAS in their manufacturing processes and promote resale as a method to reduce waste are examples of green processes aimed at minimizing environmental impacts.	company not identified	company not identified	product or process not identified	Likely NAICS Codes: 315220 - Men's Clothing Manufacturing, 315240 - Women's Clothing Manufacturing, 448140 - Family Clothing Stores, 423210 - Furniture and Home Furnishing Merchant Wholesalers.	FALSE: The article does not appear to describe greenwashing, as it focuses on legitimate challenges and efforts within the clothing industry to address harmful chemicals and promote sustainability, rather than making misleading claims about environmental benefits.	2358
10 Most Sustainable Grocers - Progressive Grocer	https://news.google.com/rss/articles/CBMiOWh0dHBzOi8vcHJvZ3Jlc3NpdmVncm9jZXIuY29tLzEwLW1vc3Qtc3VzdGFpbmFibGUtZ3JvY2Vyc9IBAA?oc=5	ALDI has made significant sustainability commitments, including eliminating single-use plastic shopping bags and pledging to divert 90% of operational waste by 2025. The company has implemented various green initiatives like nonfood donation programs, expanded recycling, and solar energy installations in their stores. ALDI aims to help shoppers make eco-friendly choices without sacrificing affordability and has set aggressive goals to reduce its carbon footprint. Their efforts have garnered recognition for reducing harmful refrigerant emissions and promoting sustainable sourcing in their supply chain.	TRUE - The article highlights ALDI's sustainability commitments and initiatives that contribute to reducing environmental impacts, such as eliminating plastic bags and minimizing food waste.	TRUE - ALDI's initiatives and changes in operations and service offerings are a significant improvement over previous practices, introducing new sustainability efforts that differ from past methods.	FALSE - The article focuses on the company's sustainability initiatives rather than specific green products being sold.	TRUE - ALDI's operational changes, including waste reduction and energy efficiency enhancements, exemplify green processes aimed at minimizing environmental impact.	ALDI	ALDI Inc.	single-use plastic bag elimination	Likely NAICS Codes: 445110 - Supermarkets and Other Grocery (except Convenience) Stores, 493110 - General Warehousing and Storage, 311811 - Retail Bakeries, 424410 - General Line Grocery Merchant Wholesalers	FALSE - The article does not indicate any misleading statements regarding the environmental benefits of ALDI's initiatives; it details actionable steps and commitments towards sustainability.	1842
Deloitte Launches Scope 3 Emissions Calculator, ESG Reporting Tools on Workiva Platform - ESG Today	https://news.google.com/rss/articles/CBMicGh0dHBzOi8vd3d3LmVzZ3RvZGF5LmNvbS9kZWxvaXR0ZS1sYXVuY2hlcy1zY29wZS0zLWVtaXNzaW9ucy1jYWxjdWxhdG9yLWVzZy1yZXBvcnRpbmctdG9vbHMtb24td29ya2l2YS1wbGF0Zm9ybS_SAQA?oc=5	Deloitte announced the expansion of its ESG accelerators on the Workiva platform, introducing three new solutions for organizations to assist with ESG reporting, including tools for calculating Scope 3 emissions. The new offerings aim to enhance connectivity between ESG reporting and GRC functions, promoting transparency and accuracy in sustainability efforts. Key tools include a Scope 3 GHG Report Calculator, Continuous Controls Monitoring templates, and an ESG Report Template to streamline reporting processes.	TRUE - The initiatives by Deloitte aim to improve ESG reporting and sustainability practices, contributing to environmental sustainability and better management of environmental impacts.	TRUE - The new solutions offered by Deloitte represent significant improvements over previous methods for ESG reporting and compliance, thus qualifying as business innovations.	FALSE - While the tools support ESG reporting, they do not meet the definition of a green product as they are not physical goods designed to reduce environmental impact throughout their life cycle.	TRUE - The solutions are methods that aim to streamline ESG reporting and improve sustainability practices, minimizing environmental impacts and promoting better governance.	Deloitte	Deloitte Consulting LLP	ESG accelerators and associated tools	['541611 - Administrative Management and General Management Consulting Services', '541512 - Computer Systems Design Services', '541618 - Other Management Consulting Services', '541990 - All Other Professional, Scientific, and Technical Services']	FALSE - The article does not present misleading claims, but instead focuses on actual innovations aimed at enhancing ESG reporting and compliance.	1732
STMicroelectronics Publishes 2023 Sustainability Report - Eetasia.com	https://news.google.com/rss/articles/CBMiUGh0dHBzOi8vd3d3LmVldGFzaWEuY29tL3N0bWljcm9lbGVjdHJvbmljcy1wdWJsaXNoZXMtMjAyMy1zdXN0YWluYWJpbGl0eS1yZXBvcnQv0gEA?oc=5	STMicroelectronics has released its 2023 Sustainability Report, showcasing significant progress in its sustainability efforts for 2022, including ambitious goals to achieve carbon neutrality by 2027 and a substantial increase in responsible products. The company is committed to sustainable technology, with 77% of new products identified as responsible and 23% of total revenue derived from these products. Additionally, ST has improved its waste management practices, achieved significant reductions in GHG emissions, and focused on creating a diverse and inclusive workplace. The report aligns with various global sustainability standards and highlights ST's R&D investment and community engagement initiatives.	TRUE: The article details STMicroelectronics' innovations aimed at promoting sustainability, such as the development of responsible products and commitment to decarbonization.	TRUE: The article discusses STMicroelectronics' introduction of new and improved sustainable products and processes that differ significantly from its previous offerings.	TRUE: The report highlights that 77% of new products are identified as responsible, indicating they are designed to minimize environmental impact.	TRUE: The article notes ST's efforts to reduce GHG emissions, enhance waste management practices, and utilize renewable energy sources, reflecting green process innovations.	STMicroelectronics	STMicroelectronics	product not identified	{'Likely NAICS Codes': [{'Code': '334413', 'Category': 'Semiconductor and Related Device Manufacturing'}, {'Code': '335999', 'Category': 'All Other Miscellaneous Electrical Equipment and Component Manufacturing'}, {'Code': '541715', 'Category': 'Research and Development in the Physical, Engineering, and Life Sciences (except Nanotechnology and Biotechnology)'}, {'Code': '811212', 'Category': 'Computer and Office Machine Repair and Maintenance'}]}	FALSE: The article provides clear and verifiable information about STMicroelectronics' sustainability efforts and achievements, showcasing a genuine commitment to environmental goals rather than misleading claims.	2391
Modern furniture committed to innovation, quality, and sustainability - DesignWanted	https://news.google.com/rss/articles/CBMiUWh0dHBzOi8vZGVzaWdud2FudGVkLmNvbS9tb2Rlcm4tZnVybml0dXJlLWlubm92YXRpb24tcXVhbGl0eS1zdXN0YWluYWJpbGl0eS1hcnR1L9IBAA?oc=5	Share Artu is a new furniture brand recognized for its modern designs that incorporate eco-friendly materials aimed at the HoReCa segment and offices. The brand collaborates annually with designers to create ergonomic furniture while emphasizing environmental respect. Artu has won several international design awards and continues to innovate with new collections being released in 2023.	TRUE, because Artu uses eco-friendly materials in their furniture production, which aligns with environmental sustainability goals.	TRUE, as Artu regularly introduces new and improved furniture designs that significantly differ from their previous offerings.	TRUE, since the furniture is designed and manufactured in a way that significantly reduces its environmental impact throughout its life cycle.	FALSE, because while the article mentions eco-friendly materials, it does not specifically detail the processes used in manufacturing that minimize environmental impacts.	Artu	Artu	Taptap collection	[{'code': '337121', 'category': 'Upholstered Household Furniture Manufacturing'}, {'code': '337122', 'category': 'Non-upholstered Wood Household Furniture Manufacturing'}, {'code': '337124', 'category': 'Metal Household Furniture Manufacturing'}, {'code': '337125', 'category': 'Household Furniture, Except Metal and Wood Manufacturing'}]	FALSE, as the article presents factual information about Artu's commitment to eco-friendly materials and environmentally responsible practices without any misleading claims.	1666
Polytag introduces QR code, UV tag combo - Polytag introduces QR code, UV tag combo - Labels and Labeling	https://news.google.com/rss/articles/CBMiYWh0dHA6Ly93d3cubGFiZWxzYW5kbGFiZWxpbmcuY29tL2V1cm9wZS9uZXdzL25ldy1wcm9kdWN0cy9wb2x5dGFnLWludHJvZHVjZXMtcXItY29kZS11di10YWctY29tYm_SAQA?oc=5	Polytag is introducing unique QR codes and UV tags to Co-op's PET 2-liter spring water bottles to enhance visibility during recycling. These tags provide data on packaging lifecycle and recycling processes while allowing consumers to reclaim deposits through smartphone scans. The initiative aims to enable a circular recycling economy by offering real-time insights and encouraging responsibility in packaging production. This partnership is positioned as a significant step toward greater sustainability in the FMCG sector.	TRUE, because the innovation enhances recycling processes, provides data to improve packaging sustainability, and promotes a circular economy, aligning with environmental sustainability goals.	TRUE, as the introduction of new QR codes and UV tags represents a significant improvement in Co-op's packaging processes and product offerings in the market.	FALSE, because while the packaging uses technologies aimed at sustainability, the product itself (water) does not inherently qualify as a green product without details on its life cycle impacts.	TRUE, since the use of QR codes and UV tags for tracking recycling and promoting sustainability represents a method that minimizes environmental impact and encourages resource conservation.	Co-op	Co-op Group Limited	QR codes and UV tags on PET bottles	[{'code': '3261', 'category': 'Plastics Product Manufacturing'}, {'code': '3222', 'category': 'Converted Paper Product Manufacturing'}, {'code': '5415', 'category': 'Computer Systems Design and Related Services'}, {'code': '5416', 'category': 'Management, Scientific, and Technical Consulting Services'}]	FALSE, because the article presents a genuine innovation aimed at improving recycling processes and enhancing sustainability rather than making misleading claims about environmental benefits.	1883
