title	link	summary	green_innovation	business_innovation	green_product	green_process	company	official_company_name	product_or_process	likely_naics_codes	greenwashing	total_tokens
The Inefficiencies of the Latest Energy Code - Pro Builder	https://news.google.com/rss/articles/CBMiS2h0dHBzOi8vd3d3LnByb2J1aWxkZXIuY29tL2Jsb2cvaW5lZmZpY2llbmNpZXMtbGF0ZXN0LWVuZXJneS1jb2RlLTIwMjEtaWVjY9IBAA?oc=5	The article discusses the ineffectiveness and high costs associated with the 2021 International Energy Conservation Code (IECC), highlighting that some energy-saving measures yield unreasonably long payback periods that exceed the lifespan of the investment. It emphasizes the need for clearer compliance criteria to enhance cost-effectiveness and energy savings in new constructions as building codes become more stringent. The article also mentions the role of the Inflation Reduction Act in incentivizing the adoption of these codes despite potential drawbacks for consumers. The National Association of Home Builders is working to ensure flexibility in meeting these codes cost-effectively in the upcoming 2024 standards.	TRUE, because it discusses energy conservation codes aimed at improving energy efficiency and reducing environmental impacts in new building constructions.	TRUE, as it refers to the changes and adaptations in construction practices and compliance with updated building codes representing a significant improvement in business processes.	FALSE, because the article does not identify a specific good or service that meets the definition of a green product; it focuses on building codes and insulation standards instead.	TRUE, since the article talks about methods in construction and building practices aimed at reducing energy consumption and promoting sustainability.	company not identified	company not identified	International Energy Conservation Code (IECC)	Likely NAICS Codes: 236115 - New Single-Family Housing Construction, 236116 - New Multifamily Housing Construction, 541330 - Engineering Services, 811310 - Commercial and Industrial Machinery and Equipment (except Automotive and Electronic) Repair and Maintenance	FALSE, because the article does not involve deceptive marketing or misleading claims; it critically analyzes the efficacy and financial implications of energy codes rather than promoting products or practices with unsubstantiated environmental benefits.	2115
Global Advanced Phase Change Materials (PCM) Strategic Analysis Report 2023: Growing Demand for Energy ... - GlobeNewswire	https://news.google.com/rss/articles/CBMigwJodHRwczovL3d3dy5nbG9iZW5ld3N3aXJlLmNvbS9lbi9uZXdzLXJlbGVhc2UvMjAyMy8wNi8yMC8yNjkwODM4LzI4MTI0L2VuL0dsb2JhbC1BZHZhbmNlZC1QaGFzZS1DaGFuZ2UtTWF0ZXJpYWxzLVBDTS1TdHJhdGVnaWMtQW5hbHlzaXMtUmVwb3J0LTIwMjMtR3Jvd2luZy1EZW1hbmQtZm9yLUVuZXJneS1FZmZpY2llbnQtVGVjaG5vbG9neS1SaXNpbmctRW1waGFzaXMtb24tRW5lcmd5LUNvbnNlcnZhdGlvbi1Ecml2ZS1Gb2N1cy1vbnRvLUFQQy5odG1s0gEA?oc=5	The global market for Advanced Phase Change Materials (PCM) is estimated to grow from $1.5 billion in 2022 to $6.3 billion by 2030, with a projected CAGR of 19.8%. The market demand is driven by energy-efficient technologies and the growing emphasis on greenhouse gas emission regulations. The article discusses projections in various regions, emphasizing the opportunities and challenges related to financial markets and supply chain disruptions. The report includes insights into advancements and applications of PCM in sectors like construction and textiles.	TRUE, because Advanced Phase Change Materials (PCM) are designed to enhance energy efficiency and contribute to the reduction of greenhouse gas emissions.	TRUE, because the market for Advanced Phase Change Materials (PCM) represents a new and improved product aimed at increasing energy conservation in various industries.	TRUE, as Advanced Phase Change Materials (PCM) significantly reduce environmental impacts by improving energy efficiency and supporting sustainable practices in their usage.	FALSE, as the article does not describe any specific manufacturing or operational methods related to Advanced Phase Change Materials (PCM) that would classify them as a green process.	company not identified	company not identified	Advanced Phase Change Materials (PCM)	Likely NAICS Codes: 325998 - All Other Miscellaneous Chemical Product and Preparation Manufacturing; 332999 - All Other Miscellaneous Fabricated Metal Product Manufacturing; 423860 - Transportation Equipment and Supplies Merchant Wholesalers; 541715 - Research and Development in the Physical, Engineering, and Life Sciences (Except Nanotechnology and Biotechnology).	FALSE, the article does not indicate any misleading claims regarding the environmental benefits of Advanced Phase Change Materials (PCM); it presents factual market data and trends.	2826
Chijet Motor Company Listed on NASDAQ - Yahoo Finance	https://news.google.com/rss/articles/CBMiUGh0dHBzOi8vZmluYW5jZS55YWhvby5jb20vbmV3cy9jaGlqZXQtbW90b3ItY29tcGFueS1saXN0ZWQtbmFzZGFxLTE5MDEwMDMyNS5odG1s0gEA?oc=5	Chijet Motor Company, Inc. is a developer of next-generation electric vehicles that was listed on NASDAQ on June 2, 2023. The company aims to provide cost-effective new energy vehicle products and services, focusing on R&D for advanced technologies and a range of products, including pure electric and hybrid vehicles. Its strategic partnerships and commitment to environmental responsibility highlight its role in global energy conservation and low carbon protection. With a significant product launch pipeline, Chijet is positioned for growth in both commercial and passenger vehicle markets.	TRUE, because Chijet is developing electric vehicles which significantly reduce environmental impacts and promote sustainability.	TRUE, as Chijet is introducing new products and processes that significantly differ from its previous offerings in the electric vehicle market.	TRUE, because the electric vehicles designed, manufactured, and offered by Chijet are aimed at significantly reducing environmental impact throughout their life cycle.	TRUE, because Chijet's manufacturing systems focus on minimizing energy consumption and emissions while using sustainable processes.	Chijet Motor Company, Inc.	Chijet Motor Company, Inc.	FB77, R9 PHEV hybrid SUV, FV20, FB21, FB31	{'Likely NAICS Codes': [{'code': '336111', 'category': 'Automobile Manufacturing'}, {'code': '336112', 'category': 'Light Truck and Utility Vehicle Manufacturing'}, {'code': '541715', 'category': 'Research and Development in the Physical, Engineering, and Life Sciences (except Nanotechnology and Biotechnology)'}, {'code': '811198', 'category': 'All Other Automotive Repair and Maintenance'}]}	FALSE, there is no indication of misleading statements regarding environmental benefits; Chijet appears committed to sustainability and developing genuine green products.	2529
ITC SWOT Analysis (2024) - Business Model Analyst	https://news.google.com/rss/articles/CBMiM2h0dHBzOi8vYnVzaW5lc3Ntb2RlbGFuYWx5c3QuY29tL2l0Yy1zd290LWFuYWx5c2lzL9IBAA?oc=5	The article discusses ITC Ltd, a diversified Indian conglomerate with a significant presence in fast-moving consumer goods, agribusiness, hospitality, and more. It outlines the company's evolution from a tobacco-based business to a broader entity while examining its strengths, weaknesses, opportunities, and threats (SWOT analysis). ITC's commitment to sustainable practices and environmental stewardship is highlighted, particularly in its FMCG and hotel sectors. Overall, the article emphasizes ITC's strategic approach to leveraging its portfolio for continued growth and adaptability in a competitive market.	TRUE, because ITC Ltd has implemented sustainable practices and initiatives, particularly in agribusiness and hospitality, that focus on environmental stewardship and reducing ecological footprints.	TRUE, because ITC Ltd has developed new and improved products, such as its personal care and FMCG product lines, which significantly differ from its historical tobacco products and meet market demands.	TRUE, as ITC offers products like Aashirvaad and Sunfeast that are designed and manufactured with a focus on reducing environmental impact and promoting sustainability.	TRUE, since ITC has adopted processes in its operations that reduce waste, conserve resources, and emphasize sustainability, particularly in its agribusiness sector.	ITC Ltd	ITC Limited	product or process not identified	Likely NAICS Codes: 4244 - Grocery and Related Product Merchant Wholesalers, 3119 - Other Food Manufacturing, 7211 - Hotels (except Casino Hotels) and Motels, 3256 - Soap, Cleaning Compound, and Toilet Preparation Manufacturing.	FALSE, as the article does not indicate any misleading claims about environmental benefits; it presents ITC Ltd's genuine efforts toward sustainability and environmental responsibility.	5001
Neochem Technologies: Driving Sustainable Innovations in the Textile Industry - The Textile Magazine	https://news.google.com/rss/articles/CBMicmh0dHBzOi8vd3d3LmluZGlhbnRleHRpbGVtYWdhemluZS5pbi9uZW9jaGVtLXRlY2hub2xvZ2llcy1kcml2aW5nLXN1c3RhaW5hYmxlLWlubm92YXRpb25zLWluLXRoZS10ZXh0aWxlLWluZHVzdHJ5L9IBAA?oc=5	Neochem Technologies is a chemical company focused on sustainability, particularly in the textile industry, offering innovative eco-friendly products, such as biodegradable fabric softeners and energy-efficient processing solutions. They emphasize expansion into new markets and participation in events like ITMA 2023 to showcase their sustainable innovations. The company's mission revolves around developing alternatives to conventional chemicals and prioritizing transparency in their supply chain to reduce environmental impacts. Their commitment to sustainability is reflected in their manufacturing practices and R&D-driven approach.	TRUE: The company leverages innovative technologies to create sustainable products and processes that significantly reduce environmental impacts, align with sustainability goals, and support water and energy conservation.	TRUE: Neochem Technologies offers a range of new and improved chemical products and processes for the textile industry that differ significantly from previous offerings, thus aligning with the definition of business innovation.	TRUE: The products mentioned, such as plant-based fabric softeners and biodegradable alternatives, are designed to minimize environmental impact throughout their lifecycle, meeting the definition of a green product.	TRUE: The article discusses innovative processes that reduce waste and resource consumption, demonstrating a commitment to sustainable manufacturing practices, thus qualifying as green processes.	Neochem Technologies	Neochem Technologies Private Limited	Natural and Plant-based Ester Quats fabric softeners	Likely NAICS Codes: 325199 - All Other Basic Organic Chemical Manufacturing; 325611 - Soap and Other Detergent Manufacturing; 325612 - Polish and Sanitation Good Manufacturing; 313320 - Fabric Coating Mills	FALSE: The article does not provide misleading information about the environmental benefits of Neochem Technologies' products and practices, rather it emphasizes a genuine commitment to sustainability and innovation in their offerings.	2318
Blue Tree Phuket drives ESG Initiatives, Reinforces its Sustainable Entertainment Hub Status - Khaosodenglish	https://news.google.com/rss/articles/CBMikAFodHRwczovL3d3dy5raGFvc29kZW5nbGlzaC5jb20vc3BvbnNvcmVkLzIwMjMvMDYvMDEvYmx1ZS10cmVlLXBodWtldC1kcml2ZXMtZXNnLWluaXRpYXRpdmVzLXJlaW5mb3JjZXMtaXRzLXN1c3RhaW5hYmxlLWVudGVydGFpbm1lbnQtaHViLXN0YXR1cy_SAZQBaHR0cHM6Ly93d3cua2hhb3NvZGVuZ2xpc2guY29tL3Nwb25zb3JlZC8yMDIzLzA2LzAxL2JsdWUtdHJlZS1waHVrZXQtZHJpdmVzLWVzZy1pbml0aWF0aXZlcy1yZWluZm9yY2VzLWl0cy1zdXN0YWluYWJsZS1lbnRlcnRhaW5tZW50LWh1Yi1zdGF0dXMvYW1wLw?oc=5	Blue Tree Phuket emphasizes its commitment to sustainability by implementing ESG standards focused on energy efficiency, water management, and waste reduction. They have initiated various green initiatives, including using renewable energy sources, advanced water management technologies, and effective waste segregation and recycling programs. The company also fosters community awareness on environmental issues and actively engages in community-based sustainable initiatives. Their efforts contribute to both organizational sustainability and positive environmental impacts.	TRUE: The article describes blue Tree Phuket's comprehensive set of initiatives aimed at promoting environmental sustainability through energy efficiency, water management, waste reduction, and community engagement, all of which align with the principles of green innovation.	TRUE: The article discusses Blue Tree Phuket's innovative business processes and products that significantly differ from their previous offerings, particularly in their commitment to sustainability and waste reduction initiatives.	FALSE: There are no specific products mentioned in the article that meet the definition of a green product, although the practices described contribute to overall sustainability.	TRUE: The article highlights specific processes at Blue Tree Phuket, such as waste segregation, the use of renewable energy, and water-saving technologies, which are designed to minimize environmental impacts.	Blue Tree Phuket	Blue Tree Phuket	product or process not identified	Likely NAICS Codes: 713110 - Amusement and Theme Parks, 713120 - Amusement Arcades, 721199 - All Other Traveler Accommodation, 562119 - Other Waste Collection	FALSE: The article does not appear to be an example of greenwashing as it provides concrete examples of sustainable practices and policies being implemented by Blue Tree Phuket, reflecting genuine efforts towards environmental responsibility.	2782
Drowning in plastic: Over 75% of plastic produced between 1950 to 2017 become waste – How big a monster have we created? - The Financial Express	https://news.google.com/rss/articles/CBMiqgFodHRwczovL3d3dy5maW5hbmNpYWxleHByZXNzLmNvbS9saWZlL3NjaWVuY2UtZHJvd25pbmctaW4tcGxhc3RpYy1vdmVyLTc1LW9mLXBsYXN0aWMtcHJvZHVjZWQtYmV0d2Vlbi0xOTUwLXRvLTIwMTctYmVjb21lLXdhc3RlLWhvdy1iaWctYS1tb25zdGVyLWhhdmUtd2UtY3JlYXRlZC0zMTMwMzA3L9IBrwFodHRwczovL3d3dy5maW5hbmNpYWxleHByZXNzLmNvbS9saWZlL3NjaWVuY2UtZHJvd25pbmctaW4tcGxhc3RpYy1vdmVyLTc1LW9mLXBsYXN0aWMtcHJvZHVjZWQtYmV0d2Vlbi0xOTUwLXRvLTIwMTctYmVjb21lLXdhc3RlLWhvdy1iaWctYS1tb25zdGVyLWhhdmUtd2UtY3JlYXRlZC0zMTMwMzA3L2xpdGUv?oc=5	The article discusses the growing issue of plastic pollution and the efforts of companies like Coca-Cola, Bisleri International, and Hindustan Unilever to combat it through various initiatives aimed at promoting recycling, upcycling, and the circular economy. While these initiatives are seen as positive steps toward reducing plastic waste, concerns remain about their effectiveness and whether they sufficiently address the root causes of plastic pollution. Experts caution that more significant actions are required beyond just recycling and upcycling to truly mitigate plastic's environmental impact. The article also highlights the complexities and potential health risks associated with plastic recycling and microplastics.	TRUE - The article describes various initiatives aimed at reducing plastic pollution through recycling and upcycling, which contribute to environmental sustainability objectives.	TRUE - The recycling and upcycling initiatives presented by companies represent new or improved business processes that differ significantly from their previous practices.	TRUE - The new rPET bottles made from 100% recycled plastic introduced by Coca-Cola are designed to reduce environmental impact throughout their life cycle.	TRUE - The initiatives outlined by companies like Coca-Cola and Hindustan Unilever involve processes that minimize environmental impacts through recycling and responsible waste management.	Coca-Cola, Bisleri International, Hindustan Unilever	Coca-Cola Company, Bisleri International Pvt. Ltd., Hindustan Unilever Limited	Return and Recycle initiative, 100% recycled PET bottles	Likely NAICS Codes: 325311 - Nitrogenous Fertilizer Manufacturing, 326199 - All Other Plastics Product Manufacturing, 336111 - Automobile Manufacturing, 445110 - Supermarkets and Other Grocery (except Convenience) Stores	FALSE - The article does not suggest that the companies are engaging in greenwashing; instead, it provides a critical perspective on their initiatives, acknowledging both their efforts and the need for more comprehensive solutions to plastic pollution.	4145
Swaraj launches 'Target' range of light tractors aimed at the growing horticulture segment - Autocar Professional	https://news.google.com/rss/articles/CBMifmh0dHBzOi8vd3d3LmF1dG9jYXJwcm8uaW4vbmV3cy9zd2FyYWotbGF1bmNoZXMtdGFyZ2V0LXJhbmdlLW9mLWxpZ2h0LXRyYWN0b3JzLWFpbWVkLWF0LXRoZS1ncm93aW5nLWhvcnRpY3VsdHVyZS1zZWdtZW50LTExNTMwNNIBhAFodHRwczovL3d3dy5hdXRvY2FycHJvLmluL25ld3Mvc3dhcmFqLWxhdW5jaGVzLXRhcmdldC1yYW5nZS1vZi1saWdodC10cmFjdG9ycy1haW1lZC1hdC10aGUtZ3Jvd2luZy1ob3J0aWN1bHR1cmUtc2VnbWVudC0xMTUzMDQ_YW1wPTE?oc=5	Swaraj Tractors has launched a new range of compact lightweight tractors, the Swaraj Target 630 model, aimed at the horticulture sector in India. These tractors are designed for high productivity with low turning radius and narrow track width to reduce crop damage. The company plans to expand its manufacturing and product options while strengthening its market share in the growing 20-30 horsepower segment. Notable figures like former cricket captain Mahendra Singh Dhoni have been associated with the brand.	FALSE - The article primarily discusses the introduction of new tractor models, which does not explicitly indicate that they reduce environmental impacts or contribute to sustainability goals.	TRUE - The launch of a new range of tractors that cater to the horticulture space represents a significant improvement from previous products and processes by Swaraj Tractors.	FALSE - While the tractors may possess features that could benefit the environment, there is no specific mention that they are designed, manufactured, or used in a way that significantly reduces their environmental impact throughout their life cycle.	FALSE - The article does not detail any innovative processes in the manufacturing or production that minimize environmental impacts or promote sustainability.	Swaraj Tractors	Mahindra & Mahindra Limited	Swaraj Target 630	Likely NAICS Codes: 333111 - Tractors, Farm; 333112 - Lawn and Garden Tractor and Home Garden Equipment; 333249 - Other Industrial Machinery Manufacturing; 321920 - Wood Container and Pallet Manufacturing	FALSE - There is no indication that Swaraj Tractors is making misleading claims about the environmental benefits of their products; the focus is on innovation for agricultural efficiency rather than environmental deception.	2054
