title	link	summary	green_innovation	business_innovation	green_product	green_process	company	official_company_name	product_or_process	likely_naics_codes	greenwashing	total_tokens
Antalis launches new system to help identify sustainable packaging - Dealer Support Magazine	https://news.google.com/rss/articles/CBMiX2h0dHBzOi8vZGVhbGVyc3VwcG9ydC5jby51ay9hbnRhbGlzLWxhdW5jaGVzLW5ldy1zeXN0ZW0tdG8taGVscC1pZGVudGlmeS1zdXN0YWluYWJsZS1wYWNrYWdpbmcv0gEA?oc=5	Antalis Packaging has launched a new Green Star System and Green Card to aid customers in pursuing sustainable packaging solutions. This initiative responds to growing market demand and a customer survey indicating environmental friendliness as a key purchasing factor. The Green Star System classifies packaging based on criteria like recycled materials, while the Green Card offers detailed environmental product information. Antalis aims for 100% of its Master’in products to have an environmental rating by 2025.	TRUE, because the launch of the Green Star System and Green Card supports customers in choosing eco-friendly packaging solutions, which aligns with environmental sustainability goals.	TRUE, because the Green Star System and Green Card are new services introduced by Antalis Packaging to enhance their product offerings and meet market demand for sustainable packaging.	TRUE, as the initiatives promote eco-friendly packaging solutions that are designed to significantly reduce environmental impact throughout their lifecycle.	FALSE, as the article focuses on product initiatives rather than a specific manufacturing or operational process that minimizes environmental impacts.	Antalis Packaging	Antalis Packaging	Green Star System and Green Card	[{'code': '322211', 'category': 'Corrugated and Solid Fiber Box Manufacturing'}, {'code': '322212', 'category': 'Paper Bag and Coated and Treated Paper Manufacturing'}, {'code': '325611', 'category': 'Soap and Other Detergent Manufacturing'}, {'code': '541614', 'category': 'Process, Physical Distribution, and Logistics Consulting Services'}]	FALSE, because Antalis Packaging's initiatives are substantiated with concrete actions towards sustainability, aiming to provide customers with verified environmental information rather than making misleading claims.	1706
The 15 Best Refillable Beauty Products, Hands Down - Who What Wear	https://news.google.com/rss/articles/CBMiPGh0dHBzOi8vd3d3Lndob3doYXR3ZWFyLmNvbS9iZXN0LXJlZmlsbGFibGVzLWJlYXV0eS1wcm9kdWN0c9IBAA?oc=5	The article discusses the importance of sustainability in the beauty industry, highlighting the overwhelming waste generated by beauty products and packaging. It emphasizes the trend of refillable beauty products as a means to reduce environmental impact, showcasing various brands that offer refill options. The author advocates for a minimalist beauty routine and shares how selecting refillable products can be both eco-friendly and cost-effective. The article lists 15 brands that provide refillable options, encouraging more sustainable consumer choices.	TRUE - The article describes innovations such as refillable beauty products that significantly reduce waste and environmental impact, aligning with green innovation principles focused on sustainability.	TRUE - The introduction of refillable beauty products represents a new and improved business process that differs significantly from traditional single-use packaging, qualifying as business innovation.	TRUE - Refillable beauty products are designed and manufactured to reduce environmental impact throughout their life cycle, making them a green product.	TRUE - The processes involved in creating refillable beauty products minimize waste and promote sustainability by encouraging the reuse of packaging.	The Body Shop, La Bouche Rouge, Tata Harper, Dermalogica, Ouai, Byoma, Charlotte Tilbury, L’Occitane, Diptyque, Bobbi Brown, Le Labo, Molten Brown, Isle Of Paradise, Susanne Kaufmann, Kjaer Weis	The Body Shop	refillable beauty products	Likely NAICS Codes: 325620 - Cosmetic Manufacturing, 446120 - Cosmetics, Beauty Supplies, and Perfume Stores, 339999 - All Other Miscellaneous Manufacturing, 424210 - Drugs and Druggists' Sundries Merchant Wholesalers	FALSE - The article does not promote misleading claims about the environmental benefits of products. Instead, it emphasizes genuine sustainability efforts by brands, particularly focusing on refillable options and their impact on reducing beauty waste.	3264
Berton Vineyards : Berton Does it Better - APAC Outlook Magazine	https://news.google.com/rss/articles/CBMiU2h0dHBzOi8vd3d3LmFwYWNvdXRsb29rbWFnLmNvbS9mb29kLWJldmVyYWdlL2JlcnRvbi12aW5leWFyZHMtYmVydG9uLWRvZXMtaXQtYmV0dGVy0gEA?oc=5	Berton Vineyards is positioning itself within the competitive wine industry through innovation and a strong commitment to sustainability. The company focuses on improving production processes, reducing environmental impact, and introducing new products in response to consumer trends. As a member of Sustainable Wine Australia, Berton emphasizes the importance of sustainable practices in their winemaking operations. Jamie Bennett, the Managing Director, expresses the need for continual improvement and adaptation to remain relevant in the market.	TRUE, because Berton Vineyards demonstrates a commitment to sustainability through initiatives aimed at reducing power consumption and seeking efficient solutions for secondary products, which aligns with green innovation goals.	TRUE, because Berton is actively introducing new products to the market and improving its business processes in wine production to meet evolving consumer demands, fulfilling the definition of business innovation.	FALSE, because while the article discusses sustainability in wine production, it does not specifically name a product that fits the definition of a green product with significantly reduced environmental impacts throughout its lifecycle.	TRUE, because Berton Vineyards mentions its efforts to implement efficient production processes that minimize environmental impacts, consistent with the definition of a green process.	Berton Vineyards	Berton Vineyards Pty Ltd	sustainable production processes	Likely NAICS Codes: 312130 - Wineries, 311920 - Coffee and Tea Manufacturing, 312140 - Distilleries, 422490 - Other Grocery and Related Products Merchant Wholesalers	FALSE, because the article highlights genuine efforts by Berton Vineyards to improve sustainability and innovate in wine production, rather than making misleading claims about environmental benefits.	3019
Greggs reveals progress made on 2025 sustainability goals | News - British Baker	https://news.google.com/rss/articles/CBMiaGh0dHBzOi8vYmFrZXJ5aW5mby5jby51ay9yZXRhaWwvZ3JlZ2dzLXJldmVhbHMtcHJvZ3Jlc3MtbWFkZS1vbi0yMDI1LXN1c3RhaW5hYmlsaXR5LWdvYWxzLzY3ODExOS5hcnRpY2xl0gEA?oc=5	Greggs has reported significant progress towards its 2025 sustainability goals, including reducing food waste, opening school breakfast clubs, and moving towards net zero operations. The company outlines ten commitments aimed at building communities and protecting the planet while promoting healthy food options. Greggs is on track to meet its goals, with a strong focus on redistributing food and implementing renewable energy initiatives.	TRUE - The article describes various sustainability goals and initiatives undertaken by Greggs that contribute to environmental sustainability, such as reducing food waste, using renewable energy, and promoting healthier food options.	TRUE - The advancements and initiatives by Greggs are improvements in their processes and offerings that significantly differ from their previous operations and products, thereby qualifying as business innovations.	FALSE - The article does not mention a specific product designed with a reduced environmental impact throughout its life cycle, rather it discusses broader sustainability goals.	TRUE - Greggs' initiatives to reduce food waste, implement renewable energy, and create eco-shop designs reflect environmentally sustainable processes in their operational activities.	Greggs	Greggs plc	process not identified	Likely NAICS Codes: 7225 - Restaurants and Other Eating Places, 3118 - Bakeries and Tortilla Manufacturing, 5621 - Waste Collection, 4244 - Grocery and Related Product Merchant Wholesalers	FALSE - The article does not indicate that Greggs is making misleading claims about its environmental responsibility; instead, it reports concrete progress towards defined sustainability goals.	2523
Transparency and authenticity crucial for brands aiming sustainability: Surbhi Bafna Gupta - The Times of India	https://news.google.com/rss/articles/CBMiqwFodHRwczovL3RpbWVzb2ZpbmRpYS5pbmRpYXRpbWVzLmNvbS9saWZlLXN0eWxlL3Nwb3RsaWdodC90cmFuc3BhcmVuY3ktYW5kLWF1dGhlbnRpY2l0eS1jcnVjaWFsLWZvci1icmFuZHMtYWltaW5nLXN1c3RhaW5hYmlsaXR5LXN1cmJoaS1iYWZuYS1ndXB0YS9hcnRpY2xlc2hvdy85OTUxNTA1Mi5jbXPSAa8BaHR0cHM6Ly90aW1lc29maW5kaWEuaW5kaWF0aW1lcy5jb20vbGlmZS1zdHlsZS9zcG90bGlnaHQvdHJhbnNwYXJlbmN5LWFuZC1hdXRoZW50aWNpdHktY3J1Y2lhbC1mb3ItYnJhbmRzLWFpbWluZy1zdXN0YWluYWJpbGl0eS1zdXJiaGktYmFmbmEtZ3VwdGEvYW1wX2FydGljbGVzaG93Lzk5NTE1MDUyLmNtcw?oc=5	Surbhi Bafna Gupta, co-founder of Allter, discusses her journey in creating India's first sustainable baby care brand, focusing on Organic Bamboo Diapers. She emphasizes the brand's commitment to holistic sustainability by sourcing eco-friendly materials and minimizing environmental impact. With Dia Mirza's support, the brand aims to balance functionality and sustainability, while tackling challenges like eco-friendly packaging. Transparency and building trust with consumers are central to Allter's mission.	TRUE: The brand focuses on sustainable alternatives to common baby care products, specifically diapers, and emphasizes eco-friendly sourcing and manufacturing processes.	TRUE: Allter offers a unique product, Organic Bamboo Diapers, which differs significantly from conventional disposable diapers, representing a new business model in the baby care market.	TRUE: The Organic Bamboo Diapers are designed to significantly reduce environmental impact by using biodegradable materials and avoiding hazardous chemicals during manufacturing.	TRUE: The manufacturing approach includes sustainable practices such as sourcing from managed forests and recycling, which actively minimizes waste and environmental harm.	Allter	Allter	Organic Bamboo Diapers	Likely NAICS Codes: 325611 - Soap and Other Detergent Manufacturing, 339999 - All Other Miscellaneous Manufacturing, 453998 - All Other Miscellaneous Store Retailers (except Tobacco Stores), 316999 - All Other Leather Good and Allied Product Manufacturing	FALSE: The article reflects genuine commitment to sustainability and transparency rather than misleading marketing, as the company outlines concrete measures taken to ensure their products are truly eco-friendly.	2140
Sustainability in Singapore: 21 easy eco-friendly tips to live a green life - The Honeycombers	https://news.google.com/rss/articles/CBMiVGh0dHBzOi8vdGhlaG9uZXljb21iZXJzLmNvbS9zaW5nYXBvcmUvc3VzdGFpbmFiaWxpdHktaW4tc2luZ2Fwb3JlLWVjby1mcmllbmRseS10aXBzL9IBAA?oc=5	The article discusses various eco-conscious practices and sustainable living tips provided by 21 entrepreneurs in Singapore, highlighting simple swaps and changes individuals can make to reduce their environmental impact. It emphasizes actions like using reusable products, choosing second-hand items, composting, and leveraging local resources for sustainability. These recommendations are aimed at encouraging green habits without requiring a complete lifestyle overhaul.	TRUE - The article outlines numerous practices and products that contribute to environmental sustainability goals, such as reducing waste, conserving resources, and promoting the use of eco-friendly alternatives, which are key aspects of green innovation.	TRUE - The article showcases various products and processes introduced by entrepreneurs that differ significantly from traditional options, such as reusable period underwear and solid shampoo bars, defining them as business innovations.	TRUE - Products like reusable period underwear and solid shampoo bars are designed and manufactured to significantly reduce environmental impact, aligning with the definition of green products.	TRUE - The article mentions processes like composting and using eco-friendly cleaning methods that signify a commitment to minimizing environmental impacts, fit within the definition of green processes.	company not identified	product or process not identified	not found	Likely NAICS Codes: 311810 - Bakery Product Manufacturing; 325611 - Soap and Other Detergent Manufacturing; 444190 - Other Building Material Dealers; 453310 - Used Merchandise Stores	FALSE - The article does not exhibit characteristics of greenwashing; instead, it authentically promotes sustainable practices and products that genuinely contribute to environmental sustainability.	4765
What the new taxes mean for businesses and consumers: Don't panic, take these strategic actions - Myjoyonline	https://news.google.com/rss/articles/CBMieWh0dHBzOi8vd3d3Lm15am95b25saW5lLmNvbS93aGF0LXRoZS1uZXctdGF4ZXMtbWVhbi1mb3ItYnVzaW5lc3Nlcy1hbmQtY29uc3VtZXJzLWRvbnQtcGFuaWMtdGFrZS10aGVzZS1zdHJhdGVnaWMtYWN0aW9ucy_SAQA?oc=5	Ghana's government introduced three new taxes to raise revenue and meet IMF criteria amid economic challenges, including high inflation and job losses from the COVID-19 pandemic. Businesses need to evaluate the impact of these taxes on operations, explore cost management strategies, and seek professional advice to navigate changes. While challenging, there are opportunities for growth by focusing on local sourcing and diversifying products or services. Consumers may face higher prices and a decreased standard of living but can manage this through budgeting and supporting local businesses.	FALSE, the article does not describe innovations that contribute directly to environmental sustainability goals.	TRUE, the article discusses the introduction of new taxes affecting business operations and strategies, which represents business process innovations.	FALSE, there are no specific goods or services described in the article that qualify as green products.	FALSE, the article does not specify any particular processes that would be considered green processes.	company not identified	company not identified	product or process not identified	Likely NAICS Codes: 541611 - Management Consulting Services, 541219 - Other Accounting Services, 541990 - All Other Professional, Scientific, and Technical Services, 999999 - Unclassified	FALSE, the article does not employ misleading statements about environmental benefits but discusses tax implications for businesses and consumers.	4403
