title	link	summary	green_innovation	business_innovation	green_product	green_process	company	official_company_name	product_or_process	likely_naics_codes	greenwashing	total_tokens
New York calls PepsiCo's plastic pollution a 'public nuisance' in first-of-its-kind lawsuit - Grist	https://news.google.com/rss/articles/CBMiemh0dHBzOi8vZ3Jpc3Qub3JnL2FjY291bnRhYmlsaXR5L25ldy15b3JrLWNhbGxzLXBlcHNpY29zLXBsYXN0aWMtcG9sbHV0aW9uLWEtcHVibGljLW51aXNhbmNlLWluLWZpcnN0LW9mLWl0cy1raW5kLWxhd3N1aXQv0gEA?oc=5	A lawsuit filed by New York Attorney General Letitia James claims that PepsiCo has contributed significantly to plastic pollution in the Buffalo River watershed, with PepsiCo products making up over 17% of identifiable plastic waste. The lawsuit includes a public nuisance claim and aims to hold the company accountable for its plastic packaging and its environmental impact, asserting that PepsiCo has misled the public about its recycling strategy. Additionally, PepsiCo has failed to meet its own plastic reduction targets, further questioning the validity of its claims about sustainability. The lawsuit calls for the company to reduce plastic waste and provide warnings about the health risks associated with its products.	TRUE: This article highlights the negative environmental externalities of PepsiCo's plastic production and poor recycling practices, which contradict the goals of green innovation. The lawsuit aims to promote accountability and reduce plastic waste, aligning with environmental sustainability goals.	FALSE: The article does not present any new or improved products or business processes by PepsiCo; rather, it details legal actions against the company for its current practices.	FALSE: The article discusses plastic products manufactured by PepsiCo, which have been identified as significant contributors to pollution, indicating they do not significantly reduce environmental impact.	FALSE: The article focuses on PepsiCo's problematic plastic packaging and its lack of effective recycling methods, indicating that their processes do not minimize environmental impact.	PepsiCo	PepsiCo, Inc.	product or process not identified	Likely NAICS Codes: 311919 - Other Snack Food Manufacturing; 312113 - Soft Drink Manufacturing; 326199 - All Other Plastics Product Manufacturing; 423990 - Other Miscellaneous Durable Goods Merchant Wholesalers.	TRUE: The article suggests that PepsiCo's claims about its recycling strategy and contributions to a circular economy may be misleading, as it obscures the true environmental impact of their products and suggests a commitment to sustainability that they have not fulfilled.	2592
Dow funds seven new new business and sustainability projects to drive social impact - Dow Corporate	https://news.google.com/rss/articles/CBMiaWh0dHBzOi8vY29ycG9yYXRlLmRvdy5jb20vZW4tdXMvbmV3cy9wcmVzcy1yZWxlYXNlcy8yMDIzLWRvdy1idXNpbmVzcy1pbXBhY3QtZnVuZC1zZXZlbi1uZXctcHJvamVjdHMuaHRtbNIBAA?oc=5	Dow announced its 2023 Business Impact Fund selections, funding seven projects focused on social impact and sustainability across various countries. The projects include enhancing recycling systems in Argentina, expanding a polyurethane recycling initiative in Brazil, and promoting menstrual hygiene with silicone innovations in Mexico. Additional initiatives involve repurposing soap waste in South Africa, supporting small farms with recyclable grain bags in Ukraine, and improving recycling rates in the U.S. Gulf Coast. Since 2016, the Impact Fund has supported 58 projects, creating jobs and recycling significant amounts of materials.	TRUE, because the projects aim to address environmental sustainability by improving recycling rates, reducing waste, and promoting circular economy practices.	TRUE, because the projects involve new or improved processes and collaborations that differ significantly from previous efforts, aligning with the firm's goals.	TRUE, because the initiatives involve the development and use of sustainable products, such as menstrual cups and recyclable grain bags, designed to reduce environmental impact.	TRUE, because the projects emphasize methods that minimize environmental impacts, such as using blockchain for waste traceability and pyrolysis technology for recycling plastics.	Dow	Dow Inc.	Rethinking Recycling program, Project REUSE, Eztli project, Soap for Hope, Small Scale Pyrolysis Unit, Recyclable Grain Bags	[{'code': '325211', 'category': 'Plastics Material and Resin Manufacturing'}, {'code': '562920', 'category': 'Materials Recovery Facilities'}, {'code': '311991', 'category': 'Perishable Prepared Food Manufacturing'}, {'code': '812990', 'category': 'All Other Personal Services'}]	FALSE, because the initiatives detailed in the article genuinely aim to achieve sustainability and social impact rather than making misleading claims about environmental responsibility.	3383
What should be done with the millions of used tyres? - Polytechnique Insights	https://news.google.com/rss/articles/CBMibWh0dHBzOi8vd3d3LnBvbHl0ZWNobmlxdWUtaW5zaWdodHMuY29tL2VuL2NvbHVtbnMvZW5lcmd5L3doYXQtc2hvdWxkLWJlLWRvbmUtd2l0aC10aGUtbWlsbGlvbnMtb2YtdXNlZC10eXJlcy_SAQA?oc=5	In 2021, France collected over 532,000 tonnes of used tyres, implementing extended producer responsibility to ensure their recovery. The use of tyres as alternative fuels for cement kilns and various recycling processes, including pyrolisis to recover materials, contribute to a circular economy. Efforts to increase recycling rates are being driven by stricter regulations. Emerging techniques, such as vapothermolysis, aim to enhance the recovery of valuable materials from used tyres.	TRUE - This is green innovation because it involves recycling and recovering materials from used tyres, thereby reducing waste and promoting sustainability through multiple recovery methods.	TRUE - This is a business innovation because it describes new processes and methods for recovering and recycling tyres that differ significantly from previous practices, leading to new market opportunities.	FALSE - The article does not mention a specific product that meets the definition of a green product, instead it discusses processes and recycling methods.	TRUE - This is a green process as it details various methods, such as pyrolisis and vapothermolysis, aimed at minimizing environmental impact through recycling used tyres.	Michelin	Compagnie Générale des Établissements Michelin	pyrolisis and vapothermolysis	Likely NAICS Codes: 326211 - Tire Manufacturing, 562920 - Material Recovery Facilities, 322121 - Paper (except Newsprint) Mills, 212399 - All Other Nonmetallic Mineral Mining	FALSE - The article does not exhibit characteristics of greenwashing; it appears to provide accurate information about the recycling processes and efforts to promote sustainability in tyre recovery.	3661
Defra considering provision to offset closed-loop systems in packaging regs - Resource.co	https://news.google.com/rss/articles/CBMia2h0dHBzOi8vcmVzb3VyY2UuY28vYXJ0aWNsZS9kZWZyYS1jb25zaWRlcmluZy1wcm92aXNpb24tb2Zmc2V0LWNsb3NlZC1sb29wLXJlY3ljbGluZy1zeXN0ZW1zLXBhY2thZ2luZy1yZWdz0gEA?oc=5	Defra is considering implementing provisions to support closed-loop recycling systems in light of feedback during the consultation on the draft Producer Responsibility Obligations for packaging waste. The proposal aims to allow producers managing packaging in a closed-loop system to exclude materials from household disposal fees obligations. Closed-loop recycling refers to producers collecting their own waste for recycling into new products, promoting resource efficiency and the circular economy. Companies have expressed concerns that incoming EPR regulations may disincentivize their investments in these systems due to potential taxation as waste.	TRUE, because the article discusses closed-loop recycling, which contributes to environmental sustainability by reducing waste and promoting resource efficiency.	FALSE, because the article does not focus on a specific new or improved product or business process; it discusses a regulatory framework rather than an innovation introduced in the market.	FALSE, because the article does not mention any specific goods or services but rather refers to a system and regulatory changes regarding packaging waste.	TRUE, because the article describes a closed-loop recycling process that minimizes environmental impacts and supports sustainability by enabling the recycling of packaging materials into new products.	company not identified	product or process not identified	not found	Likely NAICS Codes: 32599 - Other Chemical Product and Preparation Manufacturing;  recycling facility operations specifically; 33312 - Construction Machinery Manufacturing; 56292 - Materials Recovery Facilities; 90110 - Public Administration.	FALSE, because the article does not mention misleading statements or deceptive practices related to environmental benefits; it focuses on legitimate regulatory considerations for recycling.	1703
Industry welcomes Environment Ministers' packaging plan - PKN Packaging News	https://news.google.com/rss/articles/CBMiXmh0dHBzOi8vd3d3LnBhY2thZ2luZ25ld3MuY29tLmF1L2xhdGVzdC9pbmR1c3RyeS13ZWxjb21lcy1lbnZpcm9ubWVudC1taW5pc3RlcnMtcGFja2FnaW5nLXBsYW7SAQA?oc=5	Australian Environment Ministers have proposed a national approach to packaging regulation, focusing on ambitious targets, minimum recycled content requirements, and harmful chemical prohibitions. This initiative aims to transition Australia to a circular economy while promoting collaboration across the supply chain. Various industry leaders welcomed these regulatory reforms, emphasizing the importance of traceability and collection systems for effective recycling and reduced waste. The proposed measures are expected to create job opportunities and significantly improve environmental outcomes.	TRUE, because the proposed packaging regulations aim to reduce waste, promote recycling, and enhance environmental sustainability through mandatory design standards and recycled content requirements.	TRUE, because the article discusses regulatory changes that will lead to new and improved processes in the packaging industry, significantly different from previous approaches, aimed at enhancing sustainability.	FALSE, because the article does not identify a specific good or service that fits the definition of a green product but rather discusses broader regulatory changes impacting packaging.	TRUE, because the article outlines new packaging processes that minimize environmental impacts through mandated design standards and recycling requirements, promoting a circular economy.	Pact Group	Pact Group Holdings Ltd	national packaging standards	Likely NAICS Codes: 322211 - Flexible Packaging Manufacturing; 326199 - All Other Plastics Product Manufacturing; 311999 - All Other Miscellaneous Food Manufacturing; 335999 - All Other Miscellaneous Electrical Equipment and Component Manufacturing	FALSE, because the article discusses genuine regulatory reforms and industry commitments to enhance sustainability rather than misleading claims about environmental benefits.	2459
Malakoff Geared To Support Malaysia's Environmental Goals - BusinessToday	https://news.google.com/rss/articles/CBMiZWh0dHBzOi8vd3d3LmJ1c2luZXNzdG9kYXkuY29tLm15LzIwMjMvMTEvMjcvbWFsYWtvZmYtZ2VhcmVkLXRvLXN1cHBvcnQtbWFsYXlzaWFzLWVudmlyb25tZW50YWwtZ29hbHMv0gEA?oc=5	The article discusses Malakoff Corporation Berhad's role in Malaysia's environmental efforts, particularly its solid waste management solutions aimed at achieving sustainability and reducing greenhouse gas emissions. Malakoff offers various services that support waste management and recycling while advocating for policy changes to enhance these initiatives. The company is committed to expansion in waste management and the Waste-to-Energy sector, aligning with Malaysia's circular economy and carbon neutrality goals. Overall, Malakoff seeks to improve waste management practices to benefit both communities and the environment.	TRUE: This is green innovation because Malakoff Corporation focuses on sustainable solid waste management solutions that contribute to reducing greenhouse gas emissions and promoting recycling.	TRUE: This is a business innovation as Malakoff has introduced new and improved solid waste management processes and services that differ significantly from previous practices.	FALSE: The article does not mention a specific good that qualifies as a green product under the given definition, focusing more on processes and services.	TRUE: This is a green process because Malakoff employs methods that minimize environmental impacts in solid waste management, including recycling and waste-to-energy technologies.	Malakoff Corporation Berhad	Malakoff Corporation Berhad	Fasiliti Inovasi Kitar Semula (FIKS)	Likely NAICS Codes: 562920 - Materials Recovery Facilities, 562111 - Solid Waste Collection, 562212 - Solid Waste Landfill, 561210 - Facilities Support Services	FALSE: The article does not suggest any deceptive marketing practices. Malakoff's efforts in solid waste management appear genuine and are supported by their expansion into sustainable practices and policy advocacy.	3013
