title	link	summary	green_innovation	business_innovation	green_product	green_process	company	official_company_name	product_or_process	likely_naics_codes	greenwashing	total_tokens
Austria launches $16 million rebate scheme for residential storage - pv magazine International	https://news.google.com/rss/articles/CBMiaWh0dHBzOi8vd3d3LnB2LW1hZ2F6aW5lLmNvbS8yMDIzLzA0LzAzL2F1c3RyaWEtbGF1bmNoZXMtMTYtbWlsbGlvbi1yZWJhdGUtc2NoZW1lLWZvci1yZXNpZGVudGlhbC1zdG9yYWdlL9IBAA?oc=5	Austria has launched a €15 million subsidy scheme for residential batteries to support the installation and expansion of new storage systems used with renewable energy. Eligible storage devices with capacities between 4 kWh and 50 kWh will receive a flat-rate subsidy of €200/kWh. Participants must register for the program, file for permits, and use authorized installers, with projects to be completed within 24 months. The initiative aims to improve power supply in areas with underdeveloped grids or excess renewable energy production.	TRUE, because the subsidy scheme promotes the installation of battery storage systems that integrate with renewable energy sources, thereby supporting environmental sustainability and reducing reliance on fossil fuels.	TRUE, because the subsidy scheme represents a new method of financing and implementing energy storage solutions, which significantly differs from previous methods used in the energy sector.	FALSE, because the article does not specifically identify a product, but instead discusses a subsidy program for battery storage without naming a particular good.	TRUE, because the installation of the battery storage systems involves methods that promote sustainability by minimizing environmental impacts through the use of renewable energy and energy-efficient technologies.	company not identified	product or process not identified	battery storage systems	Likely NAICS Codes: 221118 - Other Electric Power Generation, 335999 - All Other Miscellaneous Electrical Equipment and Component Manufacturing, 333618 - Other Engine Equipment Manufacturing, 541690 - Other Scientific and Technical Consulting Services	FALSE, because the article does not include false or misleading statements about the environmental benefits of the subsidy scheme or the battery storage systems; it provides clear information about the program's intent to support renewable energy integration.	1604
Consumer Companies Must Innovate to Drive Impact on Climate - BCG	https://news.google.com/rss/articles/CBMicWh0dHBzOi8vd3d3LmJjZy5jb20vcHVibGljYXRpb25zLzIwMjMvY29uc3VtZXItY29tcGFuaWVzLW5lZWQtaW5ub3ZhdGl2ZS1jbGltYXRlLWNoYW5nZS1zb2x1dGlvbnMtdG8tZHJpdmUtaW1wYWN00gEA?oc=5	The article discusses the challenges and opportunities within the Consumer Packaged Goods (CPG) sector regarding sustainability and innovation, highlighting how companies like Nestlé and AB InBev are making strides towards greener products and processes. It points out the importance of aligning innovations with consumer needs and the need for advanced digital tools to drive sustainable practices. Additionally, it emphasizes that consumer participation is crucial for the effectiveness of sustainability efforts, along with case examples of innovations like Nestlé's plant-based products and ABI's agricultural initiatives.	TRUE, because the article discusses innovations and initiatives by companies aimed at reducing environmental impact through sustainable practices, such as using renewable resources and developing greener products.	TRUE, because it describes the strategic efforts of CPG companies to innovate their product offerings and business processes to meet sustainability criteria and changing consumer behaviors.	TRUE, because the article mentions green products like Nestlé's plant-based alternatives, which are designed to have a lower environmental impact throughout their life cycle.	TRUE, because the article outlines sustainable practices such as manufacturing with renewable energy and optimizing supply chains to reduce carbon emissions.	Nestlé and AB InBev	Nestlé S.A. and Anheuser-Busch InBev	Wunda (pea-based milk alternative)	Likely NAICS Codes: 3111 - Animal Food Manufacturing; 3114 - Fruit and Vegetable Preserving and Specialty Food Manufacturing; 3121 - Beverage Manufacturing; 3253 - Pesticide, Fertilizer, and Other Agricultural Chemical Manufacturing	FALSE, because the article presents genuine innovations and efforts by companies to enhance sustainability and does not suggest misleading information regarding their environmental credentials.	3820
Plastic-free produce: Are supermarkets and shoppers ready for loose fruit and veg? - Grocery Gazette	https://news.google.com/rss/articles/CBMiRGh0dHBzOi8vd3d3Lmdyb2NlcnlnYXpldHRlLmNvLnVrLzIwMjMvMDQvMTIvcGxhc3RpYy1sb29zZS1mcnVpdC12ZWcv0gEA?oc=5	The article discusses the growing movement against plastic packaging in supermarkets, highlighting the push for offering more loose fresh produce to reduce plastic waste, food waste, and save costs for consumers. While organizations such as Wrap set targets for reducing packaging, supermarkets face consumer hesitance due to concerns about hygiene and cost. Efforts are underway to increase loose product offerings, but critics argue that these initiatives are not ambitious enough and may lack urgency. Overall, there is a clear push for more sustainable shopping practices, but challenges remain.	TRUE, because the initiatives discussed aim to eliminate plastic packaging, reduce waste, and contribute to sustainability goals.	TRUE, as the shift in packaging and product offerings represents a new process being introduced by supermarkets that significantly differs from their previous practices.	FALSE, because while the initiative relates to the concept of green products, no specific product is directly identified as a green product within the article.	TRUE, because the move towards offering loose produce and reducing packaging is a method aimed at minimizing environmental impact and promoting sustainability.	company not identified	product or process not identified	not found	Likely NAICS Codes: 445110 - Supermarkets and Other Grocery (except Convenience) Stores; 312113 - Soft Drink Manufacturing; 311811 - Retail Bakeries; 722515 - Snack and Nonalcoholic Beverage Bars.	FALSE, as the article does not indicate that the initiatives are misleading or exaggerated; instead, they reflect genuine efforts to address packaging waste and promote sustainability.	2845
SFST's speech at High-level Dialogue cum Dinner - "Hong Kong's Unique Position as the Green Finance and Fintech ... - info.gov.hk	https://news.google.com/rss/articles/CBMiQGh0dHBzOi8vd3d3LmluZm8uZ292LmhrL2dpYS9nZW5lcmFsLzIwMjMwNC8xNC9QMjAyMzA0MTMwMDM0Ni5odG3SAQA?oc=5	The article discusses Hong Kong's commitment to becoming a leading hub for green finance and fintech, highlighting the government's initiatives to achieve carbon neutrality and promote sustainable development through green technology and finance. It details the action agenda for building a green ecosystem, facilitating green financing, and enhancing international collaboration, while also mentioning the significant market for green technology. The speech emphasizes the role of fintech in supporting these green initiatives and the potential for partnerships with the EU.	TRUE, because the article outlines Hong Kong's sustainable development goals, such as reducing carbon emissions, promoting green finance, and developing a green technology ecosystem.	TRUE, because it discusses new initiatives and processes the Hong Kong government is implementing to enhance its capabilities in green finance and fintech.	FALSE, because while the article addresses green finance and technology, it does not mention a specific product that meets the definition of a green product.	TRUE, because the article refers to various processes and initiatives aimed at minimizing environmental impacts and promoting sustainability within the finance and fintech sectors.	company not identified	company not identified	product or process not identified	Likely NAICS Codes: 5239 - Other Financial Investment Activities, 5416 - Management, Scientific, and Technical Consulting Services, 6113 - Colleges, Universities, and Professional Schools, 9241 - Administration of Environmental Quality Programs	FALSE, because the article presents a committed and transparent approach toward promoting green initiatives and sustainable practices in Hong Kong without misleading claims.	3104
Crown Coaches invests in Viva Energy carbon neutral diesel | News - Australasian Bus and Coach	https://news.google.com/rss/articles/CBMiaWh0dHBzOi8vd3d3LmJ1c25ld3MuY29tLmF1L2luZHVzdHJ5LW5ld3MvMjMwNC9jcm93bi1jb2FjaGVzLWludmVzdHMtaW4tdml2YS1lbmVyZ3ktY2FyYm9uLW5ldXRyYWwtZGllc2VsL9IBAA?oc=5	Crown Coaches has partnered with Viva Energy Australia to fuel its fleet with opt-in Carbon Neutral Diesel, certified by Climate Active, as part of its commitment to reduce carbon emissions. The company aims to transition to electric vehicles in the coming years while using low-carbon fuel to lower its carbon footprint in the short and medium term. Viva Energy supports businesses in their decarbonisation efforts with various low-carbon solutions.	TRUE - This is green innovation because it involves the use of opt-in Carbon Neutral Diesel, which helps reduce carbon emissions and supports sustainability goals.	TRUE - This is a business innovation because it represents a new approach in Crown Coaches' business processes by integrating low-carbon fuels into their operations.	TRUE - The opt-in Carbon Neutral Diesel qualifies as a green product because it is designed to significantly reduce environmental impact throughout its life cycle and is certified for its carbon-neutral claims.	TRUE - The utilization of Carbon Neutral Diesel reflects a green process as it minimizes environmental impacts and promotes sustainability by reducing carbon emissions.	Crown Coaches	Crown Coaches	opt-in Carbon Neutral Diesel	Likely NAICS Codes: 485111 - Mixed Mode Transit Systems, 486210 - Pipeline Transportation of Natural Gas, 324121 - Asphalt Paving Mixture and Block Manufacturing, 221118 - Other Electric Power Generation.	FALSE - The article does not indicate greenwashing as Crown Coaches' use of certified Carbon Neutral Diesel is accompanied by transparency about their sustainability efforts and a clear plan for future improvements.	2046
Viva Energy launches opt-in Carbon Neutral Diesel program - Big Rigs	https://news.google.com/rss/articles/CBMiXGh0dHBzOi8vYmlncmlncy5jb20uYXUvMjAyMy8wNC8yNi92aXZhLWVuZXJneS1sYXVuY2hlcy1vcHQtaW4tY2FyYm9uLW5ldXRyYWwtZGllc2VsLXByb2dyYW0v0gEA?oc=5	Viva Energy is introducing Climate Active-certified opt-in carbon neutral products to assist industry sectors with their decarbonisation journey. Crown Coaches is the first customer to adopt these low-carbon fuels, aiming to reduce their carbon footprint while transitioning to fully electric vehicles. Viva Energy also plans to develop infrastructure for alternative fuels like hydrogen and EV charging. Their New Energies Service Station in Geelong will be one of the first publicly accessible refuelling sites for heavy vehicles in Australia.	TRUE: The introduction of opt-in carbon neutral products and low carbon fuels contributes to decarbonisation and reduces negative environmental impacts.	TRUE: The development of new carbon neutral products and partnerships with commercial customers marks a significant improvement in Viva Energy's product offerings.	TRUE: The opt-in Carbon Neutral Diesel is designed to significantly reduce environmental impact throughout its lifecycle by offsetting emissions.	TRUE: The methods used by Viva Energy to source carbon credits and deliver low carbon fuels reflect processes aimed at minimizing environmental impacts.	Viva Energy	Viva Energy Australia	opt-in Carbon Neutral Diesel	Likely NAICS Codes: 324110 - Petroleum Refineries, 324191 - Petroleum Lubricating Oil and Grease Manufacturing, 486210 - Natural Gas Coating, 486110 - Crude Petroleum and Natural Gas Extraction	FALSE: There is no indication of misleading claims; the company appears to genuinely provide carbon neutral solutions to assist customers with their environmental goals.	1922
The Battle for Net Zero Will Be Won or Lost in Asia - BCG	https://news.google.com/rss/articles/CBMiTWh0dHBzOi8vd3d3LmJjZy5jb20vcHVibGljYXRpb25zLzIwMjMvYmF0dGxlLWZvci1uZXQtemVyby13b24tb3ItbG9zdC1pbi1hc2lh0gEA?oc=5	The article discusses Asia's significant contribution to global greenhouse gas emissions and highlights the economic opportunities associated with the transition to net zero emissions. It emphasizes the necessity for businesses in Asia to adopt climate action strategies while navigating complex regional challenges. The potential for job growth and revenue in sectors like renewable energy is also noted, urging companies to take swift and impactful actions for sustainability.	TRUE: The article promotes climate action and sustainable practices by encouraging businesses to adopt strategies that reduce emissions and support the energy transition, thus contributing to environmental sustainability.	TRUE: The article outlines the need for businesses to innovate by creating new capabilities and processes aimed at addressing climate risks, which reflects a significant improvement over previous methods.	FALSE: The article does not specifically mention any goods or services that meet the criteria for a green product.	FALSE: While the article discusses the need for companies to undertake climate action, it does not specifically identify any processes as green processes.	company not identified	product or process not identified	not found	Likely NAICS Codes: 221118 - Other Electric Power Generation, 541620 - Environmental Consulting Services, 562910 - Remediation Services, 811121 - Automotive Body, Paint, Interior, and Glass Repair	FALSE: There is no indication of greenwashing in the article as it discusses genuine climate action and opportunities for sustainable practices rather than misleading claims.	2271
