title	link	summary	green_innovation	business_innovation	green_product	green_process	company	official_company_name	product_or_process	likely_naics_codes	greenwashing	total_tokens
Top 10: Brands Embracing the Circular Economy - Sustainability Magazine	https://news.google.com/rss/articles/CBMiWGh0dHBzOi8vc3VzdGFpbmFiaWxpdHltYWcuY29tL3RvcDEwL3RvcC0xMC1icmFuZHMtZW1icmFjaW5nLXRoZS1jaXJjdWxhci1lY29ub215LWluLTIwMjPSAQA?oc=5	The article discusses brands increasingly embracing the circular economy to promote sustainable development and reduce environmental impact. Patagonia is highlighted for its sustainability initiatives, such as The Worn Wear program promoting repair, reuse, and recycling of garments. The brand also focuses on incorporating recycled materials and sustainable fibers in its clothing lines.	TRUE: The article describes Patagonia's efforts in promoting a circular economy and sustainability, aligning with the definitions of green innovation by reducing waste and minimizing environmental impact.	TRUE: The article highlights the new initiatives taken by Patagonia, such as The Worn Wear program, which represents significant improvements to its business processes and product offerings.	TRUE: Patagonia's clothing line incorporates recycled materials and uses organic cotton, fitting the definition of a green product as it reduces environmental impact throughout its life cycle.	TRUE: The Worn Wear program represents a green process as it minimizes waste and promotes sustainability through repair and recycling initiatives.	Patagonia	Patagonia, Inc.	The Worn Wear program	[{'code': '31311', 'category': 'Fiber, Yarn, and Thread Mills'}, {'code': '31521', 'category': 'Cut and Sew Apparel Manufacturing'}, {'code': '4233', 'category': 'Apparel, Piece Goods, and Notions Wholesalers'}, {'code': '4481', 'category': 'Clothing Stores'}]	FALSE: The article provides a transparent account of Patagonia's initiatives and their commitment to sustainability without misleading claims, indicating genuine efforts rather than greenwashing.	1606
New Data Show Consumers Increasingly Choose Products in Sustainable Packaging - Packaging Strategies	https://news.google.com/rss/articles/CBMigQFodHRwczovL3d3dy5wYWNrYWdpbmdzdHJhdGVnaWVzLmNvbS9hcnRpY2xlcy8xMDM3OTEtbmV3LWRhdGEtc2hvdy1jb25zdW1lcnMtaW5jcmVhc2luZ2x5LWNob29zZS1wcm9kdWN0cy1pbi1zdXN0YWluYWJsZS1wYWNrYWdpbmfSAQA?oc=5	The 2023 Buying Green Report by Trivium Packaging reveals a rising demand for sustainable packaging among consumers, with 82% willing to pay more despite inflation. Younger consumers, particularly, show a strong preference for eco-friendly options, increasing the need for clarity in sustainability claims. Trivium emphasizes the importance of educating consumers about their purchases and the environmental impact. The report, based on a survey of over 9,000 consumers across various regions, highlights a clear trend towards sustainability in consumer preferences.	TRUE - The article discusses the demand for sustainable packaging solutions, which contribute to environmental sustainability goals by reducing resource consumption and limiting harmful environmental impacts of packaging.	TRUE - The increasing consumer preference for products with sustainable packaging and the subsequent adaptation of business strategies at Trivium Packaging to meet this demand represent a significant change in their business model.	TRUE - Sustainable packaging, as described in the report, meets the definition of a green product since it is designed and used to significantly reduce its environmental impact throughout its life cycle.	FALSE - While the article discusses sustainable practices and consumer preferences, it does not specifically outline a green process related to manufacturing methods or techniques employed by Trivium Packaging.	Trivium Packaging	Trivium Packaging	product or process not identified	Likely NAICS Codes: 322211 - Paper Bag and Coated and Treated Paper Manufacturing, 322220 - Paper Bag and Coated and Treated Paper Manufacturing, 326150 - Urethane and Other Foam Product (except Polystyrene) Manufacturing, 326199 - All Other Plastics Product Manufacturing	FALSE - The article does not exhibit characteristics of greenwashing; it provides substantial data supporting the trend towards sustainable packaging and emphasizes educating consumers about environmental impacts.	2065
Circular Design Helps Homeowners Waste Less, Preserve More - National Association of REALTORS®	https://news.google.com/rss/articles/CBMiWmh0dHBzOi8vd3d3Lm5hci5yZWFsdG9yL21hZ2F6aW5lL2NpcmN1bGFyLWRlc2lnbi1oZWxwcy1ob21lb3duZXJzLXdhc3RlLWxlc3MtcHJlc2VydmUtbW9yZdIBAA?oc=5	The article discusses circular design as a sustainability-focused philosophy in interior design that aims to reduce waste by creating products and spaces with extended lifecycles. It highlights how homeowners can adopt circular design practices such as prioritizing recycled materials and sourcing durable products. This approach emphasizes a shift away from traditional linear design towards environmentally conscious choices. The article positions circular design as a fundamental practice rather than a fleeting trend.	TRUE: This is green innovation as it focuses on reducing waste and environmental impact through circular design principles.	TRUE: This article discusses products and processes related to circular design, which significantly differ from traditional interior design practices, thus qualifying as business innovation.	FALSE: While the article discusses the concept of circular design, it does not mention specific green products that meet the definition provided.	TRUE: The article describes the circular design process which minimizes environmental impacts and promotes sustainability through techniques such as recycling and using sustainable materials.	company not identified	company not identified	Circular Design	Likely NAICS Codes: 541410 - Interior Design Services, 314120 - Floor Covering Manufacturing, 321920 - Wood Container and Pallet Manufacturing, 326199 - All Other Plastics Product Manufacturing	FALSE: The article does not appear to be an example of greenwashing as it genuinely promotes sustainable practices and transparency in the philosophy of circular design.	2409
Henry Schein Champions Sustainable Business Practices With the Launch of Practice Green in North America - businesswire.com	https://news.google.com/rss/articles/CBMioQFodHRwczovL3d3dy5idXNpbmVzc3dpcmUuY29tL25ld3MvaG9tZS8yMDIzMDQxMDAwNTQzMS9lbi9IZW5yeS1TY2hlaW4tQ2hhbXBpb25zLVN1c3RhaW5hYmxlLUJ1c2luZXNzLVByYWN0aWNlcy1XaXRoLXRoZS1MYXVuY2gtb2YtUHJhY3RpY2UtR3JlZW4taW4tTm9ydGgtQW1lcmljYdIBAA?oc=5	Henry Schein, Inc. launched Practice Green, a global initiative encouraging eco-friendly practices among health care practitioners in the U.S. and Canada, coinciding with Earth Day 2023. The program offers a curated collection of green dental products and aims to engage customers in sustainable practices. Additionally, the company is implementing carbon neutral shipping and has committed to reducing its environmental impact. The initiative reflects Henry Schein's commitment to environmental stewardship and sustainable business practices.	TRUE: The initiative promotes eco-friendly practices, offers sustainable product options, and aims to reduce environmental impact, which aligns with the principles of green innovation.	TRUE: The launch of Practice Green represents a new business initiative that introduces improved processes and products aimed at promoting sustainability, differentiating it significantly from previous practices.	TRUE: The curated collection of 'green' dental products includes items that are reusable, contain recycled materials, or are biodegradable, meeting the definition of green products.	TRUE: The implementation of carbon neutral shipping and sustainable practices exemplifies green processes aimed at reducing environmental impacts.	Henry Schein, Inc.	Henry Schein, Inc.	Practice Green	['423450 - Medical, Dental, and Hospital Equipment and Supplies Merchant Wholesalers', '423990 - Other Miscellaneous Durable Goods Merchant Wholesalers', '541611 - Administrative Management and General Management Consulting Services', '812199 - Other Personal Care Services']	FALSE: The article does not indicate any misleading or exaggerated claims about environmental benefits; instead, it outlines concrete initiatives and commitments to sustainability.	2395
Sustainability and ESG glossary: 52 terms to know - TechTarget	https://news.google.com/rss/articles/CBMiX2h0dHBzOi8vd3d3LnRlY2h0YXJnZXQuY29tL3N1c3RhaW5hYmlsaXR5L2ZlYXR1cmUvU3VzdGFpbmFiaWxpdHktYW5kLUVTRy1nbG9zc2FyeS1UZXJtcy10by1rbm930gEA?oc=5	The article emphasizes the importance of sustainable practices and understanding key sustainability and ESG concepts amid the negative impacts of climate disruption. It highlights the roles of individuals, businesses, nonprofits, and governments in developing and executing sustainability strategies. The text underlines the need for informed discussions to prevent the misuse of terminology related to sustainability and ESG initiatives.	FALSE, the article does not specifically describe a product or process that contributes directly to environmental sustainability goals.	FALSE, the article does not mention a new or improved product or business process introduced to the market.	FALSE, the article does not define or describe any specific good or service designed to reduce environmental impact.	FALSE, the article does not detail any methods or techniques that minimize environmental impacts.	company not identified	product or process not identified	not found	Likely NAICS Codes: 611710 - Educational Support Services, 541620 - Environmental Consulting Services, 921120 - Administration of Urban Planning and Community and Rural Development, 813312 - Environment, Conservation and Wildlife Organizations	FALSE, the article does not contain misleading statements about the environmental benefits of a product or practice; instead, it promotes genuine sustainability discussions.	1390
Maud Borup speaks on sustainability and becoming a certified B Corp - Snack Food & Wholesale Bakery	https://news.google.com/rss/articles/CBMicmh0dHBzOi8vd3d3LnNuYWNrYW5kYmFrZXJ5LmNvbS9hcnRpY2xlcy8xMDg3NTQtbWF1ZC1ib3J1cC1zcGVha3Mtb24tc3VzdGFpbmFiaWxpdHktYW5kLWJlY29taW5nLWEtY2VydGlmaWVkLWItY29ycNIBAA?oc=5	Maud Borup, led by Christine Lantinen, has implemented sustainable practices and achieved B Corp certification, focusing on initiatives such as a zero-landfill waste approach and renewable energy sources like wind power. The company is actively enhancing its operations by sourcing recycled materials for packaging while navigating challenges during the pandemic. These efforts highlight their commitment to environmental sustainability and continuous improvement in manufacturing processes.	TRUE - The article discusses several sustainable practices and innovations implemented by Maud Borup, such as a zero-landfill waste initiative, the installation of a wind turbine for renewable energy, and the focus on recycled content in packaging, all of which contribute to environmental sustainability.	TRUE - Maud Borup's introduction of new sustainable practices, achievement of certifications such as B Corp and SQF, and continuous improvement of products and processes demonstrate significant advancements from their previous operations.	FALSE - The article does not specifically name a product that meets the definition of a green product; rather, it focuses on the company's practices and initiatives.	TRUE - The article outlines various processes in Maud Borup's operations that minimize environmental impact, such as the zero-landfill waste initiative and the use of renewable energy sources, which align with the definition of green processes.	Maud Borup	Maud Borup, Inc.	product or process not identified	Likely NAICS Codes: 311330 - Confectionery Manufacturing from Purchased Chocolate, 311340 - Nonchocolate Confectionery Manufacturing, 325998 - All Other Miscellaneous Chemical Product and Preparation Manufacturing, 423850 - Service Establishment Equipment and Supplies Merchant Wholesalers	FALSE - The article does not exhibit signs of greenwashing; it provides specific details about Maud Borup's genuine sustainability practices and certifications, indicating a sincere commitment to environmental responsibility.	2542
Harpe Bioherbicide Solutions, Inc. Closes New Investment Round, Including ADM - PR Newswire	https://news.google.com/rss/articles/CBMiggFodHRwczovL3d3dy5wcm5ld3N3aXJlLmNvbS9uZXdzLXJlbGVhc2VzL2hhcnBlLWJpb2hlcmJpY2lkZS1zb2x1dGlvbnMtaW5jLWNsb3Nlcy1uZXctaW52ZXN0bWVudC1yb3VuZC1pbmNsdWRpbmctYWRtLTMwMTc5ODIyMS5odG1s0gEA?oc=5	Harpe Bioherbicide Solutions, Inc. announced a $10.5 million funding round to advance its natural herbicide formulations and herbicide-tolerant row crop systems. The investment will help develop new, sustainable herbicide options for organic and regenerative agriculture, addressing weed resistance while reducing reliance on synthetic chemicals. This initiative aligns with ADM's commitment to sustainability and aims to support farmers globally with innovative, environmentally friendly agricultural solutions.	TRUE - The innovations discussed focus on developing natural herbicides that minimize environmental impact and promote sustainable agricultural practices.	TRUE - The article highlights the advancement of a new product (natural herbicides) and business process (herbicide-tolerant crop systems) introduced to the market by Harpe Bioherbicide Solutions.	TRUE - The natural herbicides are designed and used to significantly reduce environmental impact throughout their life cycle compared to traditional synthetic herbicides.	TRUE - The manufacturing and development processes for the natural herbicides focus on minimizing waste and reducing harmful chemicals, promoting sustainability.	Harpe Bioherbicide Solutions, Inc.	Harpe Bioherbicide Solutions, Inc.	Natural herbicides and herbicide-tolerant row crop systems.	Likely NAICS Codes: 211120 - Crude Petroleum Extraction, 325320 - Pesticide and Other Agricultural Chemical Manufacturing, 541620 - Environmental Consulting Services, 115112 - Soil Preparation, Planting, and Cultivating.	FALSE - The article does not appear to be an example of greenwashing as it describes genuine efforts by Harpe Bioherbicide Solutions to create and promote environmentally sustainable agricultural products.	2346
How can farmers deliver on EU Green Deal environmental commitments? | - Open Access Government	https://news.google.com/rss/articles/CBMiaGh0dHBzOi8vd3d3Lm9wZW5hY2Nlc3Nnb3Zlcm5tZW50Lm9yZy9ob3ctZmFybWVycy1kZWxpdmVyLWV1LWdyZWVuLWRlYWwtZW52aXJvbm1lbnRhbC1jb21taXRtZW50cy8xNTY5NDgv0gEA?oc=5	The article discusses the EU Green Deal's environmental commitments that require farmers to adopt sustainable practices to reduce their carbon footprints and meet climate goals. It emphasizes the need for farmers to implement technologies and strategies that promote sustainability, enhance biodiversity, and conserve resources. Financial support and incentives for farmers are also outlined, along with the implications of these practices for broader environmental and economic benefits. Overall, the article highlights the critical role of farmers in achieving the EU's sustainability targets.	TRUE - The article discusses innovations and practices aimed at improving environmental sustainability in agriculture through reduced emissions, sustainable land use, and enhanced biodiversity, aligning with the definition of green innovation.	TRUE - The article describes new or improved practices and technologies that farmers can adopt to enhance their operations and comply with the EU Green Deal, representing significant changes from traditional farming methods.	FALSE - The article does not identify a specific good or service that fits the definition of a green product; rather, it discusses practices and strategies that promote sustainability.	TRUE - The article outlines various sustainable agricultural practices and technologies that promote resource efficiency and minimize environmental impact, fitting the definition of a green process.	company not identified	company not identified	product or process not identified	Likely NAICS Codes: 111 - Crop Production, 112 - Animal Production and Aquaculture, 113 - Forestry and Logging, 115 - Support Activities for Agriculture and Forestry	FALSE - The article does not exhibit signs of greenwashing, as it discusses legitimate commitments and strategies for sustainable farming rather than making misleading claims about environmental benefits.	5996
Sustainability in Singapore: 21 easy eco-friendly tips to live a green life - The Honeycombers	https://news.google.com/rss/articles/CBMiVGh0dHBzOi8vdGhlaG9uZXljb21iZXJzLmNvbS9zaW5nYXBvcmUvc3VzdGFpbmFiaWxpdHktaW4tc2luZ2Fwb3JlLWVjby1mcmllbmRseS10aXBzL9IBAA?oc=5	The article provides insights from eco-conscious entrepreneurs in Singapore who share sustainable living tips. These tips include swapping single-use products for reusable ones, supporting local and ethical businesses, and adopting a more plant-based diet. The emphasis is on actionable and straightforward changes that individuals can implement in their daily lives to help reduce their environmental impact. The overall message is that small, incremental steps can create significant positive change for the planet.	TRUE, because the article promotes various sustainable practices and products that contribute to environmental sustainability goals, aligning with the definitions of green innovation.	TRUE, because the article discusses entrepreneurial initiatives that introduce new or improved sustainable products and processes to the market.	TRUE, because it mentions products like reusable period underwear, solid soap bars, and eco-friendly kitchen sponges that significantly reduce environmental impact throughout their life cycle.	TRUE, because it highlights processes such as composting and the use of concentrated cleaning products that minimize waste and reduce environmental impacts.	Mooncheeks, The Green Collective, Sacha Botanicals, Indosole Singapore, Unpackt, Habitat Collective, Loving Loot, Nimbu, The Fashion Pulpit, Green Is The New Black, Rejenerate, etc.	Company not identified	Reusable period underwear, solid soap bars, eco-friendly kitchen sponges, composting techniques.	Likely NAICS Codes: 325611 - Soap and Other Detergent Manufacturing; 447190 - Other Gasoline Stations; 424990 - Other Miscellaneous Nondurable Goods Merchant Wholesalers; 812199 - Other Personal Care Services.	FALSE, because the article promotes genuine sustainable practices and products without making misleading claims about their environmental benefits.	4811
The Sustainable Fashion Revolution: Transforming the Textile Industry - Indian Retailer	https://news.google.com/rss/articles/CBMigQFodHRwczovL3d3dy5pbmRpYW5yZXRhaWxlci5jb20vYXJ0aWNsZS9yZXRhaWwtYnVzaW5lc3MvcmV0YWlsLXRyZW5kcy9zdXN0YWluYWJsZS1mYXNoaW9uLXJldm9sdXRpb24tdHJhbnNmb3JtaW5nLXRleHRpbGUtaW5kdXN0cnnSAQA?oc=5	The article discusses the top luxury watch brands in India, highlighting their unique features, heritage, and styles. It emphasizes the blend of tradition and modernity within these brands, as well as the factors to consider when choosing the right watch. It also provides insights into the luxury watch market in India, addressing consumer preferences and investment potential.	FALSE - The article does not discuss any innovations specifically aimed at enhancing environmental sustainability or reducing negative environmental impacts.	TRUE - The article discusses luxury watches as new or improved products that significantly differ from previous offerings, thus qualifying as business innovations.	FALSE - The watches discussed do not meet the definition of green products as they do not significantly reduce environmental impact throughout their life cycle.	FALSE - The article does not describe any processes or methods used in manufacturing the watches that minimize environmental impact.	company not identified	official_company_name not identified	product or process not identified	Likely NAICS Codes: 315280 - Other Cut and Sew Apparel Manufacturing, 423990 - Other Miscellaneous Durable Goods Merchant Wholesalers, 448210 - Shoe Stores, 448320 - Luggage and Leather Goods Stores	FALSE - The article does not present misleading statements about environmental benefits; it focuses on luxury watch brands and their craftsmanship rather than making false environmental claims.	5525
Top 10 Best Agriculture Companies In USA 2023 - Inventiva	https://news.google.com/rss/articles/CBMiSmh0dHBzOi8vd3d3LmludmVudGl2YS5jby5pbi90cmVuZHMvYmVzdC1hZ3JpY3VsdHVyZS1jb21wYW5pZXMtaW4tdXNhLTIwMjMv0gEA?oc=5	The article discusses the growth and importance of the agriculture industry in the United States, highlighting major companies' investments in technology, sustainable practices, and innovations like precision agriculture and genetic engineering to meet the demands of a growing population. Companies such as Monsanto, Syngenta, and Cargill are noted for their commitment to sustainability and environmental stewardship. The article concludes that the sector is expected to benefit from new technologies and consumer demand for organic food while exploring opportunities in emerging markets.	TRUE - The article mentions several companies implementing sustainable practices and technologies, such as precision agriculture and reducing environmental impact, which align with the goals of green innovation.	TRUE - The article discusses innovations in agriculture, including new technologies and methods that significantly differ from past practices, which classifies them as business innovation.	FALSE - The article does not specify a particular good or service that distinctly meets the definition of a green product.	TRUE - The implementation of precision agriculture and sustainable farming practices mentioned in the article qualifies as green processes aimed at minimizing environmental impact.	Monsanto, Syngenta, Cargill, and others	Bayer AG (for Monsanto), Syngenta AG, Cargill, Inc.	precision agriculture	Likely NAICS Codes: 111 - Crop Production, 112 - Animal Production, 311 - Food Manufacturing, 541 - Professional, Scientific, and Technical Services	FALSE - The article does not present information that indicates misleading or false claims regarding environmental benefits; rather, it highlights legitimate sustainable practices being adopted by the agriculture companies.	4761
Top 10 Best Dairy Farming Companies In USA In 2023 - Inventiva	https://news.google.com/rss/articles/CBMiRmh0dHBzOi8vd3d3LmludmVudGl2YS5jby5pbi90cmVuZHMvdG9wLWRhaXJ5LWZhcm1pbmctY29tcGFuaWVzLWluLXVzYS_SAQA?oc=5	The article discusses the vital role of dairy farming in the U.S. economy, highlighting significant production figures and technologies used for efficiency and quality. It emphasizes the economic importance of the dairy industry and the challenges it faces, while showcasing leading dairy companies committed to sustainable practices and innovation. The future of dairy farming looks promising with expected growth and innovation in product offerings.	TRUE, because the article highlights dairy companies that implement sustainable practices, such as sourcing ingredients responsibly, using renewable energy, and promoting environmental stewardship.	TRUE, because the article describes various companies in the dairy industry improving their processes, developing new products, and employing innovative technologies which differ significantly from their previous operations.	TRUE, as it mentions dairy products designed and produced with reduced environmental impact and efforts to promote sustainable agriculture, making them environmentally friendly goods.	TRUE, since the article discusses advanced technologies and sustainable practices in dairy farming, such as precision agriculture and robotic milking, which minimize environmental impact.	Land O’ Lakes	Land O' Lakes, Inc.	Robotic milking systems	Likely NAICS Codes: 112120 - Dairy Cattle and Milk Production, 311511 - Fluid Milk Manufacturing, 312112 - Bottled Water Manufacturing, 311513 - Ice Cream and Frozen Dessert Manufacturing	FALSE, because the article emphasizes genuine sustainability efforts and technological innovations in dairy farming rather than making false claims about environmental benefits.	4977
