title,links,link,summary,published,published_parsed,news_source,news_image,news_imagesize,news_imagemaxwidth,news_imagemaxheight,title_detail.type,title_detail.language,title_detail.base,title_detail.value,summary_detail.type,summary_detail.language,summary_detail.base,summary_detail.value,query
"Retail Tech: VF Corp Deploys Mobile Inventory Scanning, Kohl's Debuts ‘The Return Drop'","[{'rel': 'alternate', 'type': 'text/html', 'href': 'http://www.bing.com/news/apiclick.aspx?ref=FexRss&aid=&tid=667b5ce970874257aab00b8d241cd1b0&url=https%3a%2f%2fwww.msn.com%2fen-us%2fmoney%2fcompanies%2fretail-tech-vf-corp-deploys-mobile-inventory-scanning-kohl-s-debuts-the-return-drop%2far-BB1oSGix&c=15802554820513801174&mkt=en-us'}]",http://www.bing.com/news/apiclick.aspx?ref=FexRss&aid=&tid=667b5ce970874257aab00b8d241cd1b0&url=https%3a%2f%2fwww.msn.com%2fen-us%2fmoney%2fcompanies%2fretail-tech-vf-corp-deploys-mobile-inventory-scanning-kohl-s-debuts-the-return-drop%2far-BB1oSGix&c=15802554820513801174&mkt=en-us,Reverse logistics solution ReturnBear is expanding its operations ... The financing will enable Zilch to grow its business and accelerate Zilch's ability to create and launch new products for a ...,"Tue, 25 Jun 2024 12:14:07 GMT","time.struct_time(tm_year=2024, tm_mon=6, tm_mday=25, tm_hour=12, tm_min=14, tm_sec=7, tm_wday=1, tm_yday=177, tm_isdst=0)",Sourcing Journal on MSN,http://www.bing.com/th?id=OVFT.YeQ1pueSHr0JaaUPVNQOnS&pid=News,w={0}&h={1}&c=14,700,466,text/plain,,,"Retail Tech: VF Corp Deploys Mobile Inventory Scanning, Kohl's Debuts ‘The Return Drop'",text/html,,,Reverse logistics solution ReturnBear is expanding its operations ... The financing will enable Zilch to grow its business and accelerate Zilch's ability to create and launch new products for a ...,"https://www.bing.com/news/search?q=""Reverse logistics"" ""new products""&format=rss"
1 company’s solution turns e-commerce returns into revenue,"[{'rel': 'alternate', 'type': 'text/html', 'href': 'http://www.bing.com/news/apiclick.aspx?ref=FexRss&aid=&tid=667b5ce970874257aab00b8d241cd1b0&url=https%3a%2f%2fwww.homeaccentstoday.com%2findustry-news%2f1-companys-solution-turns-e-commerce-returns-into-revenue%2f&c=14300776437743639979&mkt=en-us'}]",http://www.bing.com/news/apiclick.aspx?ref=FexRss&aid=&tid=667b5ce970874257aab00b8d241cd1b0&url=https%3a%2f%2fwww.homeaccentstoday.com%2findustry-news%2f1-companys-solution-turns-e-commerce-returns-into-revenue%2f&c=14300776437743639979&mkt=en-us,"“With rising costs in the furniture supply chain, Retailers are rethinking their reverse logistics strategy. Our platform enables retailers to generate revenue instead of adding costs associated with ...","Fri, 07 Jun 2024 17:00:00 GMT","time.struct_time(tm_year=2024, tm_mon=6, tm_mday=7, tm_hour=17, tm_min=0, tm_sec=0, tm_wday=4, tm_yday=159, tm_isdst=0)",Home Accents Today,,,,,text/plain,,,1 company’s solution turns e-commerce returns into revenue,text/html,,,"“With rising costs in the furniture supply chain, Retailers are rethinking their reverse logistics strategy. Our platform enables retailers to generate revenue instead of adding costs associated with ...","https://www.bing.com/news/search?q=""Reverse logistics"" ""new products""&format=rss"
Parachute Teams With SuperCircle on Textile Take-Back Program,"[{'rel': 'alternate', 'type': 'text/html', 'href': 'http://www.bing.com/news/apiclick.aspx?ref=FexRss&aid=&tid=667b5ce970874257aab00b8d241cd1b0&url=https%3a%2f%2fwww.msn.com%2fen-us%2ffoodanddrink%2ffoodnews%2fparachute-teams-with-supercircle-on-textile-take-back-program%2far-BB1ny9be&c=18334134573996463049&mkt=en-us'}]",http://www.bing.com/news/apiclick.aspx?ref=FexRss&aid=&tid=667b5ce970874257aab00b8d241cd1b0&url=https%3a%2f%2fwww.msn.com%2fen-us%2ffoodanddrink%2ffoodnews%2fparachute-teams-with-supercircle-on-textile-take-back-program%2far-BB1ny9be&c=18334134573996463049&mkt=en-us,"The EPA's most recent data from 2018 showed that 11.3 million tons of textiles ended up in municipal solid waste landfills.    ""Home linens are less frequently resold or donated when consumers are ...","Mon, 03 Jun 2024 11:32:45 GMT","time.struct_time(tm_year=2024, tm_mon=6, tm_mday=3, tm_hour=11, tm_min=32, tm_sec=45, tm_wday=0, tm_yday=155, tm_isdst=0)",Sourcing Journal on MSN,,,,,text/plain,,,Parachute Teams With SuperCircle on Textile Take-Back Program,text/html,,,"The EPA's most recent data from 2018 showed that 11.3 million tons of textiles ended up in municipal solid waste landfills.    ""Home linens are less frequently resold or donated when consumers are ...","https://www.bing.com/news/search?q=""Reverse logistics"" ""new products""&format=rss"
Encompass Selects Blitzz’s App-Free Video Support to Identify Replacement Parts Remotely,"[{'rel': 'alternate', 'type': 'text/html', 'href': 'http://www.bing.com/news/apiclick.aspx?ref=FexRss&aid=&tid=667b5ce970874257aab00b8d241cd1b0&url=https%3a%2f%2fwww.dcvelocity.com%2farticles%2f61041-encompass-selects-blitzz-s-app-free-video-support-to-identify-replacement-parts-remotely&c=13025809678612174817&mkt=en-us'}]",http://www.bing.com/news/apiclick.aspx?ref=FexRss&aid=&tid=667b5ce970874257aab00b8d241cd1b0&url=https%3a%2f%2fwww.dcvelocity.com%2farticles%2f61041-encompass-selects-blitzz-s-app-free-video-support-to-identify-replacement-parts-remotely&c=13025809678612174817&mkt=en-us,Encompass Supply Chain Solutions uses live video and augmented reality (AR) to identify replacement parts remotely ...,"Fri, 14 Jun 2024 06:45:00 GMT","time.struct_time(tm_year=2024, tm_mon=6, tm_mday=14, tm_hour=6, tm_min=45, tm_sec=0, tm_wday=4, tm_yday=166, tm_isdst=0)",DC Velocity,http://www.bing.com/th?id=OVFT.9EfN3jDDEU20LIHBD4uhji&pid=News,w={0}&h={1}&c=14,600,309,text/plain,,,Encompass Selects Blitzz’s App-Free Video Support to Identify Replacement Parts Remotely,text/html,,,Encompass Supply Chain Solutions uses live video and augmented reality (AR) to identify replacement parts remotely ...,"https://www.bing.com/news/search?q=""Reverse logistics"" ""new products""&format=rss"
Happy Returns has selected Loop as its preferred returns portal partner for Shopify brands,"[{'rel': 'alternate', 'type': 'text/html', 'href': 'http://www.bing.com/news/apiclick.aspx?ref=FexRss&aid=&tid=667b5ce970874257aab00b8d241cd1b0&url=https%3a%2f%2fwww.dcvelocity.com%2farticles%2f61030-happy-returns-has-selected-loop-as-its-preferred-returns-portal-partner-for-shopify-brands&c=5677891814881996126&mkt=en-us'}]",http://www.bing.com/news/apiclick.aspx?ref=FexRss&aid=&tid=667b5ce970874257aab00b8d241cd1b0&url=https%3a%2f%2fwww.dcvelocity.com%2farticles%2f61030-happy-returns-has-selected-loop-as-its-preferred-returns-portal-partner-for-shopify-brands&c=5677891814881996126&mkt=en-us,"“We’re excited to deepen our existing relationship with Happy Returns and bring improved software and reverse logistics capabilities to all their Shopify merchants,” said Jonathan Poma, CEO of Loop.","Tue, 11 Jun 2024 17:00:00 GMT","time.struct_time(tm_year=2024, tm_mon=6, tm_mday=11, tm_hour=17, tm_min=0, tm_sec=0, tm_wday=1, tm_yday=163, tm_isdst=0)",DC Velocity,,,,,text/plain,,,Happy Returns has selected Loop as its preferred returns portal partner for Shopify brands,text/html,,,"“We’re excited to deepen our existing relationship with Happy Returns and bring improved software and reverse logistics capabilities to all their Shopify merchants,” said Jonathan Poma, CEO of Loop.","https://www.bing.com/news/search?q=""Reverse logistics"" ""new products""&format=rss"
India Vs China: Factors Driving ReCommerce And The Road Ahead,"[{'rel': 'alternate', 'type': 'text/html', 'href': 'http://www.bing.com/news/apiclick.aspx?ref=FexRss&aid=&tid=667b5ce970874257aab00b8d241cd1b0&url=https%3a%2f%2finc42.com%2fresources%2findia-china-recommerce-road-ahead%2f&c=2116572766508499744&mkt=en-us'}]",http://www.bing.com/news/apiclick.aspx?ref=FexRss&aid=&tid=667b5ce970874257aab00b8d241cd1b0&url=https%3a%2f%2finc42.com%2fresources%2findia-china-recommerce-road-ahead%2f&c=2116572766508499744&mkt=en-us,The fragmented supply chain and reverse logistics have been another hindrance ... Brands which are focused on new products would find it difficult to create the same impact since their primary ...,"Thu, 22 Feb 2018 16:00:00 GMT","time.struct_time(tm_year=2018, tm_mon=2, tm_mday=22, tm_hour=16, tm_min=0, tm_sec=0, tm_wday=3, tm_yday=53, tm_isdst=0)",inc42,,,,,text/plain,,,India Vs China: Factors Driving ReCommerce And The Road Ahead,text/html,,,The fragmented supply chain and reverse logistics have been another hindrance ... Brands which are focused on new products would find it difficult to create the same impact since their primary ...,"https://www.bing.com/news/search?q=""Reverse logistics"" ""new products""&format=rss"
2 ASX shares to buy for strong diversification,"[{'rel': 'alternate', 'type': 'text/html', 'href': 'http://www.bing.com/news/apiclick.aspx?ref=FexRss&aid=&tid=667b5ce970874257aab00b8d241cd1b0&url=https%3a%2f%2fwww.fool.com.au%2f2024%2f04%2f30%2f2-asx-shares-to-buy-for-strong-diversification%2f&c=14767167805192247113&mkt=en-us'}]",http://www.bing.com/news/apiclick.aspx?ref=FexRss&aid=&tid=667b5ce970874257aab00b8d241cd1b0&url=https%3a%2f%2fwww.fool.com.au%2f2024%2f04%2f30%2f2-asx-shares-to-buy-for-strong-diversification%2f&c=14767167805192247113&mkt=en-us,Close the Loop has a global reverse logistics collection network ... These are the sorts of businesses creating new products and services that are changing how we do things in their own way.,"Mon, 29 Apr 2024 11:11:00 GMT","time.struct_time(tm_year=2024, tm_mon=4, tm_mday=29, tm_hour=11, tm_min=11, tm_sec=0, tm_wday=0, tm_yday=120, tm_isdst=0)",Motley Fool Australia,,,,,text/plain,,,2 ASX shares to buy for strong diversification,text/html,,,Close the Loop has a global reverse logistics collection network ... These are the sorts of businesses creating new products and services that are changing how we do things in their own way.,"https://www.bing.com/news/search?q=""Reverse logistics"" ""new products""&format=rss"
Myntra is luring its customers with additional discounts — but there’s a catch,"[{'rel': 'alternate', 'type': 'text/html', 'href': 'http://www.bing.com/news/apiclick.aspx?ref=FexRss&aid=&tid=667b5ce970874257aab00b8d241cd1b0&url=https%3a%2f%2fwww.businessinsider.in%2fmyntra-is-luring-its-customers-with-additional-discounts-but-theres-a-catch%2farticleshow%2f69035670.cms&c=6218388068639443990&mkt=en-us'}]",http://www.bing.com/news/apiclick.aspx?ref=FexRss&aid=&tid=667b5ce970874257aab00b8d241cd1b0&url=https%3a%2f%2fwww.businessinsider.in%2fmyntra-is-luring-its-customers-with-additional-discounts-but-theres-a-catch%2farticleshow%2f69035670.cms&c=6218388068639443990&mkt=en-us,"Earlier in 2018, the company floated an initiative in collaboration with Goonj, that allowed customers to upgrade — buy new products in return of the old clothes. Separately, as an upgrade to ...","Wed, 24 Apr 2019 23:41:00 GMT","time.struct_time(tm_year=2019, tm_mon=4, tm_mday=24, tm_hour=23, tm_min=41, tm_sec=0, tm_wday=2, tm_yday=114, tm_isdst=0)",Business Insider India,,,,,text/plain,,,Myntra is luring its customers with additional discounts — but there’s a catch,text/html,,,"Earlier in 2018, the company floated an initiative in collaboration with Goonj, that allowed customers to upgrade — buy new products in return of the old clothes. Separately, as an upgrade to ...","https://www.bing.com/news/search?q=""Reverse logistics"" ""new products""&format=rss"
