title,links,link,summary,published,published_parsed,news_source,news_image,news_imagesize,news_imagemaxwidth,news_imagemaxheight,title_detail.type,title_detail.language,title_detail.base,title_detail.value,summary_detail.type,summary_detail.language,summary_detail.base,summary_detail.value,query
Can Semiconductor Chips be Recycled?,"[{'rel': 'alternate', 'type': 'text/html', 'href': 'http://www.bing.com/news/apiclick.aspx?ref=FexRss&aid=&tid=667b5d1ee36847a5849af16c7cf537b8&url=https%3a%2f%2fwww.azonano.com%2farticle.aspx%3fArticleID%3d6764&c=7769358327941345376&mkt=en-us'}]",http://www.bing.com/news/apiclick.aspx?ref=FexRss&aid=&tid=667b5d1ee36847a5849af16c7cf537b8&url=https%3a%2f%2fwww.azonano.com%2farticle.aspx%3fArticleID%3d6764&c=7769358327941345376&mkt=en-us,"Advancements in semiconductor recycling aim to reduce e-waste and environmental impact, with innovative separation and recovery techniques.","Mon, 24 Jun 2024 04:38:00 GMT","time.struct_time(tm_year=2024, tm_mon=6, tm_mday=24, tm_hour=4, tm_min=38, tm_sec=0, tm_wday=0, tm_yday=176, tm_isdst=0)",AZoNano,http://www.bing.com/th?id=OVFT.l676XgKzjebEGMZfjA2yuy&pid=News,w={0}&h={1}&c=14,700,314,text/plain,,,Can Semiconductor Chips be Recycled?,text/html,,,"Advancements in semiconductor recycling aim to reduce e-waste and environmental impact, with innovative separation and recovery techniques.","https://www.bing.com/news/search?q=""Resource Recovery"" ""new products""&format=rss"
AGL plans huge solar recycling plant at retired coal site that Dutton wants for nuclear,"[{'rel': 'alternate', 'type': 'text/html', 'href': 'http://www.bing.com/news/apiclick.aspx?ref=FexRss&aid=&tid=667b5d1ee36847a5849af16c7cf537b8&url=https%3a%2f%2freneweconomy.com.au%2fagl-plans-huge-solar-recycling-plant-at-retired-coal-site-that-dutton-wants-for-nuclear%2f&c=18341834456843321846&mkt=en-us'}]",http://www.bing.com/news/apiclick.aspx?ref=FexRss&aid=&tid=667b5d1ee36847a5849af16c7cf537b8&url=https%3a%2f%2freneweconomy.com.au%2fagl-plans-huge-solar-recycling-plant-at-retired-coal-site-that-dutton-wants-for-nuclear%2f&c=18341834456843321846&mkt=en-us,"The start-up, whose patented technology transforms used solar panels into new products used in the construction and ... Elecsome managing director, Neeraj Das, describes resource recovery and ...","Mon, 24 Jun 2024 17:00:00 GMT","time.struct_time(tm_year=2024, tm_mon=6, tm_mday=24, tm_hour=17, tm_min=0, tm_sec=0, tm_wday=0, tm_yday=176, tm_isdst=0)",RenewEconomy,http://www.bing.com/th?id=OVFT.--e6yDRymQiNxCm68v4F0C&pid=News,w={0}&h={1}&c=14,700,524,text/plain,,,AGL plans huge solar recycling plant at retired coal site that Dutton wants for nuclear,text/html,,,"The start-up, whose patented technology transforms used solar panels into new products used in the construction and ... Elecsome managing director, Neeraj Das, describes resource recovery and ...","https://www.bing.com/news/search?q=""Resource Recovery"" ""new products""&format=rss"
How to recycle electronic items and batteries in Australia,"[{'rel': 'alternate', 'type': 'text/html', 'href': 'http://www.bing.com/news/apiclick.aspx?ref=FexRss&aid=&tid=667b5d1ee36847a5849af16c7cf537b8&url=https%3a%2f%2fwww.sbs.com.au%2flanguage%2fenglish%2fen%2fpodcast-episode%2fhow-to-recycle-electronic-items-and-batteries-in-australia%2fhb57fn18q&c=16275950984427755771&mkt=en-us'}]",http://www.bing.com/news/apiclick.aspx?ref=FexRss&aid=&tid=667b5d1ee36847a5849af16c7cf537b8&url=https%3a%2f%2fwww.sbs.com.au%2flanguage%2fenglish%2fen%2fpodcast-episode%2fhow-to-recycle-electronic-items-and-batteries-in-australia%2fhb57fn18q&c=16275950984427755771&mkt=en-us,"Many common household items such as mobile phones, TVs, computers, chargers, and other electronic devices, including their batteries, contain valuable materials that can be repurposed for new products ...","Mon, 17 Jun 2024 17:16:00 GMT","time.struct_time(tm_year=2024, tm_mon=6, tm_mday=17, tm_hour=17, tm_min=16, tm_sec=0, tm_wday=0, tm_yday=169, tm_isdst=0)",SBS,http://www.bing.com/th?id=OVFT.j3Aykqxf-gLbqzYOOIRV5i&pid=News,w={0}&h={1}&c=14,700,393,text/plain,,,How to recycle electronic items and batteries in Australia,text/html,,,"Many common household items such as mobile phones, TVs, computers, chargers, and other electronic devices, including their batteries, contain valuable materials that can be repurposed for new products ...","https://www.bing.com/news/search?q=""Resource Recovery"" ""new products""&format=rss"
How to Recycle Wood,"[{'rel': 'alternate', 'type': 'text/html', 'href': 'http://www.bing.com/news/apiclick.aspx?ref=FexRss&aid=&tid=667b5d1ee36847a5849af16c7cf537b8&url=https%3a%2f%2fwww.webmd.com%2fbalance%2fhow-to-recycle-wood&c=11993753592239208199&mkt=en-us'}]",http://www.bing.com/news/apiclick.aspx?ref=FexRss&aid=&tid=667b5d1ee36847a5849af16c7cf537b8&url=https%3a%2f%2fwww.webmd.com%2fbalance%2fhow-to-recycle-wood&c=11993753592239208199&mkt=en-us,"Waste that is good and clean can be reused and recycled in brand-new products. Steps in recycling wood include: Take the wood to a recycling facility, documenting quantity and weight Separate the ...","Mon, 18 Mar 2024 20:17:00 GMT","time.struct_time(tm_year=2024, tm_mon=3, tm_mday=18, tm_hour=20, tm_min=17, tm_sec=0, tm_wday=0, tm_yday=78, tm_isdst=0)",WebMD,,,,,text/plain,,,How to Recycle Wood,text/html,,,"Waste that is good and clean can be reused and recycled in brand-new products. Steps in recycling wood include: Take the wood to a recycling facility, documenting quantity and weight Separate the ...","https://www.bing.com/news/search?q=""Resource Recovery"" ""new products""&format=rss"
"KTI, Inc. Builds Success Through Vertical Integration","[{'rel': 'alternate', 'type': 'text/html', 'href': 'http://www.bing.com/news/apiclick.aspx?ref=FexRss&aid=&tid=667b5d1ee36847a5849af16c7cf537b8&url=https%3a%2f%2fwww.recyclingtoday.com%2farticle%2fkti--inc--builds-success-through-vertical-integration%2f&c=15171233228791359683&mkt=en-us'}]",http://www.bing.com/news/apiclick.aspx?ref=FexRss&aid=&tid=667b5d1ee36847a5849af16c7cf537b8&url=https%3a%2f%2fwww.recyclingtoday.com%2farticle%2fkti--inc--builds-success-through-vertical-integration%2f&c=15171233228791359683&mkt=en-us,The material – either a natural or pigmented pellet – is then sold back to the end plastic manufacturer for use in making new products. FCR Plastics ... (May 1998) Resource Recovery Systems – Acquired ...,"Wed, 28 Nov 2018 02:38:00 GMT","time.struct_time(tm_year=2018, tm_mon=11, tm_mday=28, tm_hour=2, tm_min=38, tm_sec=0, tm_wday=2, tm_yday=332, tm_isdst=0)",Recycling Today,,,,,text/plain,,,"KTI, Inc. Builds Success Through Vertical Integration",text/html,,,The material – either a natural or pigmented pellet – is then sold back to the end plastic manufacturer for use in making new products. FCR Plastics ... (May 1998) Resource Recovery Systems – Acquired ...,"https://www.bing.com/news/search?q=""Resource Recovery"" ""new products""&format=rss"
Massive solar panel recycling plant earmarked for Upper Hunter energy hub,"[{'rel': 'alternate', 'type': 'text/html', 'href': 'http://www.bing.com/news/apiclick.aspx?ref=FexRss&aid=&tid=667b5d1ee36847a5849af16c7cf537b8&url=https%3a%2f%2fwww.portnews.com.au%2fstory%2f8673889%2fagl-and-elecsome-announce-solar-panel-recycling-plan-for-bayswater%2f&c=3591604169838487850&mkt=en-us'}]",http://www.bing.com/news/apiclick.aspx?ref=FexRss&aid=&tid=667b5d1ee36847a5849af16c7cf537b8&url=https%3a%2f%2fwww.portnews.com.au%2fstory%2f8673889%2fagl-and-elecsome-announce-solar-panel-recycling-plan-for-bayswater%2f&c=3591604169838487850&mkt=en-us,Thousands of tonnes of solar panels could be recycled at Bayswater as part of a plan to establish a major recycling precinct in the Upper Hunter.,"Mon, 24 Jun 2024 16:15:00 GMT","time.struct_time(tm_year=2024, tm_mon=6, tm_mday=24, tm_hour=16, tm_min=15, tm_sec=0, tm_wday=0, tm_yday=176, tm_isdst=0)",Port Macquarie News,http://www.bing.com/th?id=OVFT.M2u62swgU8FXrfBWm5Ig3S&pid=News,w={0}&h={1}&c=14,700,367,text/plain,,,Massive solar panel recycling plant earmarked for Upper Hunter energy hub,text/html,,,Thousands of tonnes of solar panels could be recycled at Bayswater as part of a plan to establish a major recycling precinct in the Upper Hunter.,"https://www.bing.com/news/search?q=""Resource Recovery"" ""new products""&format=rss"
Chapter 13: Department of Engineering,"[{'rel': 'alternate', 'type': 'text/html', 'href': 'http://www.bing.com/news/apiclick.aspx?ref=FexRss&aid=&tid=667b5d1ee36847a5849af16c7cf537b8&url=https%3a%2f%2fwww.scu.edu%2fbulletin%2fgraduate%2fschool-of-engineering%2fchapter-13-department-of-engineering.html&c=12778067266367301968&mkt=en-us'}]",http://www.bing.com/news/apiclick.aspx?ref=FexRss&aid=&tid=667b5d1ee36847a5849af16c7cf537b8&url=https%3a%2f%2fwww.scu.edu%2fbulletin%2fgraduate%2fschool-of-engineering%2fchapter-13-department-of-engineering.html&c=12778067266367301968&mkt=en-us,Also listed as BIOE 256. This course will cover the basic principles used to classify and evaluate biofuels in terms of thermodynamic and economic efficiencies as well as environmental impact for ...,"Sat, 02 Jan 2021 16:12:00 GMT","time.struct_time(tm_year=2021, tm_mon=1, tm_mday=2, tm_hour=16, tm_min=12, tm_sec=0, tm_wday=5, tm_yday=2, tm_isdst=0)",Santa Clara University,,,,,text/plain,,,Chapter 13: Department of Engineering,text/html,,,Also listed as BIOE 256. This course will cover the basic principles used to classify and evaluate biofuels in terms of thermodynamic and economic efficiencies as well as environmental impact for ...,"https://www.bing.com/news/search?q=""Resource Recovery"" ""new products""&format=rss"
Chapter 12: Department of Engineering,"[{'rel': 'alternate', 'type': 'text/html', 'href': 'http://www.bing.com/news/apiclick.aspx?ref=FexRss&aid=&tid=667b5d1ee36847a5849af16c7cf537b8&url=https%3a%2f%2fwww.scu.edu%2fbulletin%2fgraduate%2fschool-of-engineering%2fchapter-12-department-of-engineering.html&c=2977846970725826635&mkt=en-us'}]",http://www.bing.com/news/apiclick.aspx?ref=FexRss&aid=&tid=667b5d1ee36847a5849af16c7cf537b8&url=https%3a%2f%2fwww.scu.edu%2fbulletin%2fgraduate%2fschool-of-engineering%2fchapter-12-department-of-engineering.html&c=2977846970725826635&mkt=en-us,"(2 units) ENGR 350. Success in Global Emerging Markets Strategies and tactics for moving new products and technologies into global emerging markets, comprehending cultural impact, and creating new ...","Fri, 10 Sep 2021 13:42:00 GMT","time.struct_time(tm_year=2021, tm_mon=9, tm_mday=10, tm_hour=13, tm_min=42, tm_sec=0, tm_wday=4, tm_yday=253, tm_isdst=0)",Santa Clara University,,,,,text/plain,,,Chapter 12: Department of Engineering,text/html,,,"(2 units) ENGR 350. Success in Global Emerging Markets Strategies and tactics for moving new products and technologies into global emerging markets, comprehending cultural impact, and creating new ...","https://www.bing.com/news/search?q=""Resource Recovery"" ""new products""&format=rss"
