title,links,link,summary,published,published_parsed,news_source,news_image,news_imagesize,news_imagemaxwidth,news_imagemaxheight,title_detail.type,title_detail.language,title_detail.base,title_detail.value,summary_detail.type,summary_detail.language,summary_detail.base,summary_detail.value,query
APR expands program to recognize sustainable packaging solutions,"[{'rel': 'alternate', 'type': 'text/html', 'href': 'http://www.bing.com/news/apiclick.aspx?ref=FexRss&aid=&tid=667b5ceb0f144b9f8cc5f28e66695258&url=https%3a%2f%2fwww.dairyfoods.com%2farticles%2f97341-apr-expands-program-to-recognize-sustainable-packaging-solutions&c=1632661075984069990&mkt=en-us'}]",http://www.bing.com/news/apiclick.aspx?ref=FexRss&aid=&tid=667b5ceb0f144b9f8cc5f28e66695258&url=https%3a%2f%2fwww.dairyfoods.com%2farticles%2f97341-apr-expands-program-to-recognize-sustainable-packaging-solutions&c=1632661075984069990&mkt=en-us,"The Association of Plastic Recyclers (APR) announced updates to the APR Design for Recyclability Recognition Program, adding new packaging components that are now eligible for Preferred Design ...","Sun, 31 Dec 2000 16:00:00 GMT","time.struct_time(tm_year=2000, tm_mon=12, tm_mday=31, tm_hour=16, tm_min=0, tm_sec=0, tm_wday=6, tm_yday=366, tm_isdst=0)",Dairy Foods,http://www.bing.com/th?id=OVFT.89VCZXDQdxMf_JygelTQ2S&pid=News,w={0}&h={1}&c=14,700,427,text/plain,,,APR expands program to recognize sustainable packaging solutions,text/html,,,"The Association of Plastic Recyclers (APR) announced updates to the APR Design for Recyclability Recognition Program, adding new packaging components that are now eligible for Preferred Design ...","https://www.bing.com/news/search?q=""Sustainable packaging"" ""new products""&format=rss"
Esteé Lauder Closes in on Sustainable Packaging Goals,"[{'rel': 'alternate', 'type': 'text/html', 'href': 'http://www.bing.com/news/apiclick.aspx?ref=FexRss&aid=&tid=667b5ceb0f144b9f8cc5f28e66695258&url=https%3a%2f%2fwww.packworld.com%2fsustainable-packaging%2frecycling%2farticle%2f22912386%2feste-lauder-closes-in-on-sustainable-packaging-goals&c=6233225130882271754&mkt=en-us'}]",http://www.bing.com/news/apiclick.aspx?ref=FexRss&aid=&tid=667b5ceb0f144b9f8cc5f28e66695258&url=https%3a%2f%2fwww.packworld.com%2fsustainable-packaging%2frecycling%2farticle%2f22912386%2feste-lauder-closes-in-on-sustainable-packaging-goals&c=6233225130882271754&mkt=en-us,Luxury cosmetics company Esteé Lauder shares how internal design guidelines and innovative packaging strategies have allowed it to come within 4% points of its 2025 sustainability goals.,"Thu, 13 Jun 2024 07:00:00 GMT","time.struct_time(tm_year=2024, tm_mon=6, tm_mday=13, tm_hour=7, tm_min=0, tm_sec=0, tm_wday=3, tm_yday=165, tm_isdst=0)",Packaging World,http://www.bing.com/th?id=OVFT.5ikMgMszr7K1bSVafIlE5S&pid=News,w={0}&h={1}&c=14,700,371,text/plain,,,Esteé Lauder Closes in on Sustainable Packaging Goals,text/html,,,Luxury cosmetics company Esteé Lauder shares how internal design guidelines and innovative packaging strategies have allowed it to come within 4% points of its 2025 sustainability goals.,"https://www.bing.com/news/search?q=""Sustainable packaging"" ""new products""&format=rss"
ROCKWOOL launches new product range,"[{'rel': 'alternate', 'type': 'text/html', 'href': 'http://www.bing.com/news/apiclick.aspx?ref=FexRss&aid=&tid=667b5ceb0f144b9f8cc5f28e66695258&url=https%3a%2f%2fprobuildermag.co.uk%2fproducts%2frockwool-launches-new-product-range&c=4474142787972795587&mkt=en-us'}]",http://www.bing.com/news/apiclick.aspx?ref=FexRss&aid=&tid=667b5ceb0f144b9f8cc5f28e66695258&url=https%3a%2f%2fprobuildermag.co.uk%2fproducts%2frockwool-launches-new-product-range&c=4474142787972795587&mkt=en-us,ROCKWOOL has enhanced its trade range with new products and more sustainable packaging. ROCKWOOL has expanded its non-combustible stone wool insulation range for builders and tradespeople by launching ...,"Wed, 12 Jun 2024 02:00:00 GMT","time.struct_time(tm_year=2024, tm_mon=6, tm_mday=12, tm_hour=2, tm_min=0, tm_sec=0, tm_wday=2, tm_yday=164, tm_isdst=0)",Professional Builder,,,,,text/plain,,,ROCKWOOL launches new product range,text/html,,,ROCKWOOL has enhanced its trade range with new products and more sustainable packaging. ROCKWOOL has expanded its non-combustible stone wool insulation range for builders and tradespeople by launching ...,"https://www.bing.com/news/search?q=""Sustainable packaging"" ""new products""&format=rss"
Inside the Industry Push to Label Your Yogurt Cup ‘Recyclable’,"[{'rel': 'alternate', 'type': 'text/html', 'href': 'http://www.bing.com/news/apiclick.aspx?ref=FexRss&aid=&tid=667b5ceb0f144b9f8cc5f28e66695258&url=https%3a%2f%2fgizmodo.com%2fgateway%2finside-the-industry-push-to-label-your-yogurt-cup-recy-1849652108&c=6882283067572922517&mkt=en-us'}]",http://www.bing.com/news/apiclick.aspx?ref=FexRss&aid=&tid=667b5ceb0f144b9f8cc5f28e66695258&url=https%3a%2f%2fgizmodo.com%2fgateway%2finside-the-industry-push-to-label-your-yogurt-cup-recy-1849652108&c=6882283067572922517&mkt=en-us,It may also contravene sustainable packaging guidelines from the Federal Trade Commission ... use the chasing arrows on products that are not actually being turned into new products. (In this case the ...,"Tue, 18 Jun 2024 05:14:00 GMT","time.struct_time(tm_year=2024, tm_mon=6, tm_mday=18, tm_hour=5, tm_min=14, tm_sec=0, tm_wday=1, tm_yday=170, tm_isdst=0)",Gizmodo,http://www.bing.com/th?id=OVFT.YixtM8q2AjdHA7Gpne906y&pid=News,w={0}&h={1}&c=14,200,200,text/plain,,,Inside the Industry Push to Label Your Yogurt Cup ‘Recyclable’,text/html,,,It may also contravene sustainable packaging guidelines from the Federal Trade Commission ... use the chasing arrows on products that are not actually being turned into new products. (In this case the ...,"https://www.bing.com/news/search?q=""Sustainable packaging"" ""new products""&format=rss"
How Briogeo Founder Nancy Twine Went From Goldman Sachs VP to Hair-Care Success Story,"[{'rel': 'alternate', 'type': 'text/html', 'href': 'http://www.bing.com/news/apiclick.aspx?ref=FexRss&aid=&tid=667b5ceb0f144b9f8cc5f28e66695258&url=https%3a%2f%2fwww.yahoo.com%2flifestyle%2fbriogeo-founder-nancy-twine-went-160425590.html&c=7096386949873525170&mkt=en-us'}]",http://www.bing.com/news/apiclick.aspx?ref=FexRss&aid=&tid=667b5ceb0f144b9f8cc5f28e66695258&url=https%3a%2f%2fwww.yahoo.com%2flifestyle%2fbriogeo-founder-nancy-twine-went-160425590.html&c=7096386949873525170&mkt=en-us,"""[Briogeo] is rooted in 'clean' formulations, powerful formulas and sustainable packaging,"" Twine said ... Today, Briogeo continues to develop new products for all hair types, still made with natural ...","Thu, 20 Jun 2024 09:04:00 GMT","time.struct_time(tm_year=2024, tm_mon=6, tm_mday=20, tm_hour=9, tm_min=4, tm_sec=0, tm_wday=3, tm_yday=172, tm_isdst=0)",Yahoo,http://www.bing.com/th?id=OVFT.nhOnhOEembQT6Uw5zL2ATC&pid=News,w={0}&h={1}&c=14,700,393,text/plain,,,How Briogeo Founder Nancy Twine Went From Goldman Sachs VP to Hair-Care Success Story,text/html,,,"""[Briogeo] is rooted in 'clean' formulations, powerful formulas and sustainable packaging,"" Twine said ... Today, Briogeo continues to develop new products for all hair types, still made with natural ...","https://www.bing.com/news/search?q=""Sustainable packaging"" ""new products""&format=rss"
Aldi's Releases New Chindi Rug Colors for Cutest Spring Launch,"[{'rel': 'alternate', 'type': 'text/html', 'href': 'http://www.bing.com/news/apiclick.aspx?ref=FexRss&aid=&tid=667b5ceb0f144b9f8cc5f28e66695258&url=https%3a%2f%2fwww.msn.com%2fen-us%2flifestyle%2fshopping%2faldi-s-releases-new-chindi-rug-colors-for-cutest-spring-launch%2far-BB1loKZ2&c=1634379089356534564&mkt=en-us'}]",http://www.bing.com/news/apiclick.aspx?ref=FexRss&aid=&tid=667b5ceb0f144b9f8cc5f28e66695258&url=https%3a%2f%2fwww.msn.com%2fen-us%2flifestyle%2fshopping%2faldi-s-releases-new-chindi-rug-colors-for-cutest-spring-launch%2far-BB1loKZ2&c=1634379089356534564&mkt=en-us,Aldi has always been a frontrunner when it comes to sustainability and their website promises a whole lot more when it comes to their overall sustainable packaging goals. Related: Aldi Brought ...,"Wed, 10 Apr 2024 08:35:00 GMT","time.struct_time(tm_year=2024, tm_mon=4, tm_mday=10, tm_hour=8, tm_min=35, tm_sec=0, tm_wday=2, tm_yday=101, tm_isdst=0)",MSN,,,,,text/plain,,,Aldi's Releases New Chindi Rug Colors for Cutest Spring Launch,text/html,,,Aldi has always been a frontrunner when it comes to sustainability and their website promises a whole lot more when it comes to their overall sustainable packaging goals. Related: Aldi Brought ...,"https://www.bing.com/news/search?q=""Sustainable packaging"" ""new products""&format=rss"
Canned Food Market Demand Analysis of Consumer Behavior and Needs by 2032,"[{'rel': 'alternate', 'type': 'text/html', 'href': 'http://www.bing.com/news/apiclick.aspx?ref=FexRss&aid=&tid=667b5ceb0f144b9f8cc5f28e66695258&url=https%3a%2f%2fwww.taiwannews.com.tw%2fen%2fnews%2f5894994&c=7651724701621949553&mkt=en-us'}]",http://www.bing.com/news/apiclick.aspx?ref=FexRss&aid=&tid=667b5ceb0f144b9f8cc5f28e66695258&url=https%3a%2f%2fwww.taiwannews.com.tw%2fen%2fnews%2f5894994&c=7651724701621949553&mkt=en-us,"Rise in Disposable Income and Working Women: Increasing disposable incomes and a growing number of working women globally are driving the demand for convenient and ready-to-eat food options, boosting ...","Sun, 23 Jun 2024 19:01:00 GMT","time.struct_time(tm_year=2024, tm_mon=6, tm_mday=23, tm_hour=19, tm_min=1, tm_sec=0, tm_wday=6, tm_yday=175, tm_isdst=0)",Taiwan News,,,,,text/plain,,,Canned Food Market Demand Analysis of Consumer Behavior and Needs by 2032,text/html,,,"Rise in Disposable Income and Working Women: Increasing disposable incomes and a growing number of working women globally are driving the demand for convenient and ready-to-eat food options, boosting ...","https://www.bing.com/news/search?q=""Sustainable packaging"" ""new products""&format=rss"
Mindful Awards Presents BareOrganics With 2024 “Organic Product of the Year”,"[{'rel': 'alternate', 'type': 'text/html', 'href': 'http://www.bing.com/news/apiclick.aspx?ref=FexRss&aid=&tid=667b5ceb0f144b9f8cc5f28e66695258&url=https%3a%2f%2ffinance.yahoo.com%2fnews%2fmindful-awards-presents-bareorganics-2024-120400954.html&c=15107870007279201551&mkt=en-us'}]",http://www.bing.com/news/apiclick.aspx?ref=FexRss&aid=&tid=667b5ceb0f144b9f8cc5f28e66695258&url=https%3a%2f%2ffinance.yahoo.com%2fnews%2fmindful-awards-presents-bareorganics-2024-120400954.html&c=15107870007279201551&mkt=en-us,"Awards Program Recognizes Top Mindful Companies, Services and Products Within the Packaged Goods IndustryLOS ANGELES, June 11, 2024 (GLOBE NEWSWIRE) -- The 2024  Program, an independent recognition ...","Tue, 11 Jun 2024 05:04:00 GMT","time.struct_time(tm_year=2024, tm_mon=6, tm_mday=11, tm_hour=5, tm_min=4, tm_sec=0, tm_wday=1, tm_yday=163, tm_isdst=0)",YAHOO!Finance,http://www.bing.com/th?id=OVFT.Ddu307QSHaaZ-HO3FhVV4C&pid=News,w={0}&h={1}&c=14,633,700,text/plain,,,Mindful Awards Presents BareOrganics With 2024 “Organic Product of the Year”,text/html,,,"Awards Program Recognizes Top Mindful Companies, Services and Products Within the Packaged Goods IndustryLOS ANGELES, June 11, 2024 (GLOBE NEWSWIRE) -- The 2024  Program, an independent recognition ...","https://www.bing.com/news/search?q=""Sustainable packaging"" ""new products""&format=rss"
Amazon is trying to get rid of its signature brown boxes. The retail shipping giant has a long way to go,"[{'rel': 'alternate', 'type': 'text/html', 'href': 'http://www.bing.com/news/apiclick.aspx?ref=FexRss&aid=&tid=667b5ceb0f144b9f8cc5f28e66695258&url=https%3a%2f%2fwww.msn.com%2fen-us%2fmoney%2fcompanies%2famazon-is-trying-to-get-rid-of-its-signature-brown-boxes-the-retail-shipping-giant-has-a-long-way-to-go%2far-BB1kTjBs&c=7750846928158622135&mkt=en-us'}]",http://www.bing.com/news/apiclick.aspx?ref=FexRss&aid=&tid=667b5ceb0f144b9f8cc5f28e66695258&url=https%3a%2f%2fwww.msn.com%2fen-us%2fmoney%2fcompanies%2famazon-is-trying-to-get-rid-of-its-signature-brown-boxes-the-retail-shipping-giant-has-a-long-way-to-go%2far-BB1kTjBs&c=7750846928158622135&mkt=en-us,"Some companies that sell on Amazon say they will no longer develop new products that can't be ... vice president of mechatronics and sustainable packaging at Amazon. Ultimately, the move to ...","Mon, 01 Apr 2024 09:33:00 GMT","time.struct_time(tm_year=2024, tm_mon=4, tm_mday=1, tm_hour=9, tm_min=33, tm_sec=0, tm_wday=0, tm_yday=92, tm_isdst=0)",CNBC on MSN,/th?id=ORMS.d4e284dc39c77b86b102c8c3e6abf9e5&pid=Wdp,w={0}&h={1}&c=14,234,132,text/plain,,,Amazon is trying to get rid of its signature brown boxes. The retail shipping giant has a long way to go,text/html,,,"Some companies that sell on Amazon say they will no longer develop new products that can't be ... vice president of mechatronics and sustainable packaging at Amazon. Ultimately, the move to ...","https://www.bing.com/news/search?q=""Sustainable packaging"" ""new products""&format=rss"
How the recycling symbol lost its meaning,"[{'rel': 'alternate', 'type': 'text/html', 'href': 'http://www.bing.com/news/apiclick.aspx?ref=FexRss&aid=&tid=667b5ceb0f144b9f8cc5f28e66695258&url=https%3a%2f%2fwww.msn.com%2fen-us%2fnews%2fus%2fhow-the-recycling-symbol-lost-its-meaning%2far-BB1o4O5E&c=1764483159793712096&mkt=en-us'}]",http://www.bing.com/news/apiclick.aspx?ref=FexRss&aid=&tid=667b5ceb0f144b9f8cc5f28e66695258&url=https%3a%2f%2fwww.msn.com%2fen-us%2fnews%2fus%2fhow-the-recycling-symbol-lost-its-meaning%2far-BB1o4O5E&c=1764483159793712096&mkt=en-us,"This story was originally published by Grist. Sign up for Grist’s weekly newsletter here. It’s Earth Day 1990, and Meryl Streep walks into a bar. She’s distraught about the state of the environment.","Fri, 14 Jun 2024 05:00:00 GMT","time.struct_time(tm_year=2024, tm_mon=6, tm_mday=14, tm_hour=5, tm_min=0, tm_sec=0, tm_wday=4, tm_yday=166, tm_isdst=0)",Grist on MSN,,,,,text/plain,,,How the recycling symbol lost its meaning,text/html,,,"This story was originally published by Grist. Sign up for Grist’s weekly newsletter here. It’s Earth Day 1990, and Meryl Streep walks into a bar. She’s distraught about the state of the environment.","https://www.bing.com/news/search?q=""Sustainable packaging"" ""new products""&format=rss"
APR expands program to recognize sustainable packaging components,"[{'rel': 'alternate', 'type': 'text/html', 'href': 'http://www.bing.com/news/apiclick.aspx?ref=FexRss&aid=&tid=667b5ceb0f144b9f8cc5f28e66695258&url=https%3a%2f%2fwww.recyclingtoday.com%2fnews%2fapr-expands-program-to-recognize-sustainable-packaging-components%2f&c=8524059920888885594&mkt=en-us'}]",http://www.bing.com/news/apiclick.aspx?ref=FexRss&aid=&tid=667b5ceb0f144b9f8cc5f28e66695258&url=https%3a%2f%2fwww.recyclingtoday.com%2fnews%2fapr-expands-program-to-recognize-sustainable-packaging-components%2f&c=8524059920888885594&mkt=en-us,New products now are included in real-time ... “We look forward to recognizing companies that demonstrate their commitment to developing sustainable packaging solutions.” ...,"Wed, 22 May 2024 17:00:00 GMT","time.struct_time(tm_year=2024, tm_mon=5, tm_mday=22, tm_hour=17, tm_min=0, tm_sec=0, tm_wday=2, tm_yday=143, tm_isdst=0)",Recycling Today,,,,,text/plain,,,APR expands program to recognize sustainable packaging components,text/html,,,New products now are included in real-time ... “We look forward to recognizing companies that demonstrate their commitment to developing sustainable packaging solutions.” ...,"https://www.bing.com/news/search?q=""Sustainable packaging"" ""new products""&format=rss"
