title,links,link,summary,published,published_parsed,news_source,news_image,news_imagesize,news_imagemaxwidth,news_imagemaxheight,title_detail.type,title_detail.language,title_detail.base,title_detail.value,summary_detail.type,summary_detail.language,summary_detail.base,summary_detail.value,query
Now trending: Caffeinated candy,"[{'rel': 'alternate', 'type': 'text/html', 'href': 'http://www.bing.com/news/apiclick.aspx?ref=FexRss&aid=&tid=667b5d166d5e4cdeab1c7fdf43d3950e&url=https%3a%2f%2fwww.confectionerynews.com%2fArticle%2f2024%2f06%2f19%2fThe-rise-of-caffeinated-candy&c=1235710344127584043&mkt=en-us'}]",http://www.bing.com/news/apiclick.aspx?ref=FexRss&aid=&tid=667b5d166d5e4cdeab1c7fdf43d3950e&url=https%3a%2f%2fwww.confectionerynews.com%2fArticle%2f2024%2f06%2f19%2fThe-rise-of-caffeinated-candy&c=1235710344127584043&mkt=en-us,"And now, one of the simplest functional ingredients is featured in many brands’ new products – caffeine. The stimulant, known for its fatigue-fighting properties has long been a key ingredient in the ...","Wed, 19 Jun 2024 07:41:00 GMT","time.struct_time(tm_year=2024, tm_mon=6, tm_mday=19, tm_hour=7, tm_min=41, tm_sec=0, tm_wday=2, tm_yday=171, tm_isdst=0)",Confectionery News,http://www.bing.com/th?id=OVFT.UgPDmZwIuXH-2xdFjno0vC&pid=News,w={0}&h={1}&c=14,700,393,text/plain,,,Now trending: Caffeinated candy,text/html,,,"And now, one of the simplest functional ingredients is featured in many brands’ new products – caffeine. The stimulant, known for its fatigue-fighting properties has long been a key ingredient in the ...","https://www.bing.com/news/search?q=""Alternative Energy Sources"" ""new products""&format=rss"
Arq Secures Second Contract for its Granular Activated Carbon (GAC) Facility,"[{'rel': 'alternate', 'type': 'text/html', 'href': 'http://www.bing.com/news/apiclick.aspx?ref=FexRss&aid=&tid=667b5d166d5e4cdeab1c7fdf43d3950e&url=https%3a%2f%2fmarkets.businessinsider.com%2fnews%2fstocks%2farq-secures-second-contract-for-its-granular-activated-carbon-gac-facility-1033486761&c=5884596712230682564&mkt=en-us'}]",http://www.bing.com/news/apiclick.aspx?ref=FexRss&aid=&tid=667b5d166d5e4cdeab1c7fdf43d3950e&url=https%3a%2f%2fmarkets.businessinsider.com%2fnews%2fstocks%2farq-secures-second-contract-for-its-granular-activated-carbon-gac-facility-1033486761&c=5884596712230682564&mkt=en-us,"This agreement, with a company specializing in the manufacturing of personal and industrial air purification devices, has a commencement date of January 2025 and scales up to an ultimate run-rate ...","Tue, 18 Jun 2024 06:24:00 GMT","time.struct_time(tm_year=2024, tm_mon=6, tm_mday=18, tm_hour=6, tm_min=24, tm_sec=0, tm_wday=1, tm_yday=170, tm_isdst=0)",Business Insider,,,,,text/plain,,,Arq Secures Second Contract for its Granular Activated Carbon (GAC) Facility,text/html,,,"This agreement, with a company specializing in the manufacturing of personal and industrial air purification devices, has a commencement date of January 2025 and scales up to an ultimate run-rate ...","https://www.bing.com/news/search?q=""Alternative Energy Sources"" ""new products""&format=rss"
From Sweat to Smart: Industry 4.0 and the Rise of the Connected Factory,"[{'rel': 'alternate', 'type': 'text/html', 'href': 'http://www.bing.com/news/apiclick.aspx?ref=FexRss&aid=&tid=667b5d166d5e4cdeab1c7fdf43d3950e&url=https%3a%2f%2fwww.dqindia.com%2ffeatures%2ffrom-sweat-to-smart-industry-40-and-the-rise-of-the-connected-factory-4773219&c=46096462210403356&mkt=en-us'}]",http://www.bing.com/news/apiclick.aspx?ref=FexRss&aid=&tid=667b5d166d5e4cdeab1c7fdf43d3950e&url=https%3a%2f%2fwww.dqindia.com%2ffeatures%2ffrom-sweat-to-smart-industry-40-and-the-rise-of-the-connected-factory-4773219&c=46096462210403356&mkt=en-us,"This phase will also emphasize sustainability by minimizing waste, reducing environmental impact, and adopting alternative energy sources. Generative AI and ... as well as the development of new ...","Fri, 21 Jun 2024 17:14:00 GMT","time.struct_time(tm_year=2024, tm_mon=6, tm_mday=21, tm_hour=17, tm_min=14, tm_sec=0, tm_wday=4, tm_yday=173, tm_isdst=0)",Dataquest,http://www.bing.com/th?id=OVFT.NbEOG2FNKtoQxhbrLURtqC&pid=News,w={0}&h={1}&c=14,700,466,text/plain,,,From Sweat to Smart: Industry 4.0 and the Rise of the Connected Factory,text/html,,,"This phase will also emphasize sustainability by minimizing waste, reducing environmental impact, and adopting alternative energy sources. Generative AI and ... as well as the development of new ...","https://www.bing.com/news/search?q=""Alternative Energy Sources"" ""new products""&format=rss"
Looking for seed potato solutions,"[{'rel': 'alternate', 'type': 'text/html', 'href': 'http://www.bing.com/news/apiclick.aspx?ref=FexRss&aid=&tid=667b5d166d5e4cdeab1c7fdf43d3950e&url=https%3a%2f%2fwww.thescottishfarmer.co.uk%2fnews%2f18448965.looking-seed-potato-solutions%2f&c=6455588011579626437&mkt=en-us'}]",http://www.bing.com/news/apiclick.aspx?ref=FexRss&aid=&tid=667b5d166d5e4cdeab1c7fdf43d3950e&url=https%3a%2f%2fwww.thescottishfarmer.co.uk%2fnews%2f18448965.looking-seed-potato-solutions%2f&c=6455588011579626437&mkt=en-us,"Different aspects of seed potato sustainability will be investigated by the SPot farm, including storage, alternative energy sources and biosecurity protocols. Innovation and technology are other key ...","Sun, 17 May 2020 09:00:00 GMT","time.struct_time(tm_year=2020, tm_mon=5, tm_mday=17, tm_hour=9, tm_min=0, tm_sec=0, tm_wday=6, tm_yday=138, tm_isdst=0)",The Scottish Farmer,,,,,text/plain,,,Looking for seed potato solutions,text/html,,,"Different aspects of seed potato sustainability will be investigated by the SPot farm, including storage, alternative energy sources and biosecurity protocols. Innovation and technology are other key ...","https://www.bing.com/news/search?q=""Alternative Energy Sources"" ""new products""&format=rss"
"Hydrogen Global Market 2023 - Top Companies, Industry Analysis, Growth Statistics And Outlook By 2032","[{'rel': 'alternate', 'type': 'text/html', 'href': 'http://www.bing.com/news/apiclick.aspx?ref=FexRss&aid=&tid=667b5d166d5e4cdeab1c7fdf43d3950e&url=https%3a%2f%2fmenafn.com%2f1108344136%2fHydrogen-Global-Market-2023-Top-Companies-Industry-Analysis-Growth-Statistics-And-Outlook-By-2032&c=1943988243483643134&mkt=en-us'}]",http://www.bing.com/news/apiclick.aspx?ref=FexRss&aid=&tid=667b5d166d5e4cdeab1c7fdf43d3950e&url=https%3a%2f%2fmenafn.com%2f1108344136%2fHydrogen-Global-Market-2023-Top-Companies-Industry-Analysis-Growth-Statistics-And-Outlook-By-2032&c=1943988243483643134&mkt=en-us,"Hydrogen market Size Worth $292 Billion by 2032 \| CAGR: 6.5%: AMR . Hydrogen is the simplest and most abundant element in the universe, consisting of just ...","Tue, 18 Jun 2024 01:07:00 GMT","time.struct_time(tm_year=2024, tm_mon=6, tm_mday=18, tm_hour=1, tm_min=7, tm_sec=0, tm_wday=1, tm_yday=170, tm_isdst=0)",Mena FN,,,,,text/plain,,,"Hydrogen Global Market 2023 - Top Companies, Industry Analysis, Growth Statistics And Outlook By 2032",text/html,,,"Hydrogen market Size Worth $292 Billion by 2032 \| CAGR: 6.5%: AMR . Hydrogen is the simplest and most abundant element in the universe, consisting of just ...","https://www.bing.com/news/search?q=""Alternative Energy Sources"" ""new products""&format=rss"
Jordan Islamic Bank is focusing on inclusivity to drive prosperity in the country,"[{'rel': 'alternate', 'type': 'text/html', 'href': 'http://www.bing.com/news/apiclick.aspx?ref=FexRss&aid=&tid=667b5d166d5e4cdeab1c7fdf43d3950e&url=https%3a%2f%2fwww.worldfinance.com%2fbanking%2fjordan-islamic-bank-is-focusing-on-inclusivity-to-drive-prosperity-in-the-country&c=13270573058071738045&mkt=en-us'}]",http://www.bing.com/news/apiclick.aspx?ref=FexRss&aid=&tid=667b5d166d5e4cdeab1c7fdf43d3950e&url=https%3a%2f%2fwww.worldfinance.com%2fbanking%2fjordan-islamic-bank-is-focusing-on-inclusivity-to-drive-prosperity-in-the-country&c=13270573058071738045&mkt=en-us,"Shihadeh is currently pursuing alternative energy sources for its headquarters ... with the organisation recently introducing a raft of new products and services. Mobile banking, signature bank cards ...","Wed, 01 May 2019 21:08:00 GMT","time.struct_time(tm_year=2019, tm_mon=5, tm_mday=1, tm_hour=21, tm_min=8, tm_sec=0, tm_wday=2, tm_yday=121, tm_isdst=0)",World Finance,,,,,text/plain,,,Jordan Islamic Bank is focusing on inclusivity to drive prosperity in the country,text/html,,,"Shihadeh is currently pursuing alternative energy sources for its headquarters ... with the organisation recently introducing a raft of new products and services. Mobile banking, signature bank cards ...","https://www.bing.com/news/search?q=""Alternative Energy Sources"" ""new products""&format=rss"
“We’ve got to step up and help these companies get to that next level” – new investor Ahimsa Companies on backing plant-based,"[{'rel': 'alternate', 'type': 'text/html', 'href': 'http://www.bing.com/news/apiclick.aspx?ref=FexRss&aid=&tid=667b5d166d5e4cdeab1c7fdf43d3950e&url=https%3a%2f%2ffinance.yahoo.com%2fnews%2fve-got-step-help-companies-123803368.html&c=4068407956650567173&mkt=en-us'}]",http://www.bing.com/news/apiclick.aspx?ref=FexRss&aid=&tid=667b5d166d5e4cdeab1c7fdf43d3950e&url=https%3a%2f%2ffinance.yahoo.com%2fnews%2fve-got-step-help-companies-123803368.html&c=4068407956650567173&mkt=en-us,"Ahimsa Companies is a collection of investors formed in the US to back and grow plant-based food businesses operating in the country. The investors' first deal, announced last week, was to buy ...","Tue, 11 Jun 2024 22:38:00 GMT","time.struct_time(tm_year=2024, tm_mon=6, tm_mday=11, tm_hour=22, tm_min=38, tm_sec=0, tm_wday=1, tm_yday=163, tm_isdst=0)",Yahoo Finance,,,,,text/plain,,,“We’ve got to step up and help these companies get to that next level” – new investor Ahimsa Companies on backing plant-based,text/html,,,"Ahimsa Companies is a collection of investors formed in the US to back and grow plant-based food businesses operating in the country. The investors' first deal, announced last week, was to buy ...","https://www.bing.com/news/search?q=""Alternative Energy Sources"" ""new products""&format=rss"
Citroen C4 vs Toyota RAV4,"[{'rel': 'alternate', 'type': 'text/html', 'href': 'http://www.bing.com/news/apiclick.aspx?ref=FexRss&aid=&tid=667b5d166d5e4cdeab1c7fdf43d3950e&url=https%3a%2f%2fwww.carsguide.com.au%2fcitroen%2fc4%2fvs%2ftoyota-rav4&c=14034904230094026344&mkt=en-us'}]",http://www.bing.com/news/apiclick.aspx?ref=FexRss&aid=&tid=667b5d166d5e4cdeab1c7fdf43d3950e&url=https%3a%2f%2fwww.carsguide.com.au%2fcitroen%2fc4%2fvs%2ftoyota-rav4&c=14034904230094026344&mkt=en-us,"And as car buyers move towards alternative energy sources and lower emissions ... offers a competitive five-year and unlimited-kilometre warranty for all its new products, it’s the service costs that ...","Wed, 15 Dec 2021 08:48:00 GMT","time.struct_time(tm_year=2021, tm_mon=12, tm_mday=15, tm_hour=8, tm_min=48, tm_sec=0, tm_wday=2, tm_yday=349, tm_isdst=0)",Carsguide.com.au,,,,,text/plain,,,Citroen C4 vs Toyota RAV4,text/html,,,"And as car buyers move towards alternative energy sources and lower emissions ... offers a competitive five-year and unlimited-kilometre warranty for all its new products, it’s the service costs that ...","https://www.bing.com/news/search?q=""Alternative Energy Sources"" ""new products""&format=rss"
