title	link	summary	green_innovation	business_innovation	green_product	green_process	company	official_company_name	product_or_process	likely_naics_codes	greenwashing	total_tokens
Green beauty in 2023 challenges are greenwashing, rising costs and transparency says The Green Chemist Consultancy - CosmeticsDesign-Europe.com	https://news.google.com/rss/articles/CBMiqwFodHRwczovL3d3dy5jb3NtZXRpY3NkZXNpZ24tZXVyb3BlLmNvbS9BcnRpY2xlLzIwMjMvMDMvMDgvR3JlZW4tYmVhdXR5LWluLTIwMjMtY2hhbGxlbmdlcy1hcmUtZ3JlZW53YXNoaW5nLXJpc2luZy1jb3N0cy1hbmQtdHJhbnNwYXJlbmN5LXNheXMtVGhlLUdyZWVuLUNoZW1pc3QtQ29uc3VsdGFuY3nSAQA?oc=5	The article discusses sustainability challenges and the importance of addressing greenwashing in the beauty industry, along with the increasing relevance of green beauty certifications and the need for harmonization. It also highlights the significance of transparent supply chains, high raw material costs, and ongoing raw material innovation efforts in the sector.	TRUE	FALSE	TRUE	TRUE	The Green Chemist Consultancy	The Green Chemist Consultancy	product or process not identified	Likely NAICS Codes: 541620 Environmental Consulting Services, 325620 Toilet Preparation Manufacturing, 325510 Paint and Coating Manufacturing, 325413 In-Vitro Diagnostic Substance Manufacturing	FALSE	1902
The fragrance of forests - Symrise	https://news.google.com/rss/articles/CBMiPWh0dHBzOi8vd3d3LnN5bXJpc2UuY29tL291ci1zdG9yaWVzL3RoZS1mcmFncmFuY2Utb2YtZm9yZXN0cy_SAQA?oc=5	The article discusses the optimization of processes related to the extraction of crude sulfate turpentine (CST) at Symrise, focusing on its reuse in fragrance manufacturing and the logistics around transporting the product.	FALSE	TRUE	FALSE	TRUE	Symrise	Symrise	symrise fragrance manufacturing process	Likely NAICS Codes: 325620 - Toilet Preparation Manufacturing, 325411 - Medicinal and Botanical Manufacturing, 325199 - All Other Basic Organic Chemical Manufacturing, 325510 - Paint and Coating Manufacturing	FALSE	1575
10 Sustainable British Beauty Brands To Discover Now - Country and Town House	https://news.google.com/rss/articles/CBMiXmh0dHBzOi8vd3d3LmNvdW50cnlhbmR0b3duaG91c2UuY29tL3N0eWxlL2hlYWx0aC1hbmQtYmVhdXR5L3N1c3RhaW5hYmxlLWJyaXRpc2gtYmVhdXR5LWJyYW5kcy_SAQA?oc=5	The article discusses sustainable British beauty brands focusing on carbon-neutral manufacturing, plastic-free packaging, and community action to tackle environmental issues.	TRUE The article discusses green innovations in the cosmetics industry, addressing environmental impact through carbon-neutral manufacturing and plastic-free packaging, promoting sustainability.	FALSE This article does not specifically mention new or significantly improved products or processes that differentiate from the company's previous offerings. It focuses more on sustainable practices in the cosmetics industry.	TRUE The article highlights sustainable beauty brands that offer products designed to reduce environmental impacts through eco-friendly packaging, carbon-neutral approaches, and community-focused actions.	TRUE The article mentions green processes like carbon-neutral manufacturing, plastic-free packaging, and community-focused initiatives to reduce the cosmetics industry's environmental footprint.	company not identified	product_or_process not identified	product or process not identified	Likely NAICS Codes: 325620 Toilet Preparation Manufacturing, 454111 Electronic Shopping, 325611 Soap and Other Detergent Manufacturing, 325992 Photographic Film, Paper, Plate, and Chemical Manufacturing	FALSE The article does not exhibit greenwashing as it focuses on genuine efforts by sustainable beauty brands to tackle environmental issues and adopt eco-friendly practices.	1392
Discover the Top 10 Emission Reduction Technology Trends in 2023 - StartUs Insights	https://news.google.com/rss/articles/CBMiV2h0dHBzOi8vd3d3LnN0YXJ0dXMtaW5zaWdodHMuY29tL2lubm92YXRvcnMtZ3VpZGUvZW1pc3Npb24tcmVkdWN0aW9uLXRlY2hub2xvZ3ktdHJlbmRzL9IBAA?oc=5	The article discusses the latest global emission reduction technology trends for 2023 based on research on startups and scaleups, covering areas such as carbon offsetting, artificial intelligence, electrification, green hydrogen, carbon capture and storage, energy-efficient integrations, big data, waste valorization, bio-based fuels and polymers, and emission monitoring.	TRUE - The article describes innovative technologies aimed at reducing carbon emissions and advancing sustainability, aligning with the concept of green innovation.	TRUE - The article highlights new innovative technologies and processes developed by startups and scaleups, qualifying as business innovation.	FALSE - While the article mentions products related to emission reduction technologies, it does not focus on specific individual products' environmental impacts throughout their life cycles.	TRUE - The article discusses various green processes and technologies aimed at reducing environmental impacts, such as carbon capture technologies and energy-efficient integrations.	company not identified	not found	product or process not identified	Likely NAICS Codes: 541715 - Research and Development in the Physical, Engineering, and Life Sciences | 562910 - Remediation Services | 325193 - Ethyl Alcohol Manufacturing | 221119 - Other Electric Power Generation	FALSE - The article focuses on realistic and data-driven descriptions of emission reduction technologies and does not exhibit characteristics of greenwashing.	5368
Top 10 Best Agricultural Chemicals Companies In USA In 2023 - Inventiva	https://news.google.com/rss/articles/CBMiS2h0dHBzOi8vd3d3LmludmVudGl2YS5jby5pbi90cmVuZHMvdG9wLTEwLWFncmljdWx0dXJhbC1jaGVtaWNhbHMtY29tcGFuaWVzL9IBAA?oc=5	The article discusses the importance of agricultural chemical companies in the USA in 2023, highlighting leading companies like Bayer Crop Science, Syngenta, Corteva Agriscience, BASF, FMC Corporation, and others. It mentions the industry's growth, increasing demands, and the need for sustainable solutions to boost crop yields while protecting the environment.	FALSE - The article focuses on traditional agricultural chemical products and technologies without emphasizing specific environmental sustainability goals or reducing negative environmental externalities.	TRUE - The article describes new products and technologies being developed by agricultural chemical companies, showcasing advancements and improvements in the industry.	FALSE - While the article mentions crop protection products, seeds, and agricultural solutions, it does not emphasize design, production, or usage that significantly reduces environmental impact throughout the product life cycle.	FALSE - The article discusses advancements in manufacturing, product development, and research in the agricultural chemical industry but does not specifically highlight methods or techniques that minimize environmental impacts.	company not identified	product_or_process not identified	product_or_process not identified	Likely NAICS Codes: 325320, 325411, 325411, 325411 - Resin and Pesticide, Fertilizer, and Pharmaceutical and Medicine Manufacturing	FALSE - The article does not present false or misleading information about the environmental benefits of a product or practice; it focuses on the advancements and offerings of agricultural chemical companies.	4711
