title	link	summary	green_innovation	business_innovation	green_product	green_process	company	official_company_name	product_or_process	likely_naics_codes	greenwashing	total_tokens
Ecofriendly Sun Care Brand VitaSea Launches E-Commerce Website with Five Sustainable Products for Sensitive Skin - PR Newswire	https://news.google.com/rss/articles/CBMiqAFodHRwczovL3d3dy5wcm5ld3N3aXJlLmNvbS9uZXdzLXJlbGVhc2VzL2Vjb2ZyaWVuZGx5LXN1bi1jYXJlLWJyYW5kLXZpdGFzZWEtbGF1bmNoZXMtZS1jb21tZXJjZS13ZWJzaXRlLXdpdGgtZml2ZS1zdXN0YWluYWJsZS1wcm9kdWN0cy1mb3Itc2Vuc2l0aXZlLXNraW4tMzAxODI4MzMzLmh0bWzSAQA?oc=5	The article introduces the launch of VitaSea's e-commerce platform offering a sun care collection focused on environmental conservation and sustainable ingredients.	FALSE	TRUE	TRUE	TRUE	VitaSea	VitaSea	VitaSea Sun Care Collection	Likely NAICS Codes: 325620 Toilet Preparation Manufacturing, 325611 Soap and Other Detergent Manufacturing, 325620 Toilet Preparation Manufacturing, 325620 Toilet Preparation Manufacturing	FALSE	1644
Ready-To-Drink Beverage Start-Up Salud Plans Foray Into 10 Indian Markets - Outlook Startup	https://news.google.com/rss/articles/CBMihgFodHRwczovL3N0YXJ0dXAub3V0bG9va2luZGlhLmNvbS9zZWN0b3IvZS1jb21tZXJjZS9yZWFkeS10by1kcmluay1iZXZlcmFnZS1zdGFydC11cC1zYWx1ZC1wbGFucy1mb3JheS1pbnRvLTEwLWluZGlhbi1tYXJrZXRzLW5ld3MtODUxNtIBAA?oc=5	Salud Beverages is expanding in 10 new Indian markets with new products in the RTD category, targeting Gen-Z and millennials. Their focus is on environmental conservation and local sourcing, introducing recyclable cans and incorporating NFTs for an immersive experience.	FALSE	TRUE	TRUE	TRUE	Salud Beverages	Salud Beverages	product or process not identified	Likely NAICS Codes: 312140 - Distilleries, 312130 - Wineries, 312120 - Breweries, 312110 - Soft Drink Manufacturing	FALSE	1709
Diageo India Introduces Godawan Century, a Limited-Edition Artisanal Single Malt, Celebrating the Great Indian Bustard - PR Newswire	https://news.google.com/rss/articles/CBMirwFodHRwczovL3d3dy5wcm5ld3N3aXJlLmNvbS9pbi9uZXdzLXJlbGVhc2VzL2RpYWdlby1pbmRpYS1pbnRyb2R1Y2VzLWdvZGF3YW4tY2VudHVyeS1hLWxpbWl0ZWQtZWRpdGlvbi1hcnRpc2FuYWwtc2luZ2xlLW1hbHQtY2VsZWJyYXRpbmctdGhlLWdyZWF0LWluZGlhbi1idXN0YXJkLTMwMTgzMjE4Ni5odG1s0gEA?oc=5	The article highlights the launch of 'Godawan Century,' an artisanal single malt whisky by Diageo India that celebrates heritage, culture, and conservation efforts. The product is presented as a limited-edition collection paying homage to the endangered Great Indian Bustard, with a focus on environmental preservation and sustainable luxury.	FALSE	TRUE	TRUE	TRUE	Diageo India	Diageo India	Godawan Century	Likely NAICS Codes: 312140 Distilleries, 312130 Wineries, 312120 Breweries, 312130 Distilleries; 312140 Wineries	FALSE	2669
Founders of Lifelong Online Retail Acquire Majority Ownership and Control, Expanding Focus on Indian Market - Indian Retailer	https://news.google.com/rss/articles/CBMigQFodHRwczovL3d3dy5pbmRpYW5yZXRhaWxlci5jb20vbmV3cy9mb3VuZGVycy1saWZlbG9uZy1vbmxpbmUtcmV0YWlsLWFjcXVpcmUtbWFqb3JpdHktb3duZXJzaGlwLWFuZC1jb250cm9sLWV4cGFuZGluZy1mb2N1cy1pbmRpYW7SAQA?oc=5	Juicy Chemistry and Mommy Shots by Amrita join forces for the 'Scars are Beautiful' campaign, celebrating postpartum bodies and stretch marks to inspire self-love and body positivity among women on Women’s Day.	FALSE: While the campaign promotes positive self-image and body acceptance, it does not introduce new environmental sustainability goals or technologies.	FALSE: The campaign focuses on promoting self-love and body positivity rather than introducing new products or business processes.	FALSE: The article does not discuss a specific good or service designed to significantly reduce environmental impact throughout its life cycle.	FALSE: The article does not detail a specific method or technique in manufacturing or production that minimizes environmental impacts and promotes sustainability.	Juicy Chemistry and Mommy Shots by Amrita	Juicy Chemistry and Mommy Shots by Amrita	product or process not identified	Likely NAICS Codes: 541850 - Display Advertising, 541430 - Graphic Design Services, 541921 - Photography Studios, Portrait, 541490 - Other Specialized Design Services	FALSE: The article focuses on promoting body positivity and celebrating motherhood rather than making false environmental claims.	2091
The richest people in Vancouver, listed - Cantech Letter	https://news.google.com/rss/articles/CBMiTWh0dHBzOi8vd3d3LmNhbnRlY2hsZXR0ZXIuY29tLzIwMjMvMDUvdGhlLXJpY2hlc3QtcGVvcGxlLWluLXZhbmNvdXZlci1saXN0ZWQv0gFRaHR0cHM6Ly93d3cuY2FudGVjaGxldHRlci5jb20vMjAyMy8wNS90aGUtcmljaGVzdC1wZW9wbGUtaW4tdmFuY291dmVyLWxpc3RlZC9hbXAv?oc=5	The article text covers successful entrepreneurs and investors in various industries in Vancouver, highlighting individuals like Changpeng Zhao, Jim Pattison, Anthony Von Mandl, Joseph Tsai, David Cheriton, Chip Wilson, and Stewart Butterfield.	FALSE: The article text discusses successful entrepreneurs and investors in various industries without a focus on green innovation.	FALSE: The article text focuses on the success stories of entrepreneurs in different industries and not on new or significantly improved products or business processes.	FALSE: The article text discusses the achievements and contributions of successful entrepreneurs and investors in various industries without specifically addressing the design, manufacture, or use of products with reduced environmental impact.	FALSE: The article text highlights successful entrepreneurs and investors without detailing methods or techniques in manufacturing, production, or operational activities that promote environmental sustainability.	company not identified	product or process not identified	product or process not identified	Likely NAICS Codes: Not applicable	FALSE: The article text does not focus on making false or misleading statements about the environmental benefits of a product or practice, so it is not an example of greenwashing.	3623
Top 10 Best Baby Care Companies In Europe 2023 - Inventiva	https://news.google.com/rss/articles/CBMiRmh0dHBzOi8vd3d3LmludmVudGl2YS5jby5pbi90cmVuZHMvYmFieS1jYXJlLWNvbXBhbmllcy1pbi1ldXJvcGUtMjAyMy_SAQA?oc=5	The article discusses the baby care industry's focus on safety, sustainability, and innovation. It highlights top baby care companies in Europe that prioritize safety, quality, and sustainability in their products.	FALSE	TRUE	TRUE	TRUE	AVENT	Philips AVENT	baby products	Likely NAICS Codes: 339113 - Surgical Appliance and Supplies Manufacturing, 339114 - Dental Equipment and Supplies Manufacturing, 339112 - Surgical and Medical Instrument Manufacturing, 325413 - In-Vitro Diagnostic Substance Manufacturing	FALSE	5115
Top 10 Best Consumer Products Companies In India In 2023 - Inventiva	https://news.google.com/rss/articles/CBMiSmh0dHBzOi8vd3d3LmludmVudGl2YS5jby5pbi90cmVuZHMvY29uc3VtZXItcHJvZHVjdHMtY29tcGFuaWVzLWluZGlhLTIwMjMv0gEA?oc=5	The article discusses the growth and strategies of consumer products companies in India for 2023, highlighting key players like Hindustan Unilever Limited, ITC Limited, Nestlé India, Marico Limited, Britannia Industries Limited, Dabur India Limited, Godrej Consumer Products Limited, Procter & Gamble Hygiene and Health Care Limited, Colgate-Palmolive (India) Limited, and Patanjali Ayurved Limited.	FALSE	TRUE	TRUE	TRUE	company identified	Hindustan Unilever Limited	product or process not identified	Likely NAICS Codes: 325620 Toiletry Product Manufacturing, 311330 Confectionery Manufacturing from Purchased Chocolate, 311351 Confectionery Manufacturing from Purchased Chocolate, 311352 Confectionery Manufacturing from Cacao Beans	FALSE	5346
Top 10 Best Food & Beverages Companies In India In 2023 - Inventiva	https://news.google.com/rss/articles/CBMiSGh0dHBzOi8vd3d3LmludmVudGl2YS5jby5pbi90cmVuZHMvdG9wLTEwLWJlc3QtZm9vZC1iZXZlcmFnZXMtY29tcGFuaWVzL9IBAA?oc=5	The article highlights the top food and beverage companies in India in 2023, emphasizing their contributions to the country's economy. It discusses key players such as Amul, Nestle India, Hindustan Unilever Limited, ITC Limited, PepsiCo India, Britannia Industries, Haldiram's, Coca-Cola India, Parle Products Pvt Ltd, and Dabur India Limited.	FALSE: The article focuses on the economic impact and market presence of food and beverage companies in India rather than specifically emphasizing environmentally sustainable innovations.	FALSE: The article primarily discusses the market performance and product portfolios of food and beverage companies in India, lacking a specific focus on novel business processes or product innovations.	FALSE: While the article mentions food and beverages, it does not emphasize how these products are designed, manufactured, or used in a significantly environmentally friendly manner to qualify as green products.	FALSE: The article does not delve into methods or techniques adopted by food and beverage companies in India to minimize environmental impacts or promote sustainability.	company identified	Amul	product or process not identified	Likely NAICS Codes: 3115 (Dairy Product Manufacturing), 3121 (Beverage Manufacturing), 3118 (Bakeries and Tortilla Manufacturing), 3113 (Sugar and Confectionery Product Manufacturing)	FALSE: The article does not involve making false or misleading claims about environmental benefits but rather focuses on the economic aspects and market presence of food and beverage companies in India.	5332
