title	link	summary	green_innovation	business_innovation	green_product	green_process	company	official_company_name	product_or_process	likely_naics_codes	greenwashing	total_tokens
Changing behavior could help Long Islanders better recycle and donate food - WSHU	https://news.google.com/rss/articles/CBMie2h0dHBzOi8vd3d3LndzaHUub3JnL2xvbmctaXNsYW5kLW5ld3MvMjAyMy0wNC0yMS9jaGFuZ2luZy1iZWhhdmlvci1jb3VsZC1oZWxwLWxvbmctaXNsYW5kZXJzLWJldHRlci1yZWN5Y2xlLWFuZC1kb25hdGUtZm9vZNIBAA?oc=5	The article discusses the implementation of a law in New York requiring large waste generators to donate excess food and recycle food scraps, aiming to reduce waste and promote sustainability in the state.	TRUE The article discusses the implementation of a law focused on reducing waste and promoting sustainability, aligning with the principles of green innovation.	FALSE This article does not primarily focus on a new or improved product or business process that significantly differs from the firm's previous offerings.	TRUE The article addresses the design and implementation of processes to reduce environmental impact in the life cycle of food products, thus fitting the definition of a green product.	TRUE The article describes the implementation of methods to reduce waste and promote sustainability in food waste management, aligning with the definition of green processes.	company not identified	N/A	product or process not identified	Likely NAICS Codes: 562920, 562998, 562111, 562119	FALSE The article does not demonstrate characteristics of greenwashing as it focuses on genuine efforts to reduce waste and promote sustainability in food waste management.	2298
How can farmers deliver on EU Green Deal environmental commitments? | - Open Access Government	https://news.google.com/rss/articles/CBMiaGh0dHBzOi8vd3d3Lm9wZW5hY2Nlc3Nnb3Zlcm5tZW50Lm9yZy9ob3ctZmFybWVycy1kZWxpdmVyLWV1LWdyZWVuLWRlYWwtZW52aXJvbm1lbnRhbC1jb21taXRtZW50cy8xNTY5NDgv0gEA?oc=5	The article discusses the EU Green Deal and its implications for farmers in meeting environmental commitments through sustainable agriculture practices, green infrastructure, circular economy, and organic farming. It highlights the need for farmers to adopt new technologies and strategies in order to drive meaningful change for decarbonization and protecting nature. The text also emphasizes the importance of enforcing and monitoring mechanisms to ensure compliance with environmental regulations outlined in the EU Green Deal.	FALSE	FALSE	TRUE	TRUE	company not identified	not found	product or process not identified	Likely NAICS Codes: 111, 112, 113, 114	FALSE	5855
The UK's investment in environmental science - Open Access Government	https://news.google.com/rss/articles/CBMiU2h0dHBzOi8vd3d3Lm9wZW5hY2Nlc3Nnb3Zlcm5tZW50Lm9yZy91ay1pbnZlc3RtZW50LWluLWVudmlyb25tZW50YWwtc2NpZW5jZS8xNTc2NzMv0gEA?oc=5	The article highlights the importance of investing in environmental science to address climate change, improve air quality, and transition to a green and low-carbon economy across the UK.	TRUE. The article discusses investing in environmental science, transitioning to a low-carbon economy, and addressing climate change, which align with green innovation goals such as decarbonisation and promoting green technologies.	FALSE. While the article emphasizes investments and advancements in environmental science-related research and technologies, it does not specifically focus on new or significantly improved products or business processes that differ from previous offerings.	FALSE. The article discusses the importance of investing in environmental science and transitioning to a green economy but does not specifically focus on the design, manufacture, and use of a specific product that significantly reduces its environmental impact throughout its life cycle.	FALSE. The article highlights investments in monitoring the environment, transitioning to a low-carbon economy, and improving air quality but does not specifically delve into methods or techniques in manufacturing or operational activities that minimize environmental impacts.	company not identified	product or process not identified	product or process not identified	Likely NAICS Codes: 541620 - Environmental Consulting Services, 541710 - Research and Development in the Physical, Engineering, and Life Sciences, 541720 - Research and Development in the Social Sciences and Humanities, 541330 - Engineering Services	FALSE. The article focuses on the importance of investing in environmental science, transitioning to a green economy, and addressing climate change while not making false or misleading statements about the environmental benefits of a product or practice. Therefore, it does not demonstrate greenwashing.	2550
D2C Brand Pilgrim Forays into the Hair Care Segment, Launches Its New Range - Indian Retailer	https://news.google.com/rss/articles/CBMiZWh0dHBzOi8vd3d3LmluZGlhbnJldGFpbGVyLmNvbS9uZXdzL2QyYy1icmFuZC1waWxncmltLWZvcmF5cy1oYWlyLWNhcmUtc2VnbWVudC1sYXVuY2hlcy1pdHMtbmV3LXJhbmdl0gEA?oc=5	Juicy Chemistry and Mommy Shots by Amrita collaborate on the 'Scars are Beautiful' campaign, celebrating motherhood and the uniqueness of postpartum bodies through an empowering photo series featuring 11 mothers. The campaign aims to inspire body positivity, self-love, and acceptance, challenging societal norms and perceptions of beauty.	FALSE	FALSE	TRUE	TRUE	Juicy Chemistry and Mommy Shots by Amrita	Juicy Chemistry and Mommy Shots by Amrita	product or process not identified	Likely NAICS Codes: 325620 - Toilet Preparation Manufacturing, 541921 - Photography Studios, Portrait, 541922 - Commercial Photography, 812921 - Photography Studios, Portrait	FALSE	2006
Top 20 Best Metal Ore Mining Companies In India 2023 - Inventiva	https://news.google.com/rss/articles/CBMiSmh0dHBzOi8vd3d3LmludmVudGl2YS5jby5pbi90cmVuZHMvdG9wLTIwLWJlc3QtbWV0YWwtb3JlLW1pbmluZy1jb21wYW5pZXMv0gEA?oc=5	The article discusses the significant contribution of the metal ore mining industry to India's economy, highlighting the top 20 best metal ore mining companies in the country that have demonstrated commitment to sustainable mining practices and environmental protection.	FALSE	TRUE	FALSE	TRUE	company not identified	company not identified	product or process not identified	Likely NAICS Codes: 2122 - Metal Ore Mining, 327 - Nonmetallic Mineral Product Manufacturing, 3311 - Iron and Steel Mills and Ferroalloy Manufacturing, 212399 - All Other Nonmetallic Mineral Mining	FALSE	4430
