title	link	summary	green_innovation	business_innovation	green_product	green_process	company	official_company_name	product_or_process	likely_naics_codes	greenwashing	total_tokens
The Best Rain Barrels of 2024	http://www.bing.com/news/apiclick.aspx?ref=FexRss&aid=&tid=667b5cf43cdb49bab4c1e14102430390&url=https%3a%2f%2fwww.popularmechanics.com%2fscience%2fenvironment%2fg60981003%2fbest-rain-barrels%2f&c=14017911254908642421&mkt=en-us	The article discusses rain barrels as a means to conserve and store water for non-rainy days, with tips on purchasing, reviews of best barrels, and maintenance. It covers capacity, materials, features, and regulatory considerations for rainwater collection.	FALSE; The article primarily focuses on the utility and features of rain barrels for water conservation and storage, rather than on introducing new methods or technologies that significantly reduce negative environmental externalities.	FALSE; The article does not mention any new or significantly improved product or business process that differs from the firm's previous offerings.	TRUE; The article describes rain barrels designed to collect rainwater for conservation and usage, showcasing features that minimize environmental impact throughout the product lifecycle, aligning with the definition of a green product.	FALSE; The article focuses on the use and maintenance of rain barrels as a product, rather than detailing new methods or techniques in manufacturing or production to minimize environmental impacts.	company not identified	product or process not identified	Rain Barrels	Likely NAICS Codes: 326199 - All Other Plastics Product Manufacturing, 444190 - Other Building Material Dealers, 238290 - Other Building Equipment Contractors, 221310 - Water Supply and Irrigation Systems	FALSE; The article provides informative content about rain barrels for water conservation without making false or misleading environmental claims, thus not aligning with the practice of greenwashing.	2245
Veolia Water Technologies to expand in Wuxi, China with new intelligent factory	http://www.bing.com/news/apiclick.aspx?ref=FexRss&aid=&tid=667b5cf43cdb49bab4c1e14102430390&url=https%3a%2f%2fwww.filtsep.com%2fcontent%2fnews%2fveolia-water-technologies-to-expand-in-wuxi-china-with-new-intelligent-factory&c=8471165430115910340&mkt=en-us	Veolia Water Technologies & Solutions expands its operations in Wuxi, China through an agreement with the Administrative Committee of Wuxi National High-Tech Industrial Development Zone to introduce new products for energy-saving and environmentally friendly clean production lines under the GreenUp program.	TRUE. This initiative by Veolia Water Technologies & Solutions to expand and introduce environmentally friendly products aligns with the goals of green innovation by focusing on decarbonization, energy-saving, clean production, pollution prevention, and sustainable resource management.	TRUE. Veolia Water Technologies & Solutions' expansion and introduction of new products in Wuxi, China, signify a significant change in the company's operations and product offerings, meeting the criteria of business innovation.	TRUE. The article mentions Veolia's plan to introduce new products that aim for energy-saving and environmentally friendly clean production lines, emphasizing the design, manufacturing, and use of goods with reduced environmental impact, which qualifies as green product innovation.	TRUE. The article discusses Veolia's focus on building energy-saving and environmentally friendly clean production lines, which involves methods and techniques that aim to minimize environmental impacts and promote sustainability, meeting the definition of green process innovation.	Veolia Water Technologies & Solutions	Veolia Water Technologies & Solutions	product or process not identified	Likely NAICS Codes: 221310 - Water Supply and Irrigation Systems, 562998 - All Other Miscellaneous Waste Management Services, 325181 - Alkalies and Chlorine Manufacturing, 333413 - Industrial and Commercial Fan and Blower Manufacturing	FALSE. The article does not indicate any false or misleading environmental claims by Veolia Water Technologies & Solutions, making it an authentic example of green innovation.	1661
Vallarta Supermarkets Debuts New HQ	http://www.bing.com/news/apiclick.aspx?ref=FexRss&aid=&tid=667b5cf43cdb49bab4c1e14102430390&url=https%3a%2f%2fprogressivegrocer.com%2fvallarta-supermarkets-debuts-new-hq&c=6152021121390643583&mkt=en-us	Vallarta Supermarkets opened a new facility in Santa Clarita, designed to support innovation, collaboration, and community engagement, and included various features and amenities.	FALSE - While the article mentions innovation, collaboration, and community engagement, it does not explicitly highlight any green aspects related to environmental sustainability.	TRUE - The article discusses the opening of a new office headquarters, which can be considered a business innovation as it represents a new or improved business process for Vallarta Supermarkets.	FALSE - The article does not provide details indicating the introduction of a new product or service designed to significantly reduce environmental impact throughout its life cycle.	FALSE - The article does not focus on a method or technique in manufacturing, production, or operational activity that minimizes environmental impacts or promotes sustainability.	Vallarta Supermarkets	Vallarta Supermarkets	product or process not identified	Likely NAICS Codes: 445110 - Supermarkets and Other Grocery (except Convenience) Stores, 531120 - Lessors of Nonresidential Buildings (including facility leasing), 541614 - Process, Physical Distribution, and Logistics Consulting Services, 561110 - Office Administrative Services	FALSE - The article does not contain elements of greenwashing as it does not make false or misleading environmental claims about a product or practice.	1459
How Google is supporting the circular economy	http://www.bing.com/news/apiclick.aspx?ref=FexRss&aid=&tid=667b5cf43cdb49bab4c1e14102430390&url=https%3a%2f%2fwww.nature.com%2farticles%2fd42473-022-00399-1&c=1934620950812163367&mkt=en-us	The article discusses Google's efforts in adopting circularity strategies to achieve a zero-waste goal, reducing the environmental impact of its data centers, campuses, and products. It emphasizes the concept of a circular economy to minimize waste, promote reuse of materials, and mitigate climate change through innovative design and sustainable practices.	TRUE. The article focuses on Google's adoption of circularity strategies and efforts towards a zero-waste goal, aligning with environmental sustainability goals and contributing to reducing the environmental impact of their operations.	FALSE. While the article discusses business processes and product developments, the primary focus is on environmental sustainability and circular economy practices, rather than traditional business innovations.	TRUE. The article highlights Google's commitment to using sustainable materials, designing products for circularity, and promoting safe and healthy materials in its product development, aligning with the definition of a green product.	TRUE. The article emphasizes Google's implementation of green processes in its operations, such as repairing and refurbishing components to extend product life, promoting waste diversion and recycling in data centers and campuses, and ensuring the reuse of materials.	Google	Google	product or process not identified	Likely NAICS Codes: 518210 - Data Processing, Hosting, and Related Services, 541512 - Computer Systems Design Services, 484210 - Used Household and Office Goods Moving, 423930 - Recyclable Material Merchant Wholesalers	FALSE. The article does not fall under greenwashing, as it highlights Google's genuine efforts towards sustainable practices and circular economy principles, avoiding false or misleading environmental claims.	5900
Wonder Juice™ Recognized With “Juice Product of the Year” In 2024 Mindful Awards Program	http://www.bing.com/news/apiclick.aspx?ref=FexRss&aid=&tid=667b5cf43cdb49bab4c1e14102430390&url=https%3a%2f%2fmarkets.businessinsider.com%2fnews%2fstocks%2fwonder-juice-recognized-with-juice-product-of-the-year-in-2024-mindful-awards-program-1033468566&c=14549871218580052955&mkt=en-us	Wonder Juice has been selected as 'Juice Product of the Year' for its organic, cold-pressed juices packaged in eco-friendly glass bottles. The company emphasizes ethical and sustainable practices in its production processes and ingredients.	TRUE: This is a case of green innovation as Wonder Juice promotes sustainability through its organic and Fair Trade certified products, eco-friendly packaging, and commitment to ethical and sustainable practices.	FALSE: While the article discusses a product innovation, it does not focus on a significant change in business processes that would qualify it as a distinct business innovation.	TRUE: Wonder Juice qualifies as a green product due to its environmentally friendly design, use of organic ingredients, sustainable production processes, and eco-friendly packaging.	FALSE: The article mentions the use of cold-pressing for juice extraction and emphasizes sustainability in production practices, but it does not delve into a broader green process that significantly minimizes environmental impacts and promotes sustainability.	Wonder Juice	Wonder Juice	Wonder Juice	Likely NAICS Codes: 311930 - Flavoring Syrup and Concentrate Manufacturing, 311411 - Frozen Fruit, Juice, and Vegetable Manufacturing, 311999 - All Other Miscellaneous Food Manufacturing, 325413 - In-Vitro Diagnostic Substance Manufacturing	FALSE: The article provides detailed information about Wonder Juice's sustainable practices, certifications, and ingredients, showcasing a genuine commitment to environmental responsibility rather than engaging in greenwashing.	2735
Best Showerhead for 2024	http://www.bing.com/news/apiclick.aspx?ref=FexRss&aid=&tid=667b5cf43cdb49bab4c1e14102430390&url=https%3a%2f%2fwww.cnet.com%2fhome%2fkitchen-and-household%2fbest-showerhead%2f&c=4182536862750564356&mkt=en-us	The article reviews and rates various showerheads based on factors like ease of installation, water efficiency, and customer satisfaction, highlighting features and pricing of different models.	FALSE	TRUE	TRUE	TRUE	CNET	CNET	product_or_process not identified	Likely NAICS Codes: 517410 - Satellite Telecommunications, 517110 - Wired Telecommunications Carriers, 517919 - All Other Telecommunications, 541890 - Other Services Related to Advertising	FALSE	4252
Waste Reduction	http://www.bing.com/news/apiclick.aspx?ref=FexRss&aid=&tid=667b5cf43cdb49bab4c1e14102430390&url=https%3a%2f%2fwww.sfu.ca%2ffs%2fprojects-initiatives%2fsustainable-initiatives%2fwaste-reduction.html&c=1517200599746314714&mkt=en-us	The article provides guidance on waste disposal, segregating materials for landfill and recycling.	FALSE	FALSE	FALSE	FALSE	company not identified	product or process not identified	product or process not identified	Likely NAICS Codes: 562212 - Solid Waste Landfill, 562920 - Materials Recovery Facilities, 562998 - All Other Miscellaneous Waste Management Services, 562111 - Solid Waste Collection	FALSE	1240
