title	link	summary	green_innovation	business_innovation	green_product	green_process	company	official_company_name	product_or_process	likely_naics_codes	greenwashing	total_tokens
Complete guide to Technology Readiness Level federal funding - Innovation News Network	https://news.google.com/rss/articles/CBMiaWh0dHBzOi8vd3d3Lmlubm92YXRpb25uZXdzbmV0d29yay5jb20vY29tcGxldGUtZ3VpZGUtdG8tdGVjaG5vbG9neS1yZWFkaW5lc3MtbGV2ZWwtZmVkZXJhbC1mdW5kaW5nLzM1MTk2L9IBAA?oc=5	The article discusses federal funding opportunities for various Technology Readiness Levels (TRLs) in the U.S., providing insights into grants, loans, and cooperative agreements available from different agencies to advance innovations.	FALSE	TRUE	TRUE	TRUE	American Diversified Enterprises LLC	American Diversified Enterprises LLC	product or process not identified	Likely NAICS Codes: 541715 - Research and Development in the Physical, Engineering, and Life Sciences, 541712 - Research and Development in the Social Sciences and Humanities, 541720 - Research and Development in the Social Sciences and Humanities, and 611710 - Educational Support Services	FALSE	7811
India's JSW Energy targets 40 GWh/5 GW of storage capacity by 2030 - pv magazine International	https://news.google.com/rss/articles/CBMiaWh0dHBzOi8vd3d3LnB2LW1hZ2F6aW5lLmNvbS8yMDIzLzA3LzE3L2luZGlhcy1qc3ctZW5lcmd5LXRhcmdldHMtNDAtZ3doLTUtZ3ctb2Ytc3RvcmFnZS1jYXBhY2l0eS1ieS0yMDMwL9IBAA?oc=5	JSW Energy plans to scale renewable energy capacity, green hydrogen production, and solar module manufacturing by 2030.	TRUE: The initiatives by JSW Energy align with green innovation principles as they focus on expanding renewable energy capacity, green hydrogen production, and sustainable manufacturing.	TRUE: JSW Energy's plans for expanding its energy generation, storage capacity, and entering new business ventures constitute as business innovation.	FALSE: The article does not specifically mention a new product that meets the criteria of a green product.	TRUE: The article discusses JSW Energy's efforts to enhance energy generation with a focus on renewable sources and green technologies, aligning with green process principles.	JSW Energy	JSW Energy	product or process not identified	Likely NAICS Codes: 221114, 221118, 221119, 221122 - Electric Power Generation, Transmission, and Distribution	FALSE: The article does not indicate any false or misleading claims regarding environmental benefits, thus not an example of greenwashing.	1506
Five Steps for Solving the Rare-Earth Metals Shortage - BCG	https://news.google.com/rss/articles/CBMiW2h0dHBzOi8vd3d3LmJjZy5jb20vcHVibGljYXRpb25zLzIwMjMvZml2ZS1zdGVwcy1mb3Itc29sdmluZy10aGUtcmFyZS1lYXJ0aC1tZXRhbHMtc2hvcnRhZ2XSAQA?oc=5	The article emphasizes the importance of government and private sector cooperation in regulating and developing rare-earth mining to mitigate supply and demand imbalances.	FALSE - The article focuses on rare-earth mining processes and market regulation, which are not primarily aimed at reducing negative environmental externalities.	TRUE - The article discusses new approaches and strategies in rare-earth mining and market development, constituting business innovation.	FALSE - The article does not specifically mention a good or service designed, manufactured, and used in an environmentally friendly manner.	TRUE - The article addresses efforts to minimize environmental impacts and promote sustainability in rare-earth mining processes, qualifying as green process innovation.	company not identified	product_or_process not identified	product_or_process not identified	Likely NAICS Codes: 212299 - All Other Metal Ore Mining, 213114 - Support Activities for Metal Mining, 213115 - Support Activities for Nonmetallic Minerals (except Fuels) Mining, 924110 - Administration of Air and Water Resource and Solid Waste Management Programs	FALSE - The article does not involve deceptive environmental claims about a product or practice; it discusses tangible actions in rare-earth mining and supply chain development.	3263
SECI's Gupta On India's Renewable Energy Growth Prospects - Bloomberg	https://news.google.com/rss/articles/CBMib2h0dHBzOi8vd3d3LmJsb29tYmVyZy5jb20vbmV3cy92aWRlb3MvMjAyMy0wOC0wMS9zZWNpLXMtZ3VwdGEtb24taW5kaWEtcy1yZW5ld2FibGUtZW5lcmd5LWdyb3d0aC1wcm9zcGVjdC12aWRlb9IBAA?oc=5	The article discusses India's efforts towards renewable energy development and the role of the Solar Energy Corporation of India (SECI) in transparent bidding systems, energy storage, and hydrogen production.	TRUE - The article discusses India's efforts to promote renewable energy, transparent bidding systems, energy storage, and hydrogen production, all contributing to environmental sustainability goals as green innovations.	TRUE - The article discusses how SECI has introduced new processes and products in the renewable energy sector, such as transparent bidding systems and energy storage, which differ significantly from previous approaches, thus constituting business innovation.	FALSE - Green products typically refer to goods or services that are designed and used in a way that significantly reduces environmental impact throughout their life cycle. The article does not focus on a specific product meeting this comprehensive definition of a green product.	TRUE - The article mentions the deployment of transparent bidding systems, energy storage methods, and hydrogen production techniques, all of which aim to minimize environmental impacts and promote sustainability in the renewable energy sector, aligning with the definition of green processes.	Solar Energy Corporation of India (SECI)	Solar Energy Corporation of India	product or process not identified	Likely NAICS Codes: 221114 (Solar Electric Power Generation), 221119 (Other Electric Power Generation), 221210 (Natural Gas Distribution), 221330 (Steam and Air-Conditioning Supply)	FALSE - The article does not exhibit signs of greenwashing; instead, it focuses on tangible efforts and initiatives in renewable energy, energy storage, and hydrogen production, showcasing the organization's commitment to sustainable practices.	2503
Can recycling help mitigate climate change? - University of Delaware	https://news.google.com/rss/articles/CBMiX2h0dHBzOi8vd3d3LnVkZWwuZWR1L2FjYWRlbWljcy9jb2xsZWdlcy9jYW5yL25ld3MvMjAyMy9qdWx5L2RvZXMtcmVjeWNsaW5nLWhlbHAtY2xpbWF0ZS1jaGFuZ2Uv0gEA?oc=5	The article discusses the benefits of recycling in addressing climate change and emphasizes the importance of proper recycling practices to conserve energy and reduce greenhouse gas emissions.	TRUE: The article discusses the benefits of recycling which contributes to environmental sustainability goals by conserving energy, reducing waste, and minimizing greenhouse gas emissions.	FALSE: The article focuses on individual actions and recycling practices rather than new or significantly improved products or business processes.	TRUE: The article highlights the use of recycled materials in products to reduce environmental impact and promote sustainability through conserving natural resources and reducing greenhouse gas emissions.	FALSE: The article primarily focuses on recycling practices and educating individuals about proper recycling methods rather than specific manufacturing or operational processes.	company not identified	product or process not identified	product or process not identified	Likely NAICS Codes: 562920 - Materials Recovery Facilities, 562111 - Solid Waste Collection, 562998 - All Other Miscellaneous Waste Management Services, 924110 - Administration of Air and Water Resource and Solid Waste Management Programs	FALSE: The article provides factual information about the environmental benefits of recycling and emphasizes the importance of proper recycling practices, without engaging in deceptive or misleading statements.	1782
Circular cities: The role of the sharing economy in parking - Sustainability Magazine	https://news.google.com/rss/articles/CBMiYWh0dHBzOi8vc3VzdGFpbmFiaWxpdHltYWcuY29tL2FydGljbGVzL2NpcmN1bGFyLWNpdGllcy10aGUtcm9sZS1vZi10aGUtc2hhcmluZy1lY29ub215LWluLXBhcmtpbmfSAQA?oc=5	The article discusses Amsterdam's efforts to become a circular city, implementing various sustainable initiatives including renewable energy, green buildings, urban agriculture, and parking solutions aligned with circular economy principles.	TRUE	TRUE	TRUE	TRUE	Amsterdam	City of Amsterdam	Amsterdam Circular City Initiatives	Likely NAICS Codes: 926130 - Regulation, Licensing, and Inspection of Miscellaneous Commercial Sectors, 925120 - Land, Mineral, Wildlife, and Forest Conservation, 924110 - Administration of Environmental Quality Programs, 922120 - Police Protection	FALSE	2083
Explore the 10 Leading Circular Economy Examples in 2024 - StartUs Insights	https://news.google.com/rss/articles/CBMiTGh0dHBzOi8vd3d3LnN0YXJ0dXMtaW5zaWdodHMuY29tL2lubm92YXRvcnMtZ3VpZGUvY2lyY3VsYXItZWNvbm9teS1leGFtcGxlcy_SAQA?oc=5	The article discusses real-world examples of the circular economy across industries, highlighting practices like compostable materials, sustainable packaging, zero-carbon food waste management, and more.	TRUE: The article focuses on innovative green practices within businesses that aim to reduce negative environmental impacts and promote sustainability across various industries.	TRUE: The article highlights new practices and solutions within different sectors to promote sustainability, resource efficiency, and waste reduction, aligning with the definition of business innovation.	TRUE: The article mentions examples of green products such as upcycled flour, compostable packages, and zero-waste fashion that are designed to significantly reduce environmental impact throughout their life cycles.	TRUE: The article discusses green processes like closed-loop plastic recycling, circular battery platforms, and waste-to-energy plants that aim to minimize environmental impacts, promote sustainability, and reduce energy consumption.	company identified	SWING Biomethane	product or process not identified	Likely NAICS Codes: 221119 - Other Electric Power Generation, 322130 - Paperboard Mills, 325520 - Adhesive Manufacturing, 562920 - Materials Recovery Facilities	FALSE: The article does not exhibit signs of greenwashing as it focuses on genuine examples of green practices and innovations across industries.	4740
Emerald SA progressively launching new products and business in Africa - CNBCAfrica.com	https://news.google.com/rss/articles/CBMiaWh0dHBzOi8vd3d3LmNuYmNhZnJpY2EuY29tLzIwMjMvZW1lcmFsZC1zYS1wcm9ncmVzc2l2ZWx5LWxhdW5jaGluZy1uZXctcHJvZHVjdHMtYW5kLWJ1c2luZXNzLWluLWFmcmljYS0yL9IBAA?oc=5	The article discusses Emerald's business model, operations in Africa, reinsurance relationships, market focus on various sectors including renewable energy, and the company's strength and differentiation.	FALSE	TRUE	FALSE	FALSE	Emerald	Emerald	product or process not identified	Likely NAICS Codes: 524126 - Direct Property and Casualty Insurance Carriers, 524127 - Direct Title Insurance Carriers, 524210 - Insurance Agencies and Brokerages, 524291 - Claims Adjusting	FALSE	1457
Blue Economy for Revitalization of Oceans - Modern Diplomacy	https://news.google.com/rss/articles/CBMiUGh0dHBzOi8vbW9kZXJuZGlwbG9tYWN5LmV1LzIwMjMvMDcvMjYvYmx1ZS1lY29ub215LWZvci1yZXZpdGFsaXphdGlvbi1vZi1vY2VhbnMv0gEA?oc=5	The article discusses the concept of Blue Economy, emphasizing sustainability in the use of oceans for economic development and aligning with UN Sustainable Development Goals.	TRUE	TRUE	TRUE	TRUE	company not identified	Not Applicable	product or process not identified	Likely NAICS Codes: 114111 - Finfish Fishing, 711510 - Independent Artists, Writers, and Performers, 541712 - Research and Development in the Physical, Engineering, and Life Sciences, 721199 - All Other Traveler Accommodation	FALSE	2405
4 technology trends driving sustainability in real estate - The Times of India	https://news.google.com/rss/articles/CBMicmh0dHBzOi8vdGltZXNvZmluZGlhLmluZGlhdGltZXMuY29tL2Jsb2dzL3ZhbnRhZ2UtcG9pbnQvNC10ZWNobm9sb2d5LXRyZW5kcy1kcml2aW5nLXN1c3RhaW5hYmlsaXR5LWluLXJlYWwtZXN0YXRlL9IBcmh0dHBzOi8vdGltZXNvZmluZGlhLmluZGlhdGltZXMuY29tL2Jsb2dzL3ZhbnRhZ2UtcG9pbnQvNC10ZWNobm9sb2d5LXRyZW5kcy1kcml2aW5nLXN1c3RhaW5hYmlsaXR5LWluLXJlYWwtZXN0YXRlLw?oc=5	The article discusses the importance of adopting new technologies in the real estate sector to ensure sustainability, particularly focusing on green building practices and renewable energy. It highlights the role of technology advancements like smart building systems, renewable energy solutions, green construction technologies, and AI-powered tools in promoting eco-friendly practices and reducing carbon emissions.	TRUE. The article discusses the adoption of new technologies and practices in the real estate sector to promote sustainability and reduce carbon emissions, aligning with the concept of green innovation.	TRUE. The article emphasizes the implementation of new technologies in the real estate sector to drive sustainability and efficient energy use, which aligns with the definition of business innovation.	TRUE. The article mentions the use of green building practices, renewable energy solutions, and eco-friendly construction materials, which collectively contribute to reducing environmental impact throughout the life cycle of real estate products/services.	TRUE. The article highlights the adoption of sustainable practices and technologies in the real estate sector to minimize environmental impacts, promote sustainability, and reduce energy consumption, aligning with the concept of green processes.	Magicbricks.com	Magicbricks Realty Services Limited	product or process not identified	Likely NAICS Codes: 236220 - Commercial and Institutional Building Construction, 221119 - Other Electric Power Generation, 334512 - Automatic Environmental Control Manufacturing for Residential, Commercial, and Appliance Use, 238220 - Plumbing, Heating, and Air-Conditioning Contractors	FALSE. The article focuses on genuine efforts towards incorporating sustainable technologies and practices in the real estate sector, without resorting to misleading environmental claims.	2696
Sustainable Data Centre Future in Sweden - Digital Infra Network	https://news.google.com/rss/articles/CBMiT2h0dHBzOi8vZGlnaXRhbGluZnJhbmV0d29yay5jb20vdGFsa3Mvc3VzdGFpbmFibGUtZGF0YS1jZW50cmUtZnV0dXJlLWluLXN3ZWRlbi_SAQA?oc=5	The article discusses Sweden's leadership in sustainable data centers, emphasizing green and energy-efficient practices, renewable energy sources, and collaboration for innovation.	TRUE - The article highlights green initiatives, energy efficiency, and a commitment to renewable energy sources in the sustainable data center industry, aligning with the concept of green innovation.	FALSE - The article focuses on sustainable practices in the data center industry rather than introducing new products or business processes, which are required for business innovation.	FALSE - While the article mentions green initiatives and energy-efficient practices in the data center sector, it does not provide specific details about a particular product meeting the comprehensive definition of a green product.	TRUE - The article discusses energy-efficient practices, waste heat recovery, and sustainable initiatives in data center operations, aligning with the concept of green processes.	company not identified	product or process not identified	product or process not identified	Likely NAICS Codes: 518210 - Data Processing, Hosting, and Related Services, 221112 - Fossil Fuel Electric Power Generation, 238210 - Electrical Contractors and Other Wiring Installation Contractors, 334515 - Instrument Manufacturing for Measuring and Testing Electricity and Electrical Signals	FALSE - The article appears to focus on real environmentally sustainable practices within the data center industry, promoting green initiatives and energy efficiency without misleading or exaggerating environmental benefits.	1592
National Manufacturing Institute Scotland to help deliver energy hub - University of Strathclyde	https://news.google.com/rss/articles/CBMib2h0dHBzOi8vd3d3LnN0cmF0aC5hYy51ay93aHlzdHJhdGhjbHlkZS9uZXdzLzIwMjMvbmF0aW9uYWxtYW51ZmFjdHVyaW5naW5zdGl0dXRlc2NvdGxhbmR0b2hlbHBkZWxpdmVyZW5lcmd5aHViL9IBAA?oc=5	The article discusses the establishment of a green energy incubator and scale-up hub in Aberdeen's Energy Transition Zone, to support supply chain expansion and foster innovation in green energy technology solutions.	TRUE. The establishment of a green energy incubator and scale-up hub to support green energy technology solutions aligns with the definition of green innovation by promoting sustainability and contributing to environmental goals.	TRUE. The article describes the introduction of a new facility dedicated to fostering innovation in green energy technology solutions, which signifies a business innovation.	FALSE. The article does not focus on a specific product but rather on the establishment of a facility to support green energy initiatives.	TRUE. The article discusses the development of processes and support systems for innovative green energy technology solutions, emphasizing sustainability and minimizing environmental impacts.	National Manufacturing Institute Scotland (NMIS)	National Manufacturing Institute Scotland	product or process not identified	Likely NAICS Codes: 541710 - Research and Development in the Physical, Engineering, and Life Sciences, 541715 - Research and Development in the Social Sciences and Humanities, 541611 - Administrative Management and General Management Consulting Services, 541618 - Other Management Consulting Services	FALSE. The article text focuses on the genuine collaboration and investment in green energy initiatives without presenting false or misleading information about environmental benefits.	2240
Canada Goose Brings Recommerce to Life in Canada and Achieves Sustainability Milestones - Canada NewsWire	https://news.google.com/rss/articles/CBMijAFodHRwczovL3d3dy5uZXdzd2lyZS5jYS9uZXdzLXJlbGVhc2VzL2NhbmFkYS1nb29zZS1icmluZ3MtcmVjb21tZXJjZS10by1saWZlLWluLWNhbmFkYS1hbmQtYWNoaWV2ZXMtc3VzdGFpbmFiaWxpdHktbWlsZXN0b25lcy04NTEwMDU0MDMuaHRtbNIBAA?oc=5	Canada Goose launched its recommerce platform – Canada Goose Generations - inviting consumers to trade in and purchase pre-loved outerwear, thereby supporting its Sustainable Impact Strategy and achieving its annual warranty waste goal outlined in the ESG Report. The company reported a nearly 45% YOY reduction in carbon footprint and highlighted various sustainability initiatives and achievements.	TRUE. This is green innovation as Canada Goose demonstrates a commitment to sustainability through its Generations platform, achieving significant reductions in emissions, transitioning to preferred materials, and working towards eliminating harmful substances.	TRUE. The launch of Canada Goose Generations can be considered a business innovation as it introduces a new business process (recommerce platform) that differs significantly from the company's previous retail practices, adding a new revenue stream and sustainability angle to its business model.	TRUE. Canada Goose Generations can be classified as a green product because it involves the resale of pre-loved outerwear, promoting circular economy principles, reducing waste, and extending the lifespan of products to minimize environmental impact.	TRUE. The initiatives highlighted in the article, such as reducing emissions, transitioning to preferred materials, and eliminating harmful substances in manufacturing, qualify as green processes as they aim to minimize environmental impacts and promote sustainability.	Canada Goose	Canada Goose Holdings Inc.	Canada Goose Generations	Likely NAICS Codes: 448190 - Other Clothing Stores, 315990 - Apparel Accessories and Other Apparel Manufacturing, 423990 - Other Miscellaneous Durable Goods Merchant Wholesalers, 541990 - All Other Professional, Scientific, and Technical Services	FALSE. The article does not exhibit greenwashing as it provides transparent information about Canada Goose's sustainability efforts, achievements, and future goals in reducing environmental impact.	3076
How important is plastic recycling in the aquaculture sector? - Innovation News Network	https://news.google.com/rss/articles/CBMiaWh0dHBzOi8vd3d3Lmlubm92YXRpb25uZXdzbmV0d29yay5jb20vaG93LWltcG9ydGFudC1pcy1wbGFzdGljLXJlY3ljbGluZy1pbi10aGUtYXF1YWN1bHR1cmUtc2VjdG9yLzM0NDk4L9IBAA?oc=5	The article discusses the potential for better plastic recycling in the aquaculture sector through the POCOplast project. It highlights the importance of circular economy initiatives in reducing marine plastic waste and greenhouse gas emissions.	TRUE. This article discusses innovations aimed at reducing environmental impacts and promoting sustainability in the aquaculture sector through better plastic recycling, aligning with the principles of green innovation.	TRUE. The article mentions the development of new methods and processes for plastic recycling in the aquaculture sector, which constitutes a form of business innovation as it introduces significant changes to current practices.	TRUE. The article focuses on the development and use of sustainable post-consumer plastics in aquaculture, emphasizing their reduced environmental impact and alignment with green product criteria.	TRUE. The article discusses methods and techniques to minimize environmental impacts and promote sustainability in plastic recycling within the aquaculture sector, meeting the criteria for a green process.	company not identified	not found	Plastic recycling in the aquaculture sector	Likely NAICS Codes: 562920 - Materials Recovery Facilities, 562998 - All Other Miscellaneous Waste Management Services, 562111 - Solid Waste Collection, 562112 - Hazardous Waste Collection	FALSE. The article does not exhibit characteristics of greenwashing as it focuses on real efforts and projects aimed at improving plastic recycling and promoting circular economy initiatives in the aquaculture sector.	2410
Mercury Renewables announces plans for €200m wind farm and hydrogen plant - Business Plus	https://news.google.com/rss/articles/CBMiRWh0dHBzOi8vYnVzaW5lc3NwbHVzLmllL25ld3MvbWVyY3VyeS1yZW5ld2FibGVzLWUyMDBtLWh5ZHJvZ2VuLXBsYW50L9IBAA?oc=5	Mercury Renewables submitted a planning application for a utility-scale wind farm and green hydrogen project in Mayo, Ireland. The project aims to produce 4.5m kilograms of green hydrogen annually, contributing to the Irish renewables sector and potential job creation.	TRUE. This project involves the development of a utility-scale wind farm and green hydrogen project, contributing significantly to environmental sustainability goals by producing green hydrogen through renewable energy sources.	TRUE. The submission of a planning application for a utility-scale wind farm and green hydrogen project marks a new business process for Mercury Renewables, differing significantly from previous activities.	FALSE. The article does not focus on the specific design, manufacturing, and environmental impact reduction aspects of a product.	TRUE. The development of green hydrogen through a wind farm using electrolysis constitutes a green process by minimizing environmental impacts and promoting sustainability.	Mercury Renewables	Mercury Renewables	product or process not identified	Likely NAICS Codes: 221119 - Other Electric Power Generation, 221210 - Natural Gas Distribution, 325120 - Industrial Gas Manufacturing, 221330 - Steam and Air-Conditioning Supply	FALSE. The article describes tangible efforts by Mercury Renewables to develop a green hydrogen project utilizing renewable resources, and there is no indication of false or misleading environmental claims.	1939
ETZ Ltd partners with Net Zero Technology Centre and National Manufacturing Institute Scotland to deliver Energy ... - Scottish Enterprise	https://news.google.com/rss/articles/CBMiwAFodHRwczovL3d3dy5zY290dGlzaC1lbnRlcnByaXNlLW1lZGlhY2VudHJlLmNvbS9uZXdzL2V0ei1sdGQtcGFydG5lcnMtd2l0aC1uZXQtemVyby10ZWNobm9sb2d5LWNlbnRyZS1hbmQtbmF0aW9uYWwtbWFudWZhY3R1cmluZy1pbnN0aXR1dGUtc2NvdGxhbmQtdG8tZGVsaXZlci1lbmVyZ3ktaW5jdWJhdG9yLWFuZC1zY2FsZS11cC1odWLSAQA?oc=5	The article discusses the establishment of Scotland's first Energy Incubator and Scale Up Hub to support green energy technology companies in Aberdeen's Energy Transition Zone.	TRUE. The article describes the establishment of an Energy Incubator and Scale Up Hub focused on supporting green energy technology companies, which contributes to environmental sustainability goals such as energy transition and innovation.	TRUE. The article highlights the creation of an Energy Incubator and Scale Up Hub, which represents a new initiative supporting the development and growth of green energy technology companies, constituting a significant business innovation.	FALSE. Although the article mentions the focus on green energy technology and innovation, it does not provide detailed information on specific green products or services.	FALSE. The article discusses the establishment of an Energy Incubator and Scale Up Hub to support green energy technology companies but does not delve into specific methods or techniques in manufacturing, production, or operations that minimize environmental impacts and promote sustainability.	ETZ Ltd	Energy Transition Zone Ltd	product or process not identified	Likely NAICS Codes: 541712 - Research and Development in the Physical, Engineering, and Life Sciences; 541715 - Research and Development in the Social Sciences and Humanities; 611310 - Colleges, Universities, and Professional Schools; 624310 - Vocational Rehabilitation Services	FALSE. The article focuses on the collaborative efforts to support green energy technology companies and the establishment of an Energy Incubator and Scale Up Hub, without providing misleading information or falsely portraying environmental benefits, thus not indicative of greenwashing.	2689
