title	link	summary	green_innovation	business_innovation	green_product	green_process	company	official_company_name	product_or_process	likely_naics_codes	greenwashing	total_tokens
Ferrero makes progress in traceability, recycling initiatives	http://www.bing.com/news/apiclick.aspx?ref=FexRss&aid=&tid=667b5cfb0fa142c4b98d3d26e199e45a&url=https%3a%2f%2fwww.foodbusinessnews.net%2farticles%2f26173-ferrero-makes-progress-in-traceability-recycling-initiatives&c=17013995066936238397&mkt=en-us	Ferrero Group increased traceability and recycling while reducing water use in the fiscal year 2022-23. They achieved improved traceability in hazelnut and cocoa supply chains, increased recyclable packaging, and reduced water intensity in manufacturing plants.	TRUE; The article describes how the Ferrero Group has implemented various sustainability measures to reduce negative environmental externalities, thus contributing to environmental sustainability goals.	FALSE; The article primarily focuses on sustainability and environmental initiatives rather than introducing new or significantly improved products or business processes.	TRUE; The Ferrero Group's efforts to use recyclable, reusable, and compostable materials, reduce plastic in packaging, and source ingredients responsibly align with the definition of a green product.	TRUE; The Ferrero Group's implementation of methods and techniques to increase traceability, reduce water use, and promote sustainability in manufacturing processes qualifies as a green process.	Ferrero Group	Ferrero Group	product or process not identified	Likely NAICS Codes: 311351 - Chocolate and Confectionery Manufacturing from Cacao Beans, 311352 - Confectionery Manufacturing from Purchased Chocolate, 31142 - Fruit and Vegetable Preserving and Specialty Food Manufacturing, 31239 - Other Grocery and Related Product Merchant Wholesalers	FALSE; The article does not suggest any false or misleading claims about the sustainability initiatives of the Ferrero Group, indicating it is not an example of greenwashing.	1724
Encouraging businesses to adopt ESG values	http://www.bing.com/news/apiclick.aspx?ref=FexRss&aid=&tid=667b5cfb0fa142c4b98d3d26e199e45a&url=https%3a%2f%2fwww.thestar.com.my%2fmetro%2fmetro-news%2f2023%2f06%2f16%2fencouraging-businesses--to-adopt-esg-values&c=10897089690653339478&mkt=en-us	The inaugural Star Media Group ESG Positive Impact Awards 2022 recognized 100 companies for driving positive change and inspiring sustainability. The awards highlighted initiatives within environmental, social, and governance aspects and promoted sustainable practices.	TRUE, The article describes initiatives by various companies to drive positive change and embrace sustainability, aligning with green innovation goals.	TRUE, The article mentions companies introducing new initiatives and driving positive change, qualifying as business innovation.	FALSE, The article primarily focuses on companies' sustainability initiatives and awards, not specifically on individual green products.	FALSE, The article highlights companies' efforts towards sustainability but does not delve into specific green processes.	company not identified	not found	product or process not identified	Likely NAICS Codes: 541720 - Research and Development in the Social Sciences and Humanities, 541614 - Process, Physical Distribution, and Logistics Consulting Services, 541330 - Engineering Services, 541611 - Administrative Management and General Management Consulting Services	FALSE, The article celebrates genuine sustainability efforts and initiatives by companies, rather than promoting deceptive greenwashing practices.	3395
Passionate About Our Planet	http://www.bing.com/news/apiclick.aspx?ref=FexRss&aid=&tid=667b5cfb0fa142c4b98d3d26e199e45a&url=https%3a%2f%2fwww.tottenhamhotspur.com%2fthe-stadium%2fpassionate-about-our-planet%2f&c=13396167801271653727&mkt=en-us	Tottenham Hotspur has joined the UN Race to Zero, committing to halve its carbon emissions by 2030 and become net zero carbon by 2040. The Club measured its Scope 3 emissions footprint for the first time in 2022, with fan travel being the most significant source of emissions. They are working towards reducing all emissions towards an ultimate goal of net-zero by 2040.	TRUE	FALSE	FALSE	TRUE	Tottenham Hotspur	Tottenham Hotspur Ltd	product or process not identified	Likely NAICS Codes: 711211 - Sports Teams and Clubs, 713940 - Fitness and Recreational Sports Centers, 561599 - All Other Travel Arrangement and Reservation Services, 711310 - Promoters of Performing Arts, Sports, and Similar Events	FALSE	2290
FERRERO GROUP'S 15th SUSTAINABILITY REPORT DEMONSTRATES SOLID PROGRESS AS COMPANY ACCELERATES EFFORTS TO MEET ITS TARGETS	http://www.bing.com/news/apiclick.aspx?ref=FexRss&aid=&tid=667b5cfb0fa142c4b98d3d26e199e45a&url=https%3a%2f%2fwww.newswire.ca%2fnews-releases%2fferrero-group-s-15th-sustainability-report-demonstrates-solid-progress-as-company-accelerates-efforts-to-meet-its-targets-882675808.html&c=13628891568834199516&mkt=en-us	The Ferrero Group has released its 15th Sustainability Report showcasing progress across its sustainability pillars including protecting the environment, responsible sourcing, promoting responsible consumption, and empowering people.	TRUE. This is a green innovation because the Ferrero Group is actively working towards sustainable practices in its value chain, focusing on environmental protection and responsible sourcing.	FALSE. The article focuses on sustainability efforts and progress rather than introducing new products or processes that significantly differ from the firm's previous offerings.	TRUE. The Ferrero Group is emphasizing sustainable practices in its product design and supply chain management to reduce environmental impact and promote responsible consumption.	TRUE. The Ferrero Group is implementing green processes in its manufacturing and sourcing activities to minimize environmental impacts, reduce waste, and promote sustainability.	Ferrero Group	Ferrero Group	product or process not identified	Likely NAICS Codes: 311352 - Confectionery Manufacturing from Purchased Chocolate; 311352 - Confectionery Manufacturing from Purchased Chocolate; 311352 - Confectionery Manufacturing from Purchased Chocolate; 311352 - Confectionery Manufacturing from Purchased Chocolate	FALSE. The Ferrero Group's sustainability efforts in the article appear to be genuine and backed by concrete actions, indicating a commitment to environmental responsibility rather than greenwashing.	2106
Industry, Innovation and Infrastructure – Build resilience and foster innovation	http://www.bing.com/news/apiclick.aspx?ref=FexRss&aid=&tid=667b5cfb0fa142c4b98d3d26e199e45a&url=https%3a%2f%2fwww.ulster.ac.uk%2fsustainability%2fgoals%2findustry-innovation-and-infrastructure&c=7547758947216203857&mkt=en-us	The article discusses the investment and initiatives at the Creative Industries Institute at Ulster University, including a Virtual Production Facility, collaboration with Epic Games for Games Design and Animation programs, a Art and Design Shop, an Advanced Diploma in Social Enterprise, collaboration in the dairy industry, and research centers in various technology fields.	FALSE The article does not emphasize the reduction of negative environmental externalities or sustainability goals as the focus is more on creative sector growth and employment.	TRUE The article highlights the introduction of new products, services, and experiences through initiatives at the Creative Industries Institute, showcasing a departure from previous offerings.	FALSE The article mentions initiatives, collaborations, and programs in the creative industry sector, but there is no specific emphasis on the design, manufacturing, or usage of products that significantly reduce environmental impact.	FALSE While the article mentions initiatives like the Virtual Production Facility focusing on cost efficiency and environmental impact reduction, there is no detailed discussion on specific green methods or techniques in manufacturing or production.	Ulster University	Ulster University	product or process not identified	Likely NAICS Codes: 611310 - Colleges, Universities, and Professional Schools, 541430 - Graphic Design Services, 611692 -  Digital Design Training, 611710 - Educational Support Services	FALSE The article does not exhibit greenwashing as it straightforwardly presents the initiatives and collaborations at the Creative Industries Institute without making misleading claims about environmental benefits.	1696
Arushi Rawat	http://www.bing.com/news/apiclick.aspx?ref=FexRss&aid=&tid=667b5cfb0fa142c4b98d3d26e199e45a&url=https%3a%2f%2fauto.economictimes.indiatimes.com%2fauthor%2f479252220%2farushi-rawat&c=10301154552407450244&mkt=en-us	Luxury car OEMs are targeting the emerging market of neo-rich young entrepreneurs in India, influencing the demand for luxury cars in Tier II and Tier III cities.	FALSE	TRUE	FALSE	FALSE	BMW Group India	BMW Group	Luxury Cars	Likely NAICS Codes: 336111 - Automobile Manufacturing, 336112 - Light Truck and Utility Vehicle Manufacturing, 336211 - Motor Vehicle Body Manufacturing, 336390 - Other Motor Vehicle Parts Manufacturing	FALSE	1295
