title	link	summary	green_innovation	business_innovation	green_product	green_process	company	official_company_name	product_or_process	likely_naics_codes	greenwashing	total_tokens
Dinesh Nirmal - IBM Newsroom	https://news.google.com/rss/articles/CBMiJmh0dHBzOi8vbmV3c3Jvb20uaWJtLmNvbS9EaW5lc2gtTmlybWFs0gEA?oc=5	Dinesh Nirmal, Senior Vice President of IBM Software, leads product and innovation strategies focused on AI, automation, machine learning, and data governance. With over 25 years at IBM, he has held various leadership roles in cloud, data, and AI development. Dinesh has been recognized as an industry thought leader, participating in tech events and conferences globally.	FALSE	TRUE	FALSE	FALSE	IBM	International Business Machines Corporation	product or process not identified	Likely NAICS Codes: 511210 - Software Publishers, 541511 - Custom Computer Programming Services, 541512 - Computer Systems Design Services, 541519 - Other Computer Related Services	FALSE	1624
Global Enterprise Software Market Report 2023: Industry to Reach $404 Billion by 2028 at an 11.1% CAGR - Yahoo Finance	https://news.google.com/rss/articles/CBMiVmh0dHBzOi8vZmluYW5jZS55YWhvby5jb20vbmV3cy9nbG9iYWwtZW50ZXJwcmlzZS1zb2Z0d2FyZS1tYXJrZXQtcmVwb3J0LTA5MjgwMDM3Ny5odG1s0gEA?oc=5	The article discusses the growth and trends in the global enterprise software market, highlighting factors like software enhancements, use of CRM and big data analytics, high implementation costs, different types and deployment of enterprise software, enterprise size, end-use sectors, and regional outlook.	FALSE. The article focuses on enterprise software market trends and growth, indicating improvements in software processes and technologies without a specific emphasis on environmental sustainability.	TRUE. The article discusses innovations in enterprise software products and processes, highlighting enhancements in software, use of automation, CRM, big data analytics, and other business technologies to improve efficiency and decision-making.	FALSE. The article primarily focuses on enterprise software products and services in the market without specific emphasis on the environmental impact or sustainability criteria that define green products.	FALSE. The article highlights advancements in enterprise software processes, such as automation and enhancing business operations efficiencies, but does not focus on environmental impacts or sustainability, which are key aspects of green processes.	ResearchAndMarkets.com	ResearchAndMarkets	product or process not identified	Likely NAICS Codes: 511210 - Software Publishers, 541511 - Custom Computer Programming Services, 541512 - Computer Systems Design Services, 518210 - Data Processing, Hosting, and Related Services	FALSE. The article primarily discusses trends and factors in the enterprise software market without making any claims about environmental benefits or sustainability that could constitute greenwashing.	2633
Why effective HR tech leadership is key to market value - People Management Magazine	https://news.google.com/rss/articles/CBMiZGh0dHBzOi8vd3d3LnBlb3BsZW1hbmFnZW1lbnQuY28udWsvYXJ0aWNsZS8xODExMTAzL3doeS1lZmZlY3RpdmUtaHItdGVjaC1sZWFkZXJzaGlwLWtleS1tYXJrZXQtdmFsdWXSAQA?oc=5	The article emphasizes the importance of effective HR tech leadership in increasing market value and competitiveness in today's digital economy.	FALSE	TRUE	FALSE	FALSE	The Change Leader Consulting and Barry University	The Change Leader Consulting	product or process not identified	Likely NAICS Codes: 541612 - Human Resources Consulting Services, 611430 - Professional and Management Development Training, 611699 - All Other Miscellaneous Schools and Instruction, 611710 - Educational Support Services	FALSE	2127
Vapes – a burning issue - Circular Online	https://news.google.com/rss/articles/CBMiP2h0dHBzOi8vd3d3LmNpcmN1bGFyb25saW5lLmNvLnVrL2luc2lnaHQvdmFwZXMtYS1idXJuaW5nLWlzc3VlL9IBAA?oc=5	The article discusses the environmental impact of e-cigarettes and the challenges they pose for waste management due to difficulties in recycling and disposing of their components.	FALSE	FALSE	TRUE	TRUE	company not identified	company not identified	e-cigarettes	Likely NAICS Codes: 325211 - Plastics Material and Resin Manufacturing, 334419 - Other Electronic Component Manufacturing, 562920 - Materials Recovery Facilities, 562998 - All Other Miscellaneous Waste Management Services	FALSE	2663
Siemens expands its digitalization portfolio for the Indian mach ... - Siemens press release	https://news.google.com/rss/articles/CBMifmh0dHBzOi8vcHJlc3Muc2llbWVucy5jb20vaW4vZW4vcHJlc3NyZWxlYXNlL3NpZW1lbnMtZXhwYW5kcy1pdHMtZGlnaXRhbGl6YXRpb24tcG9ydGZvbGlvLWluZGlhbi1tYWNoaW5lLXRvb2wtaW5kdXN0cnktZW5oYW5jZdIBAA?oc=5	The article highlights Siemens' offerings for the Machine Tool Industry in India, focusing on digital transformation and industrial automation solutions.	FALSE	TRUE	TRUE	TRUE	Siemens	Siemens AG	product or process not identified	Likely NAICS Codes: 333517 - Machine Tool Manufacturing, 541330 - Engineering Services, 511210 - Software Publishers, 541511 - Custom Computer Programming Services	FALSE	1677
Top 10 Use Cases of Digital Twin in the Year 2023 - Analytics Insight	https://news.google.com/rss/articles/CBMiX2h0dHBzOi8vd3d3LmFuYWx5dGljc2luc2lnaHQubmV0L2RhdGEtc2NpZW5jZS90b3AtMTAtdXNlLWNhc2VzLW9mLWRpZ2l0YWwtdHdpbi1pbi10aGUteWVhci0yMDIz0gFpaHR0cHM6Ly93d3cuYW5hbHl0aWNzaW5zaWdodC5uZXQvYW1wL3N0b3J5L2RhdGEtc2NpZW5jZS90b3AtMTAtdXNlLWNhc2VzLW9mLWRpZ2l0YWwtdHdpbi1pbi10aGUteWVhci0yMDIz?oc=5	The article discusses the growing demand for digital twin technology due to its capabilities in predicting present and future phases of physical parts through counterparts.	TRUE - The use of digital twin technology can contribute to environmental sustainability goals by optimizing processes, reducing waste, and improving resource efficiency.	TRUE - The adoption and advancement of digital twin technology represent a new and improved business process that differs significantly from traditional approaches.	FALSE - The article does not explicitly mention a good or service designed to reduce environmental impact.	TRUE - The implementation of digital twin technology can be considered a green process as it aims to minimize environmental impacts, reduce energy consumption, and optimize resource use.	company not identified	Company not identified	product or process not identified	Likely NAICS Codes: 541330 - Engineering Services, 541512 - Computer Systems Design Services, 541519 - Other Computer Related Services, 541611 - Administrative Management and General Management Consulting Services	FALSE - The article does not mention any false or misleading environmental claims.	1377
EGA unveils aluminium recycling initiative amid sustainability push - The National	https://news.google.com/rss/articles/CBMiiAFodHRwczovL3d3dy50aGVuYXRpb25hbG5ld3MuY29tL2NsaW1hdGUvcm9hZC10by1uZXQtemVyby8yMDIzLzAxLzE1L2VnYS11bnZlaWxzLWFsdW1pbml1bS1yZWN5Y2xpbmctaW5pdGlhdGl2ZS1hbWlkLXN1c3RhaW5hYmlsaXR5LXB1c2gv0gEA?oc=5	Emirates Global Aluminium has initiated an aluminium recycling coalition in the UAE to promote recycling and support a greener economy, targeting a step-change in aluminium recycling with a focus on beverage cans. The coalition includes key industry players and aims to significantly increase the recycling rate in the UAE while contributing to a circular economy and decarbonisation efforts.	TRUE. This initiative contributes to environmental sustainability goals by promoting aluminium recycling, reducing waste, and supporting a circular economy.	TRUE. The launch of the aluminium recycling initiative represents a new business process focusing on sustainability and environmental responsibility.	TRUE. Aluminium recycling is a green product as it involves the sustainable use of materials, minimizes energy consumption and waste, and supports recycling practices.	TRUE. The aluminium recycling process aims to minimize environmental impacts, reduce waste, and promote sustainability by reusing materials and minimizing energy consumption.	Emirates Global Aluminium	Emirates Global Aluminium	Aluminium Recycling Initiative	Likely NAICS Codes: 331313 - Alumina Refining and Primary Aluminum Production, 562920 - Materials Recovery Facilities, 562998 - All Other Miscellaneous Waste Management Services, 562111 - Solid Waste Collection	FALSE. The article describes a genuine initiative to promote aluminium recycling and support sustainability goals without making false or misleading claims.	1976
