title	link	summary	green_innovation	business_innovation	green_product	green_process	company	official_company_name	product_or_process	likely_naics_codes	greenwashing	total_tokens
Loam Bio Gets $73M to Boost Soil Carbon Capture - CarbonCredits.com	https://news.google.com/rss/articles/CBMiSWh0dHBzOi8vY2FyYm9uY3JlZGl0cy5jb20vbG9hbS1iaW8tZ2V0cy03M20tdG8tYm9vc3Qtc29pbC1jYXJib24tY2FwdHVyZS_SAQA?oc=5	Loam Bio secured a $73 million investment round to enhance soil's carbon capture abilities through microbial technology, aiming to improve carbon storage from crops like wheat, barley, canola, soy, and corn. Their CarbonBuilder seed inoculum and SecondCrop carbon tools support carbon farming practices, such as cover cropping and no-till, by accelerating soil carbon storage, increasing farm resilience and productivity.	TRUE. This investment in Loam Bio represents a green innovation as it focuses on enhancing soil's carbon sequestration abilities through microbial technology, contributing to environmental sustainability goals by reducing carbon emissions and improving soil health.	TRUE. The investment in Loam Bio reflects a business innovation as it involves the introduction of new products (CarbonBuilder seed inoculum and SecondCrop carbon tools) to boost soil's ability to capture and store carbon, differing significantly from the company's previous offerings.	FALSE. The article mentions products such as CarbonBuilder seed inoculum and SecondCrop carbon tools, designed to enhance soil carbon capture, but does not provide comprehensive details to confirm if they meet the definition of a green product.	TRUE. The article discusses Loam Bio's microbial technology, which coats seeds to supercharge plants' carbon storage in the soil. By minimizing environmental impacts, reducing waste, and promoting sustainability through innovative processes, Loam Bio's approach aligns with the definition of a green process.	Loam Bio	Loam Bio	product or process not identified	Likely NAICS Codes: 111998 - All Other Miscellaneous Crop Farming, 325320 - Pesticide and Other Agricultural Chemical Manufacturing, 115112 - Soil Preparation, Planting, and Cultivating, 111999 - All Other Miscellaneous Crop Farming	FALSE. The article provides detailed information about Loam Bio's technology and its impact on improving soil carbon capture. There are no indications of false or misleading claims regarding the environmental benefits of the product or practice, thus not exhibiting greenwashing behavior.	2571
Loam Bio raises $75m, launches tools to improve soil carbon capture - AgFunderNews	https://news.google.com/rss/articles/CBMiZ2h0dHBzOi8vYWdmdW5kZXJuZXdzLmNvbS9sb2FtLWJpby1yYWlzZXMtNzVtLXNlcmllcy1iLWZyb20tbG93ZXJjYXJib24tYWNyZS1vdGhlcnMtdG8tYm9vc3Qtc29pbC1jYXJib27SAQA?oc=5	Loam's CarbonBuilder seeds coated with microbial fungi aim to accelerate soil carbon sequestration, enhancing soil productivity and resilience, with a focus on broadacre cropping systems in Australia and the US.	TRUE - The innovation of CarbonBuilder by Loam contributes to environmental sustainability goals by promoting soil carbon sequestration and enhancing soil health and productivity.	TRUE - The introduction of CarbonBuilder by Loam as a new product in the agricultural market represents a significant improvement in soil management practices, thereby qualifying as a business innovation.	TRUE - CarbonBuilder by Loam qualifies as a green product as it is designed to significantly reduce environmental impact by enhancing soil carbon storage and promoting healthier and more productive soils.	TRUE - The use of microbial fungi-coated seeds aimed at accelerating soil carbon sequestration and enhancing soil health qualifies as a green process by promoting sustainability and reducing environmental impacts.	Loam	Loam Pty Ltd	CarbonBuilder	Likely NAICS Codes: 111150 - Corn Farming, 111191 - Oilseed and Grain Combination Farming, 111199 - All Other Grain Farming, 115112 - Soil Preparation, Planting, and Cultivating	FALSE - The article text does not exhibit any signs of greenwashing as it presents the CarbonBuilder innovation by Loam transparently and scientifically, focusing on its environmental benefits without any misleading or false information.	2347
Agtech: Breaking down the farmer adoption dilemma - McKinsey	https://news.google.com/rss/articles/CBMibWh0dHBzOi8vd3d3Lm1ja2luc2V5LmNvbS9pbmR1c3RyaWVzL2FncmljdWx0dXJlL291ci1pbnNpZ2h0cy9hZ3RlY2gtYnJlYWtpbmctZG93bi10aGUtZmFybWVyLWFkb3B0aW9uLWRpbGVtbWHSAQA?oc=5	The article discusses challenges and opportunities in agtech adoption, highlighting slow adoption rates despite increased investment and high farmer openness to innovation. It emphasizes regional differences in adoption levels and potential barriers like pricing and ROI concerns, as well as the importance of sustainable practices and the role of regulation and evolving business models in driving agtech adoption.	FALSE: The article primarily focuses on challenges and opportunities in agtech adoption within the agriculture sector, rather than directly showcasing innovations that contribute to environmental sustainability goals.	TRUE: The article discusses the adoption of new technologies and processes in agriculture, which can be seen as business innovations as they aim to improve operational efficiency, optimize resources, and enhance productivity within the industry.	FALSE: Although the article mentions the adoption of technologies in agriculture that could lead to more sustainable practices, it does not explicitly focus on a specific good or service designed and used in a way to significantly reduce its environmental impact throughout its life cycle.	FALSE: While the article mentions technologies and methods aimed at reducing environmental impact and promoting sustainability in agriculture, it does not delve into specific manufacturing or operational activities that minimize environmental impacts as typical of green processes.	company not identified	not found	product or process not identified	Likely NAICS Codes: 111, 112, 113, 114 - Agriculture, Forestry, Fishing, and Hunting	FALSE: The article does not involve any false or misleading environmental claims about a specific product or practice, but rather discusses challenges and trends in agtech adoption in the agriculture sector.	5971
Drapers investigates: how fashion retail is carbon offsetting - Drapers	https://news.google.com/rss/articles/CBMia2h0dHBzOi8vd3d3LmRyYXBlcnNvbmxpbmUuY29tL2luc2lnaHQvYW5hbHlzaXMvZHJhcGVycy1pbnZlc3RpZ2F0ZXMtaG93LWZhc2hpb24tcmV0YWlsLWlzLWNhcmJvbi1vZmZzZXR0aW5n0gEA?oc=5	The article discusses the importance of reducing carbon emissions in the fashion industry through various methods, such as carbon offsetting and carbon insetting, as part of sustainability initiatives.	TRUE - The article discusses innovative methods such as carbon offsetting and carbon insetting that directly contribute to environmental sustainability goals by reducing carbon emissions in the fashion industry.	TRUE - The article talks about how fashion businesses are implementing new methods like carbon offsetting and carbon insetting as part of their sustainability strategies, representing a significant change in their business processes to address environmental impact.	TRUE - The article describes how fashion businesses are investing in carbon offsets, nature-based projects, and clean energy initiatives to reduce their environmental impact, aligning with the definition of green products that aim to minimize environmental harm throughout their lifecycle.	TRUE - The article highlights the adoption of green processes like carbon offsetting, carbon insetting, renewable energy use, and reducing waste by fashion businesses to minimize their environmental footprint and promote sustainability.	company not identified	company not identified	product or process not identified	Likely NAICS Codes: 448190 - Other Clothing Stores, 541620 - Environmental Consulting Services, 424310 - Piece Goods, Notions, and Other Dry Goods Merchant Wholesalers, 424320 - Men's and Boys' Clothing and Furnishings Merchant Wholesalers	FALSE - The article does not display characteristics of greenwashing as it focuses on genuine efforts by fashion businesses to reduce carbon emissions and adopt sustainable practices.	4290
Alberta invests $58 million in Canadian circular economy projects - Recycling Product News	https://news.google.com/rss/articles/CBMieWh0dHBzOi8vd3d3LnJlY3ljbGluZ3Byb2R1Y3RuZXdzLmNvbS9hcnRpY2xlLzM5ODczL2FsYmVydGEtaW52ZXN0cy1kb2xsYXI1OC1taWxsaW9uLWluLWNhbmFkaWFuLWNpcmN1bGFyLWVjb25vbXktcHJvamVjdHPSAQA?oc=5	The Government of Alberta is investing $58 million in circular economy projects through ERA, aiming to reduce GHG emissions and create jobs by funding various technology solutions.	TRUE. This investment supports projects focused on circular economy solutions, reducing greenhouse gas emissions, and promoting sustainability through technology advancement.	TRUE. The article discusses how the projects funded by the Government of Alberta are innovative in terms of circular economy approaches and sustainability goals.	TRUE. The projects funded aim to develop technologies for recycling and producing sustainable materials, reducing waste, and promoting environmental conservation.	TRUE. The projects aim to implement green processes by focusing on waste reduction, resource recovery, and reducing environmental impacts in material production and disposal.	company	Government of Alberta	product or process not identified	Likely NAICS Codes: 924120 - Administration of Conservation Programs, 562910 - Remediation Services, 562112 - Hazardous Waste Collection, 562211 - Hazardous Waste Treatment and Disposal	FALSE. The article describes actual projects and investments in green initiatives without providing misleading information.	2088
