title	link	summary	green_innovation	business_innovation	green_product	green_process	company	official_company_name	product_or_process	likely_naics_codes	greenwashing	total_tokens
IREDA holds 36th Annual General Meeting IREDA Achieves Highest-ever Loan Sanction, Loan Disbursement and ... - PIB	https://news.google.com/rss/articles/CBMiO2h0dHBzOi8vcGliLmdvdi5pbi9QcmVzc1JlbGVhc2VJZnJhbWVQYWdlLmFzcHg_UFJJRD0xOTM2NjUz0gEA?oc=5	Indian Renewable Energy Development Agency Ltd. (IREDA) achieved record loan sanctions, disbursements, and profits in FY 2022-23, emphasizing strong financial performance and commitment to green energy projects.	TRUE. The Indian Renewable Energy Development Agency Ltd. (IREDA) achievement in renewable energy loans and commitments signifies a contribution to environmental sustainability goals by supporting green energy projects.	TRUE. IREDA's accomplishment of record loan sanctions and profits represents a significant improvement in its financial operations, signifying a business innovation within the renewable energy sector.	FALSE. The article does not specifically mention the development or characteristics of a particular green product.	FALSE. The article does not detail specific green manufacturing processes or operational techniques.	Indian Renewable Energy Development Agency Ltd.	Indian Renewable Energy Development Agency Ltd.	product or process not identified	Likely NAICS Codes: 221114 - Solar Electric Power Generation, 221115 - Wind Electric Power Generation, 221116 - Geothermal Electric Power Generation, 221119 - Other Electric Power Generation	FALSE. The article does not contain elements of greenwashing, as it highlights legitimate achievements in the renewable energy sector.	1964
Green transition - EU u Srbiji - EU u Srbiji	https://news.google.com/rss/articles/CBMiK2h0dHBzOi8vZXVyb3BhLnJzL2dyZWVuLXRyYW5zaXRpb24vP2xhbmc9ZW7SAQA?oc=5	The article discusses innovative green solutions in Serbia funded by the EU, contributing to environmental sustainability by reducing emissions, utilizing renewable energy, reusing waste, and preserving biodiversity.	TRUE. The article showcases innovative ideas that contribute to the green transformation of the Serbian economy and society, aligning with environmental sustainability goals and promoting the Green Agenda.	FALSE. The article focuses on green solutions for environmental sustainability rather than traditional business innovation within a firm's products or processes.	TRUE. The article discusses innovative products like cosmetic items made from leftover food that significantly reduce environmental impact throughout their life cycle, meeting the criteria of green products.	TRUE. The article highlights green processes such as using waste thermal water for heating that aim to minimize environmental impacts, promote sustainability, and align with green innovation principles.	company not identified	N/A	product or process not identified	Likely NAICS Codes: 562910 - Remediation Services, 221310 - Water Supply and Irrigation Systems, 325620 - Toilet Preparation Manufacturing, 221119 - Other Electric Power Generation	FALSE. The article focuses on genuine innovative ideas and solutions that align with green and sustainable practices, demonstrating a commitment to environmental responsibility rather than engaging in greenwashing.	1417
Food technology trends 2023 - FoodManufacture.co.uk	https://news.google.com/rss/articles/CBMiUGh0dHBzOi8vd3d3LmZvb2RtYW51ZmFjdHVyZS5jby51ay9BcnRpY2xlLzIwMjMvMDcvMDYvZm9vZC10ZWNobm9sb2d5LXRyZW5kcy0yMDIz0gEA?oc=5	The article discusses five technology trends impacting food and beverage production, including AI use in product development, the growth of the eNose market, cultivated fish and meat products, vertical farming powered by renewable energy, and potential EU legislation changes on gene editing in agriculture.	FALSE, The article focuses on technological advancements in food and beverage production but does not specifically emphasize innovations contributing to environmental sustainability goals.	TRUE, The article highlights new technology trends impacting food and beverage production, showcasing how companies are using innovations in their processes and products.	FALSE, The article mentions product developments and new technology trends in the food and beverage industry but does not emphasize products designed to significantly reduce environmental impact throughout their lifecycle.	FALSE, The article discusses technological advancements such as AI in product development, cultivated fish production, and vertical farming powered by renewable energy, but does not emphasize operational methods that minimize environmental impacts.	company not identified	product or process not identified	product or process not identified	Likely NAICS Codes: 311999 - All Other Miscellaneous Food Manufacturing, 325414 - Biological Product (except Diagnostic) Manufacturing, 333249 - Other Industrial Machinery Manufacturing, 541715 - Research and Development in the Physical, Engineering, and Life Sciences	FALSE, The article discusses genuine technological advancements and developments in the food and beverage industry without misleading environmental claims.	2713
Skoda's Journey Towards Carbon Neutrality - indianautosblog.com	https://news.google.com/rss/articles/CBMiTGh0dHBzOi8vaW5kaWFuYXV0b3NibG9nLmNvbS9za29kYXMtam91cm5leS10b3dhcmRzLWNhcmJvbi1uZXV0cmFsaXR5LXAzMjYwNTbSAVJodHRwczovL20uaW5kaWFuYXV0b3NibG9nLmNvbS9za29kYXMtam91cm5leS10b3dhcmRzLWNhcmJvbi1uZXV0cmFsaXR5LXAzMjYwNTYvYW1w?oc=5	Škoda Auto's subsidiary ŠKO-ENERGO is launching a key project to modernize its plant to use 100% biomass, contributing to Škoda's ambitious environmental targets. The transition to wood chips and phyto-pellets will make energy production fully carbon neutral, resulting in annual CO2 savings of approximately 290,000 tonnes. Škoda Auto is also tightening its environmental targets, aiming for completely carbon-neutral production by the end of the decade and investing in electromobility.	TRUE - This project of modernizing the plant to use 100% biomass aligns with environmental sustainability goals, reduces carbon footprint, and contributes to decarbonization efforts.	TRUE - The modernization project introducing 100% biomass usage at the plant differs significantly from Škoda Auto's previous energy production methods, making it a business innovation.	FALSE - The article focuses more on a process innovation of shifting to biomass energy production rather than detailing a specific green product.	TRUE - The transition to using 100% biomass for energy production minimizes environmental impacts, promotes sustainability, and aligns with green process practices.	Škoda Auto	Škoda Auto	product or process not identified	Likely NAICS Codes: 336111 - Automobile Manufacturing, 221330 - Steam and Air-Conditioning Supply, 562212 - Solid Waste Landfill, 562998 - All Other Miscellaneous Waste Management Services	FALSE - The article primarily highlights genuine efforts by Škoda Auto and its subsidiary towards environmental sustainability and carbon neutrality, without indications of greenwashing.	1867
India considering PLI scheme for chemicals, petrochemical sector: Nirmala Sitharaman - The Economic Times	https://news.google.com/rss/articles/CBMiswFodHRwczovL20uZWNvbm9taWN0aW1lcy5jb20vaW5kdXN0cnkvaW5kbC1nb29kcy9zdnMvY2hlbS0vLWZlcnRpbGlzZXJzL2luZGlhLWNvbnNpZGVyaW5nLXBsaS1zY2hlbWUtZm9yLWNoZW1pY2Fscy1wZXRyb2NoZW1pY2FsLXNlY3Rvci1uaXJtYWxhLXNpdGhhcmFtYW4vYXJ0aWNsZXNob3cvMTAyMTU5NzY5LmNtc9IBtwFodHRwczovL20uZWNvbm9taWN0aW1lcy5jb20vaW5kdXN0cnkvaW5kbC1nb29kcy9zdnMvY2hlbS0vLWZlcnRpbGlzZXJzL2luZGlhLWNvbnNpZGVyaW5nLXBsaS1zY2hlbWUtZm9yLWNoZW1pY2Fscy1wZXRyb2NoZW1pY2FsLXNlY3Rvci1uaXJtYWxhLXNpdGhhcmFtYW4vYW1wX2FydGljbGVzaG93LzEwMjE1OTc2OS5jbXM?oc=5	India is considering the Production Linked Incentive (PLI) scheme for chemicals and petrochemical sector to achieve net zero by 2070, aiming for green growth initiatives and emphasizing on achieving energy independence.	TRUE: The government's focus on green growth initiatives, reducing carbon intensity, and achieving net zero aligns with the definition of green innovation as it contributes to environmental sustainability goals.	TRUE: The introduction of the PLI scheme for chemicals and petrochemicals sector qualifies as a business innovation, as it represents a new approach to incentivizing and boosting local manufacturing in these industries.	FALSE: The article does not specifically mention the introduction of a new or improved product that significantly reduces its environmental impact throughout its life cycle, thus not meeting the definition of a green product.	FALSE: The article discusses government initiatives and incentives for the chemical and petrochemical sector but does not delve into specific methods or techniques aimed at minimizing environmental impacts in manufacturing or production processes.	company identified	Ministry of Finance and Ministry of Heavy Industries	product or process not identified	Likely NAICS Codes: 3251 - Basic Chemical Manufacturing, 3252 - Resin, Synthetic Rubber, and Artificial Synthetic Fibers and Filaments Manufacturing, 3253 - Pesticide, Fertilizer, and Other Agricultural Chemical Manufacturing, 3261 - Plastics Product Manufacturing	FALSE: The article does not display characteristics of greenwashing, as it primarily focuses on government initiatives, incentives, and goals related to green growth and sustainability.	1792
Jul 1, 2023 - - Top 5 Emerging Bluechip Stocks to Add to Your Watchlist - Equitymaster	https://news.google.com/rss/articles/CBMifWh0dHBzOi8vd3d3LmVxdWl0eW1hc3Rlci5jb20vZGV0YWlsLmFzcD9kYXRlPTA3LzAxLzIwMjMmc3Rvcnk9MiZ0aXRsZT1Ub3AtNS1FbWVyZ2luZy1CbHVlY2hpcC1TdG9ja3MtdG8tQWRkLXRvLVlvdXItV2F0Y2hsaXN00gEA?oc=5	The article discusses the emergence of five potential blue-chip companies in India, highlighting their financial performance, market presence, and growth strategies.	FALSE This article focuses on financial performance and market prospects of companies, not specifically on environmental sustainability or reducing negative environmental externalities.	TRUE The article talks about new or improved products and processes of companies in the Indian market, highlighting their emergence as blue-chip entities.	FALSE The article does not primarily focus on the design, manufacture, or usage of goods or services that significantly reduce environmental impact throughout their life cycle.	FALSE The article does not focus on specific methods or techniques in manufacturing or operational activities aimed at minimizing environmental impacts and promoting sustainability.	company identified	Aegis Logistics	product or process not identified	Likely NAICS Codes: 424690 - Other Chemical and Allied Products Merchant Wholesalers | 424710 - Petroleum Bulk Stations and Terminals | 493190 - Other Warehousing and Storage | 562998 - All Other Miscellaneous Waste Management Services	FALSE The article primarily discusses the financial performance and growth prospects of companies, without making false or exaggerated environmental claims.	4984
Union Minister of State for Steel and Rural Development, Shri Faggan Singh Kulaste stresses on enhancing per capita ... - PIB	https://news.google.com/rss/articles/CBMiO2h0dHBzOi8vcGliLmdvdi5pbi9QcmVzc1JlbGVhc2VJZnJhbWVQYWdlLmFzcHg_UFJJRD0xOTQzODIw0gEA?oc=5	The article discusses the importance of enhancing per capita steel consumption in India to boost the industry and move towards a greener path through circular economy.	TRUE - The article discusses moving towards a greener path through circular economy, which aligns with the concept of green innovation by advocating for reducing environmental impacts and promoting sustainability in the steel sector.	FALSE - The article does not specifically focus on a new or significantly improved product or business process that differs from previous practices to qualify as a business innovation.	FALSE - The article talks about steel consumption and decarbonization efforts but does not provide specific details on a product meeting the comprehensive green product definition.	TRUE - The article discusses the need to focus on capacity utilization, energy efficiency, and reducing carbon emissions in the steel sector, aligning with the concept of green processes that aim to minimize environmental impacts and promote sustainability.	Ministry of Steel	Ministry of Steel	product or process not identified	Likely NAICS Codes: 331110 - Iron and Steel Mills and Ferroalloy Manufacturing, 331510 - Nonferrous Metal (except Aluminum) Production and Processing, 331520 - Aluminum Production and Processing, 327992 - Ground or Treated Mineral and Earth Manufacturing	FALSE - The article focuses on enhancing steel consumption and decarbonization efforts without misleading or falsely marketing environmental benefits, thus not meeting the criteria of greenwashing.	2037
