title	link	summary	green_innovation	business_innovation	green_product	green_process	company	official_company_name	product_or_process	likely_naics_codes	greenwashing	total_tokens
Elektros Launches New Clean Energy Technology Brand - Elektros Energy - Yahoo Finance	https://news.google.com/rss/articles/CBMiV2h0dHBzOi8vZmluYW5jZS55YWhvby5jb20vbmV3cy9lbGVrdHJvcy1sYXVuY2hlcy1jbGVhbi1lbmVyZ3ktdGVjaG5vbG9neS0xMjQ1MDA5NzQuaHRtbNIBAA?oc=5	Elektros announced the launch of its clean energy technology brand Elektros Energy focusing on Lithium mining, EV charging, and solar energy. The company aims to accelerate the world's transition to a cleaner and more sustainable energy future with a commitment to responsible sourcing and sustainability.	TRUE. This is green innovation as Elektros Energy focuses on clean energy technology solutions that contribute to environmental sustainability goals and support the transition to a cleaner and more sustainable energy future.	TRUE. This is a business innovation as Elektros Energy is introducing a new brand that significantly differs from its previous offerings in the electric mobility industry, showcasing advancements in clean energy technology such as Lithium mining and EV charging.	TRUE. Elektros Energy's products, such as Lithium mining, EV charging solutions, and solar energy innovations, aim to significantly reduce environmental impact throughout their life cycles by promoting sustainability and responsible sourcing.	TRUE. Elektros Energy's focus on environmentally responsible practices in Lithium mining, EV charging development, and solar energy solutions showcases a commitment to minimizing environmental impacts and promoting sustainability in operational activities.	Elektros	Elektros, Inc.	product or process not identified	Likely NAICS Codes: 335999 - All Other Miscellaneous Electrical Equipment and Component Manufacturing, 221118 - Other Electric Power Generation, 212299 - All Other Metal Ore Mining, 238210 - Electrical Contractors and Other Wiring Installation Contractors	FALSE. The article does not exhibit signs of greenwashing, as Elektros Energy's focus on clean energy technology and responsible sourcing aligns with genuine environmental sustainability initiatives.	2443
OYA Renewables Closes US$216M in Construction-to-term Loans and Tax Equity Commitments for New York ... - PR Newswire	https://news.google.com/rss/articles/CBMivwFodHRwczovL3d3dy5wcm5ld3N3aXJlLmNvbS9uZXdzLXJlbGVhc2VzL295YS1yZW5ld2FibGVzLWNsb3Nlcy11czIxNm0taW4tY29uc3RydWN0aW9uLXRvLXRlcm0tbG9hbnMtYW5kLXRheC1lcXVpdHktY29tbWl0bWVudHMtZm9yLW5ldy15b3JrLWNvbW11bml0eS1zb2xhci1kZXZlbG9wbWVudC1waXBlbGluZS0zMDE3NTkzNTUuaHRtbNIBAA?oc=5	OYA Renewables has secured $216M in financial backing for 15 community solar projects in New York State, with $145M as a construction-to-term loan and $71M as a tax equity commitment.	TRUE. The article describes the financing and development of community solar projects, which contribute to environmental sustainability goals by promoting renewable energy generation and reducing carbon emissions.	TRUE. OYA Renewables' initiative to develop a slate of community solar projects in New York State represents a new business process in the renewable energy sector, different from their previous projects.	FALSE. The article focuses on the financing and development of community solar projects, rather than describing a specific good or service that significantly reduces environmental impact throughout its life cycle.	TRUE. The article highlights the development and financing of community solar projects, which involve methods and techniques in renewable energy production that minimize environmental impacts and promote sustainability.	OYA Renewables	OYA Renewables	product or process not identified	Likely NAICS Codes: 221114, 237130, 237990, 221118	FALSE. The article provides factual information regarding the financial backing and development of community solar projects by OYA Renewables, without making false or misleading statements about environmental benefits.	2477
Kohler Presents 'The Creator's Journey' at Milan Design Week - Canada NewsWire	https://news.google.com/rss/articles/CBMib2h0dHBzOi8vd3d3Lm5ld3N3aXJlLmNhL25ld3MtcmVsZWFzZXMva29obGVyLXByZXNlbnRzLXRoZS1jcmVhdG9yLXMtam91cm5leS1hdC1taWxhbi1kZXNpZ24td2Vlay04Mzk2MTAzODguaHRtbNIBAA?oc=5	Kohler presents 'The Creator's Journey' during Milan Design Week highlighting collaborations with contemporary artists, a limited-edition global product collection, and an aerial sculpture. The immersive experience includes a user-controlled design encounter and an artist edition collection for the bathroom, marking Kohler's 150th anniversary celebration.	TRUE - The article describes collaborations to create a limited-edition global product collection with a focus on artistry and craftsmanship that aligns with environmental sustainability and innovative design.	TRUE - The article discusses Kohler introducing a new limited-edition global product collection, showcasing business innovation through the launch of distinct products in partnership with contemporary artists.	TRUE - The article highlights the creation of a limited-edition global product collection that emphasizes beauty, decorative processes, material sets, and manufacturing craftsmanship tailored to express personal style while reducing environmental impact.	FALSE - The article does not delve into specific processes in manufacturing or operational activities that minimize environmental impacts, conserve resources, or reduce harmful substances, hence not meeting the criteria of a green process.	Kohler Co.	Kohler Co.	product_or_process not identified	Likely NAICS Codes: 337110 - Wood Kitchen Cabinet and Countertop Manufacturing, 337124 - Metal Household Furniture Manufacturing, 335312 - Motor and Generator Manufacturing, 721110 - Hotels (except Casino Hotels) and Motels	FALSE - The article focuses on genuine artist collaborations, product launches, and celebrations, without indicating any false or misleading information about the environmental benefits of the products, therefore not an example of greenwashing.	3302
Air Compressor Filter & Compressed Air Dryer Global Market Report 2023 - Yahoo Finance	https://news.google.com/rss/articles/CBMiUmh0dHBzOi8vZmluYW5jZS55YWhvby5jb20vbmV3cy9haXItY29tcHJlc3Nvci1maWx0ZXItY29tcHJlc3NlZC1haXItMTUyMTAwMjUwLmh0bWzSAQA?oc=5	The global air compressor filter & compressed air dryer market grew from $3.45 billion in 2022 to $3.81 billion in 2023, with an expected future growth to $5.39 billion in 2027, driven by the pharmaceutical industry's demand for high-quality air in manufacturing facilities.	FALSE: The article discusses market growth and economic impacts but does not focus on environmental sustainability goals or reducing negative environmental externalities.	TRUE: The article focuses on new products and components in the air compressor filter & compressed air dryer market, demonstrating a new or improved business process within this industry.	FALSE: While the article talks about air compressor filters and dryers, it does not emphasize designing, manufacturing, or using products in a way that significantly reduces their environmental impact throughout their life cycle.	FALSE: The article mentions the use of filters and dryers to remove impurities from atmospheric air but does not emphasize specific methods or techniques in manufacturing, production, or operational activities that promote sustainability.	company not identified	not found	air compressor filter & compressed air dryer	Likely NAICS Codes: 333912 - Air and Gas Compressor Manufacturing, 333999 - All Other Miscellaneous General Purpose Machinery Manufacturing, 562910 - Remediation Services, 81131 - Commercial and Industrial Machinery and Equipment (except Automotive and Electronic) Repair and Maintenance	FALSE: There is no indication in the article of false or misleading environmental claims about the air compressor filter & compressed air dryer market.	2894
Kohler Partners with Celebrated Photographer Douglas Friedman on Artistic Ad Campaign to Launch Innovative Numi ... - PR Newswire	https://news.google.com/rss/articles/CBMiuAFodHRwczovL3d3dy5wcm5ld3N3aXJlLmNvbS9uZXdzLXJlbGVhc2VzL2tvaGxlci1wYXJ0bmVycy13aXRoLWNlbGVicmF0ZWQtcGhvdG9ncmFwaGVyLWRvdWdsYXMtZnJpZWRtYW4tb24tYXJ0aXN0aWMtYWQtY2FtcGFpZ24tdG8tbGF1bmNoLWlubm92YXRpdmUtbnVtaS0yLTAtc21hcnQtdG9pbGV0LTMwMTc2MzQ1NS5odG1s0gEA?oc=5	Kohler Co. collaborates with a photographer to launch a new smart toilet, respecting the original print campaign from 1981. The ad highlights the Numi 2.0's features and design, aiming to showcase the product as a piece of art and embodying Kohler's innovative legacy.	FALSE: While the article highlights collaboration and forward-thinking, it does not explicitly mention environmental sustainability goals or reducing negative environmental externalities.	TRUE: The article discusses Kohler Co. launching a new product, the KOHLER Numi 2.0 Honed Black Smart Toilet, which represents a new or improved product introduced on the market.	TRUE: The article describes the Kohler Numi 2.0 Honed Black Smart Toilet as a product designed to minimize environmental impact through its sustainable features and functionalities.	TRUE: The article mentions the smart toilet's advanced technology that includes energy-efficient features, indicating a green process in its manufacturing and usability.	Kohler Co.	Kohler Co.	KOHLER Numi 2.0 Honed Black Smart Toilet	Likely NAICS Codes: 238990 - All Other Specialty Trade Contractors, 541410 - Interior Design Services, 541430 - Graphic Design Services, 444190 - Other Building Material Dealers	FALSE: The article focuses on highlighting the product's design and features without making any false or exaggerated environmental claims.	2194
