title	link	summary	green_innovation	business_innovation	green_product	green_process	company	official_company_name	product_or_process	likely_naics_codes	greenwashing	total_tokens
MARS PUBLISHES "ACCELERATED, AFFORDABLE AND ACHIEVABLE" NET ZERO ROADMAP TO CUT EMISSIONS ... - PR Newswire	https://news.google.com/rss/articles/CBMisQFodHRwczovL3d3dy5wcm5ld3N3aXJlLmNvbS9uZXdzLXJlbGVhc2VzL21hcnMtcHVibGlzaGVzLWFjY2VsZXJhdGVkLWFmZm9yZGFibGUtYW5kLWFjaGlldmFibGUtbmV0LXplcm8tcm9hZG1hcC10by1jdXQtZW1pc3Npb25zLTUwLWJ5LTIwMzAtYWNyb3NzLWZ1bGwtdmFsdWUtY2hhaW4tMzAxOTI3MzE3Lmh0bWzSAQA?oc=5	Mars, Incorporated has released a Net Zero Roadmap aiming to cut carbon by 50% by 2030 across its full value chain and achieve Net Zero emissions by 2050. The company will invest $1 billion over three years to drive climate action and prioritize renewable energy, sustainable supply chains, climate-smart agriculture, and emissions reductions.	TRUE - The article describes Mars, Incorporated's commitment to reducing carbon emissions across its full value chain to achieve Net Zero emissions, which aligns with environmental sustainability goals.	TRUE - Mars, Incorporated's Net Zero Roadmap represents a significant shift in the company's business processes and products to reduce its carbon footprint, demonstrating a new and improved approach to sustainability.	TRUE - Mars, Incorporated's focus on sustainable supply chains, renewable energy, and climate-smart agriculture in its products aligns with the definition of a green product as it significantly reduces environmental impact throughout the lifecycle.	TRUE - Mars, Incorporated's emphasis on transitioning to renewable energy, redesigning supply chains to stop deforestation, climate-smart agriculture, optimizing ingredients, and logistical improvements align with the definition of a green process by minimizing environmental impacts and promoting sustainability.	Mars, Incorporated	Mars, Incorporated	product or process not identified	Likely NAICS Codes: 311999 - All Other Miscellaneous Food Manufacturing, 312111 - Soft Drink Manufacturing, 325411 - Medicinal and Botanical Manufacturing, 541712 - Research and Development in the Physical, Engineering, and Life Sciences	FALSE - The article showcases Mars, Incorporated's concrete commitments and investments towards climate action, demonstrating a transparent approach to sustainability goals without misleading claims or marketing tactics.	3234
Future Center - - مركز المستقبل	https://news.google.com/rss/articles/CBMiX2h0dHBzOi8vd3d3LmZ1dHVyZXVhZS5jb20vZW4tVVMvTWFpbnBhZ2UvSXRlbS84NjM1L2lubm92YXRpb24taW4tZW52aXJvbm1lbnQlM0ItbXl0aC1vci1yZWFsaXR50gEA?oc=5	The article discusses the role of innovation in addressing environmental challenges and the potential consequences of relying solely on technological solutions for sustainability.	TRUE. The article emphasizes the importance of innovation in addressing environmental issues and sustainability challenges, positioning innovation as a key driver in transitioning towards green practices.	TRUE. The article discusses how businesses use innovation to stay competitive in the market and align with sustainability goals, highlighting the evolution of products and processes in response to environmental concerns.	TRUE. The article addresses the development and use of products that reduce environmental impact through sustainable materials, production processes, and functionalities, advocating for greener alternatives.	TRUE. The article highlights the importance of adopting processes that minimize environmental impacts, reduce waste, conserve resources, and limit harmful substance release, emphasizing the role of sustainable operations.	company not identified	N/A	product or process not identified	Likely NAICS Codes: 541712 (Research and Development in the Physical, Engineering, and Life Sciences), 541620 (Environmental Consulting Services), 562910 (Remediation Services), 325510 (Paint and Coating Manufacturing)	FALSE. The article discusses the challenges and limitations of relying solely on innovation and technology to address environmental issues, pointing out the need for holistic approaches beyond technological solutions.	3251
Innovation in Digital Banking Awards 2023 - The Banker	https://news.google.com/rss/articles/CBMiTmh0dHBzOi8vd3d3LnRoZWJhbmtlci5jb20vSW5ub3ZhdGlvbi1pbi1EaWdpdGFsLUJhbmtpbmctQXdhcmRzLTIwMjMtMTY5MzU1NTIwNdIBAA?oc=5	The article discusses the Innovation in Digital Banking Awards 2023, covering a wide range of banking services with a focus on digital transformation, frameworks, and partnerships for enhanced customer experiences in banking sectors like retail, payments, wholesale, and investment banking.	FALSE, The article focuses on digital transformation in banking services and does not specifically mention any contribution to environmental sustainability goals or the reduction of negative environmental externalities.	TRUE, The article highlights the introduction of new digital banking services and processes that differ significantly from previous offerings, showcasing business innovation in the banking sector.	FALSE, The article does not detail any specific products or services that are designed, manufactured, and used in a way to significantly reduce environmental impact throughout their life cycle.	FALSE, The article does not discuss any methods or techniques in banking operations that aim to minimize environmental impacts or promote sustainability.	company not identified	N/A	product or process not identified	Likely NAICS Codes: 522320 (Financial Transactions Processing, Reserve, and Clearinghouse Activities), 522390 (Other Activities Related to Credit Intermediation), 523920 (Portfolio Management), 541512 (Computer Systems Design Services)	FALSE, The article does not exhibit greenwashing as it focuses on digital banking innovations and industry developments without making misleading environmental claims.	1384
Soil Association says UK inaction on fertiliser at odds with net zero - Fruitnet	https://news.google.com/rss/articles/CBMibWh0dHBzOi8vd3d3LmZydWl0bmV0LmNvbS9zb2lsLWFzc29jaWF0aW9uLXNheXMtdWstaW5hY3Rpb24tb24tZmVydGlsaXNlci1hdC1vZGRzLXdpdGgtbmV0LXplcm8vMjU1NzYwLmFydGljbGXSAQA?oc=5	A campaign urges public action to reduce fossil fuel-based nitrogen fertilisers in the UK, with warnings about the impact on Net Zero Strategy. The Soil Association calls for government action and highlights the need for farmers to adopt more sustainable practices.	TRUE, The article discusses the need for reducing fossil fuel-based nitrogen fertilisers to promote environmental sustainability goals like decarbonisation and reducing harmful substances.	FALSE, The article focuses more on agricultural practices and environmental impact rather than on new products or business processes.	FALSE, The article does not explicitly discuss a specific product, but rather the need for reducing the use of fossil fuel-based nitrogen fertilisers.	TRUE, The article discusses the need for farmers to adopt more sustainable practices in agriculture to reduce environmental impacts, which aligns with the definition of a green process.	company not identified	company not identified	product or process not identified	Likely NAICS Codes: 111150 - Corn Farming, 325311 - Nitrogenous Fertilizer Manufacturing, 115114 - Post-Harvest Crop Activities (except Cotton Ginning)	FALSE, The article does not show signs of greenwashing as it addresses genuine concerns about the environmental impact of nitrogen fertilisers and the need for sustainable farming practices.	2205
How green and environmental considerations are impacting State purchasing in the construction sector | Irish Building ... - Irish Building Magazine	https://news.google.com/rss/articles/CBMikQFodHRwczovL2lyaXNoYnVpbGRpbmdtYWdhemluZS5pZS8yMDIzLzA5LzEwL2hvdy1ncmVlbi1hbmQtZW52aXJvbm1lbnRhbC1jb25zaWRlcmF0aW9ucy1hcmUtaW1wYWN0aW5nLXN0YXRlLXB1cmNoYXNpbmctaW4tdGhlLWNvbnN0cnVjdGlvbi1zZWN0b3Iv0gEA?oc=5	The article discusses how green and environmental considerations impact state purchasing in the construction sector as part of efforts to reach net zero emissions, emphasizing public sector leadership in decarbonization of buildings and transport stocks through green public procurement processes.	TRUE. The article emphasizes the adoption of green and environmental considerations in state purchasing processes to achieve sustainability goals, specifically targeted at reducing greenhouse gas emissions and promoting decarbonization in the construction sector.	FALSE. While the article discusses procurement processes and public sector leadership in environmental considerations, it does not specifically focus on introducing new or significantly improved products or business processes.	TRUE. The article describes the adoption of green public procurement processes to choose solutions with reduced environmental impact, considering factors such as lifecycle sustainability, sourcing practices, and recycling capabilities.	TRUE. The article highlights the importance of green processes in the construction sector, focusing on minimizing environmental impacts, reducing waste, conserving resources, and promoting sustainability throughout the project lifecycle.	company not identified	Not Applicable	product or process not identified	Likely NAICS Codes: 924110 - Administration of Environmental Quality Programs, 236220 - Commercial and Institutional Building Construction, 221122 - Electric Power Distribution, 237310 - Highway, Street, and Bridge Construction	FALSE. The article does not exhibit characteristics of greenwashing as it promotes genuine efforts in adopting green public procurement practices and emphasizing environmental considerations in the construction sector.	2567
Best Vegan Skincare Brands: Top 5 Lines Most Recommended By Experts - Study Finds	https://news.google.com/rss/articles/CBMiMmh0dHBzOi8vc3R1ZHlmaW5kcy5vcmcvYmVzdC12ZWdhbi1za2luY2FyZS1icmFuZHMv0gEA?oc=5	The article highlights the increasing popularity of vegan skincare products that are eco-friendly, cruelty-free, and made with natural ingredients. It mentions several top vegan skincare brands and their commitment to clean, sustainable, and ethical practices.	FALSE	FALSE	TRUE	FALSE	company not identified	company not identified	product or process not identified	Likely NAICS Codes: 325620 - Toilet Preparation Manufacturing, 325611 - Soap and Other Detergent Manufacturing, 325992 - Photographic Film, Paper, Plate, and Chemical Manufacturing	FALSE	2606
Bioeconomy – FONA - fona.de	https://news.google.com/rss/articles/CBMiP2h0dHBzOi8vd3d3LmZvbmEuZGUvZW4vdG9waWNzL2Jpb29la29ub21pZS1iaW9iYXNlZC1lY29ub215LnBocNIBAA?oc=5	The article discusses the national bioeconomy strategy of the Federal Republic of Germany, focusing on sustainable development through the production, exploitation, and use of biological resources to create a future-oriented economy.	TRUE. The article describes the national bioeconomy strategy aimed at sustainable solutions to protect resources and ensure prosperity, aligning with environmental sustainability goals.	FALSE. The article primarily focuses on the bioeconomy strategy related to the use of biological resources and processes rather than business innovation.	TRUE. The article emphasizes the use of biogenic resources, sustainable production, and the creation of new products with lower environmental impact, aligning with the definition of green products.	TRUE. The article highlights methods and techniques in the bioeconomy that minimize environmental impacts, promote sustainability, and focus on renewable resources and sustainable production processes.	company not identified	company not identified	product or process not identified	Likely NAICS Codes: 32411 - Petroleum Refineries, 541710 - Research and Development in the Physical, Engineering, and Life Sciences, 312140 - Distilleries, 325199 - All Other Basic Organic Chemical Manufacturing	FALSE. The article discusses the legitimate efforts and strategies of the German government towards sustainability through the bioeconomy strategy, without any indication of false or misleading environmental claims.	2090
SGX Announces a New Corporate Structure: Can the Bourse Operator Continue Growing its Profits and Dividends? - The Smart Investor	https://news.google.com/rss/articles/CBMiiwFodHRwczovL3RoZXNtYXJ0aW52ZXN0b3IuY29tLnNnL3NneC1hbm5vdW5jZXMtYS1uZXctY29ycG9yYXRlLXN0cnVjdHVyZS1jYW4tdGhlLWJvdXJzZS1vcGVyYXRvci1jb250aW51ZS1ncm93aW5nLWl0cy1wcm9maXRzLWFuZC1kaXZpZGVuZHMv0gEA?oc=5	Singapore Exchange Limited (SGX) reports strong financial performance with increased revenue and net profit, launches new products and unveils a new corporate structure to drive further growth, aiming for rising profits and dividends.	FALSE	TRUE	FALSE	FALSE	Singapore Exchange Limited (SGX)	Singapore Exchange Limited	product or process not identified	Likely NAICS Codes: 523210 - Securities and Commodity Exchanges, 523130 - Commodity Contracts Dealing, 523120 - Securities Brokerage, 523999 - Miscellaneous Financial Investment Activities	FALSE	2203
India & China Emerging As Gamechangers Of Green Industrial Era - Indian PSU	https://news.google.com/rss/articles/CBMiU2h0dHBzOi8vaW5kaWFucHN1LmNvbS9pbmRpYS1jaGluYS1lbWVyZ2luZy1hcy1nYW1lY2hhbmdlcnMtb2YtZ3JlZW4taW5kdXN0cmlhbC1lcmEv0gEA?oc=5	The article discusses the emergence of India and China as game-changers in the green industrial era, with the EU and the US competing for leadership in the global race towards zero-carbon technologies.	TRUE This text describes various countries investing in green technologies and transitioning towards sustainable practices, aligning with the concept of green innovation aiming to reduce negative environmental externalities.	TRUE This article focuses on new developments and investments in industries related to green technologies, showcasing advances in manufacturing and market strategies, which align with the definition of business innovation.	TRUE The article mentions advancements in green products like renewable energy sources, heat pumps, and electric vehicles, showcasing a shift towards goods designed to significantly reduce environmental impact throughout their life cycle.	TRUE The text highlights the adoption of green processes in manufacturing and operational activities, referring to methods that minimize environmental impacts and promote sustainability through resource conservation and waste reduction.	company not identified	Not Applicable	product or process not identified	Likely NAICS Codes: 541712 - Research and Development in the Physical, Engineering, and Life Sciences; 221114 - Solar Electric Power Generation; 336111 - Automobile Manufacturing; 334413 - Semiconductor and Related Device Manufacturing	FALSE The article does not mention any false or misleading environmental claims about products or practices, but rather focuses on genuine efforts and progress in transitioning towards green technologies and sustainability.	2315
PUMA India Sets New Sustainability Standard in Retail with IoT-Enabled Clean Air Initiative - Indian Retailer	https://news.google.com/rss/articles/CBMid2h0dHBzOi8vd3d3LmluZGlhbnJldGFpbGVyLmNvbS9uZXdzL3B1bWEtaW5kaWEtc2V0cy1uZXctc3VzdGFpbmFiaWxpdHktc3RhbmRhcmQtcmV0YWlsLWlvdC1lbmFibGVkLWNsZWFuLWFpci1pbml0aWF0aXZl0gEA?oc=5	HanesBrands has entered into an agreement to sell its Champion business to Authentic Brands Group for a transaction value of up to $1.5 billion. The company intends to focus on its innerwear brands after the completion of the transaction, aiming to generate above-market growth through consumer-centric innovation and increased investment.	FALSE, The article does not mention any environmental sustainability goals or practices that would qualify as green innovation.	TRUE, The article describes a new business strategy involving the sale of a business unit to focus on other brands, constituting a business innovation.	FALSE, There is no mention of specific features of a product designed to significantly reduce environmental impact throughout its lifecycle.	FALSE, The article does not discuss specific methods or techniques in manufacturing, production, or operations aimed at minimizing environmental impacts and promoting sustainability.	HanesBrands	HanesBrands	product or process not identified	Likely NAICS Codes: 315990 Apparel Accessories and Other Apparel Manufacturing, 448120 Women's Clothing Stores, 315210 Cut and Sew Apparel Contractors, 316999 All Other Leather Good and Allied Product Manufacturing	FALSE, The article does not contain any false or exaggerated environmental claims that would qualify as greenwashing.	2057
