title	link	summary	green_innovation	business_innovation	green_product	green_process	company	official_company_name	product_or_process	likely_naics_codes	greenwashing	total_tokens
Bold, Urgent Proposals for Using AI in Climate Action - The Rockefeller Foundation	https://news.google.com/rss/articles/CBMicGh0dHBzOi8vd3d3LnJvY2tlZmVsbGVyZm91bmRhdGlvbi5vcmcvaW5zaWdodHMvcGVyc3BlY3RpdmUvYm9sZC11cmdlbnQtcHJvcG9zYWxzLWZvci11c2luZy1haS1pbi1jbGltYXRlLWFjdGlvbi_SAQA?oc=5	The article discusses the importance of establishing guidelines for applying artificial intelligence to climate action considering climate justice and environmental costs.	FALSE. The article discusses the application of artificial intelligence to climate action but does not focus on innovations that specifically reduce negative environmental externalities.	FALSE. The article primarily focuses on the use of artificial intelligence in climate action rather than introducing new or significantly improved products or business processes.	FALSE. The article does not explicitly mention the development, manufacturing, or use of a specific product designed to reduce environmental impact throughout its life cycle.	FALSE. The article does not directly discuss a method or technique in manufacturing, production, or operational activities aimed at minimizing environmental impacts and promoting sustainability.	company not identified	N/A	product or process not identified	N/A	FALSE. The article does not make false or misleading statements about the environmental benefits of a product or practice; rather, it emphasizes the importance of clear guidelines for AI in climate action.	1314
Mars Tackles Climate Change Across Iconic Brands - PR Newswire	https://news.google.com/rss/articles/CBMiaGh0dHBzOi8vd3d3LnBybmV3c3dpcmUuY29tL25ld3MtcmVsZWFzZXMvbWFycy10YWNrbGVzLWNsaW1hdGUtY2hhbmdlLWFjcm9zcy1pY29uaWMtYnJhbmRzLTMwMTkzMzc0MS5odG1s0gEA?oc=5	Mars Incorporated commits over $1 billion to tackle climate change by investing in sustainability initiatives across its brands. Initiatives include improving soil health, restoring coral reefs, rethinking packaging, and promoting sustainable rice production practices.	TRUE. Mars Incorporated is investing in sustainability initiatives that contribute to environmental goals, such as reducing carbon emissions and supporting biodiversity.	FALSE. The focus of the article is on sustainability and climate action rather than introducing significant new products or processes that differ from previous offerings.	TRUE. Mars is implementing green practices in its packaging, food sourcing, and pet care products to reduce environmental impact throughout the product life cycle.	TRUE. Mars is adopting green processes to improve soil health, restore coral reefs, and reduce waste in packaging production.	Mars Incorporated	Mars, Incorporated	product or process not identified	Likely NAICS Codes: 311999 - All Other Miscellaneous Food Manufacturing, 112990 - All Other Animal Production, 541620 - Environmental Consulting Services, 325998 - All Other Miscellaneous Chemical Product and Preparation Manufacturing	FALSE. The article provides detailed information on Mars' sustainability initiatives with partners and specific actions taken to address environmental challenges, showing a genuine commitment to climate action.	2949
Explainer: What is SDG13? - Capital Monitor	https://news.google.com/rss/articles/CBMiTWh0dHBzOi8vY2FwaXRhbG1vbml0b3IuYWkvc2Rncy9zZGctMTMtY2xpbWF0ZS1hY3Rpb24vZXhwbGFpbmVyLXdoYXQtaXMtc2RnMTMv0gEA?oc=5	The article emphasizes the urgency of addressing climate change, highlighting the importance of reaching peak greenhouse gas emissions by 2025 to align with the Paris Agreement's goals. It discusses the impact of climate change on society and biodiversity and the efforts needed to meet the targets set by Sustainable Development Goal 13: Climate Action.	TRUE. The article focuses on innovations and actions aimed at reducing negative environmental impacts, particularly in the context of climate change and the transition to a more sustainable future.	FALSE. Although the article discusses climate-related policies and the shift towards sustainable practices, it primarily focuses on addressing environmental challenges rather than introducing new business products or processes.	TRUE. The article mentions the development and adoption of green technologies, renewable energy sources, and sustainable practices to reduce environmental impact and combat climate change.	TRUE. The article advocates for the adoption of environmentally friendly methods, renewable resources, and sustainable practices to minimize environmental impacts and promote sustainability.	company identified	The Capital Monitor	product or process not identified	Likely NAICS Codes: 519190 - All Other Information Services, 541620 - Environmental Consulting Services, 926130 - Regulation and Administration of Communications, Electric, Gas, and Other Utilities, 221119 - Other Electric Power Generation	FALSE. The article does not exhibit greenwashing as it primarily focuses on the importance of addressing climate change, enhancing sustainability, and meeting global goals related to environmental protection.	3444
Meet the climate innovators of tomorrow - MIT Technology Review	https://news.google.com/rss/articles/CBMiXGh0dHBzOi8vd3d3LnRlY2hub2xvZ3lyZXZpZXcuY29tLzIwMjMvMDkvMTQvMTA3OTQzNS9tZWV0LXRoZS1jbGltYXRlLWlubm92YXRvcnMtb2YtdG9tb3Jyb3cv0gFgaHR0cHM6Ly93d3cudGVjaG5vbG9neXJldmlldy5jb20vMjAyMy8wOS8xNC8xMDc5NDM1L21lZXQtdGhlLWNsaW1hdGUtaW5ub3ZhdG9ycy1vZi10b21vcnJvdy9hbXAv?oc=5	The article discusses innovators in the fields of batteries and fuels who are contributing to climate action by advancing battery technology.	TRUE. The article discusses innovators who are working on battery technology to address climate change, which falls under the category of green innovation by contributing to environmental sustainability goals.	FALSE. The article focuses on technological advancements in batteries and fuels related to climate action, which do not primarily involve new or improved business processes or products.	FALSE. The article emphasizes advancements in battery technology and materials but does not specifically describe a product that significantly reduces environmental impact throughout its life cycle.	FALSE. The article highlights innovations in battery materials and technology but does not focus on methods or techniques in manufacturing or operational activities that minimize environmental impacts.	company not identified	N/A	product or process not identified	Likely NAICS Codes: 	FALSE. The article does not involve false or misleading statements about the environmental benefits of a product or practice; instead, it discusses genuine efforts in advancing battery technology for climate action.	1576
Blueprint for the Energy Transition | BCG - BCG	https://news.google.com/rss/articles/CBMiQWh0dHBzOi8vd3d3LmJjZy5jb20vaW5kdXN0cmllcy9lbmVyZ3kvZW5lcmd5LXRyYW5zaXRpb24vYmx1ZXByaW500gEA?oc=5	The article outlines the need for accelerating progress towards meeting ambitious environmental targets by studying the energy transition and suggesting ways to scale low-carbon technologies globally.	TRUE: The article discusses implementing new low-carbon technologies and shifting to a net zero energy system, which aligns with the concept of green innovation by aiming to reduce negative environmental impacts.	TRUE: The article emphasizes the introduction of new low-carbon technologies and the need for policy changes, which represents a significant change in business processes to address sustainability goals.	TRUE: The article highlights the importance of transitioning to green products like renewables, energy-efficient technologies, and technologies promoting sustainability and reducing environmental impacts.	TRUE: The article emphasizes the need for reducing waste, conserving resources, and limiting harmful substance releases in operational activities, representing the principles of green processes.	company not identified	company not identified	product or process not identified	Likely NAICS Codes: 22 - Utilities, 52 - Finance and Insurance, 54 - Professional, Scientific, and Technical Services, 56 - Administrative and Support and Waste Management and Remediation Services	FALSE: The article focuses on the imperative need to transition to sustainable energy sources and outlines concrete steps, showing a genuine effort towards addressing environmental concerns rather than engaging in deceptive practices.	2102
Corbion launches AlgaPrime™ DHA P3, addressing the demand for sustainable active nutrition in the pet food industry - GlobeNewswire	https://news.google.com/rss/articles/CBMiuQFodHRwczovL3d3dy5nbG9iZW5ld3N3aXJlLmNvbS9uZXdzLXJlbGVhc2UvMjAyMy8wOS8yNS8yNzQ5MDU4LzAvZW4vQ29yYmlvbi1sYXVuY2hlcy1BbGdhUHJpbWUtREhBLVAzLWFkZHJlc3NpbmctdGhlLWRlbWFuZC1mb3Itc3VzdGFpbmFibGUtYWN0aXZlLW51dHJpdGlvbi1pbi10aGUtcGV0LWZvb2QtaW5kdXN0cnkuaHRtbNIBAA?oc=5	Corbion launches AlgaPrime™ DHA P3, a sustainable omega-3 ingredient for pet food, reducing marine resource dependency and carbon footprint.	TRUE. This is a green innovation as it introduces an environmentally sustainable solution, reducing the dependency on marine-based resources and positively impacting the carbon footprint.	TRUE. The introduction of AlgaPrime™ DHA P3 as a new sustainable omega-3 ingredient for pet food qualifies as a business innovation as it differs significantly from its previous products, offering a new solution in the market.	TRUE. AlgaPrime™ DHA P3 qualifies as a green product due to its design, manufacturing, and use that significantly reduces environmental impact throughout its life cycle, offering sustainable ingredients for pet nutrition.	TRUE. The production process of AlgaPrime™ DHA P3 using microalgae precision fermentation in closed tanks, powered by renewable energy sources aligns with green process principles by minimizing environmental impacts and promoting sustainability.	Corbion	Corbion	AlgaPrime™ DHA P3	Likely NAICS Codes: 325998 - All Other Miscellaneous Chemical Product and Preparation Manufacturing, 311119 - Other Animal Food Manufacturing, 325199 - All Other Basic Organic Chemical Manufacturing, 325411 - Medicinal and Botanical Manufacturing	FALSE. The article does not exhibit characteristics of greenwashing, as it transparently presents the innovation of AlgaPrime™ DHA P3 as a sustainable solution for pet nutrition.	2044
Climate Education: How to Instil Hope & Action, Instead of Fear & Anxiety - Green Queen Media	https://news.google.com/rss/articles/CBMiamh0dHBzOi8vd3d3LmdyZWVucXVlZW4uY29tLmhrL2NsaW1hdGUtZWR1Y2F0aW9uLWhvdy13ZS1jYW4taW5zdGlsLWhvcGUtYWN0aW9uLWluc3RlYWQtb2YtZmVhci1lY28tYW54aWV0eS_SAQA?oc=5	The article discusses reframing climate change education with a message of 'hopeful alarm' to motivate action and shape the future, emphasizing the importance of empowering students with information on climate solutions and practical actions.	TRUE - The article emphasizes the urgency of the climate crisis and the need for action to combat climate change through education and empowerment, aligning with the principles of green innovation by addressing environmental challenges and promoting sustainable solutions.	FALSE - The article focuses on climate change education and empowerment rather than introducing new products or business processes for commercial purposes.	TRUE - The article discusses green products and solutions such as sustainable land use, emissions reduction, and climate change adaptation in the context of environmental sustainability and reduced environmental impact.	TRUE - The article highlights the importance of green processes by incorporating methods and techniques that minimize environmental impacts, promote sustainability, and reduce carbon emissions.	company not identified	N/A	product or process not identified	Likely NAICS Codes: 611710 - Educational Support Services, 813910 - Business Associations, 541620 - Environmental Consulting Services, 611699 - All Other Miscellaneous Schools and Instruction	FALSE - The article does not exhibit greenwashing as it focuses on genuine climate change education, empowerment, and encouraging action to combat climate change through hopeful and informative messaging.	3876
Opportunities for Near-Zero-Emissions Steel Production in the Great Lakes - Rocky Mountain Institute	https://news.google.com/rss/articles/CBMiWWh0dHBzOi8vcm1pLm9yZy9nYXAtYW5hbHlzaXMtZm9yLW5lYXItemVyby1lbWlzc2lvbnMtc3RlZWwtcHJvZHVjdGlvbi1pbi10aGUtZ3JlYXQtbGFrZXMv0gEA?oc=5	The article discusses the importance of procuring clean electricity, clean hydrogen, and implementing carbon capture and storage technologies in the steel production value chain in the Great Lakes region.	TRUE. The article discusses various initiatives aimed at reducing carbon emissions, promoting clean energy generation, and implementing clean hydrogen production, which align with the goals of green innovation to reduce negative environmental externalities.	FALSE. The article focuses more on the adoption of clean energy and sustainability practices in the steel industry rather than highlighting new or significantly different business processes or products within a firm.	TRUE. The article emphasizes the use of clean electricity, clean hydrogen, and carbon capture technologies in the steel production value chain, showcasing efforts to reduce environmental impact throughout the product life cycle.	TRUE. The article discusses the implementation of green processes such as clean energy generation, sustainable hydrogen production, and carbon capture technologies to minimize environmental impacts and enhance sustainability in the steel industry.	company not identified	company not identified	product or process not identified	Likely NAICS Codes: 3311 - Iron and Steel Mills, 2211 - Electric Power Generation, 562910 - Remediation Services, 562998 - All Other Miscellaneous Waste Management Services	FALSE. The article does not exhibit characteristics of greenwashing as it focuses on genuine efforts and initiatives towards clean energy, clean hydrogen production, and carbon capture technologies for sustainability in the steel industry.	3985
Leapfrogging to prosperity through Science, Technology and Innovation - UNEP	https://news.google.com/rss/articles/CBMibmh0dHBzOi8vd3d3LnVuZXAub3JnL25ld3MtYW5kLXN0b3JpZXMvc3BlZWNoL2xlYXBmcm9nZ2luZy1wcm9zcGVyaXR5LXRocm91Z2gtc2NpZW5jZS10ZWNobm9sb2d5LWFuZC1pbm5vdmF0aW9u0gEA?oc=5	The article highlights the importance of addressing the triple planetary crisis through sustainable development, emphasizing the need for global cooperation, technology, and innovation to achieve a low-carbon, nature-positive, and pollution-free future.	TRUE, as the article discusses the importance of green innovation in addressing environmental challenges and promoting sustainability through technological advancements and global collaboration.	FALSE, as the article primarily focuses on environmental challenges and the role of science, technology, and innovation in achieving sustainable development, rather than specific business innovations.	FALSE, as the article mentions the need for developing nations to prioritize clean and sustainable development, but does not focus on specific green products or their environmental impact.	FALSE, as the article talks about the importance of science, technology, and innovation in addressing environmental challenges and promoting sustainability, but does not detail specific green processes in manufacturing or production.	company not identified	N/A	product or process not identified	Likely NAICS Codes: 54 (Professional, Scientific, and Technical Services), 56 (Administrative and Support and Waste Management and Remediation Services), 62 (Health Care and Social Assistance), 71 (Arts, Entertainment, and Recreation)	FALSE, as the article does not contain any instances of greenwashing. It focuses on genuine environmental challenges, the importance of sustainability, and the role of technology and innovation in addressing these issues.	2750
Open-source net zero roadmap revealed by Mars - Packaging Europe	https://news.google.com/rss/articles/CBMiXGh0dHBzOi8vcGFja2FnaW5nZXVyb3BlLmNvbS9uZXdzL29wZW4tc291cmNlLW5ldC16ZXJvLXJvYWRtYXAtcmV2ZWFsZWQtYnktbWFycy8xMDMyOS5hcnRpY2xl0gEA?oc=5	Mars, Incorporated announces its Net Zero Roadmap to achieve carbon neutrality across its value chain by 2030, investing $1 billion in climate action and emphasizing science-backed emission reductions and renewable energy usage.	TRUE: Mars, Incorporated is adopting green processes and products to reduce its environmental impact and achieve carbon neutrality, aligning with sustainability goals.	TRUE: Mars' Net Zero Roadmap represents a significant new business process to achieve carbon neutrality, distinguishable from its previous strategies.	TRUE: Mars' focus on green product design and sustainability in its supply chains aligns with the definition of a green product, promoting ecological and human health benefits.	TRUE: Mars' commitment to reducing waste, conserving resources, and transitioning to renewable energy sources embodies green process innovation, aiming to minimize environmental impacts.	Mars, Incorporated	Mars, Incorporated	Net Zero Roadmap	Likely NAICS Codes: 311352 - Confectionery Manufacturing from Purchased Chocolate, 312130 - Wineries, 325412 - Pharmaceutical Preparation Manufacturing, 327320 - Ready-Mix Concrete Manufacturing	FALSE: The focus on transparent action, investment in emissions reduction, and alignment with science-backed goals indicate a genuine commitment to sustainability, rather than greenwashing.	2514
The Vodka Masters 2023 results - The Spirits Business	https://news.google.com/rss/articles/CBMiSmh0dHBzOi8vd3d3LnRoZXNwaXJpdHNidXNpbmVzcy5jb20vMjAyMy8wOS90aGUtdm9ka2EtbWFzdGVycy0yMDIzLXJlc3VsdHMv0gEA?oc=5	The article discusses the results of The Vodka Masters 2023 competition, highlighting various vodka brands and their characteristics, as well as trends in the vodka industry.	FALSE	TRUE	FALSE	FALSE	company not identified	not found	product or process not identified	Likely NAICS Codes: 312140 - Distilleries, 312130 - Wineries, 424820 - Wine and Distilled Alcoholic Beverage Merchant Wholesalers, 445310 - Beer, Wine, and Liquor Stores	FALSE	4861
Optera Secures $12M to Help Companies Prepare for New SEC Climate Disclosure Requirements - PR Newswire	https://news.google.com/rss/articles/CBMikAFodHRwczovL3d3dy5wcm5ld3N3aXJlLmNvbS9uZXdzLXJlbGVhc2VzL29wdGVyYS1zZWN1cmVzLTEybS10by1oZWxwLWNvbXBhbmllcy1wcmVwYXJlLWZvci1uZXctc2VjLWNsaW1hdGUtZGlzY2xvc3VyZS1yZXF1aXJlbWVudHMtMzAxOTIzNTIzLmh0bWzSAQA?oc=5	Optera, a leader in ESG and carbon management software, secures $12M in Series A funding led by Next Frontier Capital for its platform that helps companies reduce their climate impacts. The platform tracks emissions in supply chains and supports businesses in achieving net-zero goals.	TRUE. The article discusses Optera's carbon management software, which enables companies to reduce the carbon impacts of their operations, supply chains, and products, aligning with environmental sustainability goals.	TRUE. The article describes Optera's ESG and carbon management software as a new and improved business process that differs significantly from traditional approaches.	FALSE. The article does not specifically mention a product or service that meets the criteria of a green product.	TRUE. Optera's carbon management software can be considered a green process as it minimizes environmental impacts and promotes sustainability by helping companies reduce emissions in their operations and supply chains.	Optera	Optera	Optera's ESG and carbon management software	Likely NAICS Codes: 334510 - Electromedical Apparatus Manufacturing, 541620 - Environmental Consulting Services, 511210 - Software Publishers, 523930 - Investment Advice	FALSE. The article does not show any indication of greenwashing as it focuses on Optera's genuine efforts and contributions to environmental sustainability.	2272
Refilled launches initiative to save 100m single-use plastic bottles from vending - FoodBev.com	https://news.google.com/rss/articles/CBMib2h0dHBzOi8vd3d3LmZvb2RiZXYuY29tL25ld3MvcmVmaWxsZWQtbGF1bmNoZXMtaW5pdGlhdGl2ZS10by1zYXZlLTEwMG0tc2luZ2xlLXVzZS1wbGFzdGljLWJvdHRsZXMtZnJvbS12ZW5kaW5nL9IBAA?oc=5	Refilled, a start-up in Sydney, aims to combat single-use plastic bottle waste by introducing a BYO-Bottle system with customisable beverages and a sustainable refill model in collaboration with universities.	TRUE. This initiative by Refilled contributes to environmental sustainability by reducing single-use plastic bottle waste and promoting reusable alternatives, aligning with green innovation goals.	TRUE. Refilled's BYO-Bottle system and customisable beverage offerings represent a new business process in the vending industry, distinguishing the company's approach and products from traditional vending machines.	TRUE. Refilled's BYO-Bottle system and range of customisable beverages designed to reduce single-use plastic bottle waste exemplify a green product that significantly reduces environmental impact throughout its life cycle.	TRUE. Refilled's sustainable refill model, use of reusable bottles, and tracking technology to reduce waste and emissions showcase green process innovation in combating plastic pollution.	Refilled	Refilled	Refilled's BYO-Bottle system and customisable beverages	Likely NAICS Codes: 722330 - Mobile Food Services, 312111 - Soft Drink Manufacturing, 312130 - Ice Manufacturing, 722511 - Full-Service Restaurants	FALSE. The article text describes a genuine effort by Refilled to combat single-use plastic bottle waste through its innovative BYO-Bottle system and sustainable refill model, without any indication of greenwashing.	1814
Ann Mettler on funding Europe’s energy transition - McKinsey	https://news.google.com/rss/articles/CBMiaGh0dHBzOi8vd3d3Lm1ja2luc2V5LmNvbS9tZ2kvZm9yd2FyZC10aGlua2luZy9mb3J3YXJkLXRoaW5raW5nLW9uLWZ1bmRpbmctYS1jbGVhbi13b3JsZC13aXRoLWFubi1tZXR0bGVy0gEA?oc=5	The article features Ann Mettler discussing her work at Breakthrough Energy on cleantech innovation towards a net-zero-emissions future, focusing on the challenges in Europe's clean energy infrastructure and the importance of innovation and public policy in advancing the energy transition.	TRUE. The article discusses cleantech innovation and the pursuit of a net-zero-emissions future, contributing towards environmental sustainability goals.	TRUE. Ann Mettler's work at Breakthrough Energy involves cleantech innovation, which represents an example of business innovation by introducing new approaches and products in pursuit of a net-zero-emissions future.	FALSE. The article does not specifically mention a good or service designed, manufactured, and used in a way that significantly reduces its environmental impact throughout its life cycle.	FALSE. While the article touches on the importance of green processes in manufacturing and production, it does not explicitly discuss a method or technique that minimizes environmental impacts and promotes sustainability in this context.	Breakthrough Energy	Breakthrough Energy	product or process not identified	Likely NAICS Codes: 541710 (Research and Development in the Physical, Engineering, and Life Sciences), 541990 (All Other Professional, Scientific, and Technical Services), 926120 (Regulation and Administration of Transportation Programs), 237130 (Power and Communication Line and Related Structures Construction)	FALSE. The article does not exhibit characteristics of greenwashing as it genuinely discusses cleantech innovation and the challenges and opportunities in the energy transition.	7576
