title	link	summary	green_innovation	business_innovation	green_product	green_process	company	official_company_name	product_or_process	likely_naics_codes	greenwashing	total_tokens
Chemical recycling “a dangerous deception” for solving plastic pollution: Report - Environmental Health News	https://news.google.com/rss/articles/CBMiQGh0dHBzOi8vd3d3LmVobi5vcmcvY2hlbWljYWwtcmVjeWNsaW5nLXBvbGx1dGlvbi0yNjY2MDk5NzIxLmh0bWzSAQA?oc=5	Chemical recycling is criticized as inefficient and harmful, posing risks to the environment and public health. Advocacy groups caution against the misleading promises of chemical recycling as a solution to plastic pollution.	FALSE This is not green innovation as chemical recycling, as discussed in the article, is deemed harmful and inefficient, exacerbating environmental problems.	TRUE The article discusses the introduction of new processes in the form of chemical recycling facilities, which can be seen as a form of business innovation by changing existing methods significantly.	FALSE The article primarily focuses on the negative impacts of chemical recycling rather than highlighting characteristics of a green product.	TRUE The article discusses attempts to use chemical recycling processes to address plastic waste, aiming to minimize environmental impacts and promote sustainability.	company not identified	company not identified	chemical recycling	Likely NAICS Codes: 562920 - Materials Recovery Facilities, 562998 - All Other Miscellaneous Waste Management Services, 325998 - All Other Miscellaneous Chemical Product and Preparation Manufacturing, 562211 - Hazardous Waste Treatment and Disposal	FALSE The article exposes the negative impacts of chemical recycling without promoting false environmental benefits, aligning with the definition of greenwashing.	2217
Alt-Meat Companies Are Grappling With A Harsh Reality - TIME	https://news.google.com/rss/articles/CBMiQWh0dHBzOi8vdGltZS5jb20vNjMzOTA1MC9wbGFudC1iYXNlZC1tZWF0LW1vdmVtZW50LWhhcnNoLXJlYWxpdHkv0gEA?oc=5	The article discusses challenges faced in the alternative meat industry due to various factors like rising interest rates, consumer perceptions, and competition in the market.	TRUE. The article discusses innovations in the alternative meat industry that focus on reducing the environmental impact of meat production, contributing to sustainability goals.	FALSE. The article does not primarily focus on new or improved products or business processes from a firm's perspective but rather on challenges in the alternative meat industry.	TRUE. The article elaborates on green products in the form of alternative meat products that aim to reduce environmental impact compared to traditional meat production.	FALSE. The article does not focus on specific methods or techniques in manufacturing or operational activities that minimize environmental impacts or promote sustainability.	company not identified	N/A	product or process not identified	Likely NAICS Codes: 311612 - Meat Processed from Purchased Meat, 311999 - All Other Miscellaneous Food Manufacturing, 325411 - Medicinal and Botanical Manufacturing, 325414 - Biological Product (except Diagnostic) Manufacturing	FALSE. The article does not discuss false or misleading environmental claims about a product or practice.	2478
Sidel launches new PET bottle | Dairy Foods - dairyfoods.com	https://news.google.com/rss/articles/CBMiR2h0dHBzOi8vd3d3LmRhaXJ5Zm9vZHMuY29tL2FydGljbGVzLzk2ODI2LXNpZGVsLWxhdW5jaGVzLW5ldy1wZXQtYm90dGxl0gEA?oc=5	Sidel introduced a new PET mini-bottle designed for liquid dairy products to reduce greenhouse gas emissions, costs, and weight, enhancing marketing opportunities and production performance.	TRUE This is green innovation as it introduces a more sustainable packaging option with reduced environmental impacts and improved efficiency.	TRUE This is business innovation as Sidel has introduced a new product format that differs significantly from its previous offerings, aiming to enhance competitiveness in the market.	TRUE This qualifies as a green product as the PET mini-bottle is designed to significantly reduce environmental impact throughout its life cycle by minimizing energy consumption, waste, and greenhouse gas emissions.	TRUE This qualifies as a green process as the manufacturing process of the PET mini-bottle aims to minimize environmental impacts by using renewable resources, reducing waste, and limiting harmful substance emissions.	Sidel	Sidel Group	The PET mini-bottle	Likely NAICS Codes: 326160 - Plastics Bottle Manufacturing, 311511 - Fluid Milk Manufacturing, 312111 - Soft Drink Manufacturing, 312112 - Bottled Water Manufacturing	FALSE This is not an example of greenwashing as the described innovations align with tangible environmental benefits and features.	1565
Sidel launches ultra-small, ultra-light PET bottle for liquid dairy products - Packaging Strategies	https://news.google.com/rss/articles/CBMif2h0dHBzOi8vd3d3LnBhY2thZ2luZ3N0cmF0ZWdpZXMuY29tL2FydGljbGVzLzEwNDI1NS1zaWRlbC1sYXVuY2hlcy11bHRyYS1zbWFsbC11bHRyYS1saWdodC1wZXQtYm90dGxlLWZvci1saXF1aWQtZGFpcnktcHJvZHVjdHPSAQA?oc=5	The article discusses Sidel's new ultra-light PET bottle designed for liquid dairy products, offering sustainability benefits, cost-efficiency, and enhanced creativity for manufacturers.	TRUE. This innovation aims to reduce greenhouse gas emissions, decrease costs, and promote sustainability in packaging.	TRUE. The introduction of the new PET bottle marks a significant improvement in Sidel's packaging solutions, reflecting a change from previous products or processes.	TRUE. The PET bottle is designed to reduce environmental impact throughout its life cycle by using lightweight, recyclable PET material and offering sustainability benefits.	TRUE. The article highlights the use of sustainable production processes and materials in the creation of the PET bottle, emphasizing environmental impact reduction in manufacturing.	Sidel	Sidel	PET bottle	Likely NAICS Codes: 326160 - Plastics Bottle Manufacturing, 311511 - Fluid Milk Manufacturing, 311412 - Frozen Specialty Food Manufacturing, 312111 - Soft Drink Manufacturing	FALSE. The article does not exhibit greenwashing as it provides factual information about the environmental benefits of the PET bottle without misleading statements.	1963
Bakery waste to be put to use as sustainable oils and fats in new partnership - FoodNavigator.com	https://news.google.com/rss/articles/CBMifmh0dHBzOi8vd3d3LmZvb2RuYXZpZ2F0b3IuY29tL0FydGljbGUvMjAyMy8xMS8yOS9iYWtlcnktd2FzdGUtdG8tYmUtcHV0LXRvLXVzZS1hcy1zdXN0YWluYWJsZS1vaWxzLWFuZC1mYXRzLWluLW5ldy1wYXJ0bmVyc2hpcNIBAA?oc=5	Clean Food Group partners with Roberts Bakery to use surplus bread as feedstock for fermentation technology, creating oil and fat ingredients that reduce greenhouse gas emissions.	TRUE: This initiative contributes to environmental sustainability by reducing food waste, lowering greenhouse gas emissions, and promoting resource efficiency.	TRUE: This partnership introduces a new process for utilizing surplus bread in creating oil and fat ingredients, which is a significant deviation from traditional practices, thereby constituting a form of business innovation.	TRUE: The oil and fat ingredients produced from surplus bread through the fermentation process align with the definition of a green product by significantly reducing environmental impact through sustainable production practices and resource conservation.	TRUE: The fermentation technology used to convert surplus bread into oils and fats demonstrates a green process by minimizing waste, conserving natural resources, and reducing greenhouse gas emissions through innovative manufacturing techniques.	Clean Food Group	Clean Food Group	fermentation technology	Likely NAICS Codes: 311999 All Other Miscellaneous Food Manufacturing, 324191 Petroleum Lubricating Oil and Grease Manufacturing, 325199 All Other Basic Organic Chemical Manufacturing, 562998 All Other Miscellaneous Waste Management Services	FALSE	1729
Simplifying R&D: tech solutions for faster and more efficient NPD - CosmeticsDesign-Europe.com	https://news.google.com/rss/articles/CBMiemh0dHBzOi8vd3d3LmNvc21ldGljc2Rlc2lnbi1ldXJvcGUuY29tL0FydGljbGUvMjAyMy8xMS8xMC9zaW1wbGlmeWluZy1yLWQtdGVjaC1zb2x1dGlvbnMtZm9yLWZhc3Rlci1hbmQtbW9yZS1lZmZpY2llbnQtbnBk0gEA?oc=5	The article discusses the introduction of various tech solutions to aid R&D professionals in creating innovative beauty and personal care products. These solutions include AI-powered software tools and digital platforms to streamline product development processes and enhance environmental sustainability practices in the industry.	TRUE. The article describes the implementation of AI-powered tools and digital platforms to enhance sustainability practices and streamline product development processes in the beauty and personal care industry.	TRUE. The article discusses the introduction of AI-powered software tools and digital platforms to enhance product development processes and streamline operations, indicating a significant departure from traditional methods.	TRUE. The article details the utilization of AI-powered tools and digital platforms to support the creation of environmentally sustainable beauty and personal care products through enhanced product development processes.	TRUE. The article highlights the adoption of green processes in the beauty and personal care industry through the implementation of AI-powered tools and digital platforms to promote environmental sustainability and streamline product development.	company not identified	company not identified	product or process not identified	Likely NAICS Codes: 325620, 325411, 325620, 325610 - Toilet Preparation Manufacturing, Medicinal and Botanical Manufacturing, Toilet Preparation Manufacturing, Soap and Cleaning Compound Manufacturing	FALSE. The article focuses on the legitimate implementation of AI-powered tools and digital platforms to enhance sustainability practices and streamline product development processes, without engaging in deceptive environmental marketing.	2465
Vineyards of the future will produce more than wine - European Union	https://news.google.com/rss/articles/CBMicWh0dHBzOi8vcHJvamVjdHMucmVzZWFyY2gtYW5kLWlubm92YXRpb24uZWMuZXVyb3BhLmV1L2VuL2hvcml6b24tbWFnYXppbmUvdmluZXlhcmRzLWZ1dHVyZS13aWxsLXByb2R1Y2UtbW9yZS13aW5l0gEA?oc=5	The article discusses innovative approaches in winemaking, including using carbon dioxide to grow algae and extracting useful compounds from grape waste for various applications.	TRUE. This is green innovation as it focuses on developing a technology to capture carbon dioxide and repurpose it for beneficial uses, contributing to environmental sustainability goals.	TRUE. The article discusses new techniques and processes in winemaking industry, showcasing a business innovation by introducing novel approaches to improve product value and sustainability.	TRUE. The article highlights the development of green products by utilizing environmentally friendly materials and sustainable processes in winemaking to reduce environmental impact.	TRUE. The use of carbon dioxide to grow algae and the extraction of useful compounds from grape waste demonstrate green processes by minimizing environmental impacts and promoting sustainability in winemaking.	company not identified	not found	product or process not identified	Likely NAICS Codes: 312130 - Wineries, 325411 - Medicinal and Botanical Manufacturing, 325620 - Toilet Preparation Manufacturing, 325998 - All Other Miscellaneous Chemical Product and Preparation Manufacturing	FALSE. The article does not exhibit greenwashing as it involves genuine efforts to enhance sustainability in winemaking practices rather than misleading environmental claims.	2617
CSRWire - 5 Examples of Sustainable Packaging Solutions for the Industry That Contribute to the Circular Economy - CSRwire.com	https://news.google.com/rss/articles/CBMidWh0dHBzOi8vd3d3LmNzcndpcmUuY29tL3ByZXNzX3JlbGVhc2VzLzc4ODA3MS01LWV4YW1wbGVzLXN1c3RhaW5hYmxlLXBhY2thZ2luZy1zb2x1dGlvbnMtaW5kdXN0cnktY29udHJpYnV0ZS1jaXJjdWxhctIBAA?oc=5	Henkel aims to design 100% of its packaging for reuse or recycling by 2025, emphasizing sustainable development through strong partnerships across the value chain.	TRUE. The article describes innovations aimed at reducing environmental impact, promoting sustainability, and contributing to a circular economy.	TRUE. The article discusses new packaging solutions and sustainable practices introduced by Henkel, showing a significant deviation from existing processes to achieve environmental goals.	TRUE. The article highlights Henkel's development of green packaging solutions, such as paper-based alternatives to plastic packaging and bio-based adhesives, aimed at reducing environmental impact throughout the product life cycle.	TRUE. The article showcases how Henkel has developed processes, such as debonding for recycling, to minimize environmental impacts and promote sustainability in manufacturing and production.	Henkel	Henkel AG & Co. KGaA	product or process not identified	Likely NAICS Codes: 325520 - Adhesive Manufacturing, 322221 - Coated and Laminated Packaging Paper and Plastics Film Manufacturing, 493110 - General Warehousing and Storage, 541711 - Research and Development in Biotechnology	FALSE. The article extensively details tangible sustainability efforts and innovations by Henkel, avoiding any misleading or false claims.	3012
14 Vegan Thanksgiving Roasts for Your Plant-Based Feast - VegNews	https://news.google.com/rss/articles/CBMiMmh0dHBzOi8vdmVnbmV3cy5jb20vYmVzdC12ZWdhbi1yb2FzdHMtdGhhbmtzZ2l2aW5n0gEA?oc=5	The article discusses the evolution of vegan Thanksgiving roasts, highlighting the expanding options of plant-based meats as alternatives to traditional turkey dishes.	FALSE This article focuses on plant-based alternatives for Thanksgiving meals and does not specifically address broader sustainability or environmental impact innovations.	FALSE This article does not focus on a new or significantly improved product or business process in a company's operations.	TRUE The article discusses vegan holiday roasts that are designed, manufactured, and used in a way to significantly reduce environmental impact throughout their life cycle.	FALSE While the article describes plant-based products, it does not elaborate on specific methods or techniques in manufacturing or production to minimize environmental impacts.	company not identified	company not identified	Vegan Thanksgiving roasts	Likely NAICS Codes: 311612 Meat Processed from Purchased Meat, 311991 Perishable Prepared Food Manufacturing, 311999 All Other Miscellaneous Food Manufacturing, 311612 Meat Processed from Purchased Meat	FALSE The article does not exhibit characteristics of greenwashing as it does not make false or misleading claims about the environmental benefits of the products discussed.	3410
Chemical recycling of plastic not so fantastic, report finds - Mongabay.com	https://news.google.com/rss/articles/CBMiXmh0dHBzOi8vbmV3cy5tb25nYWJheS5jb20vMjAyMy8xMS9jaGVtaWNhbC1yZWN5Y2xpbmctb2YtcGxhc3RpYy1ub3Qtc28tZmFudGFzdGljLXJlcG9ydC1maW5kcy_SAQA?oc=5	The article discusses chemical recycling as a potential solution to plastic waste problems, highlighting concerns about its environmental impact, potential risks, and lack of proven success.	FALSE - While chemical recycling aims to address environmental issues, the article raises doubts about its effectiveness and environmental impact, hence not qualifying as a clear example of green innovation.	FALSE - The article focuses on chemical recycling processes and their challenges, rather than introducing new products or processes that significantly differ from previous ones, hence not aligning with the definition of business innovation.	FALSE - Although the article mentions the use of materials and processes in plastic recycling to minimize negative impacts, the discussion points more towards the limitations and risks of chemical recycling rather than highlighting a specific green product.	TRUE - The article emphasizes the importance of green processes in the context of chemical recycling, focusing on methods to minimize environmental impacts and promote sustainability.	Beyond Plastics and IPEN	Beyond Plastics and International Pollutants Elimination Network (IPEN)	chemical recycling	Likely NAICS Codes: 562920 - Materials Recovery Facilities, 562998 - All Other Miscellaneous Waste Management Services, 325199 - All Other Basic Organic Chemical Manufacturing, 325193 - Ethyl Alcohol Manufacturing	TRUE - The article raises concerns about how chemical recycling might be perceived as a green solution while highlighting the risks, unproven claims, and potential negative environmental impacts associated with the process, thus indicating elements of greenwashing.	4131
Tonnes of cocoa in EU warehouses face being destroyed because of red tape regarding new deforestation law - ConfectioneryNews.com	https://news.google.com/rss/articles/CBMingFodHRwczovL3d3dy5jb25mZWN0aW9uZXJ5bmV3cy5jb20vQXJ0aWNsZS8yMDIzLzExLzI3L1Rvbm5lcy1vZi1jb2NvYS1pbi1FVS13YXJlaG91c2VzLWZhY2UtYmVpbmctZGVzdHJveWVkLWJlY2F1c2Utb2YtcmVkLXRhcGUtcmVnYXJkaW5nLW5ldy1kZWZvcmVzdGF0aW9uLWxhd9IBAA?oc=5	The article discusses new EU regulations on due diligence for deforestation-free and legal products to be placed on the market or exported, focusing on commodities like palm oil, cattle, soy, coffee, cocoa, timber, and rubber to reduce global deforestation and forest degradation.	TRUE. This is green innovation as it addresses environmental sustainability goals by aiming to reduce deforestation, minimize negative environmental impacts, and promote sustainability in agricultural practices.	FALSE. The article focuses more on regulatory and due diligence requirements for products and commodities, rather than new or significantly improved business products or processes.	FALSE. The article does not specifically mention a product or service that significantly reduces environmental impact throughout its life cycle; rather, it emphasizes the compliance of commodities with deforestation-free and legal regulations.	TRUE. The article discusses methods and regulations aimed at minimizing environmental impacts, encouraging sustainable practices, and reducing deforestation, which align with the definition of green processes.	company not identified	N/A	product or process not identified	Likely NAICS Codes: 112, 113, 114, 115 - Agricultural, Forestry, Fishing, and Hunting Industries	FALSE. The article focuses on regulations to combat deforestation and promote sustainable practices rather than making false or misleading environmental claims.	1903
Second Vegan BILLA PFLANZILLA Store Opens in Austria Today - vegconomist - the vegan business magazine	https://news.google.com/rss/articles/CBMiUGh0dHBzOi8vdmVnY29ub21pc3QuY29tL3JldGFpbC1lLWNvbW1lcmNlL3NlY29uZC1iaWxsYS1wZmxhbnppbGxhLXN0b3JlLWF1c3RyaWEv0gEA?oc=5	A new plant-based store, BILLA PFLANZILLA, opened in Graz, Austria, offering a range of vegan products expanding on their successful store in Vienna, with a focus on environmentally friendly eating habits.	TRUE. This is a green innovation as it contributes to environmental sustainability goals by promoting plant-based eating habits and reducing greenhouse gas emissions.	TRUE. This is a business innovation as it introduces a new store concept focused on plant-based products, marking a significant change in the firm's product offering.	TRUE. This is a green product innovation as it involves the design, manufacture, and use of vegan products that significantly reduce environmental impact throughout their life cycle.	TRUE. This is a green process innovation as the operational activity of offering plant-based products aims to minimize environmental impacts and promote sustainability.	BILLA	BILLA	BILLA PFLANZILLA store	Likely NAICS Codes: 445110 - Supermarkets and Other Grocery (except Convenience) Stores, 722513 - Limited-Service Restaurants, 311999 - All Other Miscellaneous Food Manufacturing, 445210 - Meat Markets	FALSE. This initiative does not appear to be an example of greenwashing as it genuinely promotes plant-based consumption and environmental sustainability.	1767
Yara Launches New Biostimulants Brand - Agribusiness Global	https://news.google.com/rss/articles/CBMiZGh0dHBzOi8vd3d3LmFncmlidXNpbmVzc2dsb2JhbC5jb20vcGxhbnQtaGVhbHRoL2Jpb3N0aW11bGFudHMveWFyYS1sYXVuY2hlcy1uZXctYmlvc3RpbXVsYW50cy1icmFuZC_SAWhodHRwczovL3d3dy5hZ3JpYnVzaW5lc3NnbG9iYWwuY29tL3BsYW50LWhlYWx0aC9iaW9zdGltdWxhbnRzL3lhcmEtbGF1bmNoZXMtbmV3LWJpb3N0aW11bGFudHMtYnJhbmQvP2FtcA?oc=5	Yara launches YaraAmplix, a new brand of biostimulants, to help farmers increase crop resilience and nutrient use efficiency in response to extreme weather conditions globally. Yara's biostimulants are formulated with natural ingredients like seaweed and plant extracts to promote plant metabolism and performance, with plans for further product expansion and commercial rollout across various regions.	TRUE. This article describes the introduction of YaraAmplix biostimulants, which contribute to environmental sustainability by promoting regenerative agriculture and addressing climate, soil health, and resource conservation.	TRUE. Yara's launch of YaraAmplix biostimulants represents a new product innovation introduced on the market, aligning with the definition of business innovation.	TRUE. YaraAmplix biostimulants are designed with natural ingredients to reduce environmental impact throughout their life cycle, promoting plant health and crop productivity while minimizing negative externalities.	TRUE. The formulation and production process of YaraAmplix biostimulants aim to minimize environmental impacts by using sustainable ingredients and technologies, aligning with the principles of green processes.	Yara	Yara International ASA	YaraAmplix	Likely NAICS Codes: 325320 (Pesticide and Other Agricultural Chemical Manufacturing), 325188 (All Other Basic Inorganic Chemical Manufacturing), 325411 (Medicinal and Botanical Manufacturing)	FALSE. The article provides transparent information about Yara's biostimulants, highlighting their formulation, benefits, and plans for commercial rollout without misleading or exaggerated environmental claims.	2016
Burnbrae Farms launches free-range, solar-produced eggs - RealAgriculture	https://news.google.com/rss/articles/CBMiW2h0dHBzOi8vd3d3LnJlYWxhZ3JpY3VsdHVyZS5jb20vMjAyMy8xMS9idXJuYnJhZS1mYXJtcy1sYXVuY2hlcy1lZ2dzLWZyZWUtcmFuZ2Utc29sYXItZWdncy_SAQA?oc=5	Burnbrae Farms introduces new specialty egg offerings produced at a solar-powered farm, aiming to reduce greenhouse gas emissions and electricity consumption. The Naturegg Solar Free Range and Nature Omega Plus Solar Free Range eggs are part of their sustainability efforts.	TRUE - The company is launching specialty offerings produced at a solar-powered farm to reduce greenhouse gas emissions, aligning with environmental sustainability goals.	TRUE - Burnbrae Farms is introducing new specialty egg offerings which significantly differ from their previous products, showcasing a business innovation.	TRUE - The Naturegg Solar Free Range and Nature Omega Plus Solar Free Range eggs are designed, manufactured, and used in a way that reduces environmental impact throughout their lifecycle.	TRUE - The solar-powered farm and sustainable farming practices used to produce the new egg offerings minimize environmental impacts and promote sustainability.	Burnbrae Farms	Burnbrae Farms	Naturegg Solar Free Range and Nature Omega Plus Solar Free Range eggs	Likely NAICS Codes: 112310 - Chicken Egg Production, 112320 - Egg Production, 112340 - Poultry Hatcheries, 311999 - All Other Miscellaneous Food Manufacturing	FALSE - The company's efforts to reduce greenhouse gas emissions and promote sustainable farming practices align with their statements, indicating a genuine commitment to environmental responsibility.	1541
Plant-Based Fish: Nestlé Adds to Growing Vegan Seafood Sector - Green Queen Media	https://news.google.com/rss/articles/CBMiaGh0dHBzOi8vd3d3LmdyZWVucXVlZW4uY29tLmhrL25lc3RsZS1nYXJkZW4tZ291cm1ldC1oYXJ2ZXN0LXZlZ2FuLXdoaXRlLWZpc2gtcGxhbnQtYmFzZWQtc2VhZm9vZC1sYXVuY2gv0gEA?oc=5	Nestlé introduces new vegan white fish SKUs in Europe and Asia to meet the growing demand for sustainable proteins, emphasizing health and Nutri-score labels.	TRUE: The article discusses the introduction of new vegan white fish SKUs by Nestlé, which aligns with environmental sustainability goals by offering plant-based seafood products to reduce the environmental impact of traditional fish consumption.	FALSE: While the article mentions the introduction of new products by Nestlé, it does not focus on significant differences in the firm's previous products or processes, which are key aspects of business innovation.	TRUE: Nestlé's new vegan white fish SKUs are designed and manufactured to significantly reduce environmental impact throughout their life cycle by offering plant-based alternatives to traditional seafood products.	FALSE: The article does not specifically detail any new methods or techniques in manufacturing or production that minimize environmental impacts, which are essential characteristics of a green process.	Nestlé	Nestlé	Vegan white fish SKUs	Likely NAICS Codes: 311999 - All Other Miscellaneous Food Manufacturing, 311412 - Frozen Specialty Food Manufacturing, 311411 - Frozen Fruit, Juice, and Vegetable Manufacturing, 311419 - Frozen Food Manufacturing	FALSE: The article does not indicate any false or misleading statements about the environmental benefits of the product or practice; instead, it focuses on Nestlé's new vegan seafood products and their nutritional value.	2347
