title	link	summary	green_innovation	business_innovation	green_product	green_process	company	official_company_name	product_or_process	likely_naics_codes	greenwashing	total_tokens
Europe needs to listen to the unusual suspects - E3G	https://news.google.com/rss/articles/CBMiSGh0dHBzOi8vd3d3LmUzZy5vcmcvbmV3cy9ldXJvcGUtbmVlZHMtdG8tbGlzdGVuLXRvLXRoZS11bnVzdWFsLXN1c3BlY3RzL9IBAA?oc=5	The article discusses the need for Europe to transition to a prosperous and fair net-zero economy, emphasizing the importance of faster and bolder actions to achieve this goal.	TRUE: The article discusses the transition to a net-zero economy with a focus on clean technology, renewable energy resources, and decarbonization efforts, aligning with the definition of green innovation.	FALSE: The article does not primarily focus on specific products or business processes introduced by a firm; instead, it emphasizes policy changes, clean technology investments, and strategic decisions related to the transition to a net-zero economy.	FALSE: The article does not focus on the design, production, or use of a specific product that significantly reduces environmental impact throughout its lifecycle.	TRUE: The article discusses methods and strategies to minimize environmental impacts, promote sustainability, and transition to a cleaner economy, aligning with the definition of green processes.	company not identified	product_or_process not identified	product or process not identified	Likely NAICS Codes: 22 - Utilities, 23 - Construction, 54 - Professional, Scientific, and Technical Services, 92 - Public Administration	FALSE: The article does not contain any false or misleading environmental claims about a product or practice; it primarily focuses on the need for policy changes, clean technology investments, and strategic decisions for a net-zero transition.	4090
Cosmetic 360: “The green transition is an innovation challenge” - Premium beauty	https://news.google.com/rss/articles/CBMiTGh0dHBzOi8vd3d3LnByZW1pdW1iZWF1dHluZXdzLmNvbS9lbi9jb3NtZXRpYy0zNjAtdGhlLWdyZWVuLXRyYW5zaXRpb24sMjI3MTjSAQA?oc=5	The Cosmetic 360 show, organized by the Cosmetic Valley, focuses on Cleantech innovations in the cosmetics and perfume industry, featuring sessions on responsible consumption, packaging ecoresponsibility, decarbonation, and circular economy technologies. The event showcases a variety of innovative solutions and environmentally friendly practices, aiming to advance the industry's environmental protection efforts.	TRUE. The article discusses Cleantech innovations such as decarbonation, waste management, circular economy, and biomaterials in the cosmetics and perfume industry, highlighting their contribution to environmental protection and sustainability goals.	TRUE. The article talks about the introduction of new technologies and practices in the cosmetics and perfume industry, including responsible consumption patterns, ecoresponsible packaging, and the adoption of Cleantech solutions, demonstrating significant differences from previous approaches.	TRUE. The article discusses green products in the cosmetics and perfume industry that aim to reduce environmental impacts throughout their life cycle through the use of sustainable materials, energy-efficient production processes, and functionalities that support recycling and low environmental impact.	TRUE. The article highlights green processes in the cosmetics and perfume industry that focus on minimizing environmental impacts, reducing waste, conserving resources, and limiting the release of harmful substances, aligning with sustainability objectives.	Cosmetic Valley	Cosmetic Valley	product or process not identified	Likely NAICS Codes: 325620 - Toilet Preparation Manufacturing, 325620 - Perfume, Cosmetics, and Other Toilet Preparations Manufacturing, 541940 - Veterinary Services, 424210 - Drugs and Druggists' Sundries Merchant Wholesalers	FALSE. The article focuses on genuine efforts and initiatives within the cosmetics and perfume industry to promote environmental sustainability and Cleantech innovations, without deceptive or misleading claims of environmental benefits.	2383
Government of Canada announces $9.9 million to scale up B.C. technology businesses and improve productivity - Canada NewsWire	https://news.google.com/rss/articles/CBMingFodHRwczovL3d3dy5uZXdzd2lyZS5jYS9uZXdzLXJlbGVhc2VzL2dvdmVybm1lbnQtb2YtY2FuYWRhLWFubm91bmNlcy05LTktbWlsbGlvbi10by1zY2FsZS11cC1iLWMtdGVjaG5vbG9neS1idXNpbmVzc2VzLWFuZC1pbXByb3ZlLXByb2R1Y3Rpdml0eS04MTQwNDA5MjkuaHRtbNIBAA?oc=5	The Integrated Marketplace initiative in British Columbia connects local tech companies with large-scale organizations to pilot green solutions, supported by government funding.	TRUE, The Integrated Marketplace focuses on sustainable solutions that address business challenges and advance climate goals in real-world environments.	TRUE, The introduction of the Integrated Marketplace initiative in British Columbia is a new business process involving multiple technology companies and large-scale organizations to pilot green solutions.	TRUE, The article mentions the development of new products and services that reduce greenhouse gas emissions and operational impacts at sites like the Port of Vancouver and Vancouver International Airport.	TRUE, The article highlights the implementation of green technologies and solutions such as electrifying support vehicles and reducing diesel fuel consumption to decarbonize operations at transportation sites in British Columbia.	Pacific Economic Development Canada	Pacific Economic Development Canada	product or process not identified	Likely NAICS Codes: 926150, 926130, 926120, 926110	FALSE, The article does not exhibit greenwashing as it focuses on government funding to support and promote green innovations and sustainability in technology.	2695
Elemis partners with Morro to create upcycled single-use sachets for cosmetics - Premium beauty	https://news.google.com/rss/articles/CBMiSGh0dHBzOi8vd3d3LnByZW1pdW1iZWF1dHluZXdzLmNvbS9lbi9lbGVtaXMtcGFydG5lcnMtd2l0aC1tb3Jyby10bywyMjgyOdIBAA?oc=5	Elemis collaborates with Morro and Xampla to create bio-based film for plastic-free sachets, aiming to replace single-use plastics in skincare samples through upcycling leftover plant waste. Supported by grants, the initiative addresses challenges in recyclability and sustainability.	TRUE, The collaboration between Elemis, Morro, and Xampla to develop bio-based film for plastic-free sachets aligns with the definition of green innovation by aiming to reduce environmental impact and promote sustainability through upcycling and replacing single-use plastics with plant-based materials.	TRUE, Elemis' initiative to create bio-based film for plastic-free sachets can be considered a business innovation as it involves introducing a new product process combination that significantly differs from the company's previous products and processes, focusing on environmental sustainability goals.	TRUE, Elemis' development of plastic-free sachets using bio-based film from upcycled plant waste qualifies as a green product as it significantly reduces environmental impact throughout its life cycle by promoting sustainability, conserving natural resources, and minimizing waste and toxic substances.	TRUE, The process of creating bio-based film for plastic-free sachets through upcycling leftover plant waste and utilizing plant-based materials aligns with the definition of a green process as it aims to minimize environmental impacts, reduce waste, conserve resources, and limit the release of harmful substances.	Elemis	Elemis	bio-based film for plastic-free sachets	Likely NAICS Codes: 325620 - Toilet Preparation Manufacturing, 325998 - All Other Miscellaneous Chemical Product and Preparation Manufacturing, 325411 - Medicinal and Botanical Manufacturing, 325412 - Pharmaceutical Preparation Manufacturing	FALSE, The article does not appear to demonstrate greenwashing as Elemis' initiative with Morro and Xampla aims to genuinely address sustainability challenges in their packaging by leveraging bio-based materials and upcycling plant waste.	1842
CICE Funds Innovation to Advance the Measuring, Monitoring, and Verification (MMV) of Carbon Management - Canada NewsWire	https://news.google.com/rss/articles/CBMimAFodHRwczovL3d3dy5uZXdzd2lyZS5jYS9uZXdzLXJlbGVhc2VzL2NpY2UtZnVuZHMtaW5ub3ZhdGlvbi10by1hZHZhbmNlLXRoZS1tZWFzdXJpbmctbW9uaXRvcmluZy1hbmQtdmVyaWZpY2F0aW9uLW1tdi1vZi1jYXJib24tbWFuYWdlbWVudC04NDY3NjA2NzIuaHRtbNIBAA?oc=5	The B.C. Centre for Innovation and Clean Energy will provide $2.82 million in funding to support carbon emission reduction, removal, and avoidance projects by local clean energy innovators.	TRUE, The article describes funding for innovative solutions focused on decarbonization and emissions reduction, contributing to environmental sustainability goals.	FALSE, The article focuses on funding for clean energy solutions rather than new or improved products or business processes.	FALSE, The article does not specifically mention a green product as defined by reduced environmental impact throughout its life cycle.	TRUE, The article discusses the development of methods and technologies to assess and reduce carbon emissions, which align with the definition of green processes.	B.C. Centre for Innovation and Clean Energy	British Columbia Centre for Innovation and Clean Energy	product or process not identified	Likely NAICS Codes: 541715 - Research and Development in the Physical, Engineering, and Life Sciences, 541690 - Other Scientific and Technical Consulting Services, 562910 - Remediation Services, 237990 - Other Heavy and Civil Engineering Construction	FALSE, The article does not contain false or misleading information about the environmental benefits of the innovations mentioned; it focuses on funding real clean energy solutions.	2504
