title	link	summary	green_innovation	business_innovation	green_product	green_process	company	official_company_name	product_or_process	likely_naics_codes	greenwashing	total_tokens
Environmental Chemist	http://www.bing.com/news/apiclick.aspx?ref=FexRss&aid=&tid=667b5d073ddd47bfae539563ff596a2b&url=https%3a%2f%2fwww.purdue.edu%2fscience%2fcareers%2fwhat_can_i_do_with_a_major%2fCareer%2520Pages%2fenvironmental_chemist.html&c=12973979222863015297&mkt=en-us	Environmental chemists play a crucial role in designing pollution control and cleanup processes, aiding in chemical spill containment and cleaning, and contributing to pollution prevention efforts through green chemistry practices. They are involved in measuring chemical impacts, developing remediation systems, and promoting environmentally safer industrial processes. Educational requirements include a solid foundation in chemistry with interdisciplinary knowledge, and job opportunities exist in various sectors like the chemical industry, government agencies, and waste management companies, with an average salary of $73,518 in 2023.	TRUE. The article discusses how environmental chemists work on pollution control, cleanup processes, and pollution prevention through green chemistry practices, aligning with the concept of green innovation that aims to minimize environmental impacts and promote sustainability.	FALSE. While the article touches upon innovations in pollution control and cleanup processes, it does not focus on introducing new products or business processes significantly different from previous ones on the market.	FALSE. The article mentions the work of environmental chemists in designing pollution control systems and developing remediation processes, but it does not specifically highlight a product designed, manufactured, and used to significantly reduce environmental impact throughout its life cycle.	TRUE. The article highlights the role of environmental chemists in developing processes that minimize environmental impacts, such as pollution control systems, remediation processes, and green chemistry practices aimed at sustainability and pollution prevention.	company not identified	N/A	product or process not identified	Likely NAICS Codes: 541620 - Environmental Consulting Services, 562112 - Hazardous Waste Collection, 541714 - Research and Development in Biotechnology, 541380 - Testing Laboratories	FALSE. The article focuses on the genuine efforts of environmental chemists in pollution control, cleanup processes, and green chemistry practices, without presenting misleading or false claims about environmental benefits that would constitute greenwashing.	1877
International Journal of Pollution and Noise Control	http://www.bing.com/news/apiclick.aspx?ref=FexRss&aid=&tid=667b5d073ddd47bfae539563ff596a2b&url=https%3a%2f%2ffinance.yahoo.com%2fnews%2finternational-journal-pollution-noise-control-150200002.html&c=6382002534059923142&mkt=en-us	The 'International Journal of Pollution and Noise Control' journal has been added to ResearchAndMarkets.com's offering, focusing on advancements in pollution control.	FALSE This does not describe an innovation contributing to environmental sustainability goals.	FALSE This does not describe a new or improved product or business process.	FALSE This does not describe a good or service that significantly reduces its environmental impact throughout its lifecycle.	FALSE This does not describe a method in manufacturing, production, or operational activity that minimizes environmental impacts.	ResearchAndMarkets.com	Research and Markets	product or process not identified	Likely NAICS Codes: 	FALSE This article does not appear to be an example of greenwashing as it provides information about a journal in the pollution control field.	1427
The Next American Frontier	http://www.bing.com/news/apiclick.aspx?ref=FexRss&aid=&tid=667b5d073ddd47bfae539563ff596a2b&url=https%3a%2f%2fwww.theatlantic.com%2fpast%2fdocs%2fissues%2f83mar%2freich.htm&c=8269114544521621125&mkt=en-us	The article discusses the decline of American industrial productivity and the rise of paper entrepreneurialism, highlighting issues related to corporate structure, financial strategies, and human talent.	FALSE	TRUE	FALSE	FALSE	company not identified	product or process not identified	product or process not identified	Likely NAICS Codes: 	FALSE	14057
How Tata Steel is leading sustainability in the steel sector	http://www.bing.com/news/apiclick.aspx?ref=FexRss&aid=&tid=667b5d073ddd47bfae539563ff596a2b&url=https%3a%2f%2favenuemail.in%2fhow-tata-steel-is-leading-sustainability-in-the-steel-sector%2f&c=5405140777589256373&mkt=en-us	Tata Steel is being recognized in Sustainability Month for its commendable efforts in environmental sustainability, including reductions in specific freshwater consumption, dust emissions, and solid waste management, as well as initiatives in carbon footprint reduction, clean energy transition, biodiversity conservation, and industry recognition for sustainability practices.	TRUE. Tata Steel is making significant strides in environmental sustainability, including reducing environmental impacts, conserving resources, and transitioning to clean energy, meeting the criteria for green innovation.	TRUE. Tata Steel is implementing new processes and products to reduce its environmental impact and improve sustainability, leading to a significant departure from its previous operations and demonstrating business innovation.	TRUE. Tata Steel's initiatives, such as Tata Aggreto and Tata Nirman, focus on developing environmentally friendly products for various applications, meeting the criteria for green products.	TRUE. Tata Steel emphasizes green processes in its steel manufacturing operations, aiming to minimize environmental impacts through waste reduction, resource conservation, and sustainable practices.	Tata Steel	Tata Steel Limited	product or process not identified	Likely NAICS Codes: 331111 - Iron and Steel Mills, 562998 - All Other Miscellaneous Waste Management Services, 221111 - Hydroelectric Power Generation, 212210 - Iron Ore Mining	FALSE. The article highlights tangible efforts and achievements of Tata Steel in sustainability, backed by data and industry recognition, rather than engaging in deceptive or misleading environmental claims.	3185
Quality, Test & Measurement News	http://www.bing.com/news/apiclick.aspx?ref=FexRss&aid=&tid=667b5d073ddd47bfae539563ff596a2b&url=https%3a%2f%2fwww.globalspec.com%2fnewsletter%2fpub%2f100%2fquality-test-measurement&c=8285740011896809389&mkt=en-us	The article provides news and insights across a wide range of technology sectors, including telecommunications, acoustics, aerospace, renewable energy, automotive, and more.	FALSE	FALSE	TRUE	TRUE	company not identified	product or process not identified	product or process not identified	Likely NAICS Codes: 	FALSE	2986
Industrial Processing Equipment News	http://www.bing.com/news/apiclick.aspx?ref=FexRss&aid=&tid=667b5d073ddd47bfae539563ff596a2b&url=https%3a%2f%2fwww.globalspec.com%2fnewsletter%2fpub%2f53%2findustrial-processing-equipment&c=14798894341501915042&mkt=en-us	The article text discusses various innovations in different industrial sectors such as food and beverage heating, laser sensors, mining industry enhancements, and thermal processing.	FALSE: The article text does not specifically mention contributions to environmental sustainability goals or reducing negative environmental externalities.	TRUE: The article mentions different types of innovations in products and processes across various industries, which can be considered as business innovations.	FALSE: The article text does not explicitly describe products designed, manufactured, and used in a way that significantly reduces their environmental impact throughout their life cycle.	TRUE: The article text mentions process and product innovations aimed at ensuring safer, smarter, and more sustainable practices in the mining industry, which align with the definition of green processes.	company not identified	company not identified	product or process not identified	Likely NAICS Codes: 335999 - All Other Miscellaneous Electrical Equipment and Component Manufacturing, 333131 - Mining Machinery and Equipment Manufacturing, 541712 - Research and Development in the Physical, Engineering, and Life Sciences	FALSE: The article text focuses on discussing various innovations in different industrial sectors without making any false or misleading claims about environmental benefits.	2367
Nanocatalysts Global Strategic Research Report 2023-2024 & 2030 - Expanding Role of Renewable Fuels in the Global Energy Mix Reflects Opportunities - ResearchAndMarkets.com	http://www.bing.com/news/apiclick.aspx?ref=FexRss&aid=&tid=667b5d073ddd47bfae539563ff596a2b&url=https%3a%2f%2fwww.businesswire.com%2fnews%2fhome%2f20240614665097%2fen%2f&c=6732450236713219404&mkt=en-us	The article discusses the global market for Nanocatalysts, highlighting its estimated growth, applications, synthesis methods, and impact on industries like energy and environmental protection.	FALSE - Nanocatalysts, though beneficial for environmental protection and clean energy, are not primarily aimed at achieving broader environmental sustainability goals or reducing negative externalities of human activity as stated in the definition of green innovation.	TRUE - The article discusses Nanocatalysts as a business innovation due to their new and improved nature, differing significantly from previous products or processes, and being introduced to the market by firms.	FALSE - The article focuses on Nanocatalysts as a market product but does not address green product criteria such as sustainable production processes, environmental impact reduction throughout the life cycle, or conservation of resources.	TRUE - The article highlights Nanocatalysts as promoting sustainability by minimizing environmental impacts, reducing waste, conserving resources, and decreasing energy consumption through their application in various catalytic processes.	company identified	ResearchAndMarkets.com	Nanocatalysts	Likely NAICS Codes: 325120 - Industrial Gas Manufacturing, 325188 - All Other Basic Inorganic Chemical Manufacturing, 325199 - All Other Basic Organic Chemical Manufacturing, 541711 - Research and Development in Biotechnology	FALSE - The article does not exhibit greenwashing as it provides factual information about the market growth and applications of Nanocatalysts without making deceptive claims about their environmental benefits.	2883
Farmers concerned about ‘forever chemicals’ found in wastewater sludge	http://www.bing.com/news/apiclick.aspx?ref=FexRss&aid=&tid=667b5d073ddd47bfae539563ff596a2b&url=https%3a%2f%2fwww.newstribune.com%2fnews%2f2024%2fjun%2f07%2ffarmers-concerned-about-forever-chemicals-found%2f&c=17558565247860223588&mkt=en-us	The article discusses cases of PFAS contamination on farms due to the application of sewage sludge, leading to health risks and environmental damage. Farmers in various states have faced challenges and legal actions following PFAS contamination from sludge spreading. Maine and Texas are highlighted for their responses to impacted farmers and legal actions taken.	TRUE. The article discusses the environmental impacts of PFAS contamination due to the application of sewage sludge, highlighting the need for sustainable waste management practices that consider environmental sustainability goals.	FALSE. The article focuses on the environmental and health impacts of PFAS contamination from sewage sludge, rather than introducing new or improved products or processes in the market.	FALSE. The article does not specifically focus on a good or service that is designed, manufactured, and used in a way that significantly reduces its environmental impact throughout its life cycle.	TRUE. The article addresses the importance of green processes in manufacturing and agricultural activities to minimize environmental impacts and promote sustainability by reducing harmful substances' release into the environment.	company not identified	N/A	product or process not identified	Likely NAICS Codes: 111998 (All Other Miscellaneous Crop Farming), 115112 (Soil Preparation, Planting, and Cultivating), 115310 (Support Activities for Forestry), 92412 (Administration of Conservation Programs)	FALSE. The article highlights genuine concerns and challenges faced by farmers due to PFAS contamination from sewage sludge, rather than promoting false or misleading environmental claims.	3554
Top 50 Socially Responsible Companies 2013	http://www.bing.com/news/apiclick.aspx?ref=FexRss&aid=&tid=667b5d073ddd47bfae539563ff596a2b&url=https%3a%2f%2fmacleans.ca%2fcanada-top-50-socially-responsible-corporations-2013%2f&c=3724921621900435006&mkt=en-us	The article highlights the top 50 socially responsible companies in Canada across various industries, showcasing their initiatives in environmental sustainability, social responsibility, and corporate governance.	TRUE. The article focuses on companies implementing sustainability practices, renewable energy projects, and environmental commitments, aligning with the definition of green innovation.	TRUE. The article discusses how companies are driving social responsibility through novel products or processes, which align with the definition of business innovation.	TRUE. The article mentions companies offering sustainable insurance products, green savings premiums for electric cars, and initiatives to reduce environmental impact throughout the product lifecycle.	TRUE. The article discusses companies implementing methods to reduce environmental impacts, such as reducing greenhouse gas emissions, adopting sustainable practices, and promoting energy efficiency.	company not identified	company not identified	product or process not identified	Likely NAICS Codes: 522220 - Sales Financing, 523920 - Portfolio Management, 237130 - Power and Communication Line and Related Structures Construction, 334515 - Instrument Manufacturing for Measuring and Testing Electricity and Electrical Signals	FALSE. The article provides factual information about the sustainability initiatives and environmental practices of various companies, demonstrating a focus on true green innovations.	6212
