title	link	summary	green_innovation	business_innovation	green_product	green_process	company	official_company_name	product_or_process	likely_naics_codes	greenwashing	total_tokens
Eastman announces project success with USAMP, PADNOS and Yanfeng for fully circular recycling study in automotive ... - PR Newswire	https://news.google.com/rss/articles/CBMirwFodHRwczovL3d3dy5wcm5ld3N3aXJlLmNvbS9uZXdzLXJlbGVhc2VzL2Vhc3RtYW4tYW5ub3VuY2VzLXByb2plY3Qtc3VjY2Vzcy13aXRoLXVzYW1wLXBhZG5vcy1hbmQteWFuZmVuZy1mb3ItZnVsbHktY2lyY3VsYXItcmVjeWNsaW5nLXN0dWR5LWluLWF1dG9tb3RpdmUtbWFya2V0LTMwMTgwMTE3OC5odG1s0gEA?oc=5	Eastman announces successful completion of closed-loop recycling project for automotive mixed plastic waste in collaboration with USAMP, PADNOS, and Yanfeng, demonstrating the production of sustainable materials from shredding end-of-life vehicles.	TRUE. This initiative contributes to environmental sustainability goals by reducing waste, conserving natural resources, and creating a closed-loop recycling system for automotive plastic waste.	TRUE. The development of closed-loop technology for sustainable materials from automotive plastic waste represents a new business process for Eastman, USAMP, PADNOS, and Yanfeng.	TRUE. The project focuses on creating sustainable materials from automotive plastic waste, which aligns with the definition of a green product by significantly reducing environmental impact throughout the product life cycle.	TRUE. The closed-loop recycling project utilizes green processes by minimizing environmental impacts, reducing waste, and promoting sustainability in the automotive industry.	Eastman	Eastman Chemical Company	closed-loop recycling project for automotive mixed plastic waste	Likely NAICS Codes: 325211 - Plastics Material and Resin Manufacturing, 562920 - Materials Recovery Facilities, 326199 - All Other Plastics Product Manufacturing, 325998 - All Other Miscellaneous Chemical Product and Preparation Manufacturing	FALSE. The article describes a genuine effort of closed-loop recycling and sustainable material production from automotive plastic waste without any indication of false or exaggerated environmental claims.	2431
Why Earth Day 2023 Is A Big Deal For Brands And Consumers In China - Jing Daily	https://news.google.com/rss/articles/CBMiR2h0dHBzOi8vamluZ2RhaWx5LmNvbS9wb3N0cy9lYXJ0aC1kYXktMjAyMy1icmFuZHMtY29uc3VtZXJzLWNoaW5hLXByYWRh0gEA?oc=5	The article discusses various initiatives by different companies in China promoting sustainability around Earth Day, demonstrating commitments to environmental goals and consumer interests.	TRUE, The article highlights companies engaging in sustainable practices and promoting environmental initiatives, aligning with the concept of green innovation.	TRUE, The article mentions companies introducing new sustainability-driven products and business practices to cater to consumer demands, fitting the definition of business innovation.	TRUE, The article showcases brands developing eco-friendly products like recycled clothing, refillable beauty products, and low-carbon standards, aligning with the concept of green products.	TRUE, The article discusses companies implementing sustainable practices in their supply chains, production processes, and circular economy initiatives, illustrating green process practices.	company not identified	not found	product or process not identified	Likely NAICS Codes: 325620 - Toilet Preparation Manufacturing, 424210 - Drugs and Druggists' Sundries Merchant Wholesalers, 541613 - Marketing Consulting Services, 541690 - Other Scientific and Technical Consulting Services	FALSE, The article focuses on genuine sustainability efforts by various companies, including transparency in supply chains and sincere commitments to environmental and social responsibility.	2551
L'Oréal and Alibaba join hands in sustainable packaging campaign - Dao Insights	https://news.google.com/rss/articles/CBMiXWh0dHBzOi8vZGFvaW5zaWdodHMuY29tL25ld3MvbG9yZWFsLWFuZC1hbGliYWJhLWpvaW4taGFuZHMtaW4tc3VzdGFpbmFibGUtcGFja2FnaW5nLWNhbXBhaWduL9IBAA?oc=5	L’Oréal and Alibaba partner to drive sustainability in China's beauty industry through green and low-carbon standards and circular economy solutions.	TRUE - The collaboration between L’Oréal and Alibaba to establish green and low-carbon standards, develop new products, and create circular economy solutions for the beauty industry aligns with the concept of green innovation by promoting sustainability and reducing negative environmental impacts.	TRUE - L’Oréal and Alibaba’s partnership to introduce new green and low-carbon standards and products in the beauty industry qualifies as a business innovation as it represents a significant shift from their previous practices to incorporate more sustainable elements in their products and processes.	TRUE - The focus on developing new green and low-carbon products and improving product packaging to comply with L’Oréal’s 3R principles indicates a commitment to reducing environmental impact throughout the product lifecycle, aligning with the definition of a green product.	TRUE - The article discusses efforts by L’Oréal and Alibaba to make the beauty industry's supply chain greener, promote sustainability, and reduce waste through green processes, such as improving packaging, recycling, and adopting low-carbon standards.	L’Oréal	L'Oréal	product or process not identified	Likely NAICS Codes: 325620 - Toilet Preparation Manufacturing, 454111 - Electronic Shopping, 562111 - Solid Waste Collection, 562119 - Other Waste Collection	FALSE - The article showcases a genuine effort by L’Oréal and Alibaba to enhance sustainability in the beauty industry through tangible actions and partnerships, rather than engaging in greenwashing practices.	1645
L'Oréal And Alibaba To Tackle Beauty's Environmental Problem In China - Jing Daily	https://news.google.com/rss/articles/CBMiRmh0dHBzOi8vamluZ2RhaWx5LmNvbS9wb3N0cy9sb3JlYWwtYWxpYmFiYS1iZWF1dHktc3VzdGFpbmFiaWxpdHktY2hpbmHSAQA?oc=5	L’Oréal partners with Alibaba to make China’s beauty industry greener by establishing low-carbon standards, developing new products, and creating circular economy solutions. They aim to clean up the beauty sector supply chain and increase consumer education on sustainable lifestyles.	TRUE. This partnership between L’Oréal and Alibaba to promote sustainability in the beauty industry aligns with the concept of green innovation by addressing environmental impact and promoting circular economy solutions.	FALSE. While the partnership focuses on sustainability and new product development, it falls more under the realm of green innovation than business innovation as it emphasizes environmental impacts more than significant changes to business processes.	TRUE. The initiative to develop new green products and use environmentally friendly packaging aligns with the definition of green products, which aim to reduce environmental impact throughout their life cycle.	TRUE. The focus on establishing low-carbon standards, cleaning up the supply chain, and promoting sustainable consumption practices align with green process principles by minimizing environmental impacts and promoting sustainability.	L’Oréal	L'Oréal	product or process not identified	Likely NAICS Codes: 325620 - Toilet Preparation Manufacturing, 312120 - Breweries, 493110 - General Warehousing and Storage, 424610 - Plastics Materials and Basic Forms and Shapes Merchant Wholesalers	FALSE. The article does not exhibit greenwashing as it highlights genuine efforts by L’Oréal and Alibaba to make the beauty industry more sustainable and reduce its environmental impact.	1920
CS Tuiya invites Danish waste recyclers to invest in Kenya - The Star Kenya	https://news.google.com/rss/articles/CBMiZmh0dHBzOi8vd3d3LnRoZS1zdGFyLmNvLmtlL25ld3MvMjAyMy0wNC0yNy1jcy10dWl5YS1pbnZpdGVzLWRhbmlzaC13YXN0ZS1yZWN5Y2xlcnMtdG8taW52ZXN0LWluLWtlbnlhL9IBAA?oc=5	Kenya's Environment CS invited Danish waste recycling companies to invest in the country's emerging circular economy during the 2023 Loop Forum held in Copenhagen, Denmark. She assured the investors of government support and expressed interest in their circular economy solutions for Nairobi.	TRUE: The article describes an initiative focused on waste recycling and circular economy technologies, which align with environmental sustainability goals.	FALSE: The article focuses on environmental initiatives and waste recycling rather than introducing new products or processes within a firm's operations.	TRUE: The article highlights the promotion of green products and technologies that reduce environmental impact, such as waste recycling solutions.	TRUE: The article discusses methods and techniques aimed at minimizing environmental impacts, focusing on sustainable practices like circular economy technologies.	company not identified	company not identified	product or process not identified	Likely NAICS Codes: 562920 - Materials Recovery Facilities, 562998 - All Other Miscellaneous Waste Management Services, 562112 - Hazardous Waste Collection, and 562119 - Other Waste Collection	FALSE: The article does not exhibit signs of greenwashing, as it promotes legitimate partnership opportunities for waste recycling and circular economy initiatives.	1499
