title	link	summary	green_innovation	business_innovation	green_product	green_process	company	official_company_name	product_or_process	likely_naics_codes	greenwashing	total_tokens
Trending: Upcycled Cosmetics, Circular Beauty - Cosmetics & Toiletries	https://news.google.com/rss/articles/CBMiemh0dHBzOi8vd3d3LmNvc21ldGljc2FuZHRvaWxldHJpZXMuY29tL3Jlc2VhcmNoL2NvbnN1bWVycy1tYXJrZXQvbmV3cy8yMjg2MjE2Ni90cmVuZGluZy11cGN5Y2xlZC1jb3NtZXRpY3MtY2lyY3VsYXItYmVhdXR50gEA?oc=5	The article discusses the growth of upcycled cosmetic ingredients market due to sustainability trends and the introduction of various upcycled cosmetic products by different companies.	TRUE - The article discusses the introduction and growth of upcycled cosmetic ingredients market, which contributes to environmental sustainability by promoting the use of recycled materials in cosmetic products.	TRUE - The article talks about new or improved products and processes in the upcycled cosmetic ingredients market, introducing innovative approaches to utilizing waste materials in the production of cosmetics.	TRUE - The article describes upcycled cosmetic ingredients as goods designed and manufactured to significantly reduce environmental impact through the utilization of recycled materials and sustainable production processes.	TRUE - The article highlights green processes in the upcycled cosmetics industry that aim to minimize environmental impacts by reducing waste, conserving resources, and utilizing energy-efficient technologies.	The Upcycled Beauty Company	The Upcycled Beauty Company	Upcycled cosmetic ingredients	Likely NAICS Codes: 325620 - Toilet Preparation Manufacturing, 325411 - Medicinal and Botanical Manufacturing, 325992 - Photographic Film, Paper, Plate, and Chemical Manufacturing, 325611 - Soap and Other Detergent Manufacturing	FALSE - The article does not engage in greenwashing; it provides factual information about the use of upcycled cosmetic ingredients and their benefits.	2098
Sustainable side-stream management in Swedish food processing companies using external actors and biogas solutions - Frontiers	https://news.google.com/rss/articles/CBMiP2h0dHBzOi8vd3d3LmZyb250aWVyc2luLm9yZy9hcnRpY2xlcy8xMC4zMzg5L2ZyZnN0LjIwMjMuMTA3MzY2M9IBAA?oc=5	The article discusses how food processing companies manage their side-streams to improve sustainability performance by upcycling bio-residuals into high-value products. It highlights the preference for external partners over investing in innovative technology themselves and emphasizes the role of biogas solutions in side-stream management.	TRUE: The article aligns with the definition of green innovation as it focuses on improving sustainability in food processing companies through the management of side-streams and the utilization of biogas solutions.	FALSE: While the article discusses innovations within the food processing industry, the primary focus is on sustainability and waste management rather than traditional business innovations.	TRUE: The article addresses green products in the context of food processing companies managing side-streams, which involves the development of sustainable practices and the creation of high-value products from bio-residuals.	TRUE: The article emphasizes green processes by highlighting methods adopted by food processing companies to minimize environmental impacts, reduce waste, and promote sustainability, particularly through the use of biogas solutions in side-stream management.	company not identified	not found	product or process not identified	Likely NAICS Codes: 311119 - Other Animal Food Manufacturing, 562213 - Solid Waste Combustors and Incinerators, 562219 - Other Nonhazardous Waste Treatment and Disposal, 221119 - Other Electric Power Generation	FALSE: The article does not exhibit greenwashing as it focuses on genuine efforts by food processing companies to improve sustainability and manage side-streams in an environmentally responsible manner.	12086
Upcycling Initiatives Turn Railway Industry Waste Materials into Creative Products - The Japan News	https://news.google.com/rss/articles/CBMiRWh0dHBzOi8vamFwYW5uZXdzLnlvbWl1cmkuY28uanAvc29jaWV0eS9nZW5lcmFsLW5ld3MvMjAyMzA1MDEtMTA2ODk0L9IBAA?oc=5	The article discusses upcycling and recycling initiatives in the railroad industry, transforming discarded items into new products such as slippers, shoehorns, iron kettles, and more, which are attracting new fans and contributing to waste reduction and circular economy efforts.	TRUE. This is green innovation as it involves initiatives in the railroad industry that recycle and upcycle discarded items into new products, contributing to waste reduction and circular economy efforts.	TRUE. This is a business innovation as it involves the creation of new products and processes, such as slippers, shoehorns, and iron kettles, from discarded items in the railroad industry, introducing new goods to the market.	TRUE. This is a green product as it involves creating environmentally friendly goods like slippers made from recycled seat covers, shoehorns from worn overhead wires, and iron kettles from melted-down steel rails, focusing on reducing waste and promoting sustainability.	TRUE. This is a green process as it involves methods and techniques in the manufacturing and production of goods in the railroad industry that minimize environmental impacts, promote sustainability, reduce waste, conserve resources, and reuse materials.	company not identified	not found	product or process not identified	Likely NAICS Codes: 336510 Railroad Rolling Stock Manufacturing, 336390 Other Motor Vehicle Parts Manufacturing, 332999 All Other Miscellaneous Fabricated Metal Product Manufacturing, 339920 Sporting and Athletic Goods Manufacturing	FALSE. This text does not appear to be an example of greenwashing as it discusses genuine efforts by the railroad industry to create new products through upcycling and recycling initiatives, contributing to waste reduction and sustainability goals.	2428
Why the future of sustainable food in India is upcycling - FFOODS Spectrum - nuFFooDS Spectrum	https://news.google.com/rss/articles/CBMiZGh0dHBzOi8vbnVmZm9vZHNzcGVjdHJ1bS5pbi8yMDIzLzA1LzA5L3doeS10aGUtZnV0dXJlLW9mLXN1c3RhaW5hYmxlLWZvb2QtaW4taW5kaWEtaXMtdXBjeWNsaW5nLmh0bWzSAQA?oc=5	The article discusses the potential of upcycled food to reduce food waste and drive sustainability in India.	TRUE - The article describes how upcycled food promotes sustainability by reducing food waste and lowering environmental impact.	FALSE - The article focuses on sustainability and food waste reduction, rather than introducing new business processes or products.	TRUE - The article talks about upcycled food products, which are designed to significantly reduce environmental impact throughout their life cycle.	TRUE - The article mentions processes in the food industry that aim to minimize waste and reduce environmental impacts.	Nestlé	Nestlé	Upcycled food products	Likely NAICS Codes: 311999 - All Other Miscellaneous Food Manufacturing, 312130 - Wineries, 311230 - Breakfast Cereal Manufacturing, 311119 - Other Animal Food Manufacturing	FALSE - The article does not exhibit greenwashing as it focuses on genuine efforts to reduce food waste and promote sustainability.	2954
what design can do reveals the 13 winners of the make it circular challenge - Designboom	https://news.google.com/rss/articles/CBMiZmh0dHBzOi8vd3d3LmRlc2lnbmJvb20uY29tL2Rlc2lnbi93aGF0LWRlc2lnbi1jYW4tZG8tMTMtd2lubmVycy1tYWtlLWl0LWNpcmN1bGFyLWNoYWxsZW5nZS0wNS0xOC0yMDIzL9IBAA?oc=5	What Design Can Do announces the winners of the Make it Circular Challenge. Thirteen projects focusing on building a more circular society are chosen to receive awards and development training. Winners include initiatives like 'Guiding the Runoff,' 'Balena,' 'Nivogo,' and 'Alterist Marketplace.' Each project aims to promote sustainability and address environmental challenges.	TRUE: The Make it Circular Challenge by What Design Can Do, in partnership with the IKEA Foundation, identifies and supports innovative projects focused on developing circular economy solutions, which align with environmental sustainability goals.	TRUE: The Make it Circular Challenge introduces new strategies and projects for building a more circular society, involving innovative approaches to product design, recycling, and sustainable practices, thereby qualifying as business innovation.	TRUE: Initiatives like 'Balena,' which introduces a new type of bioplastic that is both durable and compostable, and 'Alterist Marketplace,' a platform for upcycled products, align with the definition of green products by significantly reducing environmental impacts throughout their life cycle.	TRUE: Projects such as 'Guiding the Runoff,' which focuses on adaptive reuse and urban renewal, and 'Resortecs,' developing solutions for textile disassembly and recycling, adhere to green process principles by minimizing environmental impacts, promoting sustainability, and reducing waste.	What Design Can Do	What Design Can Do	product or process not identified	Likely NAICS Codes: 541410 - Interior Design Services, 541430 - Graphic Design Services, 611710 - Educational Support Services, 611430 - Professional and Management Development Training	FALSE: The article highlights authentic projects recognized by What Design Can Do, emphasizing their impactful solutions for environmental challenges and promoting sustainability. There is no indication of false or misleading environmental claims, thus not constituting greenwashing.	2555
Tortilla chips category continues to grow - Snack Food & Wholesale Bakery	https://news.google.com/rss/articles/CBMiWGh0dHBzOi8vd3d3LnNuYWNrYW5kYmFrZXJ5LmNvbS9hcnRpY2xlcy8xMDkwNjItdG9ydGlsbGEtY2hpcHMtY2F0ZWdvcnktY29udGludWVzLXRvLWdyb3fSAQA?oc=5	The article discusses the increasing sales and trends in the tortilla chips category, with insights from industry experts and company representatives.	FALSE, The article discusses trends in the tortilla chips market and product innovations, but it does not primarily focus on environmental sustainability goals or reducing negative environmental externalities.	TRUE, The article discusses new product variations, flavors, and packaging strategies in the tortilla chips market, indicating innovations in the business processes of companies within the industry.	FALSE, While the article mentions product developments and trends in the tortilla chips market, it does not emphasize the environmental impact reduction strategies or sustainable practices associated with green products.	FALSE, The article mentions innovations in product formulations and flavors but does not provide detailed insights into operational activities that promote sustainability or minimize environmental impacts in manufacturing or production processes.	company not identified	company not identified	product or process not identified	Likely NAICS Codes: 311919 - Other Snack Food Manufacturing, 311821 - Cookie and Cracker Manufacturing, 722513 - Limited-Service Restaurants, 311130 - Dry Pasta, Dough, and Flour Mixes Manufacturing from Purchased Flour	FALSE, The article does not exhibit characteristics of greenwashing as it primarily focuses on discussing market trends, product innovations, and consumer preferences in the tortilla chips category without making false or exaggerated environmental claims.	5007
Q&A: Carbonwave expands seaweed emulsifier as demand grows - CosmeticsDesign.com USA	https://news.google.com/rss/articles/CBMibGh0dHBzOi8vd3d3LmNvc21ldGljc2Rlc2lnbi5jb20vQXJ0aWNsZS8yMDIzLzA1LzI0L1EtQS1DYXJib253YXZlLWV4cGFuZHMtc2Vhd2VlZC1lbXVsc2lmaWVyLWFzLWRlbWFuZC1ncm93c9IBAA?oc=5	Carbonwave received a $5 million investment to expand production of their seaweed-based cosmetic emulsifier, SeaBalance 2000, which has gained traction. The upcycling of Sargassum seaweed into this product presents a sustainable solution to an environmental issue, with potential for further innovation in the cosmetics industry.	TRUE. This innovation aligns with green principles by upcycling Sargassum into a sustainable cosmetic emulsifier, addressing environmental challenges and promoting sustainability.	TRUE. The introduction of SeaBalance 2000 as a novel cosmetic emulsifier represents a significant improvement in the firm's product offerings, showcasing a new approach to the market.	TRUE. SeaBalance 2000 qualifies as a green product as it is designed from upcycled Sargassum seaweed, contributing to environmental sustainability goals in its production and usage.	TRUE. The process of upcycling Sargassum seaweed to create SeaBalance 2000 demonstrates a green process by minimizing environmental impacts and promoting sustainability in cosmetic production.	Carbonwave	Carbonwave	SeaBalance 2000	Likely NAICS Codes: 325620 Toilet Preparation Manufacturing, 324110 Petroleum Refineries, 325411 Medicinal and Botanical Manufacturing, 325411 Pharmaceutical Preparation Manufacturing	FALSE. The description of SeaBalance 2000 and its development process aligns with genuine environmental considerations, without appearing to mislead about its sustainability impact.	2719
Singapore's Confetti Snacks in talks with Walmart and Target as collaboration with Dole and Disney lays on the horizon - FoodNavigator-Asia.com	https://news.google.com/rss/articles/CBMirAFodHRwczovL3d3dy5mb29kbmF2aWdhdG9yLWFzaWEuY29tL0FydGljbGUvMjAyMy8wNS8yNS9zaW5nYXBvcmUtcy1jb25mZXR0aS1zbmFja3MtaW4tdGFsa3Mtd2l0aC13YWxtYXJ0LWFuZC10YXJnZXQtYXMtY29sbGFib3JhdGlvbi13aXRoLWRvbGUtYW5kLWRpc25leS1sYXlzLW9uLXRoZS1ob3Jpem9u0gEA?oc=5	Confetti, a snack brand, is using upcycled 'ugly veggies' and surplus crops in their products while expanding their market presence in the US and Asia-Pacific region. They are exploring collaborations with other companies like Dole and Disney to introduce new product lines and packaging designs.	FALSE	TRUE	TRUE	TRUE	Confetti	Confetti	product or process not identified	Likely NAICS Codes: 311919 - Other Snack Food Manufacturing, 424440 - Grocery and Related Product Merchant Wholesalers, 311411 - Frozen Fruit, Juice, and Vegetable Manufacturing, 722513 - Limited-Service Restaurants	FALSE	1987
Tiger breaks beer-making boundaries to keep up with 'sessionable and accessible' drinking trends - FoodNavigator-Asia.com	https://news.google.com/rss/articles/CBMilAFodHRwczovL3d3dy5mb29kbmF2aWdhdG9yLWFzaWEuY29tL0FydGljbGUvMjAyMy8wNS8yOS9UaWdlci1icmVha3MtYmVlci1tYWtpbmctYm91bmRhcmllcy10by1rZWVwLXVwLXdpdGgtc2Vzc2lvbmFibGUtYW5kLWFjY2Vzc2libGUtZHJpbmtpbmctdHJlbmRz0gEA?oc=5	Tiger introduced Tiger Soju Infused Lager, inspired by Korean culture and catering to evolving drinking trends in Asia. The product comes in two flavors, with an easy-to-drink profile aimed at a wider consumer base. Tiger engaged South Korean artist G-DRAGON as its global brand ambassador and hosted an event to celebrate the product launch.	FALSE This innovation does not primarily focus on environmental sustainability goals, but rather on meeting evolving consumer preferences and market trends.	TRUE The introduction of Tiger Soju Infused Lager represents a new product innovation for Tiger that differs significantly from its previous offerings, catering to changing consumer preferences.	FALSE While the product emphasizes accessibility and a unique flavor profile, it does not align with the comprehensive definition of a green product that significantly reduces its environmental impact throughout its life cycle.	FALSE This article does not focus on the implementation of methods or techniques in manufacturing or production that minimize environmental impacts and promote sustainability.	Asia Pacific Breweries Singapore	Asia Pacific Breweries Limited	Tiger Soju Infused Lager	Likely NAICS Codes: 312120 Breweries, 312130 Wineries, 312140 Distilleries, 722410 Drinking Places (Alcoholic Beverages)	FALSE The article does not portray misleading environmental benefits of the product; instead, it focuses on consumer preferences, product innovation, and brand engagement.	2070
