title	link	summary	green_innovation	business_innovation	green_product	green_process	company	official_company_name	product_or_process	likely_naics_codes	greenwashing	total_tokens
IGI Wins $70 Million to Study Microbiome Engineering for Health, Climate Challenges - Genetic Engineering & Biotechnology News	https://news.google.com/rss/articles/CBMidmh0dHBzOi8vd3d3LmdlbmVuZ25ld3MuY29tL2luc2lnaHRzL2lnaS13aW5zLTcwLW1pbGxpb24tdG8tc3R1ZHktbWljcm9iaW9tZS1lbmdpbmVlcmluZy1mb3ItaGVhbHRoLWNsaW1hdGUtY2hhbGxlbmdlcy_SAQA?oc=5	A research initiative led by Jennifer Doudna and Jill Banfield aims to combine genome editing with microbiome research to address health and climate challenges. The project focuses on precision genome editing in microbiomes to develop new products for treating and preventing human diseases, as well as reducing greenhouse gas emissions.	TRUE - The research initiative aims to address health and climate challenges by combining genome editing with microbiome research, which aligns with goals of environmental sustainability and promoting human health benefits.	FALSE - The article focuses on a research initiative rather than a new or improved product or business process that differs significantly from previous offerings in the market.	FALSE - The article does not specifically mention the development or introduction of a new product that significantly reduces its environmental impact throughout its life cycle.	TRUE - The article discusses the use of green processes such as precision genome editing in microbiomes to reduce environmental impacts and promote sustainability in addressing health and climate challenges.	company not identified	product_or_process not identified	CRISPR genome editing and microbiome research	Likely NAICS Codes: 541711 - Research and Development in Biotechnology, 541712 - Research and Development in the Physical, Engineering, and Life Sciences, 54194 - Veterinary Services, 541715 - Research and Development in the Physical, Engineering, and Life Sciences (except Nanotechnology and Biotechnology)	FALSE - The article describes a legitimate research initiative combining genome editing with microbiome research to address health and climate challenges, without any indication of false or misleading information regarding environmental benefits.	3446
Danfoss Debuts New Line of Liquid-Cooled System Modules at the 2023 Mari-Tech Conference - Automation.com	https://news.google.com/rss/articles/CBMiY2h0dHBzOi8vd3d3LmF1dG9tYXRpb24uY29tL2VuLXVzL2FydGljbGVzL2FwcmlsLTIwMjMvZGFuZm9zcy1saW5lLWxpcXVpZC1jb29sZWQtc3lzdGVtLW1vZHVsZXMtbWFyadIBAA?oc=5	Danfoss introduces new iC7 Series liquid-cooled system modules at the Mari-Tech 2023 Conference in Vancouver, aimed at delivering superior performance with high power density and thermal management for industrial use, alongside showcasing the VACON NX Series driving decarbonization through electrification.	TRUE. This innovation introduces liquid-cooled system modules that aim to reduce energy consumption and emissions, contributing to environmental sustainability goals.	TRUE. The introduction of new iC7 Series liquid-cooled system modules represents a significant change in product offering by Danfoss, showcasing innovation in their market.	TRUE. The iC7 Series liquid-cooled system modules are designed to reduce energy consumption, promote sustainability with liquid-cooled thermal management, and offer environmentally friendly operations.	TRUE. The introduction of liquid-cooled system modules by Danfoss signifies a green process that aims to minimize environmental impacts by reducing energy consumption and emissions in industrial operations.	Danfoss	Danfoss Group	iC7 Series liquid-cooled system modules	Likely NAICS Codes: 335313 - Switchgear and Switchboard Apparatus Manufacturing, 335314 - Relay and Industrial Control Manufacturing, 335999 - All Other Miscellaneous Electrical Equipment and Component Manufacturing, 334419 - Other Electronic Component Manufacturing	FALSE. The article clearly outlines the environmental benefits and sustainability aspects of the new liquid-cooled system modules without misleading or false information.	2152
To all those lab meat skeptics: Please, just stay out of the way - The Japan Times	https://news.google.com/rss/articles/CBMiW2h0dHBzOi8vd3d3LmphcGFudGltZXMuY28uanAvb3Bpbmlvbi8yMDIzLzA0LzIxL2NvbW1lbnRhcnkvd29ybGQtY29tbWVudGFyeS9sYWItZ3Jvd24tbWVhdC_SAQA?oc=5	The article discusses Italy's proposed ban on lab-grown meats, attracting both support and opposition, akin to the GMO debate and potentially hindering technological progress in cellular agriculture.	TRUE, The article discusses a potential ban on lab-grown meats, which aligns with green innovation through the promotion of sustainable agricultural practices and environmentally friendly food production methods.	FALSE, The article does not primarily focus on a new or improved product or business process, but rather on the debate around banning lab-grown meats.	FALSE, The article does mention lab-grown meats, but it does not delve into the detailed design, manufacturing process, or environmental impact of these products to classify them as green products.	FALSE, The article does not focus on a specific method or technique in manufacturing, production, or operational activity that minimizes environmental impacts.	company not identified	company not identified	product or process not identified	Likely NAICS Codes: 112330 - Turkey Production, 112410 - Sheep Farming, 112990 - All Other Animal Production, 325411 - Medicinal and Botanical Manufacturing	FALSE, The article does not promote false or misleading environmental claims but rather discusses the potential ban on lab-grown meats and the impact on technological progress.	1397
Why is recycling so important? The dirty truth behind our trash - ZME Science	https://news.google.com/rss/articles/CBMieGh0dHBzOi8vd3d3LnptZXNjaWVuY2UuY29tL2ZlYXR1cmUtcG9zdC90ZWNobm9sb2d5LWFydGljbGVzL3N1c3RhaW5hYmlsaXR5L2dyZWVuLWxpdmluZy0xL3doeS1pcy1yZWN5Y2xpbmctc28taW1wb3J0YW50L9IBAA?oc=5	The article discusses the benefits of recycling in reducing waste, conserving resources, creating jobs, and protecting the environment.	FALSE. The article does not introduce significantly new or improved products or processes that differ from previous offerings.	FALSE. The article focuses on recycling practices rather than new or significantly improved products or processes.	TRUE. The article highlights the benefits of using recycled materials, reducing waste, conserving resources, and enhancing environmental sustainability.	TRUE. The article discusses methods in recycling that minimize environmental impacts, conserve resources, and promote sustainability.	company not identified	product or process not identified	Recycling	Likely NAICS Codes: 562920 - Materials Recovery Facilities, 562998 - All Other Miscellaneous Waste Management Services, 562111 - Solid Waste Collection, 562119 - Other Waste Collection	FALSE. The article focuses on the genuine benefits and importance of recycling, rather than misleading environmental claims.	3242
Float Foods Launches Asia's First Plant-Based Poached Egg & Egg Yolk for Food Service - vegconomist - the vegan business magazine	https://news.google.com/rss/articles/CBMiV2h0dHBzOi8vdmVnY29ub21pc3QuY29tL3Byb2R1Y3RzLWxhdW5jaGVzL2Zsb2F0LWZvb2RzLXBsYW50LWJhc2VkLXBvYWNoZWQtZWdnLWVnZy15b2xrL9IBAA?oc=5	Float Foods is launching plant-based alternatives to eggs, claimed to be Asia's first plant-based poached egg and egg yolk. The products aim to provide sustainable and nutritious food options to address the environmental impact of egg production.	TRUE. This innovation aims to reduce the environmental impact of egg production, contributing to environmental sustainability goals.	TRUE. Float Foods is introducing new plant-based egg products in the market, differing significantly from traditional egg products.	TRUE. The plant-based egg products by Float Foods are designed to significantly reduce the environmental impact throughout their life cycle, promoting ecological and human health benefits.	TRUE. Float Foods' innovative method of producing plant-based egg products minimizes environmental impacts by reducing waste, conserving resources, and promoting sustainability.	Float Foods	Float Foods	plant-based poached egg and egg yolk	Likely NAICS Codes: 311999 - All Other Miscellaneous Food Manufacturing, 311991 - Perishable Prepared Food Manufacturing, 325414 - Biological Product (except Diagnostic) Manufacturing, 311999 - All Other Miscellaneous Food Manufacturing	FALSE. The article does not indicate any false or misleading environmental claims about the product or process innovation.	1810
California approves phase-out of large diesel-powered trucks - Vijesti.me	https://news.google.com/rss/articles/CBMiXmh0dHBzOi8vZW4udmlqZXN0aS5tZS93b3JsZC9nbG9idXMvNjU0NDM4L0NhbGlmb3JuaWEtYXBwcm92ZXMtcGhhc2Utb3V0LW9mLWxhcmdlLWRpZXNlbC10cnVja3PSAVVodHRwczovL2VuLnZpamVzdGkubWUvYW1wLzY1NDQzOC9DYWxpZm9ybmlhLWFwcHJvdmVzLXBoYXNlLW91dC1vZi1sYXJnZS1kaWVzZWwtdHJ1Y2tz?oc=5	California approves a rule to ban the sale of new diesel-powered tow trucks and buses by 2036 to combat climate change and transition to zero-emission vehicles in the transportation sector. The state aims to achieve carbon neutrality by 2045 and implement stricter regulations on vehicle emissions to improve air quality and reduce pollution.	TRUE, The article describes California's new rule to phase out diesel-powered vehicles and transition to zero-emission vehicles in the transportation sector, which aligns with environmental sustainability goals and aims to reduce harmful emissions and combat climate change.	FALSE, The article focuses on regulatory changes and environmental policies rather than introducing new products or business processes by a firm.	FALSE, The article discusses regulatory changes and emission standards for vehicles, focusing on the transition to zero-emission transportation, rather than a specific green product.	FALSE, The article mentions transitioning to zero-emission technologies and phasing out diesel-powered vehicles, which involves operational changes in the transportation sector, but it doesn't detail specific green processes within a manufacturing or production context.	company not identified	NA	product or process not identified	Likely NAICS Codes: 924110 - Administration of Air and Water Resource and Solid Waste Management Programs, 484110 - General Freight Trucking, Local, 336111 - Automobile Manufacturing, 336120 - Heavy Duty Truck Manufacturing	FALSE	2119
Offshore Wind Power Foundation | Offshore Wind Power Generation Business | New Products | Products & Services ... - jfe-eng.co.jp	https://news.google.com/rss/articles/CBMiNWh0dHBzOi8vd3d3LmpmZS1lbmcuY28uanAvZW4vcHJvZHVjdHMvbGlmZS9vd3AwMi5odG1s0gEA?oc=5	The article discusses the development of Japan's first monopile type foundation manufacturing plant for offshore wind turbines, aiming to contribute to the country's renewable energy goals by establishing a domestic manufacturing base for offshore wind turbine foundations.	FALSE	TRUE	TRUE	TRUE	JFE Group	JFE Holdings, Inc.	monopile type foundation manufacturing plant	Likely NAICS Codes: 333298 - All Other Industrial Machinery Manufacturing, 237130 - Power and Communication Line and Related Structures Construction, 221121 - Electric Bulk Power Transmission and Control, 221122 - Electric Power Distribution	FALSE	1477
Top 10 Best Specialty Chemicals Companies In Europe 2023 - Inventiva	https://news.google.com/rss/articles/CBMiS2h0dHBzOi8vd3d3LmludmVudGl2YS5jby5pbi90cmVuZHMvMTAtc3BlY2lhbHR5LWNoZW1pY2Fscy1jb21wLWV1cm9wZS0yMDIzL9IBAA?oc=5	The article discusses the specialty chemicals industry, highlighting the role of specialty chemicals in various sectors and the drivers for industry growth. It features the top 10 specialty chemicals companies in Europe in 2023, detailing their products, sustainability commitments, and global presence.	FALSE	TRUE	TRUE	TRUE	company	company not identified	product or process not identified	Likely NAICS Codes: 3251 - Basic Chemical Manufacturing, 32513 - Ethyl Alcohol Manufacturing, 32518 - Other Basic Inorganic Chemical Manufacturing, 32519 - Other Basic Organic Chemical Manufacturing	FALSE	4471
Top 10 Best Laundry Companies In Europe 2023 - Inventiva	https://news.google.com/rss/articles/CBMiRGh0dHBzOi8vd3d3LmludmVudGl2YS5jby5pbi90cmVuZHMvbGF1bmRyeS1jb21wYW5pZXMtaW4tZXVyb3BlLTIwMjMv0gEA?oc=5	The article lists the top laundry companies in Europe in 2021, highlighting their popularity, revenue, and customer satisfaction.	FALSE	TRUE	FALSE	FALSE	company identified	Unilever	product or process not identified	Likely NAICS Codes: 325611 - Soap and Other Detergent Manufacturing, 325612 - Polish and Other Sanitation Good Manufacturing, 325613 - Surface Active Agent Manufacturing, 311225 - Fats and Oils Refining and Blending	FALSE	3840
