title	link	summary	green_innovation	business_innovation	green_product	green_process	company	official_company_name	product_or_process	likely_naics_codes	greenwashing	total_tokens
How to make climate finance work for everyone - World Economic Forum	https://news.google.com/rss/articles/CBMiUWh0dHBzOi8vd3d3LndlZm9ydW0ub3JnL2FnZW5kYS8yMDIzLzA2L2NsaW1hdGUtZGVjYXJib25pemF0aW9uLWZpbmFuY2UtZXF1aXRhYmxlL9IBAA?oc=5	The article emphasizes the need for scaling up and redesigning climate finance to prioritize green solutions, highlighting the importance of public sector intervention and private sector participation. It discusses the transition to a decarbonized economy to eradicate poverty, reduce inequality, and create decent employment opportunities.	TRUE, The article discusses innovations aimed at reducing negative environmental impacts, promoting sustainability, and addressing climate and biodiversity goals.	FALSE, The article focuses on climate finance, public sector interventions, and private sector participation rather than specific new products or business processes.	FALSE, The article discusses the need for green solutions and investments but does not focus on specific green products or their features.	FALSE, The article emphasizes financial aspects, public sector interventions, and policy measures rather than specific green processes in manufacturing or operations.	company not identified	N/A	product or process not identified	Likely NAICS Codes: 924110 - Administration of Air and Water Resource and Solid Waste Management Programs, 923110 - Administration of Conservation Programs, 926130 - Regulation and Administration of Communications, Electric, Gas, and Other Utilities, 926150 - Regulation, Licensing, and Inspection of Miscellaneous Commercial Sectors	FALSE, The article focuses on the importance of genuine climate finance, public and private sector contributions, and sustainability initiatives rather than engaging in deceptive marketing practices related to environmental benefits.	4150
Why CPG Leaders Must Reimagine Business Models | BCG - BCG	https://news.google.com/rss/articles/CBMiVGh0dHBzOi8vd3d3LmJjZy5jb20vcHVibGljYXRpb25zLzIwMjMvd2h5LWNwZy1sZWFkZXJzLW11c3QtcmVpbWFnaW5lLWJ1c2luZXNzLW1vZGVsc9IBAA?oc=5	The article discusses how CPG companies are not on track to meet their greenhouse gas emission reduction pledges by 2030 and emphasizes the importance of reimagining business models to achieve sustainability goals.	FALSE. The article addresses the need for businesses to meet their sustainability goals but does not focus on specific green innovations or technologies.	TRUE. The article highlights the need for CPG companies to innovate their business models to achieve sustainability goals, qualify as a business innovation.	FALSE. The article discusses the importance of sustainability and reducing environmental impact but does not focus on specific green products.	FALSE. While the article discusses the decarbonization efforts and sustainability transformations in the CPG industry, it does not focus on specific green processes.	company not identified	N/A	product or process not identified	Likely NAICS Codes: 325992, 312120, 325611, 551112	FALSE. The article does not mention any false or misleading information about the environmental benefits of a product or practice, so it is not an example of greenwashing.	2134
HYZON MOTORS, PERFORMANCE FOOD GROUP SIGN AGREEMENT FOR FUEL CELL TRUCKS - PR Newswire	https://news.google.com/rss/articles/CBMif2h0dHBzOi8vd3d3LnBybmV3c3dpcmUuY29tL25ld3MtcmVsZWFzZXMvaHl6b24tbW90b3JzLXBlcmZvcm1hbmNlLWZvb2QtZ3JvdXAtc2lnbi1hZ3JlZW1lbnQtZm9yLWZ1ZWwtY2VsbC10cnVja3MtMzAxODQ0NTg5Lmh0bWzSAQA?oc=5	Performance Food Group partners with Hyzon to introduce up to 50 hydrogen-powered trucks for decarbonization of operations.	TRUE: The partnership between Performance Food Group and Hyzon to introduce hydrogen-powered trucks aligns with decarbonization goals and promotes sustainability in transportation.	TRUE: The introduction of hydrogen-powered trucks by Performance Food Group utilizing Hyzon's technology represents a significant shift in their operational processes, making it a business innovation.	TRUE: The introduction of environmentally friendly hydrogen-powered trucks by Hyzon qualifies as a green product as it significantly reduces environmental impact throughout the product's life cycle.	TRUE: The utilization of Hyzon's fuel cell technology in manufacturing heavy-duty trucks demonstrates a green process that aims to minimize environmental impacts and promote sustainability.	Performance Food Group	Performance Food Group Company	product or process not identified	Likely NAICS Codes: 424210 - Wholesale Trade Agents and Brokers, 425110 - Business to Business Electronic Markets, 425120 - Wholesale Trade Services, 484110 - General Freight Trucking	FALSE: The article does not exhibit greenwashing as it provides factual information about the environmental benefits and technological advancements of the hydrogen-powered trucks.	2631
Tesla Of The Sea? How EV Tech Is Revolutionizing Boating - Markets Insider	https://news.google.com/rss/articles/CBMicmh0dHBzOi8vbWFya2V0cy5idXNpbmVzc2luc2lkZXIuY29tL25ld3Mvc3RvY2tzL3Rlc2xhLW9mLXRoZS1zZWEtaG93LWV2LXRlY2gtaXMtcmV2b2x1dGlvbml6aW5nLWJvYXRpbmctMTAzMjM2MjcwMdIBAA?oc=5	The article discusses Vision Marine Technologies Inc and its advancements in electric boats and batteries, positioning itself as a pioneer in the green revolution for the boating industry.	TRUE. The article focuses on Vision Marine Technologies Inc's advancements in electric boats and batteries, clearly contributing to environmental sustainability by introducing green technology into the boating industry.	TRUE. The article highlights Vision Marine Technologies Inc's development of the world’s most powerful marine electric motor, showcasing significant improvements in the company's product offerings and business processes.	TRUE. Vision Marine Technologies Inc's electric outboard motor and H2 Bowrider are designed to significantly reduce environmental impact by providing all-electric, high-performance boating options, aligning with the definition of a green product.	TRUE. The article discusses Vision Marine Technologies Inc's method of developing electric boats and batteries designed to minimize environmental impacts and promote sustainability, making it a green process.	Vision Marine Technologies Inc	Vision Marine Technologies Inc	product or process not identified	Likely NAICS Codes: 336612, 423860, 713930, 712130	FALSE. The article provides detailed information about Vision Marine Technologies Inc's advancements in green electric boating technology, which does not suggest any false or misleading claims typically associated with greenwashing.	5654
The Subduing Love for Coal! - TimesTech	https://news.google.com/rss/articles/CBMiMGh0dHBzOi8vdGltZXN0ZWNoLmluL3RoZS1zdWJkdWluZy1sb3ZlLWZvci1jb2FsL9IBAA?oc=5	The article discusses the global shift towards renewable energy, with an increase in electricity generation from renewables by 2025, influenced by factors like cost reduction, climate change concerns, and investor pressure. It also highlights the growth of nuclear energy and the role of carbon pricing mechanisms in mitigating emissions and driving investments in low-carbon technologies.	TRUE	FALSE	TRUE	TRUE	company not identified	N/A	product or process not identified	Likely NAICS Codes: 221114 - Solar Electric Power Generation, 221115 - Wind Electric Power Generation, 221116 - Geothermal Electric Power Generation, 221117 - Biomass Electric Power Generation	FALSE	3418
