title	link	summary	green_innovation	business_innovation	green_product	green_process	company	official_company_name	product_or_process	likely_naics_codes	greenwashing	total_tokens
Consumer Companies Must Innovate to Drive Impact on Climate - BCG	https://news.google.com/rss/articles/CBMicWh0dHBzOi8vd3d3LmJjZy5jb20vcHVibGljYXRpb25zLzIwMjMvY29uc3VtZXItY29tcGFuaWVzLW5lZWQtaW5ub3ZhdGl2ZS1jbGltYXRlLWNoYW5nZS1zb2x1dGlvbnMtdG8tZHJpdmUtaW1wYWN00gEA?oc=5	The article discusses the importance of incorporating sustainability and green innovations in the consumer packaged goods (CPG) sector to meet consumer demands and tackle climate concerns through innovative strategies and product development.	TRUE The article discusses sustainable innovations in the consumer packaged goods sector, addressing environmental concerns and the need for sustainable practices in product development and business strategies.	TRUE The article focuses on new product development and sustainability initiatives in the consumer packaged goods sector, highlighting the importance of innovative strategies to address environmental challenges and meet consumer demands.	TRUE The article emphasizes the development of greener products in the consumer packaged goods sector, promoting sustainable practices in product formulation, packaging, and overall environmental impact reduction.	TRUE The article highlights the importance of green processes in manufacturing and production within the consumer packaged goods sector, emphasizing the need to minimize environmental impacts and promote sustainability.	company not identified	not found	product or process not identified	Likely NAICS Codes: 311999 - All Other Miscellaneous Food Manufacturing, 325414 - Biological Product (except Diagnostic) Manufacturing, 325411 - Medicinal and Botanical Manufacturing, 333249 - Other Industrial Machinery Manufacturing	FALSE The article does not display any characteristics of greenwashing, as it focuses on genuine efforts towards sustainability and green innovation in the consumer packaged goods sector.	3770
Tennant Company Announces Net-Zero Greenhouse Gas Emissions Goals - CleanLink	https://news.google.com/rss/articles/CBMib2h0dHBzOi8vd3d3LmNsZWFubGluay5jb20vbmV3cy9hcnRpY2xlL1Rlbm5hbnQtQ29tcGFueS1Bbm5vdW5jZXMtTmV0LVplcm8tR3JlZW5ob3VzZS1HYXMtRW1pc3Npb25zLUdvYWxzLS0yOTY2MNIBAA?oc=5	Tennant Company aims to achieve net-zero greenhouse gas emissions by 2040 through various initiatives and collaborations, emphasizing sustainability across their operations and value chain.	TRUE. This is green innovation as Tennant Company is embarking on efforts to reduce their environmental impact and achieve net-zero greenhouse gas emissions.	TRUE. Tennant Company's initiatives to become net-zero by 2040 involve significant changes to their operations and value chain, positioning this as a business innovation.	TRUE. Tennant Company is introducing sustainable cleaning solutions and committing to reducing environmental impacts throughout the life cycle of its products, aligning with the definition of a green product.	TRUE. Tennant Company is implementing green processes to reduce waste, conserve resources, and limit harmful emissions, making their operations more environmentally friendly.	Tennant Company	Tennant Company	product or process not identified	Likely NAICS Codes: 561720 - Janitorial Services, 325612 - Polish and Other Sanitation Good Manufacturing, 333319 - Other Commercial and Service Industry Machinery Manufacturing, 562910 - Remediation Services	FALSE. The article does not exhibit greenwashing as Tennant Company's sustainability efforts appear to be genuine, with transparent goals and past initiatives supporting their commitment.	2069
Sustainability and ESG glossary: 52 terms to know - TechTarget	https://news.google.com/rss/articles/CBMiX2h0dHBzOi8vd3d3LnRlY2h0YXJnZXQuY29tL3N1c3RhaW5hYmlsaXR5L2ZlYXR1cmUvU3VzdGFpbmFiaWxpdHktYW5kLUVTRy1nbG9zc2FyeS1UZXJtcy10by1rbm930gEA?oc=5	The article discusses the importance of sustainability and ESG concepts for individuals, businesses, and governments to address climate disruption.	FALSE: The article does not provide a specific example of an innovation that contributes to environmental sustainability goals.	FALSE: The article focuses on sustainability and ESG concepts rather than new products or business processes.	FALSE: The article does not detail the design or features of a specific product that significantly reduces its environmental impact.	FALSE: The article does not mention any specific method or technique in manufacturing or operational activities that promote sustainability.	company not identified	N/A	product or process not identified	Likely NAICS Codes: N/A	FALSE: The article emphasizes the importance of understanding sustainability concepts without making false or misleading environmental claims.	1328
Sustainable aluminum: Decarbonizing at a cost that makes sense - McKinsey	https://news.google.com/rss/articles/CBMidmh0dHBzOi8vd3d3Lm1ja2luc2V5LmNvbS9pbmR1c3RyaWVzL21ldGFscy1hbmQtbWluaW5nL291ci1pbnNpZ2h0cy9hbHVtaW51bS1kZWNhcmJvbml6YXRpb24tYXQtYS1jb3N0LXRoYXQtbWFrZXMtc2Vuc2XSAQA?oc=5	The article discusses the importance of decarbonization in the aluminum industry and explores various green technologies and solutions to reduce greenhouse gas emissions.	TRUE. The article discusses the need for decarbonization in the aluminum industry, which aligns with the goal of reducing environmental impact.	FALSE. The focus of the article is on decarbonization and green technologies in the aluminum industry, rather than a new or significantly improved product or business process.	TRUE. The article explores the concept of producing low-carbon aluminum, which involves using sustainable production processes and environmentally friendly materials.	TRUE. The article discusses methods and technologies in the aluminum industry aimed at minimizing environmental impacts and promoting sustainability.	Mission Possible Partnership	Mission Possible Partnership	product or process not identified	Likely NAICS Codes: 331313 - Alumina Refining and Primary Aluminum Production, 331314 - Secondary Smelting and Alloying of Aluminum, 221112 - Fossil Fuel Electric Power Generation, 238220 - Plumbing, Heating, and Air-Conditioning Contractors	FALSE. The article does not contain any false or misleading environmental claims, instead focusing on real efforts and challenges in decarbonizing the aluminum industry.	3108
Md. taking tentative steps toward clean construction rules: 'How we buy things matters' - Maryland Matters	https://news.google.com/rss/articles/CBMie2h0dHBzOi8vbWFyeWxhbmRtYXR0ZXJzLm9yZy8yMDIzLzA0LzAzL21kLXRha2luZy10ZW50YXRpdmUtc3RlcHMtdG93YXJkLWNsZWFuLWNvbnN0cnVjdGlvbi1ydWxlcy1ob3ctd2UtYnV5LXRoaW5ncy1tYXR0ZXJzL9IBAA?oc=5	The article discusses Brad Hill's innovative method of producing cleaner cement using a natural thickener, which is environmentally friendly, cost-effective, and durable. It highlights the growing 'Buy Clean' movement in the construction industry, focusing on reducing carbon emissions through the use of low-carbon materials.	TRUE - This is a green innovation as it describes an innovative method that significantly reduces environmental pollutants in the concrete manufacturing process by eliminating the use of fossil fuels, contributing to climate-friendliness and sustainability.	TRUE - This is a business innovation as it introduces a new method for producing cement that is cleaner, more cost-effective, and durable, disrupting the traditional concrete manufacturing process.	TRUE - This is a green product innovation as the article describes the development of a method to create cleaner and greener cement, which aligns with the criteria of reducing environmental impact throughout its life cycle.	TRUE - This is a green process innovation as it details a method in the concrete manufacturing process that aims to minimize environmental impacts, reduce pollutants, and promote sustainability by using a natural thickener and avoiding the burning of fossil fuels.	Laurel Sand and Gravel	Laurel Sand and Gravel	product or process not identified	Likely NAICS Codes: 212312 - Crushed and Broken Limestone Mining and Quarrying, 327320 - Ready-Mix Concrete Manufacturing, 237310 - Highway, Street, and Bridge Construction, 327390 - Other Concrete Product Manufacturing	FALSE - The article does not exhibit greenwashing as it focuses on a genuine effort to reduce carbon emissions and promote environmentally friendly practices in the concrete manufacturing sector.	4256
How closed loop systems are key to a sustainable future - Chain Store Age	https://news.google.com/rss/articles/CBMiTGh0dHBzOi8vY2hhaW5zdG9yZWFnZS5jb20vaG93LWNsb3NlZC1sb29wLXN5c3RlbXMtYXJlLWtleS1zdXN0YWluYWJsZS1mdXR1cmXSAQA?oc=5	The article discusses the importance of sustainability, driven by consumer demand, and highlights closed-loop systems as a key solution to create a more sustainable future for the planet.	TRUE: The article emphasizes the importance of sustainability and closed-loop systems as a green innovation that contributes to environmental sustainability goals.	TRUE: The article mentions innovative business practices such as closed-loop systems, sustainable consumption, and production patterns, showcasing a business innovation in line with the company's activities.	TRUE: The article discusses the production and promotion of reusable products, closed-loop systems, and eco-friendly practices, aligning with the definition of green products and their positive environmental impacts.	TRUE: The article highlights the implementation of green processes, specifically closed-loop systems in manufacturing and production as a way to minimize environmental impacts and promote sustainability.	SodaStream	SodaStream	product or process not identified	Likely NAICS Codes: 312112 (Bottled Water Manufacturing), 312113 (Bottled Water Manufacturing), 325199 (All Other Basic Organic Chemical Manufacturing), 333243 (Soda Fountain Equipment Manufacturing)	FALSE: The article focuses on genuine efforts towards sustainability, closed-loop systems, and environmental responsibility, rather than misleading marketing practices.	2228
Introducing Coachtopia: A new world of circular craft from Coach. Powered by community, building towards a better ... - PR Newswire	https://news.google.com/rss/articles/CBMivAFodHRwczovL3d3dy5wcm5ld3N3aXJlLmNvbS9uZXdzLXJlbGVhc2VzL2ludHJvZHVjaW5nLWNvYWNodG9waWEtYS1uZXctd29ybGQtb2YtY2lyY3VsYXItY3JhZnQtZnJvbS1jb2FjaC1wb3dlcmVkLWJ5LWNvbW11bml0eS1idWlsZGluZy10b3dhcmRzLWEtYmV0dGVyLWZ1dHVyZS1mb3Itb3VyLXBsYW5ldC0zMDE4MDI2NDEuaHRtbNIBAA?oc=5	Coachtopia is introduced as a discovery lab and a collaborative platform by Coach. It aims to pioneer circularity in fashion and involve a community of Gen Z individuals in designing circular products using recycled and sustainable materials.	TRUE	TRUE	TRUE	TRUE	Coach	Coach, Inc.	Coachtopia	Likely NAICS Codes: 448190 - Other Clothing Stores, 448210 - Shoe Stores, 313310 - Textile and Fabric Finishing Mills, 316999 - All Other Leather Good Manufacturing	FALSE	5861
11 Effective Solutions for Food Waste - EARTH.ORG	https://news.google.com/rss/articles/CBMiK2h0dHBzOi8vZWFydGgub3JnL3NvbHV0aW9ucy1mb3ItZm9vZC13YXN0ZS_SAQA?oc=5	The article discusses the environmental impact of food waste and presents solutions for businesses, producers, retailers, and consumers to tackle this issue effectively.	FALSE - While the article discusses environmental issues related to food waste, it does not introduce new products, processes, or innovations aimed at green goals or sustainability.	FALSE - The article focuses on addressing food waste and sustainability issues but does not introduce new products or processes that significantly differ from previous practices in the business world.	FALSE - The article discusses the impact of food waste and possible solutions but does not specifically introduce a new product designed and manufactured to reduce environmental impact throughout its life cycle.	TRUE - The article highlights various processes and solutions aimed at minimizing environmental impacts, promoting sustainability, and reducing food waste throughout production, storage, and consumption stages.	company not identified	product_or_process not identified	food waste solutions	Likely NAICS Codes: 562920 - Materials Recovery Facilities, 722310 - Food Service Contractors, 424480 - Fresh Fruit and Vegetable Merchant Wholesalers, 311999 - All Other Miscellaneous Food Manufacturing	FALSE - The article does not display characteristics of greenwashing as it aims to raise awareness about food waste problems and suggest actual solutions rather than misleading environmental claims.	4142
Introducing the 2023 ENERGY STAR Award Winners | ProBuilder - Pro Builder	https://news.google.com/rss/articles/CBMiRWh0dHBzOi8vd3d3LnByb2J1aWxkZXIuY29tL2ludHJvZHVjaW5nLTIwMjMtZW5lcmd5LXN0YXItYXdhcmQtd2lubmVyc9IBAA?oc=5	The article highlights the ENERGY STAR awards program that recognizes companies and organizations for their contributions to energy efficiency and environmental protection.	TRUE. The ENERGY STAR awards program promotes energy efficiency, contributes to reducing greenhouse gas emissions, and supports environmental protection.	TRUE. The ENERGY STAR awards program recognizes companies for introducing energy-efficient products and practices, which differ significantly from their previous offerings.	TRUE. ENERGY STAR certified products are designed to significantly reduce energy consumption and environmental impact throughout their life cycle, promoting sustainability.	FALSE. While the article mentions energy-efficient practices and awards for environmental achievements, it does not specifically describe a method or technique in a manufacturing or operational activity.	ENERGY STAR	ENERGY STAR	product or process not identified	Likely NAICS Codes: 541620 - Environmental Consulting Services, 423930 - Recyclable Material Merchant Wholesalers, 236210 - Industrial Building Construction, 562910 - Remediation Services	FALSE. The article does not display characteristics of greenwashing; it focuses on the legitimate ENERGY STAR awards program and the positive environmental impact of certified products and practices.	5983
Fact-or-Myth: Bio-based, organic, biodegradable - Cordis News	https://news.google.com/rss/articles/CBMiVGh0dHBzOi8vY29yZGlzLmV1cm9wYS5ldS9hcnRpY2xlL2lkLzEyNTM5Ni1mYWN0b3JteXRoLWJpb2Jhc2VkLW9yZ2FuaWMtYmlvZGVncmFkYWJsZdIBAA?oc=5	The article clarifies the distinctions between bio-based, organic, and biodegradable terms, highlighting the complexity of environmental labeling in the context of sustainable materials and products.	TRUE: The article discusses the development and utilization of bio-based materials and products, emphasizing their environmental impacts and sustainability considerations, aligning with green innovation principles.	FALSE: The article focuses on the definition and characteristics of bio-based, organic, and biodegradable terms in relation to sustainable materials and products, rather than introducing new business processes or products.	FALSE: The article highlights the definitions and relationships between bio-based, organic, and biodegradable terms, but it does not explicitly discuss the design, manufacturing, and usage of products to reduce environmental impact throughout their lifecycle.	FALSE: While the article explains the concepts of bio-based, organic, and biodegradable terms, it does not specifically address methods or techniques in manufacturing, production, or operations that minimize environmental impacts.	company not identified	company name not provided	product or process not identified	Likely NAICS Codes: 326199 - All Other Plastics Product Manufacturing, 325211 - Plastics Material and Resin Manufacturing, 325998 - All Other Miscellaneous Chemical Product and Preparation Manufacturing, 325612 - Polish and Other Sanitation Good Manufacturing	FALSE: The article does not engage in greenwashing; instead, it provides educational content on the distinctions and complexities of bio-based, organic, and biodegradable terms in environmental labeling.	2116
These 8 Countries are Embracing Plant-Based Food for the Planet - VegNews	https://news.google.com/rss/articles/CBMiQ2h0dHBzOi8vdmVnbmV3cy5jb20vY291bnRyaWVzLWVtYnJhY2luZy1wbGFudC1iYXNlZC1mb29kLWZvci1wbGFuZXTSAQA?oc=5	The article discusses various government initiatives and investments in promoting plant-based diets as a solution for mitigating climate change on a larger scale.	TRUE The article discusses innovations that contribute to environmental sustainability goals through government actions promoting plant-based diets as a solution for climate change.	FALSE This article primarily focuses on government initiatives and investments rather than new products or business processes within a firm.	FALSE The article discusses government strategies and investments in promoting plant-based diets rather than a specific product meeting the criteria of a green product.	FALSE The article does not focus on specific methods or techniques in manufacturing or production that minimize environmental impacts.	company not identified	product or process not identified	product or process not identified	Likely NAICS Codes: 926130 - Regulation and Administration of Communications, Electric, Gas, and Other Utilities, 311999 - All Other Miscellaneous Food Manufacturing, 924110 - Administration of Air and Water Resource and Solid Waste Management Programs, 923130 - Administration of Human Resource Programs	FALSE This article does not exhibit greenwashing as it focuses on legitimate government actions and investments towards promoting plant-based diets for environmental sustainability.	3257
Exxon’s new ‘advanced recycling’ plant raises environmental concerns - The Guardian US	https://news.google.com/rss/articles/CBMiXGh0dHBzOi8vd3d3LnRoZWd1YXJkaWFuLmNvbS91cy1uZXdzLzIwMjMvYXByLzEwL2V4eG9uLWFkdmFuY2VkLXJlY3ljbGluZy1wbGFzdGljLWVudmlyb25tZW500gFcaHR0cHM6Ly9hbXAudGhlZ3VhcmRpYW4uY29tL3VzLW5ld3MvMjAyMy9hcHIvMTAvZXh4b24tYWR2YW5jZWQtcmVjeWNsaW5nLXBsYXN0aWMtZW52aXJvbm1lbnQ?oc=5	ExxonMobil launched a chemical recycling plant in Baytown, Texas, which environmental advocates criticize as a misleading solution to plastic waste, highlighting its environmental impacts and inefficiencies.	FALSE	TRUE	TRUE	FALSE	ExxonMobil	Exxon Mobil Corporation	chemical recycling plant	Likely NAICS Codes: 325110 (Petrochemical Manufacturing), 325131 (Inorganic Dye and Pigment Manufacturing), 325192 (Cyclic Crude, Intermediate, and Gum and Wood Chemical Manufacturing), 562112 (Hazardous Waste Collection)	FALSE	3171
Can you future-proof a refinery against climate change concerns? Shell thinks so - CBC.ca	https://news.google.com/rss/articles/CBMiTGh0dHBzOi8vd3d3LmNiYy5jYS9uZXdzL2NhbmFkYS9jYWxnYXJ5L2Jha3gtc2hlbGwtc2NvdGZvcmQtY2xpbWF0ZS0xLjY4MTQwNTjSASBodHRwczovL3d3dy5jYmMuY2EvYW1wLzEuNjgxNDA1OA?oc=5	Shell's Scotford industrial complex in Edmonton aims to become a low-carbon energy production facility, taking steps towards reducing emissions and producing low-carbon products.	TRUE. This is green innovation because Shell is taking steps to transform its refining operation into a low-carbon energy production facility, aligning with environmental sustainability goals.	TRUE. This is business innovation as Shell is introducing new processes and products to adapt to the changing environmental landscape.	TRUE. This is a green product innovation as Shell is working towards producing low-carbon products and reducing environmental impacts in its operations.	TRUE. The initiatives at Shell's Scotford facility to reduce emissions and promote sustainability qualify as green process innovations.	Shell	Royal Dutch Shell	product or process not identified	Likely NAICS Codes: 324110 - Petroleum Refineries, 219132 - Fossil Fuel Electric Power Generation, 481111 - Scheduled Passenger Air Transportation, 325110 - Petrochemical Manufacturing	FALSE. The article does not mention any false or misleading environmental claims; rather, it discusses tangible steps taken by Shell towards reducing emissions and transitioning to low-carbon energy production.	3061
Semiconductor Consulting & Strategy | BCG - BCG	https://news.google.com/rss/articles/CBMiUWh0dHBzOi8vd3d3LmJjZy5jb20vaW5kdXN0cmllcy90ZWNobm9sb2d5LW1lZGlhLXRlbGVjb21tdW5pY2F0aW9ucy9zZW1pY29uZHVjdG9yc9IBAA?oc=5	The article discusses the transformation of the sales and marketing organization at a semiconductor company, focusing on global customer service and regional team utilization to drive revenue growth.	FALSE	TRUE	FALSE	FALSE	semiconductor company	Official Company Name Not Available	product or process not identified	Likely NAICS Codes: 334413, 541613, 323111, 541810	FALSE	1209
12 New Staples Are Pushing Farms Into the Future with Vegan Milk, Meat, and Honey - VegNews	https://news.google.com/rss/articles/CBMiNWh0dHBzOi8vdmVnbmV3cy5jb20vZnV0dXJlLWZhcm0tdmVnYW4tbWlsay1tZWF0LWhvbmV50gEA?oc=5	The article discusses Future Farm, a company focused on creating plant-based products to replace animal-derived food items while promoting environmental sustainability.	TRUE. This is a green innovation because Future Farm is introducing plant-based products to reduce the environmental impact of traditional animal agriculture, thus aligning with goals related to conservation and sustainability.	TRUE. This is a business innovation as Future Farm is developing and introducing new plant-based products to the market, differing significantly from traditional animal-derived products.	TRUE. Future Farm's plant-based products are designed and manufactured to significantly reduce environmental impacts throughout their life cycles by promoting sustainable and eco-friendly alternatives to traditional meat products.	FALSE. The article primarily focuses on the product innovation of Future Farm and does not provide detailed information on the specific processes involved in their manufacturing. Thus, it does not clearly address green processes.	Future Farm	Future Farm	Future Burger, Future Meatball, Future Beef, Future Sausage, Future Chik'n, and Future Tuna	Likely NAICS Codes: 311999 - All Other Miscellaneous Food Manufacturing, 311612 - Meat Processed from Carcasses, 311111 - Dog and Cat Food Manufacturing, 311812 - Commercial Bakeries	FALSE. The article highlights Future Farm's genuine efforts to create sustainable plant-based products and promote environmental consciousness, rather than engaging in deceptive environmental marketing practices.	2442
Cummins Inc. and Tata Motors Strengthen Their 30-Year Alliance to Power a Cleaner India With Low- to Zero ... - businesswire.com	https://news.google.com/rss/articles/CBMi0AFodHRwczovL3d3dy5idXNpbmVzc3dpcmUuY29tL25ld3MvaG9tZS8yMDIzMDQyNjAwNTE1MS9lbi9DdW1taW5zLUluYy4tYW5kLVRhdGEtTW90b3JzLVN0cmVuZ3RoZW4tVGhlaXItMzAtWWVhci1BbGxpYW5jZS10by1Qb3dlci1hLUNsZWFuZXItSW5kaWEtV2l0aC1Mb3ctLXRvLVplcm8tRW1pc3Npb25zLVRlY2hub2xvZ2llcy1mb3ItTW9iaWxpdHktU29sdXRpb25z0gEA?oc=5	Cummins Inc. and Tata Motors have signed an agreement to manufacture low- to zero-emissions technology products in India. They have set up a new entity, TCPL Green Energy Solutions Private Limited, focusing on sustainable technology products including hydrogen-powered engines and battery electric systems for commercial vehicles in India.	TRUE. This initiative involves the development and manufacturing of sustainable technology products that aim to reduce greenhouse gas emissions, improve air quality, and support India's net-zero ambitions, aligning with the goals of green innovation.	TRUE. The agreement between Cummins Inc. and Tata Motors to manufacture low- to zero-emissions technology products in India represents a new business process that differs significantly from their previous products or processes, thus meeting the criteria of business innovation.	TRUE. The agreement aims to develop sustainable technology products, including hydrogen-powered engines, fuel delivery systems, and battery electric powertrains, which align with the definition of green products by significantly reducing environmental impact throughout their life cycles.	TRUE. The establishment of TCPL Green Energy Solutions Private Limited focusing on sustainable technology products and the development of low- to zero-emissions propulsion technology align with the definition of green processes by minimizing environmental impacts and promoting sustainability.	Cummins Inc. and Tata Motors	Cummins Inc.	product or process not identified	Likely NAICS Codes: 336120 - Heavy Duty Truck Manufacturing, 336111 - Automobile Manufacturing, 335312 - Motor and Generator Manufacturing, 221210 - Natural Gas Distribution	FALSE. The article describes a collaboration between Cummins Inc. and Tata Motors to develop and manufacture low- to zero-emissions technology products, showcasing a genuine effort towards sustainability rather than engaging in greenwashing.	2910
