title	link	summary	green_innovation	business_innovation	green_product	green_process	company	official_company_name	product_or_process	likely_naics_codes	greenwashing	total_tokens
Where rubber meets road - Resource Recycling	https://news.google.com/rss/articles/CBMiTGh0dHBzOi8vcmVzb3VyY2UtcmVjeWNsaW5nLmNvbS9yZWN5Y2xpbmcvMjAyMy8wOS8xOS93aGVyZS1ydWJiZXItbWVldHMtcm9hZC_SAUxodHRwczovL3Jlc291cmNlLXJlY3ljbGluZy5jb20vcmVjeWNsaW5nLzIwMjMvMDkvMTkvd2hlcmUtcnViYmVyLW1lZXRzLXJvYWQv?oc=5	The article discusses the development of a regional bicycle inner tube and tire recycling pilot in the Seattle region, aiming to divert hard-to-recycle materials from landfill through technical assistance to businesses and exploring recycling options for bike tubes and tires.	TRUE, The article describes an initiative that aims to reduce waste, improve recycling, and divert materials from landfills, aligning with environmental sustainability goals and contributing to a circular economy.	TRUE, The article focuses on the introduction of a new recycling pilot program for bike tubes and tires, differing significantly from previous processes and aiming to address waste reduction and recycling needs in the region.	TRUE, The article discusses the recycling of bike inner tubes and tires, which are designed to significantly reduce environmental impact by promoting recycling, reducing waste, and embracing a circular economy approach.	TRUE, The article outlines the green process of recycling bike tubes and tires to minimize environmental impacts, promote sustainability, reduce waste, and conserve resources while exploring innovative recycling options.	Full Circle Environmental	Full Circle Environmental	bicycle inner tube and tire recycling	Likely NAICS Codes: 562920 - Materials Recovery Facilities, 562111 - Solid Waste Collection, 562119 - Other Waste Collection, 562998 - All Other Miscellaneous Waste Management Services	FALSE, The article does not engage in greenwashing, as it focuses on real efforts to recycle bike tubes and tires, providing technical assistance to businesses and exploring viable recycling options to reduce waste and promote sustainability.	3749
Making the most of materials: Africa's skills in repair and repurposing point the way for the Global North - ellenmacarthurfoundation.org	https://news.google.com/rss/articles/CBMiTmh0dHBzOi8vd3d3LmVsbGVubWFjYXJ0aHVyZm91bmRhdGlvbi5vcmcvYXJ0aWNsZXMvbWFraW5nLXRoZS1tb3N0LW9mLW1hdGVyaWFsc9IBAA?oc=5	The article discusses repair and repurpose strategies in the circular economy, highlighting the economic benefits and environmental advantages of extending product lifecycles through repair and repurposing initiatives.	TRUE: The article promotes repair and repurposing strategies in the circular economy, which align with the principles of green innovation by reducing waste, promoting sustainability, and minimizing environmental impacts.	FALSE: The article focuses on repair and repurpose strategies within the circular economy domain, which pertains more to sustainability practices and resource optimization rather than traditional business innovations.	TRUE: The article emphasizes the importance of repair and repurpose initiatives in the circular economy to extend the life of products, reduce waste, and conserve resources, thereby aligning with the definition of green products.	TRUE: The article discusses green processes such as repair and repurpose strategies in the circular economy that aim to minimize environmental impacts, reduce waste, and promote sustainability in operational activities.	company not identified	company not identified	product or process not identified	Likely NAICS Codes: 562998 - All Other Miscellaneous Waste Management Services, 811412 - Appliance Repair and Maintenance, 562112 - Hazardous Waste Collection, 811490 - Other Personal and Household Goods Repair and Maintenance	FALSE: The article does not exhibit greenwashing as it authentically discusses the benefits of repair and repurpose strategies in the circular economy without making false or exaggerated environmental claims.	3483
Companies are claiming to be 'plastic neutral.' Is it greenwashing? - Grist	https://news.google.com/rss/articles/CBMiYWh0dHBzOi8vZ3Jpc3Qub3JnL2FjY291bnRhYmlsaXR5L2NvbXBhbmllcy1hcmUtY2xhaW1pbmctdG8tYmUtcGxhc3RpYy1uZXV0cmFsLWlzLWl0LWdyZWVud2FzaGluZy_SAQA?oc=5	Companies are purchasing plastic credits to claim 'plastic neutrality' by funding waste collection initiatives, a practice met with skepticism by some experts and environmental groups. The debate centers on whether these credits truly offset the impact of ongoing plastic production and usage. Concerns include the emphasis on managing rather than reducing plastic waste and the potential for greenwashing in the industry.	TRUE. This is green innovation as it addresses environmental sustainability goals by trying to reduce the negative environmental externalities of plastic production and usage through the concept of plastic neutrality.	FALSE. While the article discusses companies' strategies and practices related to plastic neutrality and waste collection activities, it does not primarily focus on introducing new or significantly improved products or business processes.	TRUE. The concept of 'plastic neutrality' and the use of plastic credits to fund waste collection initiatives align with the definition of green products in terms of reducing environmental impact throughout the product life cycle.	TRUE. The article discusses methods and techniques like waste collection initiatives and plastic credit programs that aim to minimize environmental impacts and promote sustainability, thus fitting the definition of green processes.	company identified	Grist	product or process not identified	Likely NAICS Codes: 541620 - Environmental Consulting Services, 562920 - Materials Recovery Facilities, 562998 - All Other Miscellaneous Waste Management Services, 562111 - Solid Waste Collection	TRUE. The article describes the practice of 'plastic neutrality' and the use of plastic credits, which can be perceived as greenwashing as it raises doubts about whether it effectively offsets the impact of plastic production without actual reduction efforts.	3799
The case for chemical recycling and mass balance accounting - BusinessGreen	https://news.google.com/rss/articles/CBMibWh0dHBzOi8vd3d3LmJ1c2luZXNzZ3JlZW4uY29tL3Nwb25zb3JlZC80MTI4MTM3L2Rvdy1iZy1lbmdhZ2UtY2FzZS1jaGVtaWNhbC1yZWN5Y2xpbmctbWFzcy1iYWxhbmNlLWFjY291bnRpbmfSAQA?oc=5	The article emphasizes the urgent need for action on climate change, plastic pollution, and resource conservation in the industry. It discusses the challenges faced by the plastics industry and highlights the importance of transitioning to a circular economy through innovations like chemical recycling and mass balance accounting.	TRUE. The article discusses innovations such as chemical recycling and mass balance accounting, which aim to reduce the environmental impact of plastic waste and promote sustainability in the industry.	TRUE. The article highlights the introduction of new processes like chemical recycling and mass balance accounting in the industry, indicating a significant departure from traditional practices.	TRUE. The article mentions the development of green products through sustainable packaging solutions and circular economy initiatives like recycled content targets for plastic packaging.	TRUE. The article discusses green processes such as chemical recycling, which aim to minimize environmental impacts and promote sustainability by recycling plastics back into raw materials.	Dow	The Dow Chemical Company	chemical recycling and mass balance accounting	Likely NAICS Codes: 325211 - Plastics Material and Resin Manufacturing, 562920 - Materials Recovery Facilities, 325998 - All Other Miscellaneous Chemical Product and Preparation Manufacturing, 333249 - Other Industrial Machinery Manufacturing	FALSE. The article does not exhibit greenwashing as it transparently discusses the industry's challenges and the need for genuine sustainability efforts like chemical recycling and mass balance accounting.	3110
Giants lead green packaging future - Vietnam Investment Review	https://news.google.com/rss/articles/CBMiQWh0dHBzOi8vdmlyLmNvbS52bi9naWFudHMtbGVhZC1ncmVlbi1wYWNrYWdpbmctZnV0dXJlLTEwNTM0My5odG1s0gEA?oc=5	The article discusses the growth and impacts of the food and packaging industries in Vietnam at the ProPak exhibition, highlighting the increase in recycling initiatives and sustainable practices by various companies in response to consumer demand and environmental regulations.	TRUE. The article discusses various companies investing in green and sustainable practices in response to environmental concerns, consumer demand, and regulatory requirements.	TRUE. The article mentions new technologies and equipment being showcased at the ProPak exhibition, indicating innovation in the packaging and food processing industries.	TRUE. The article highlights companies like Unilever and Nestlé implementing sustainable packaging practices, reducing plastic waste, improving recyclability, and promoting consumer awareness.	TRUE. The article discusses companies and initiatives focusing on reducing waste, conserving resources, and implementing recycling programs in their production processes.	company identified	Informa Markets Vietnam	product or process not identified	Likely NAICS Codes: 3121, 3222, 3254, 5629	FALSE. The article highlights real efforts and investments made by companies towards sustainable and green practices, demonstrating a genuine commitment rather than greenwashing.	3265
Products | UK Regulatory Outlook September 2023 - Osborne Clarke - Osborne Clarke	https://news.google.com/rss/articles/CBMiUWh0dHBzOi8vd3d3Lm9zYm9ybmVjbGFya2UuY29tL2luc2lnaHRzL3JlZ3VsYXRvcnktb3V0bG9vay1zZXB0ZW1iZXItMjAyMy1wcm9kdWN0c9IBAA?oc=5	The UK government announced an extension of CE marking recognition and launched consultations on product safety regulatory frameworks. The government also introduced guidelines for an Innovative Devices Access Pathway pilot scheme and enacted regulations on product security and telecommunication infrastructure, toy safety, single-use plastics ban, sustainable batteries, and energy labelling rules for smartphones and tablets.	FALSE	TRUE	FALSE	TRUE	company not identified	company not identified	product or process not identified	Likely NAICS Codes: 926150 - Regulation and Administration of Communications, Electric, Gas, and Other Utilities, 423990 - Other Miscellaneous Durable Goods Merchant Wholesalers, 541611 - Administrative Management and General Management Consulting Services, 339113 - Surgical Appliance and Supplies Manufacturing	FALSE	3778
Waste from electrical and electronic equipment - Malta Independent Online	https://news.google.com/rss/articles/CBMiemh0dHBzOi8vd3d3LmluZGVwZW5kZW50LmNvbS5tdC9hcnRpY2xlcy8yMDIzLTA5LTAzL2J1c2luZXNzLW5ld3MvV2FzdGUtZnJvbS1lbGVjdHJpY2FsLWFuZC1lbGVjdHJvbmljLWVxdWlwbWVudC02NzM2MjU0NzY20gEA?oc=5	The article discusses the environmental concerns surrounding Waste from Electrical and Electronic Equipment (WEEE) in Malta, along with the regulations and initiatives in place to manage and recycle e-waste.	FALSE, The article focuses on waste management regulations and sustainable practices for handling electronic waste, but it does not introduce any new or significantly improved products or processes that differ from previous innovations.	FALSE, The article primarily addresses environmental regulations and waste management practices related to electronic waste, rather than introducing new or significantly improved products or business processes.	TRUE, The article discusses the concept of Waste from Electrical and Electronic Equipment (WEEE) and highlights the importance of recycling and managing electronic waste to reduce environmental impacts. This aligns with the definition of green products.	FALSE, The article highlights waste management initiatives for electrical and electronic waste, focusing on recycling practices and environmental regulations rather than describing specific methods or techniques in manufacturing or production processes.	company not identified	product or process not identified	product or process not identified	Likely NAICS Codes: 562920 - Materials Recovery Facilities, 562111 - Solid Waste Collection, 541620 - Environmental Consulting Services, 541620 - Environmental Consulting Services	FALSE, The article focuses on discussing legitimate environmental concerns, waste management regulations, and sustainable practices for handling electronic waste in Malta, without making false or misleading claims about environmental benefits.	2638
