title	link	summary	green_innovation	business_innovation	green_product	green_process	company	official_company_name	product_or_process	likely_naics_codes	greenwashing	total_tokens
Senator Kavanagh's Carpet Recycling Bill Signed Into Law - The New York State Senate	https://news.google.com/rss/articles/CBMid2h0dHBzOi8vd3d3Lm55c2VuYXRlLmdvdi9uZXdzcm9vbS9wcmVzcy1yZWxlYXNlcy8yMDIzL2JyaWFuLWthdmFuYWdoL3NlbmF0b3Ita2F2YW5hZ2hzLWNhcnBldC1yZWN5Y2xpbmctYmlsbC1zaWduZWQtbGF30gEA?oc=5	New York State passed a Carpet EPR bill requiring carpet manufacturers to establish a program for recycling discarded carpet, setting recycling performance goals and prohibiting hazardous chemicals in carpets from 2026 onwards.	TRUE - This initiative aligns with environmental sustainability goals by reducing waste, promoting circular economy principles, and protecting human health and the environment through extended producer responsibility for carpet recycling.	FALSE - The focus of the article is on environmental regulations and recycling programs rather than a new or improved product or business process being introduced on the market.	TRUE - The article discusses the implementation of a program to recycle discarded carpet, which aligns with the definition of a green product by significantly reducing its environmental impact throughout its life cycle.	TRUE - The implementation of carpet recycling programs and performance goals in the article signifies a green process that minimizes environmental impacts in the manufacturing and disposal of carpets.	company not identified	not found	product or process not identified	Likely NAICS Codes: 561720 - Janitorial Services, 562920 - Materials Recovery Facilities, 562998 - All Other Miscellaneous Waste Management Services, 325211 - Plastics Material and Resin Manufacturing	FALSE - The article does not exhibit signs of greenwashing, as it focuses on genuine efforts to improve recycling practices and reduce harmful substances in carpets, backed by legislative actions and environmental advocacy.	2714
Hundreds of undersized lobsters found in New York City supermarkets - SeafoodSource	https://news.google.com/rss/articles/CBMic2h0dHBzOi8vd3d3LnNlYWZvb2Rzb3VyY2UuY29tL25ld3Mvc3VwcGx5LXRyYWRlL2h1bmRyZWRzLW9mLXVuZGVyc2l6ZWQtbG9ic3RlcnMtZm91bmQtaW4tbmV3LXlvcmstY2l0eS1zdXBlcm1hcmtldHPSAQA?oc=5	The New York State Department of Environmental Conservation found hundreds of undersized lobsters for sale in New York City supermarkets, leading to violation notices and fines, with the lobsters being confiscated and donated to a food pantry.	FALSE	FALSE	TRUE	FALSE	company not identified	not applicable	product or process not identified	Likely NAICS Codes: 445220 - Fish and Seafood Markets, 722110 - Full-Service Restaurants, 424460 - Fish and Seafood Merchant Wholesalers, 445230 - Fruit and Vegetable Markets	FALSE	1491
The 'Shellmet' Is an Eco-Friendly Solution to Marine Waste in Japan | LBBOnline - Little Black Book	https://news.google.com/rss/articles/CBMiXGh0dHBzOi8vbGJib25saW5lLmNvbS9uZXdzL3RoZS1zaGVsbG1ldC1pcy1hbi1lY28tZnJpZW5kbHktc29sdXRpb24tdG8tbWFyaW5lLXdhc3RlLWluLWphcGFu0gEA?oc=5	TBWA\HAKUHODO and Koushi Chemical Industry Co. introduced 'Shellmet', an eco-friendly helmet made from wasted scallop shells, aiming to tackle the issue of surplus shells in Sarufutsu Village, Hokkaido. The Shellmet is a disaster prevention helmet made from a new material based on scallop shells and recycled plastic, contributing to reduced CO2 emissions and waste. It incorporates a biomimicry design inspired by scallop shells, offering durability and sustainability. A crowdfunding campaign will support the product's promotion and adoption in the village and beyond.	TRUE	TRUE	TRUE	TRUE	TBWA\HAKUHODO and Koushi Chemical Industry Co.	TBWA\HAKUHODO	Shellmet	Likely NAICS Codes: 325998, 315990, 339999, 327213	FALSE	2734
Implementing circular economy and sustainability policies in Rwanda: Experiences of Rwandan manufacturers with the ... - Frontiers	https://news.google.com/rss/articles/CBMiP2h0dHBzOi8vd3d3LmZyb250aWVyc2luLm9yZy9hcnRpY2xlcy8xMC4zMzg5L2Zyc3VzLjIwMjMuMTA5MjEwN9IBAA?oc=5	The article discusses Rwanda's sustainability policies, experiences of manufacturers post implementation of the plastic ban, and challenges faced in transitioning to alternative materials. It explores the alignment of Rwanda's sustainability policies with circular economy principles and the importance of government support in facilitating the transition to more sustainable practices.	TRUE	FALSE	TRUE	TRUE	company not identified	product_or_process not identified	circ	Likely NAICS Codes: 325211 - Plastics Material and Resin Manufacturing, 562920 - Materials Recovery Facilities, 561790 - Other Services to Buildings and Dwellings, 221310 - Water Supply and Irrigation Systems	FALSE	15273
Flipkart Launches ‘Flipkart Green’ for Customers Looking to Adopt a Sustainable Lifestyle - Indian Retailer	https://news.google.com/rss/articles/CBMicmh0dHBzOi8vd3d3LmluZGlhbnJldGFpbGVyLmNvbS9uZXdzL2ZsaXBrYXJ0LWxhdW5jaGVzLWZsaXBrYXJ0LWdyZWVuLWN1c3RvbWVycy1sb29raW5nLWFkb3B0LXN1c3RhaW5hYmxlLWxpZmVzdHlsZdIBAA?oc=5	The article discusses the 'Scars are Beautiful' campaign by Juicy Chemistry and Mommy Shots by Amrita, celebrating the beauty of postpartum bodies and stretch marks and empowering women to embrace their unique motherhood journeys.	FALSE	FALSE	TRUE	TRUE	Juicy Chemistry and Mommy Shots by Amrita	Juicy Chemistry	product or process not identified	Likely NAICS Codes: 325620 Toilet Preparation Manufacturing, 541921 Photography Studios, Portrait, 812990 All Other Personal Services, 541430 Graphic Design Services	FALSE	1976
