title	link	summary	green_innovation	business_innovation	green_product	green_process	company	official_company_name	product_or_process	likely_naics_codes	greenwashing	total_tokens
Low-Carbon Solutions | Renewable Energy Consulting | BCG - BCG	https://news.google.com/rss/articles/CBMiRWh0dHBzOi8vd3d3LmJjZy5jb20vaW5kdXN0cmllcy9lbmVyZ3kvcmVuZXdhYmxlcy1sb3ctY2FyYm9uLXNvbHV0aW9uc9IBAA?oc=5	The article discusses expertise in creating low-carbon and renewable energy leaders, addressing a range of elements crucial for success in the field.	FALSE	TRUE	FALSE	TRUE	company not identified	Not applicable	product or process not identified	Likely NAICS Codes: 221119 - Other Electric Power Generation, 541614 - Process, Physical Distribution, and Logistics Consulting Services, 562998 - All Other Miscellaneous Waste Management Services, 541618 - Other Management Consulting Services	FALSE	1246
Transition to n-type products and enhanced ESG strategy crucial to future – Trina Solar - PV Tech	https://news.google.com/rss/articles/CBMibmh0dHBzOi8vd3d3LnB2LXRlY2gub3JnL3RyYW5zaXRpb24tdG8tbi10eXBlLXByb2R1Y3RzLWFuZC1lbmhhbmNlZC1lc2ctc3RyYXRlZ3ktY3J1Y2lhbC10by1mdXR1cmUtdHJpbmEtc29sYXIv0gEA?oc=5	The article discusses Trina Solar's transition to n-type cells for new modules and the launch of their Vanguard 2P tracker solution, focusing on the expansion of their products and services globally.	TRUE The article describes Trina Solar's commitment to transitioning towards n-type cells which are known for their high efficiency and other environmental benefits. Additionally, the company is investing in hydrogen solutions and aiming to achieve renewable energy use in manufacturing by 2030, showcasing efforts towards green innovation.	TRUE Trina Solar's transition to n-type cells and the launch of the Vanguard 2P tracker solution represent new or improved products and processes significantly different from their previous offerings, meeting the criteria for business innovation.	TRUE Trina Solar's n-type cells and Vanguard 2P tracker solution are designed to significantly reduce environmental impact through high efficiency, renewable energy use, and sustainable manufacturing processes, making them green products.	TRUE Trina Solar's adoption of green processes, such as transitioning to n-type cells, reducing emissions, and aiming for renewable energy use in operations, exemplifies efforts to minimize environmental impacts and promote sustainability.	Trina Solar	Trina Solar	n-type cells, Vanguard 2P tracker solution	Likely NAICS Codes: 221114, 334413, 221115, 238990 - Solar power generation, Semiconductor and Related Device Manufacturing, Wind Electric Power Generation, All Other Specialty Trade Contractors	FALSE The article does not display characteristics of greenwashing as it focuses on Trina Solar's genuine efforts towards sustainable development, renewable energy use, and innovative green technologies.	2197
The Inflation Reduction Act is Driving a Clean Tech Industrial Revolution | Spectra - Spectra	https://news.google.com/rss/articles/CBMiYWh0dHBzOi8vc3BlY3RyYS5taGkuY29tL3RoZS1pbmZsYXRpb24tcmVkdWN0aW9uLWFjdC1pcy1kcml2aW5nLWEtY2xlYW4tdGVjaC1pbmR1c3RyaWFsLXJldm9sdXRpb27SAQA?oc=5	The article discusses the impact and potential of the Inflation Reduction Act (IRA) on clean energy investment and industrial policy in the U.S., highlighting the acceleration of decarbonization efforts and the broad range of industries affected by the legislation.	TRUE: The IRA aims to accelerate the energy transition, reduce emissions, and promote investments in clean energy technologies, aligning with goals of decarbonization and environmental sustainability.	TRUE: The article mentions new business processes and investments spurred by the IRA, indicating a significant departure from previous practices and demonstrating business innovation.	FALSE: The article does not explicitly discuss the design, manufacturing, or use of specific products that significantly reduce their environmental impact throughout their lifecycle.	FALSE: Although the article talks about methods and techniques in the context of clean energy investments and industrial policy, it does not delve into specific operational activities that minimize environmental impacts and promote sustainability.	company not identified	not found	product or process not identified	Likely NAICS Codes: 22 - Utilities, 23 - Construction, 54 - Professional, Scientific, and Technical Services, 62 - Health Care and Social Assistance	FALSE: The article does not display characteristics of greenwashing as it focuses on the genuine impacts and implications of the Inflation Reduction Act on clean energy investments and industrial policies without misleading environmental claims.	3108
East Penn Manufacturing power a closed loop circular economy - Sustainability Magazine	https://news.google.com/rss/articles/CBMiY2h0dHBzOi8vc3VzdGFpbmFiaWxpdHltYWcuY29tL2FydGljbGVzL2Vhc3QtcGVubi1tYW51ZmFjdHVyaW5nLXBvd2VyLWEtY2xvc2VkLWxvb3AtY2lyY3VsYXItZWNvbm9tedIBAA?oc=5	East Penn Manufacturing is a leading battery manufacturer with a strong focus on sustainability, including recycling all major parts of lead batteries and investing in renewable energy. The company's commitment to a circular economy and employee well-being has garnered recognition for its environmental stewardship.	TRUE. This is green innovation as East Penn Manufacturing demonstrates a commitment to sustainability by implementing environmentally friendly practices in its operations and product offerings.	TRUE. The company's focus on sustainability, circular economy, and innovative practices in battery recycling and renewable energy procurement represents business innovation in the field of manufacturing.	TRUE. The recycled lead batteries and the focus on environmentally friendly materials and processes align with the definition of a green product that significantly reduces environmental impact throughout its life cycle.	TRUE. East Penn Manufacturing's methods of reusing and recycling all major parts of lead batteries, investing in renewable energy, and promoting a circular economy constitute green processes that minimize environmental impacts and promote sustainability.	East Penn Manufacturing	East Penn Manufacturing Co.	lead batteries	Likely NAICS Codes: 335911 - Storage Battery Manufacturing, 562920 - Materials Recovery Facilities, 221114 - Solar Electric Power Generation, 562112 - Hazardous Waste Collection	FALSE. The article depicts genuine efforts by East Penn Manufacturing towards sustainability, recycling, and environmental stewardship, rather than making false or misleading claims about the environmental benefits of its products or practices.	1872
Benefits (and tradeoffs) of large-format PV modules - Solar Builder Magazine	https://news.google.com/rss/articles/CBMiV2h0dHBzOi8vc29sYXJidWlsZGVybWFnLmNvbS9mZWF0dXJlZC9iZW5lZml0cy1hbmQtdHJhZGVvZmZzLW9mLWxhcmdlLWZvcm1hdC1wdi1tb2R1bGVzL9IBAA?oc=5	The article discusses the benefits and challenges of large-format PV modules in the solar industry, highlighting their potential for cost savings and efficiency improvements as well as structural vulnerabilities and performance risks.	FALSE. While the article focuses on innovative large-format PV modules in the solar industry, it does not explicitly discuss their environmental benefits or contributions to sustainability goals.	TRUE. The article discusses the introduction of large-format PV modules in the solar industry as a new product innovation, offering improved performance and cost reductions, which align with the definition of business innovation.	FALSE. Although the article extensively discusses large-format PV modules and their characteristics, it does not delve into the design, manufacturing, or usage aspects that significantly reduce environmental impact throughout the product lifecycle, as required for a green product.	FALSE. While the article mentions advancements in PV module technology and discusses potential improvements in energy efficiency and reduced costs, it does not focus on specific manufacturing processes or operational techniques that minimize environmental impacts, which are essential for a green process.	Renewable Energy Test Center (RETC)	Renewable Energy Test Center	Large-format PV modules	Likely NAICS Codes: 541712 (Research and Development in the Physical, Engineering, and Life Sciences), 221119 (Other Electric Power Generation), 238210 (Electrical Contractors and Other Wiring Installation Contractors), 237130 (Power and Communication Line and Related Structures Construction)	FALSE. The article provides a detailed analysis of large-format PV modules, highlighting both their benefits and challenges without making false or misleading claims about their environmental benefits. It does not appear to be an example of greenwashing.	3243
Making Renewable, Infinitely Recyclable Plastics Using Bacteria – Berkeley Lab News Center - Lawrence Berkeley National Laboratory (.gov)	https://news.google.com/rss/articles/CBMiZWh0dHBzOi8vbmV3c2NlbnRlci5sYmwuZ292LzIwMjMvMDcvMjcvbWFraW5nLXJlbmV3YWJsZS1pbmZpbml0ZWx5LXJlY3ljbGFibGUtcGxhc3RpY3MtdXNpbmctYmFjdGVyaWEv0gEA?oc=5	Researchers engineered E. coli to produce biorenewable plastics known as PDKs, made partially from plant sugars. These PDKs offer efficient recycling properties and are a bio-based alternative to traditional plastics, expanding their potential applications. The innovation aims to address the plastic waste problem by creating circular and biorenewable materials that could be both greener and cost-effective compared to petrochemicals.	TRUE. This innovation aligns with green innovation as it aims to reduce negative environmental externalities by creating biorenewable plastics that can be efficiently recycled, thus contributing to environmental sustainability goals.	TRUE. The development of biorenewable plastics from plant sugars represents a business innovation as it introduces a new product with significantly different raw materials compared to traditional plastics, potentially offering competitive advantages in terms of sustainability and cost-effectiveness.	TRUE. The biorenewable plastics known as PDKs are designed, manufactured, and used in a way that significantly reduces environmental impact throughout their life cycle. They promote recycling, minimize energy consumption, and aim to address the plastic waste problem, making them a green product.	TRUE. The method of engineering E. coli to convert plant sugars into raw materials for biorenewable plastics is a green process. This technique minimizes environmental impacts by using renewable resources, reducing waste, and promoting sustainability in plastic production.	company not identified	not found	PDKs (Poly(diketoenamine))	Likely NAICS Codes: 325211 - Plastics Material and Resin Manufacturing, 325199 - All Other Basic Organic Chemical Manufacturing, 325998 - All Other Miscellaneous Chemical Product and Preparation Manufacturing, 541711 - Research and Development in Biotechnology	FALSE. This article does not exhibit greenwashing, as it presents factual information about the development of biorenewable plastics and their potential environmental benefits without making false or misleading environmental claims.	2565
Continental opens TechCenter Hydrogen Technologies in Hamburg - Continental	https://news.google.com/rss/articles/CBMiVWh0dHBzOi8vd3d3LmNvbnRpbmVudGFsLmNvbS9lbi9wcmVzcy9wcmVzcy1yZWxlYXNlcy90ZWNoY2VudGVyLWh5ZHJvZ2VuLXRlY2hub2xvZ2llcy_SAQA?oc=5	The selection and development of appropriately suitable materials is a key success factor for the extensive future use of hydrogen.	TRUE: The article discusses the development of new products to meet the requirements of new energy carriers, such as hydrogen, which aligns with green innovation by facilitating the use of alternative energy sources.	FALSE: The focus of the article is on the technical expertise and material considerations for handling hydrogen as an energy carrier, rather than introducing new products or processes to the market.	FALSE: The article does not specifically focus on a good or service designed, manufactured, and used to reduce environmental impact throughout its life cycle; instead, it discusses the technical aspects of materials for handling hydrogen.	FALSE: The article primarily highlights the importance of suitable materials for handling hydrogen effectively and does not delve into specific methods or techniques in manufacturing or production that minimize environmental impacts.	Continental	Continental AG	product or process not identified	Likely NAICS Codes: 325120 - Industrial Gas Manufacturing, 325998 - All Other Miscellaneous Chemical Product and Preparation Manufacturing, 336320 - Motor Vehicle Electrical and Electronic Equipment Manufacturing, 541710 - Research and Development in the Physical, Engineering, and Life Sciences	FALSE: The article provides technical insights into material properties for handling hydrogen and does not contain any misleading or false environmental claims, thus not demonstrating greenwashing behavior.	1421
KLINGELNBERG to Present Innovative Solutions for Renewable Energy at EMO 2023 – Metrology and Quality News ... - "metrology news"	https://news.google.com/rss/articles/CBMiZWh0dHBzOi8vbWV0cm9sb2d5Lm5ld3Mva2xpbmdlbG5iZXJnLXRvLXByZXNlbnQtaW5ub3ZhdGl2ZS1zb2x1dGlvbnMtZm9yLXJlbmV3YWJsZS1lbmVyZ3ktYXQtZW1vLTIwMjMv0gEA?oc=5	The article discusses Klingelnberg's involvement in renewable energies, particularly focusing on the advancements in developing high-quality gears for electric cars and wind energy applications.	TRUE. Klingelnberg's continuous analysis of renewable energies, like electromobility and wind energy, resulting in new products and product advancements align with green innovation principles by contributing to reducing environmental impacts through sustainable development.	TRUE. Klingelnberg's introduction of new products and advancements in gear manufacturing processes, especially targeting applications in renewable energies, represents a clear example of business innovation.	TRUE. Klingelnberg's focus on developing high-quality gears for electric cars and wind energy applications aligns with the definition of green products by significantly reducing the environmental impact in those sectors through sustainable production processes and use of eco-friendly materials.	TRUE. Klingelnberg's emphasis on sustainable development, energy efficiency, waste reduction, and the use of innovative manufacturing techniques in producing high-quality gears reflects the characteristics of a green process.	Klingelnberg	Klingelnberg GmbH	product or process not identified	Likely NAICS Codes: 333613 - Mechanical Power Transmission Equipment Manufacturing, 333517 - Machine Tool Manufacturing, 541330 - Engineering Services, 335312 - Motor and Generator Manufacturing	FALSE. The article does not exhibit signs of greenwashing, as it focuses on real advancements and innovations introduced by Klingelnberg in the field of sustainable manufacturing.	2256
European warehouses store 40 GW of unsold solar panels - pv magazine International	https://news.google.com/rss/articles/CBMiZ2h0dHBzOi8vd3d3LnB2LW1hZ2F6aW5lLmNvbS8yMDIzLzA3LzE5L2V1cm9wZWFuLXdhcmVob3VzZXMtY3VycmVudGx5LWhvc3QtNDAtZ3ctb2YtdW5zb2xkLXNvbGFyLXBhbmVscy_SAQA?oc=5	Rystad Energy reports increasing European imports of Chinese-made solar panels, leading to record-breaking inventory levels and import projections for the year.	FALSE. This article does not focus on an innovation aimed at reducing negative environmental externalities, as it primarily discusses solar panel imports and inventory levels.	FALSE. The article does not describe a new or significantly improved product or business process introduced by a firm; instead, it focuses on existing market trends.	TRUE. The article discusses solar panels, which are designed to significantly reduce environmental impact during their life cycle by generating renewable energy.	FALSE. The article does not provide details on specific manufacturing or operational methods for producing the solar panels to minimize environmental impacts.	Rystad Energy	Rystad Energy	solar panels	Likely NAICS Codes: 221114 Solar Electric Power Generation, 423730 Warm Air Heating and Air-Conditioning Equipment and Supplies Merchant Wholesalers, 326199 All Other Plastics Product Manufacturing, 551112 Offices of Other Holding Companies	FALSE. The article does not contain misleading information about the environmental benefits of the solar panels; it primarily reports on import trends and inventory levels.	1492
Renewable Power Procurement Needs a Reset | BCG - BCG	https://news.google.com/rss/articles/CBMiZWh0dHBzOi8vd3d3LmJjZy5jb20vcHVibGljYXRpb25zLzIwMjMvYnVpbGRpbmctYS1tb3JlLXN1c3RhaW5hYmxlLXJlbmV3YWJsZS1lbmVyZ3ktcHJvY3VyZW1lbnQtc3lzdGVt0gEA?oc=5	The article discusses how companies are increasing their use of green power to decarbonize the global power system, focusing on ambitious sustainability-led procurement actions and supporting the development of additional renewable generating capacity.	TRUE, The article discusses how companies are adopting green power procurement strategies to support sustainable power ecosystems, decarbonization, and global climate goals.	FALSE, The article focuses on sustainable power procurement strategies and decarbonization efforts rather than introducing new products or business processes.	FALSE, The article does not specifically focus on individual products or services in terms of their design, manufacturing, or usage that significantly reduce environmental impacts throughout their life cycle.	TRUE, The article highlights green process innovations such as sustainable power procurement methods that aim to minimize environmental impacts, reduce waste, and promote sustainability in manufacturing and production.	company not identified	Information not available	product or process not identified	Likely NAICS Codes: 221119, 221114, 221116, 221117 (Electric Power Generation, Transmission, and Distribution; Solar Electric Power Generation; Wind Electric Power Generation; Other Electric Power Generation)	FALSE, The article does not exhibit greenwashing as it promotes genuine efforts by companies to increase the use of green power and support sustainability goals.	3108
Net zero and insurance underwriting - PwC	https://news.google.com/rss/articles/CBMiZGh0dHBzOi8vd3d3LnB3Yy5jb20vdXMvZW4vaW5kdXN0cmllcy9maW5hbmNpYWwtc2VydmljZXMvbGlicmFyeS9uZXQtemVyby1pbnN1cmFuY2UtdW5kZXJ3cml0aW5nLmh0bWzSAQA?oc=5	An urgent call to achieve net zero emissions and the need for public and private investments in high abatement potential solutions.	TRUE, The article discusses the urgent need to reduce greenhouse gas emissions and highlights investments in solutions for achieving net zero, aligning with the concept of green innovation by addressing environmental sustainability goals.	FALSE, The article focuses on emissions reductions and investments in solutions for achieving net zero, rather than introducing new products or business processes.	FALSE, The article mentions solutions and investments aimed at reducing emissions and achieving net zero, but it does not specifically address the design, manufacturing, and use of products to reduce environmental impact throughout their life cycle.	TRUE, The article discusses the need for processes that minimize environmental impacts and promote sustainability in sectors such as alternative energy, heating and cooling solutions, and transportation, aligning with the concept of green processes.	company not identified	N/A	product or process not identified	Likely NAICS Codes: 221114, 237130, 327310, 336111 - Electric Power Generation, Residential Solar Installation, Cement Manufacturing, Automobile Manufacturing	FALSE, The article does not provide evidence of false or misleading environmental claims, but rather emphasizes the urgent need for emissions reduction and investments in sustainable solutions.	1479
EconiQ retrofill: the sustainable solution that reduces reliance on SF₆ - Hitachi Energy	https://news.google.com/rss/articles/CBMie2h0dHBzOi8vd3d3LmhpdGFjaGllbmVyZ3kuY29tL25ld3MvYmxvZ3MvMjAyMy8wNy9lY29uaXEtcmV0cm9maWxsLXRoZS1zdXN0YWluYWJsZS1zb2x1dGlvbi1mb3ItcmVkdWNpbmctZ3JlZW4taG91c2UtZ2FzLXNmNtIBAA?oc=5	The article discusses the environmental impact of SF6, a potent greenhouse gas, and the need to minimize its use in the energy sector.	TRUE. This is green innovation as it addresses the need to reduce the environmental impact of using SF6, a potent greenhouse gas, in the energy sector.	FALSE. The focus of the article is on environmental impact and reducing the use of SF6, rather than on introducing new products or processes for business development.	FALSE. The article discusses the environmental impact of SF6 but does not focus on a specific product designed, manufactured, and used in an environmentally sustainable way.	TRUE. The article discusses the need to minimize the use of SF6, which involves operational changes to reduce environmental impacts in the energy sector.	company not identified	not found	SF6 (Sulfur Hexafluoride)	Likely NAICS Codes: 221112 - Fossil Fuel Electric Power Generation, 221119 - Other Electric Power Generation, 221121 - Electric Bulk Power Transmission and Control, 221122 - Electric Power Distribution	FALSE. The article focuses on the environmental implications of SF6 and the need to minimize its usage, without misleading or deceptive environmental claims.	1620
Darling Ingredients 'Can Do' Chief Strategist To Retire, Embraces New Chapter with Named Successor - dallasinnovates.com	https://news.google.com/rss/articles/CBMidGh0dHBzOi8vZGFsbGFzaW5ub3ZhdGVzLmNvbS9kYXJsaW5nLWluZ3JlZGllbnRzLXNhbHV0ZXMtY2FuLWRvLWNoaWVmLXN0cmF0ZWdpc3QtZW1icmFjZXMtbmV3LWNoYXB0ZXItd2l0aC1zdWNjZXNzb3Iv0gEA?oc=5	Darling Ingredients' Chief Strategist to retire, replaced by a new executive with extensive agribusiness experience. The company highlights the transformative leadership of the retiring officer and the focus on innovation and strategic growth.	FALSE	TRUE	TRUE	TRUE	Darling Ingredients Inc.	Darling Ingredients Inc.	product or process not identified	Likely NAICS Codes: 325311 - Nitrogenous Fertilizer Manufacturing, 311119 - Other Animal Food Manufacturing, 424490 - Other Grocery and Related Products Merchant Wholesalers, 324110 - Petroleum Refineries	FALSE	1771
Winning A Greener Future, XCMG Machinery's Renewable Energy Equipment Products Outshine in Major Construction ... - Canada NewsWire	https://news.google.com/rss/articles/CBMiqgFodHRwczovL3d3dy5uZXdzd2lyZS5jYS9uZXdzLXJlbGVhc2VzL3dpbm5pbmctYS1ncmVlbmVyLWZ1dHVyZS14Y21nLW1hY2hpbmVyeS1zLXJlbmV3YWJsZS1lbmVyZ3ktZXF1aXBtZW50LXByb2R1Y3RzLW91dHNoaW5lLWluLW1ham9yLWNvbnN0cnVjdGlvbi1wcm9qZWN0cy04NjkzODI2NzYuaHRtbNIBAA?oc=5	XCMG Machinery is driving the green transformation of the construction machinery industry with new energy equipment. They showcased their latest pure electric mixing truck and successfully installed a new wind turbine unit at a wind farm. XCMG is investing in R&D for new energy products, like forklifts and loaders, to promote green and intelligent manufacturing.	TRUE. This article discusses XCMG Machinery's commitment to green transformation, introducing new energy equipment like pure electric mixing trucks and loaders to promote sustainability in the construction machinery industry.	TRUE. XCMG Machinery is introducing new energy equipment such as pure electric mixing trucks and loaders, representing significant advancements from their previous products, aligning with the definition of business innovation.	TRUE. XCMG's new energy products like the pure electric mixing truck and loaders are designed and manufactured to significantly reduce environmental impact throughout their lifecycle, meeting the criteria of green products.	TRUE. XCMG Machinery's emphasis on promoting green and intelligent manufacturing and developing new energy products reflects the adoption of methods and techniques that minimize environmental impacts, making it a green process.	XCMG Machinery	XCMG Construction Machinery Co., Ltd.	product or process not identified	Likely NAICS Codes: 333120 - Construction Machinery Manufacturing, 333924 - Industrial Truck, Tractor, Trailer, and Stacker Machinery Manufacturing, 333131 - Mining Machinery and Equipment Manufacturing, 333298 - All Other Industrial Machinery Manufacturing	FALSE. The article does not appear to engage in greenwashing as it genuinely discusses XCMG Machinery's efforts towards green innovation and the development of new energy products.	1935
Making the most of every ray: Exclusive interview with Huawei's Guoguang Chen - pv magazine International	https://news.google.com/rss/articles/CBMic2h0dHBzOi8vd3d3LnB2LW1hZ2F6aW5lLmNvbS8yMDIzLzA3LzE4L21ha2luZy10aGUtbW9zdC1vZi1ldmVyeS1yYXktZXhjbHVzaXZlLWludGVydmlldy13aXRoLWh1YXdlaXMtZ3VvZ3VhbmctY2hlbi_SAQA?oc=5	FusionSolar introduced a new three-pronged strategy focusing on core technology and product solutions, with plans to expand into different market segments and types of solar applications. The company aligns its product offerings with utility, commercial & industrial, and residential scenarios, emphasizing safety, innovation, and sustainability. FusionSolar also discusses its past successes in the European market and future outlook for the PV and storage industry, highlighting grid-forming technology and global growth expectations.	FALSE	TRUE	TRUE	TRUE	FusionSolar	Huawei FusionSolar	product or process not identified	Likely NAICS Codes: 221114, 221115, 221116, 221117	FALSE	3745
