title	link	summary	green_innovation	business_innovation	green_product	green_process	company	official_company_name	product_or_process	likely_naics_codes	greenwashing	total_tokens
What's Now And Next In Sustainable Textiles? - Textile World Magazine	https://news.google.com/rss/articles/CBMiZ2h0dHBzOi8vd3d3LnRleHRpbGV3b3JsZC5jb20vdGV4dGlsZS13b3JsZC9mZWF0dXJlcy8yMDIzLzA3L3doYXRzLW5vdy1hbmQtbmV4dC1pbi1zdXN0YWluYWJsZS10ZXh0aWxlcy_SAQA?oc=5	The textile industry is shifting towards sustainability with trends in fiber solutions, conservation, recycling, innovation in biobased materials, smart textiles, and the circular economy to address environmental challenges.	TRUE: The article discusses various sustainable innovations in the textile industry, such as recycling, conservation, and the adoption of eco-friendly fibers, which align with green innovation criteria by reducing environmental impact.	FALSE: While the article talks about innovations in the textile industry, the focus is primarily on sustainability practices and environmental impacts rather than significant changes to business models or processes.	TRUE: The article mentions the use of recycled fibers like REPREVE®, SEAQUAL®, and ECONYL®, as well as organic and rapidly renewable fibers like organic cotton, hemp, and bamboo, all designed to significantly reduce the environmental impact throughout the product life cycle.	TRUE: The text discusses new processes and technologies in the textile industry aimed at minimizing environmental impacts, such as energy-efficient machinery, waterless dyeing techniques, and recycling initiatives, making it a green process innovation.	company not identified	N/A	product or process not identified	Likely NAICS Codes: 313210 - Broadwoven Fabric Mills, 314999 - All Other Miscellaneous Textile Product Mills, 325992 - Photographic Film, Paper, Plate, and Chemical Manufacturing, 423220 - Home Furnishing Merchant Wholesalers	FALSE: The article does not exhibit greenwashing as it focuses on genuine sustainability practices and innovations within the textile industry, without making false or misleading claims about environmental benefits.	3377
UCLA Study Highlights Smart Cups' Revolutionary Technology Reducing Environmental Impact of Liquid Consumer ... - PR Newswire	https://news.google.com/rss/articles/CBMiqwFodHRwczovL3d3dy5wcm5ld3N3aXJlLmNvbS9uZXdzLXJlbGVhc2VzL3VjbGEtc3R1ZHktaGlnaGxpZ2h0cy1zbWFydC1jdXBzLXJldm9sdXRpb25hcnktdGVjaG5vbG9neS1yZWR1Y2luZy1lbnZpcm9ubWVudGFsLWltcGFjdC1vZi1saXF1aWQtY29uc3VtZXItcHJvZHVjdHMtMzAxODgzMjc4Lmh0bWzSAQA?oc=5	The article discusses a new research study on Smart Cups' technology that aims to reduce material, energy, and emissions for liquid consumer products through printing, emphasizing the environmental benefits and potential sustainability impact of the innovation.	TRUE	TRUE	TRUE	TRUE	Smart Cups	Smart Cups, Inc	Smart Cups Technology	Likely NAICS Codes: 325412 - Pharmaceutical Preparation Manufacturing, 326199 - All Other Plastics Product Manufacturing, 322220 - Paper Bag and Coated and Treated Paper Manufacturing, 322299 - All Other Converted Paper Product Manufacturing	FALSE	2310
'You don't have to be an activist': Here's how your simple actions can help protect the Earth - The Economic Times	https://news.google.com/rss/articles/CBMimgFodHRwczovL20uZWNvbm9taWN0aW1lcy5jb20vbmV3cy9ob3ctdG8veW91LWRvbnQtaGF2ZS10by1iZS1hbi1hY3RpdmlzdC1oZXJlcy1ob3cteW91ci1zaW1wbGUtYWN0aW9ucy1jYW4taGVscC1wcm90ZWN0LXRoZS1lYXJ0aC9hcnRpY2xlc2hvdy8xMDIxNDIyNDIuY21z0gGeAWh0dHBzOi8vbS5lY29ub21pY3RpbWVzLmNvbS9uZXdzL2hvdy10by95b3UtZG9udC1oYXZlLXRvLWJlLWFuLWFjdGl2aXN0LWhlcmVzLWhvdy15b3VyLXNpbXBsZS1hY3Rpb25zLWNhbi1oZWxwLXByb3RlY3QtdGhlLWVhcnRoL2FtcF9hcnRpY2xlc2hvdy8xMDIxNDIyNDIuY21z?oc=5	The article emphasizes the importance of individual actions in conservation efforts for the planet Earth, highlighting practices such as waste reduction, water conservation, eco-friendly transportation, renewable energy adoption, mindful purchasing, tree-planting, and energy savings.	FALSE. The article focuses on environmental conservation efforts at the individual level rather than introducing new or significantly improved products or processes in the market.	FALSE. The article does not introduce new or significantly improved products or processes in the market. It mainly discusses individual actions for environmental conservation.	FALSE. The article mentions adopting eco-friendly habits and choices but does not specifically highlight a new or significantly improved product designed, manufactured, and used to reduce environmental impact.	FALSE. The article promotes environmentally conscious practices but does not detail a specific method or technique in manufacturing, production, or operations aimed at minimizing environmental impacts and promoting sustainability.	company not identified	product or process not identified	product or process not identified	Likely NAICS Codes: 	FALSE. The article does not contain any indication of false or misleading statements regarding the environmental benefits of a product or practice. It focuses on promoting individual actions for environmental conservation.	2235
Unveiling The Mind-Blowing Retail Trends Of 2050: An Investigative Adventure Into The Future Of… - DataDrivenInvestor	https://news.google.com/rss/articles/CBMikQFodHRwczovL21lZGl1bS5kYXRhZHJpdmVuaW52ZXN0b3IuY29tL3VudmVpbGluZy10aGUtbWluZC1ibG93aW5nLXJldGFpbC10cmVuZHMtb2YtMjA1MC1hbi1pbnZlc3RpZ2F0aXZlLWFkdmVudHVyZS1pbnRvLXRoZS1mdXR1cmUtb2YtOTk2MGFlMTJlMzI50gEA?oc=5	The article explores the future of shopping and retail in 2050 with predictions made by artificial intelligence (GPT4).	FALSE	TRUE	FALSE	FALSE	company not identified	N/A	product or process not identified	Likely NAICS Codes: 454110 - Electronic Shopping and Mail-Order Houses, 531110 - Lessors of Residential Buildings and Dwellings, 522298 - All Other Nondepository Credit Intermediation, 561510 - Travel Agencies	FALSE	1242
Tesla's 1st Cybertruck electric pickup has rolled off the assembly line, the company says - ETAuto	https://news.google.com/rss/articles/CBMiqAFodHRwczovL2F1dG8uZWNvbm9taWN0aW1lcy5pbmRpYXRpbWVzLmNvbS9uZXdzL2NvbW1lcmNpYWwtdmVoaWNsZS9taGN2L3Rlc2xhcy0xc3QtY3liZXJ0cnVjay1lbGVjdHJpYy1waWNrdXAtaGFzLXJvbGxlZC1vZmYtdGhlLWFzc2VtYmx5LWxpbmUtdGhlLWNvbXBhbnktc2F5cy8xMDE3OTc0MjnSAawBaHR0cHM6Ly9hdXRvLmVjb25vbWljdGltZXMuaW5kaWF0aW1lcy5jb20vYW1wL25ld3MvY29tbWVyY2lhbC12ZWhpY2xlL21oY3YvdGVzbGFzLTFzdC1jeWJlcnRydWNrLWVsZWN0cmljLXBpY2t1cC1oYXMtcm9sbGVkLW9mZi10aGUtYXNzZW1ibHktbGluZS10aGUtY29tcGFueS1zYXlzLzEwMTc5NzQyOQ?oc=5	Tesla's first production Cybertruck electric pickup has rolled off the assembly line nearly two years behind schedule at Giga Texas, with unique design features and delayed production projections. Competitors have entered the electric truck market with more conventional looking models.	FALSE	TRUE	FALSE	FALSE	Tesla	Tesla, Inc.	Cybertruck electric pickup	Likely NAICS Codes: 336111 - Automobile Manufacturing, 336112 - Light Truck and Utility Vehicle Manufacturing, 336390 - Other Motor Vehicle Parts Manufacturing, 336211 - Motor Vehicle Body Manufacturing	FALSE	1557
Emerging Fabric Trends: Unveiling the Latest Innovations and Designs in the Fabric Industry - Indian Retailer	https://news.google.com/rss/articles/CBMifWh0dHBzOi8vd3d3LmluZGlhbnJldGFpbGVyLmNvbS9hcnRpY2xlL3JldGFpbC1idXNpbmVzcy90cmVuZHMvZW1lcmdpbmctZmFicmljLXRyZW5kcy11bnZlaWxpbmctbGF0ZXN0LWlubm92YXRpb25zLWFuZC1kZXNpZ25z0gEA?oc=5	The article discusses the top luxury watch brands in India, highlighting their history, innovations, and recognition among watch enthusiasts. It covers renowned brands such as Rolex, Franck Muller, Omega, Breguet, TAG Heuer, Hublot, Breitling, Chopard, Longines, and Bell & Ross, emphasizing their unique characteristics and appeal to different preferences and styles.	FALSE. The article focuses on luxury watches and their attributes, which do not directly contribute to environmental sustainability goals such as decarbonisation, reducing harmful substances, or nature conservation.	FALSE. The article discusses luxury watches as symbols of artistry, social status, and history, and does not introduce new products or business processes that significantly differ from previous offerings.	FALSE. The article describes luxury watches in terms of elegance, craftsmanship, and symbolism, without emphasizing environmentally friendly design, materials, or production processes.	FALSE. The article highlights the design, history, and appeal of luxury watches, but it does not discuss manufacturing or operational processes that minimize environmental impacts or promote sustainability.	company not identified	not found	product or process not identified	Likely NAICS Codes: 423940 - Jewelry, Watch, Precious Stone, and Precious Metal Merchant Wholesalers, 713940 - Fitness and Recreational Sports Centers, 448310 - Jewelry Stores, 339911 - Jewelry (except Costume) Manufacturing	FALSE. The content of the article mainly focuses on displaying the features, prestige, and history of luxury watch brands, rather than making false or exaggerated environmental claims.	5671
India stands to gain from global socio-political and economic changes, says Ralf Speth, TVS Motor Chairman - ETAuto	https://news.google.com/rss/articles/CBMiowFodHRwczovL2F1dG8uZWNvbm9taWN0aW1lcy5pbmRpYXRpbWVzLmNvbS9uZXdzL3R3by13aGVlbGVycy9pbmRpYS1zdGFuZHMtdG8tZ2Fpbi1mcm9tLWdsb2JhbC1zb2Npby1wb2xpdGljYWwtYW5kLWVjb25vbWljLWNoYW5nZXMtcmFsZi1zcGV0aC10dnMtY2hhaXJtYW4vMTAyMTU3ODgx0gGnAWh0dHBzOi8vYXV0by5lY29ub21pY3RpbWVzLmluZGlhdGltZXMuY29tL2FtcC9uZXdzL3R3by13aGVlbGVycy9pbmRpYS1zdGFuZHMtdG8tZ2Fpbi1mcm9tLWdsb2JhbC1zb2Npby1wb2xpdGljYWwtYW5kLWVjb25vbWljLWNoYW5nZXMtcmFsZi1zcGV0aC10dnMtY2hhaXJtYW4vMTAyMTU3ODgx?oc=5	TVS Motor Company remains cautiously optimistic for India's business in 2023-24, focusing on diversified market strategies amidst forecasts of GDP growth and sectorial challenges. The company is set to leverage growth opportunities, including urban demand, premium segments, electric vehicle initiatives, and global partnerships, while navigating rural market pressures and international market fluctuations.	FALSE	TRUE	TRUE	TRUE	TVS Motor Company	TVS Motor Company	product or process not identified	Likely NAICS Codes: 336991 - Motorcycle, Bicycle, and Parts Manufacturing, 336992 - Military Armored Vehicle, Tank, and Tank Component Manufacturing, 336399 - All Other Motor Vehicle Parts Manufacturing, 336111 - Automobile Manufacturing	FALSE	2001
Retail India News: e-Sprinto Partners with AutoEVmart to Accelerate Electric Two-Wheeler Sales - Indian Retailer	https://news.google.com/rss/articles/CBMieWh0dHBzOi8vd3d3LmluZGlhbnJldGFpbGVyLmNvbS9uZXdzL3JldGFpbC1pbmRpYS1uZXdzLWUtc3ByaW50by1wYXJ0bmVycy1hdXRvZXZtYXJ0LWFjY2VsZXJhdGUtZWxlY3RyaWMtdHdvLXdoZWVsZXItc2FsZXPSAQA?oc=5	HanesBrands has reached an agreement to sell its global Champion business to Authentic Brands Group with a transaction value of up to $1.5 billion, focusing on debt reduction and growth strategy.	FALSE This transaction involving the sale of the global Champion business does not directly involve green innovation or sustainability criteria.	TRUE The agreement to sell the global Champion business represents a significant change in business strategy and product offerings, aligning with the definition of business innovation.	FALSE While the article mentions iconic apparel brands and market positioning, it does not elaborate on environmentally friendly design, manufacturing processes, or life cycle impact for green product designation.	FALSE The article focuses on the sale of a business unit and financial aspects, without mentioning specific processes or technologies that promote environmental sustainability.	HanesBrands	HanesBrands	product or process not identified	Likely NAICS Codes: 448110 - Men's Clothing Stores, 448120 - Women's Clothing Stores, 448190 - Other Clothing Stores, 424310 - Piece Goods, Notions, and Other Dry Goods Merchant Wholesalers	FALSE This article does not exhibit greenwashing as it primarily discusses a business transaction and financial aspects.	2051
Retail India News: Alia Bhatt Joins Hands with SuperBottoms, as Investor and Brand Ambassador - Indian Retailer	https://news.google.com/rss/articles/CBMid2h0dHBzOi8vd3d3LmluZGlhbnJldGFpbGVyLmNvbS9uZXdzL3JldGFpbC1pbmRpYS1uZXdzLWFsaWEtYmhhdHQtam9pbnMtaGFuZHMtc3VwZXJib3R0b21zLWludmVzdG9yLWFuZC1icmFuZC1hbWJhc3NhZG9y0gEA?oc=5	The article highlights the 'Scars are Beautiful' campaign launched by Juicy Chemistry and Mommy Shots by Amrita to celebrate the beauty of postpartum bodies and stretch marks, featuring 11 mothers sharing their stories of motherhood and body positivity.	FALSE. The article does not explicitly mention any new or improved methods that significantly reduce negative environmental externalities.	FALSE. The article does not refer to any new or significantly improved products or business processes introduced by a firm.	TRUE. The 'Scars are Beautiful' campaign promotes body positivity and self-love, emphasizing the beauty and uniqueness of postpartum bodies and stretch marks.	FALSE. The article does not discuss any specific method or technique in manufacturing, production, or operations that minimizes environmental impacts.	Juicy Chemistry	Juicy Chemistry	product or process not identified	Likely NAICS Codes: 325620 Toilet Preparation Manufacturing, 541820 Public Relations Agencies, 541921 Photography Studios, Portrait, 711510 Independent Artists, Writers, and Performers	FALSE. The article does not mention any false or misleading statements about environmental benefits related to a product or practice.	2090
